{"id": "gt_dedup_00000", "question": "What is the purpose of using specific wording forms on egg packaging when sold to the ultimate consumer?", "reference": "32001R1651", "gold_snippet": "9) Article 28 of Regulation (EEC) No 1274/91 provides that in the case of sales to the ultimate consumer the forms of wording for use on eggs and packs are to be expressed in a language or languages easily understood by purchasers in the Member State in which retailing takes place.", "ground_truth_answer": "The purpose is to ensure that the purchaser can understand the information, as it should be expressed in a language or languages easily understood by purchasers in the Member State where retailing takes place.", "reference_contexts": ["9) Article 28 of Regulation (EEC) No 1274/91 provides that in the case of sales to the ultimate consumer the forms of wording for use on eggs and packs are to be expressed in a language or languages easily understood by purchasers in the Member State in which retailing takes place."], "retrieved_documents": [{"page_content": "(9) Article 28 of Regulation (EEC) No 1274/91 provides that in the case of sales to the ultimate consumer the forms of wording for use on eggs and packs are to be expressed in a language or languages easily understood by purchasers in the Member State in which retailing takes place. This provision should be repealed as Article 16 of Directive 2000/13/EC of the European Parliament and of the Council of 20 March 2000 on the approximation of the laws of the Member States relating to the labelling,", "metadata": {"categories_en": "trade, agri-foodstuffs, agriculture, forestry and fisheries", "celex_id": "32001R1651", "chunk_strategy": "len_500_o50", "chunk_uid": "0040486fd2ac0e1b372e509aa751834f", "label_ids": "100147,100157,100156"}}, {"page_content": "Whereas Article 5 (4) (e) of Commission Regulation (EEC) No 685/69 (3), as last amended by Regulation (EEC) No 2687/87 (4), specifies certain forms of wording to be used on the packaging of butter offered for intervention; whereas these forms of wording, the purpose of which is to indicate the type of butter being offered, must be made more explicit; whereas the said Article 5 (4) (e) should therefore be amended;", "metadata": {"categories_en": "trade, agri-foodstuffs, agriculture, forestry and fisheries", "celex_id": "31987R3724", "chunk_strategy": "len_500_o50", "chunk_uid": "212819c85ff54a2258fc85706a9740e3", "label_ids": "100147,100157,100156"}}, {"page_content": "(5)\nBecause eggs lose water and weight between the time they are laid and the date on which they are sold to the end consumer, it should be specified that the total net weight indicated when the eggs are packed must correspond at least to the total net weight of the eggs when they are sold to the end consumer.\n(6)", "metadata": {"categories_en": "production, technology and research, trade, agri-foodstuffs", "celex_id": "32004R1515", "chunk_strategy": "len_500_o50", "chunk_uid": "e5cfdc78ea7cb0c6d704b419c05b45b7", "label_ids": "100158,100147,100157"}}, {"page_content": "Whereas Article 28 of Commission Regulation (EEC) No 1274/91 (2) provides that the forms of wording for use on eggs and packs are to be expressed at least in the language or languages of the Member State in which retailing or any other use takes place; whereas this provision should be modified in accordance with the relevant provisions of Council Directive 79/112/EEC of 18 December 1978 on the approximation of the laws of the Member States, relating to the labelling, presentation and", "metadata": {"categories_en": "trade, agri-foodstuffs", "celex_id": "31991R3540", "chunk_strategy": "len_500_o50", "chunk_uid": "746db1c34997de55a45d79391afd5352", "label_ids": "100147,100157"}}, {"page_content": "(20)\nEggs may be sold with an indication highlighting the particular freshness of the egg. For this purpose, a maximum time limit should be fixed for such indications.\n(21)\nEggs may be sold with an indication highlighting the particular feed formula fed to the laying hens. Minimum requirements for the use of such indications should be laid down.\n(22)\nWhen eggs are sold loose, certain information normally on the pack should be accessible to the consumer.\n(23)", "metadata": {"categories_en": "trade, agri-foodstuffs, agriculture, forestry and fisheries", "celex_id": "32008R0589", "chunk_strategy": "len_500_o50", "chunk_uid": "f43e6a0ed60431f8fa5cffdc7ab908c6", "label_ids": "100147,100157,100156"}}, {"page_content": "(35)\nPoint 2 of part A, I of Annex XIV to Regulation (EC) No 1234/2007 allows Member States to exempt certain forms of direct sales of eggs from producers to the final consumer from the requirements of that Regulation. In order to take account of the specific conditions of egg marketing in certain regions in Finland, sales from producers to retail outlets in those regions should be exempted from the requirements of Regulation (EC) No 1234/2007 and of this Regulation.\n(36)", "metadata": {"categories_en": "trade, agri-foodstuffs, agriculture, forestry and fisheries", "celex_id": "32008R0589", "chunk_strategy": "len_500_o50", "chunk_uid": "dc9502cbd5d9a5ce1fca4bfb766417a2", "label_ids": "100147,100157,100156"}}, {"page_content": "relating to the labelling, presentation and advertising of foodstuffs for sale to the ultimate consumer (3) as last amended by Directive 91/72/EEC (4) and in order to facilitate the marketing of eggs in cases other than the delivery of eggs to the ultimate consumer;", "metadata": {"categories_en": "trade, agri-foodstuffs", "celex_id": "31991R3540", "chunk_strategy": "len_500_o50", "chunk_uid": "0a1eb1ed7cdc6fbd1f3f8fa9e94725b2", "label_ids": "100147,100157"}}, {"page_content": "(12)\nIn order to inform consumers of the meaning of the distinguishing number of the producer and the codes used where eggs are sold in bulk, it must be made compulsory to provide an explanation on large packs and other packs, such as those covered with plastic film, or on a separate notice.\n(13)", "metadata": {"categories_en": "production, technology and research, trade, agri-foodstuffs", "celex_id": "32004R1515", "chunk_strategy": "len_500_o50", "chunk_uid": "148a4c285231d3e0b154048acc34bb87", "label_ids": "100158,100147,100157"}}, {"page_content": "(3)\nThe standards should in principle be applicable to all eggs of hens of the species Gallus gallus marketed in the Community. Nevertheless, it appears advisable to give to the Member States the possibility to exempt from the application of those standards eggs sold through certain forms of direct sale from the producer to the final consumer where small quantities are involved.\n(4)", "metadata": {"categories_en": "trade, agri-foodstuffs", "celex_id": "32006R1028", "chunk_strategy": "len_500_o50", "chunk_uid": "4167795646edad61be01291272eccf8f", "label_ids": "100147,100157"}}, {"page_content": "- the month; from 1 to 12.\n2. Large packs, and small packs even when contained in large packs, shall bear on the outer surface in clearly visible and legible type an indication to advise consumers to keep eggs refrigerated after purchase.\n3. In case of loose egg sales, wording equivalent to the indication referred to in paragraph 2 shall be indicated in such a manner as to be clearly visible and unequivocal to the consumer.\nArticle 15", "metadata": {"categories_en": "trade, agri-foodstuffs", "celex_id": "31993R3300", "chunk_strategy": "len_500_o50", "chunk_uid": "0946ead9fb896aa099cebb90dfcdbf1c", "label_ids": "100147,100157"}}, {"page_content": "(55)\nAccording to those Regulations, Member States should be able to exempt from the application of those marketing standards eggs and poultrymeat, respectively, sold through certain forms of direct sale from the producer to the final consumer where small quantities are involved.\n(56)", "metadata": {"categories_en": "business and competition, economics, trade, agriculture, forestry and fisheries, EUROPEAN UNION", "celex_id": "32007R1234", "chunk_strategy": "len_500_o50", "chunk_uid": "53a62903b183aae4d4251ae770464212", "label_ids": "100152,100146,100147,100156,100144"}}, {"page_content": "Whereas the definitions laid down in previous Community Regulations relating to the packaging and manner of presentation for sale of eggs need to be drafted more strictly; whereas it has become essential to provide the necessary safeguards for the retail sale of eggs without special packaging;", "metadata": {"categories_en": "trade, agri-foodstuffs", "celex_id": "31990R1907", "chunk_strategy": "len_500_o50", "chunk_uid": "b87a341528ecb27be8e311c62c2a451b", "label_ids": "100147,100157"}}, {"page_content": "7. Large packs containing small packs marked in accordance with paragraph 1 (a), (b), (c) or (d) shall bear one of the following indications:\n\"FREE RANGE EGGS\"\n\"SEMI-INTENSIVE EGGS\"\n\"DEEP LITTER EGGS\"\n\"PERCHERY EGGS (BARN EGGS)\".\n8. The forms of wording referred to in paragraphs 1 and 7 shall be affixed at least in the language or languages of the Member State in which retailing or any other use takes place.", "metadata": {"categories_en": "production, technology and research, trade", "celex_id": "31985R1943", "chunk_strategy": "len_500_o50", "chunk_uid": "db18cf08525b94a4bb38439a0c10b0fa", "label_ids": "100158,100147"}}, {"page_content": "(a)\n‘pack’ means a wrapping containing Class A or B eggs, excluding transport packaging and containers of industrial eggs;\n(b)\n‘loose sales’ means the offer for retail sale of eggs to the final consumer, other than in packs;\n(c)", "metadata": {"categories_en": "trade, agri-foodstuffs, agriculture, forestry and fisheries", "celex_id": "32008R0589", "chunk_strategy": "len_500_o50", "chunk_uid": "924a14fc14a70cd4da079c44044905c7", "label_ids": "100147,100157,100156"}}, {"page_content": "(2) The method by which hens are farmed has become one of the major factors for consumers when purchasing eggs. The Commission has undertaken to propose an amendment of the marketing standards and to make it compulsory to indicate the farming method on eggs and packs so that consumers are not liable to be misled. To that end, clear and unambiguous compulsory labelling is the only way of ensuring that the consumer is able to make an informed choice between the various classes of egg on the basis", "metadata": {"categories_en": "trade, agri-foodstuffs", "celex_id": "32001R0005", "chunk_strategy": "len_500_o50", "chunk_uid": "ab0dde725290ba74f78afd951bc61239", "label_ids": "100147,100157"}}, {"page_content": "The indication must be worded in such a way that the meaning of the recommended sell-by date is clear.\n3. The laying date may be indicated by the operator on packs at the time of packing, in which case it shall also be indicated on the eggs contained in the packs. The laying date may, however, also be stamped on eggs at the farm.", "metadata": {"categories_en": "trade, agri-foodstuffs", "celex_id": "31993R3300", "chunk_strategy": "len_500_o50", "chunk_uid": "9d39c50a626a72e2424ea5d236e62680", "label_ids": "100147,100157"}}, {"page_content": "Whereas the delivery of down-graded eggs should be restricted to food industry undertakings approved in accordance with Council Directive 89/437/EEC of 20 June 1989 on hygiene and health problems affecting the production and the placing on the market of egg products (3) in order to assure proper handling of such eggs;\nWhereas it should be made clear that optional indications serving publicity purposes on egg packs may comprise symbols and refer to eggs and to other items;", "metadata": {"categories_en": "trade, agri-foodstuffs", "celex_id": "31993R2617", "chunk_strategy": "len_500_o50", "chunk_uid": "069a7ffcb640852a829fd81f98b065c0", "label_ids": "100147,100157"}}, {"page_content": "of egg products(5). Provided that the packs containing these eggs are labelled with the above destination, they need not in such cases bear the distinguishing mark which would otherwise identify them as grade B eggs. Such marking should also rule out any confusion, whether accidental or deliberate, with the marking provided for in the case of eggs unfit for human consumption, which may be delivered only to the non-food industry.", "metadata": {"categories_en": "trade, agri-foodstuffs", "celex_id": "32003R2295", "chunk_strategy": "len_500_o50", "chunk_uid": "1b94794a21439c41961e6fcb35068672", "label_ids": "100147,100157"}}, {"page_content": "(2) Council Regulation (EC) No 1907/1990 of 26 June 1990 on certain marketing standards for eggs(3) requires, inter alia, that eggs for human consumption be marked with a code indicating the producer and allowing identification of the type of farming, as from 1 January 2004.\n(3) It would be useful to inform consumers about these new rules on the marking of eggs.", "metadata": {"categories_en": "trade, EUROPEAN UNION, agriculture, forestry and fisheries", "celex_id": "32004R0185", "chunk_strategy": "len_500_o50", "chunk_uid": "a77dcc313ddd265a8e26669f55bfc464", "label_ids": "100147,100144,100156"}}, {"page_content": "6. Article 10 (1) (e) shall be replaced by the following:\n'(e) the date of minimum durability (\"best-before date\") followed by appropriate storage recommendations for grade A eggs, and the packing date for eggs of other grades'.\n7. Article 10 (2) point (e) shall be replaced by the following:\n'(e) statements or symbols designed to promote sales of eggs or other items, provided that such statements or symbols and the manner in which they are made are not likely to mislead the purchaser'.", "metadata": {"categories_en": "trade, agri-foodstuffs", "celex_id": "31993R2617", "chunk_strategy": "len_500_o50", "chunk_uid": "7a794c8becf84f07b8a490c6923a4646", "label_ids": "100147,100157"}}], "rag_answer": "The answer is not provided in the retrieved context.", "generator_model": "llama3.2", "final_k": 20, "candidate_k": 100, "retrieval_source": "prefetch", "prefetch_path": "/home/mwc/Documents/MIOTI/Current/TFM/Data/eval_top10_dedup/prefetch/eval1_baseline/len_500_o50/hyb_fill_dense_then_bm25_ce_r50/000000.json", "query_index": 0}
{"id": "gt_dedup_00001", "question": "What is the method used to measure the size of lobsters in this EU legal instrument?", "reference": "31984R2178", "gold_snippet": "The size of nephrops and lobsters shall be defined as the length of the cephalothorax measured parallel to the mid-line from the back of either eye-socket to the distal edge of the cephalothorax and as the total length measured from the tip of the rostrum to the rear end of the telson, not including the setae.", "ground_truth_answer": "The size of lobsters is measured by taking the length from the tip of the rostrum to the rear end of the telson, not including the setae.", "reference_contexts": ["The size of nephrops and lobsters shall be defined as the length of the cephalothorax measured parallel to the mid-line from the back of either eye-socket to the distal edge of the cephalothorax and as the total length measured from the tip of the rostrum to the rear end of the telson, not including the setae."], "retrieved_documents": [{"page_content": "(b) The size of Norway lobster and lobsters shall be measured, as shown in Annex IV,\n- either as the length of the carapace, measured parallel to the mid-line from the back of either eye socket to the distal edge of the carapace, or,\n- as the total length, measured from the tip of the rostrum to the rear end of the telson, not including the setae.", "metadata": {"categories_en": "education and communications, agriculture, forestry and fisheries", "celex_id": "31986R3094", "chunk_strategy": "len_500_o50", "chunk_uid": "d9472b204f0b6dc9e50b4dd3f242e6ce", "label_ids": "100150,100156"}}, {"page_content": "3.\nArticle 5\n(2) (b) and (c) shall be replaced by the following:\n'(b) The size of Norway lobster and lobsters shall be measured, as shown in Annex IV:\n- as the length of the carapace, parallel to the mid-line from the back of either eye socket to the distal edge of the carapace,\n- as the total length, from the tip of the rostrum to the rear end of the telson, not including the setae.", "metadata": {"categories_en": "agriculture, forestry and fisheries", "celex_id": "31992R0345", "chunk_strategy": "len_500_o50", "chunk_uid": "2cde6f396af6cd4cbcf9abda44be5e84", "label_ids": "100156"}}, {"page_content": "2. (a) The size of a fish shall be measured from the tip of the snout to the end of the tail fin.\n(b) The size of Norway lobster and lobsters shall be measured, as shown in Annex IV:\n- as the length of the carapace, parallel to the mid-line from the back of either eye socket to the distal edge of the carapace,\n- as the total length, from the tip of the rostrum to the rear end of the telson, not including the setae.", "metadata": {"categories_en": "environment, agriculture, forestry and fisheries", "celex_id": "31997R0894", "chunk_strategy": "len_500_o50", "chunk_uid": "67f6c19ca4d6230eaa0a8351bdd17b32", "label_ids": "100155,100156"}}, {"page_content": "The size of nephrops and lobsters shall be defined as the length of the cephalothorax measured parallel to the mid-line from the back of either eye-socket to the distal edge of the cephalothorax and as the total length measured from the tip of the rostrum to the rear end of the telson, not including the setae. A nephrops or a lobster shall be considered undersized if either the cephalothoracic length or the total length is less than the specified minimum length.", "metadata": {"categories_en": "agriculture, forestry and fisheries", "celex_id": "31984R2178", "chunk_strategy": "len_500_o50", "chunk_uid": "c8165c885d767d2ce4e2376615e0d412", "label_ids": "100156"}}, {"page_content": "'Article 7\n1. Shrimps, crabs and Norway lobsters shall be graded in the following size categories:\n(a) shrimps (width of shell):\n- size 1: 6,8 mm and over,\n- size 2: 6,5 mm and over;\n(b) crabs (width of shell, as measured in its widest dimension):\n- size 1: 16 cm and over,\n- size 2: from 13 up to but excluding 16 cm;\n(c) Norway lobsters, (units per kg), (subject to compliance with the minimum biological sizes applicable to each region, in accordance with Regulation (EEC) No 171/83):\nwhole:", "metadata": {"categories_en": "production, technology and research, trade, agri-foodstuffs, agriculture, forestry and fisheries", "celex_id": "31985R3118", "chunk_strategy": "len_500_o50", "chunk_uid": "08528df95085662691c19924179e5967", "label_ids": "100158,100147,100157,100156"}}, {"page_content": "4. In Annex VI, for lobster (Hommarus gammarus) in region 2, except Skagerrak and Kattegat, the minimum size of '26 cm overall length' is replaced by the minimum size of '24 cm overall length'.\n5. Annex VII is deleted.\nArticle 2\nThis Regulation shall enter into force on the third day following its publication in the Official Journal of the European Communities.\nThis Regulation shall be binding in its entirety and directly applicable in all Member States.\nDone at Brussels, 23 July 1984.", "metadata": {"categories_en": "agriculture, forestry and fisheries", "celex_id": "31984R2178", "chunk_strategy": "len_500_o50", "chunk_uid": "03b4ebc08c7a18583cef12987f2b0139", "label_ids": "100156"}}, {"page_content": "All catches shall be deemed to have been taken with the net on board having the smallest mesh size unless the logbook, kept in accordance with Article 3 of Regulation (EEC) No 2057/82 (1) and with the rules laid down in implementation of that Article, shows otherwise.\n6. Catches shall be estimated as live weight.\nFor the purpose of this Article, the equivalent weight of whole Norway lobster shall be obtained by multiplying the weight of Norway lobster tails by three.", "metadata": {"categories_en": "education and communications, agriculture, forestry and fisheries", "celex_id": "31986R3094", "chunk_strategy": "len_500_o50", "chunk_uid": "9d82e79335431c2d7b18ef711f85b25b", "label_ids": "100150,100156"}}, {"page_content": "6. Catches shall be estimated as live weight.\nFor the purpose of this Article, the equivalent weight of whole Norway lobster shall be obtained by multiplying the weight of Norway lobster tails by three.", "metadata": {"categories_en": "environment, agriculture, forestry and fisheries", "celex_id": "31997R0894", "chunk_strategy": "len_500_o50", "chunk_uid": "419cba99959e54b695d9fdaea9715736", "label_ids": "100155,100156"}}, {"page_content": "The percentage of undersized fish, crustaceans and molluscs shall be calculated in accordance with Article 2, paragraphs 3 to 6. 4. It shall be prohibited to land tails or claws of lobsters which have been detached from the body and which have been caught in the regions or geographical areas referred to in Annex III for which a minimum size is shown for these species.", "metadata": {"categories_en": "education and communications, agriculture, forestry and fisheries", "celex_id": "31986R3094", "chunk_strategy": "len_500_o50", "chunk_uid": "2b1f960ce06e4f635a7446ea122c85e3", "label_ids": "100150,100156"}}, {"page_content": "Having regard to Council Regulation (EEC) No 104/76 of 19 January 1976 laying down common marketing standards for shrimps (crangon crangon), edible crabs (Cancer pagurus) and Norway lobsters (Nephrops norvegicus) (1), as last amended by Regulation (EEC) No 3118/85 (2), and in particular Article 7 (5) thereof,\nWhereas the coastal areas of the United Kingdom in which the minimum marketing size for edible crabs is to be reduced to 11,5 centimetres must be defined;", "metadata": {"categories_en": "trade, economics, geography, agriculture, forestry and fisheries", "celex_id": "31986R1048", "chunk_strategy": "len_500_o50", "chunk_uid": "f1ff966b528a8f652aea63b69e004cf9", "label_ids": "100147,100146,100161,100156"}}, {"page_content": "4. It shall be prohibited to land tails or claws of lobsters which have been detached from the body and which have been caught in the regions or geographical areas referred to in Annex III for which a minimum size is shown for these species.\nOnly whole scallops (Pecten spp.) may be landed.\n5. Minimum size for species marked by an asterisk in Annexes II or III shall be adopted in accordance with the procedure provided for in Article 18.\nTITLE III PROHIBITION OF FISHING", "metadata": {"categories_en": "environment, agriculture, forestry and fisheries", "celex_id": "31997R0894", "chunk_strategy": "len_500_o50", "chunk_uid": "f6df6b1ab93c5a7f8c6f31a77d46b3f7", "label_ids": "100155,100156"}}, {"page_content": "Article 4\nNotwithstanding the conditions laid down in Article 4(4) and Article 15(1) of Regulation (EC) No 850/98:\n1. The catch taken with any demersal towed net of mesh size range 70 to 79 mm and retained on board in ICES Sub-area VI and/or ICES Division Vb shall consist of at least 30 % of Norway lobsters and no more than 5 % of cod.", "metadata": {"categories_en": "environment, geography, agriculture, forestry and fisheries", "celex_id": "32001R2056", "chunk_strategy": "len_500_o50", "chunk_uid": "cfe2727e79470fb1938f240d54075077", "label_ids": "100155,100161,100156"}}, {"page_content": "WHEREAS THE MEASURES PROVIDED FOR IN THIS REGULATION ARE IN ACCORDANCE WITH THE OPINION OF THE MANAGEMENT COMMITTEE FOR FISHERY PRODUCTS,\nHAS ADOPTED THIS REGULATION :\nARTICLE 1\nREGULATION ( EEC ) NO 104/76 IS HEREBY AMENDED AS FOLLOWS :\n1 . THE FOLLOWING IS ADDED TO ARTICLE 5 ( 1 ) ( A ):\n\"HOWEVER, LIVE NORWAY LOBSTERS SHALL BE CLASSIFIED IN FRESHNESS CATEGORY E .'\n2 . IN ARTICLE 7 ( 1 ) ( C ) THE SECTION HEADED \"WHOLE' IS REPLACED BY THE FOLLOWING :\n\"WHOLE :\n_ SIZE 1 : 20 AND LESS,", "metadata": {"categories_en": "trade, agri-foodstuffs, agriculture, forestry and fisheries", "celex_id": "31988R4213", "chunk_strategy": "len_500_o50", "chunk_uid": "34da881166e97927179efebb3a70f932", "label_ids": "100147,100157,100156"}}, {"page_content": "WHEREAS, PURSUANT TO ARTICLE 3 OF REGULATION ( EEC ) NO 3796/81, ADJUSTMENTS MUST BE MADE TO THE ABOVEMENTIONED STANDARDS TO TAKE ACCOUNT OF CHANGES IN PRODUCTION AND SALES CONDITION; WHEREAS CHANGES HAVE BEEN OBSERVED IN PARTICULAR IN THE PRODUCTION CONDITIONS FOR NORWAY LOBSTERS; WHEREAS THE FRESHNESS AND SIZE SCALE FOR THIS PRODUCT SHOULD THEREFORE BE ADJUSTED;", "metadata": {"categories_en": "trade, agri-foodstuffs, agriculture, forestry and fisheries", "celex_id": "31988R4213", "chunk_strategy": "len_500_o50", "chunk_uid": "618dcc999a82046de5a5a0a6fec680ec", "label_ids": "100147,100157,100156"}}, {"page_content": "Detached Norway lobster tails shall be measured from the front edge of the first segment present of the tail to the rear end of the telson, not including the setae. The tail shall be measured flat and unstretched.\n(c) The size of edible crabs shall be defined, as shown in Annex IV,\n- either as the length of the carapace measured along the mid-line from the interorbital space to the distal edge of the carapace, or,", "metadata": {"categories_en": "education and communications, agriculture, forestry and fisheries", "celex_id": "31986R3094", "chunk_strategy": "len_500_o50", "chunk_uid": "b0df571e1a497699c0714a635795cd37", "label_ids": "100150,100156"}}, {"page_content": "Detached Norway lobster tails shall be measured from the front edge of the first segment present of the tail to the rear end of the telson, not including the setae. The tail shall be measured flat and unstretched.\n(c)\nThe size of edible crabs shall be measured, as shown in Annex IV:\n- as the length of the carapace measured along the mid-line from the interorbital space to the rear edge of the carapace,", "metadata": {"categories_en": "agriculture, forestry and fisheries", "celex_id": "31992R0345", "chunk_strategy": "len_500_o50", "chunk_uid": "15dcb870d83c6acc169ac65e5c78ca44", "label_ids": "100156"}}, {"page_content": "Detached Norway lobster tails shall be measured from the front edge of the first segment present of the tail to the rear end of the telson, not including the setae. The tail shall be measured flat and unstretched.\n(c) The size of edible crabs shall be measured, as shown in Annex IV:\n- as the length of the carapace measured along the mid-line from the interorbital space to the rear edge of the carapace,", "metadata": {"categories_en": "environment, agriculture, forestry and fisheries", "celex_id": "31997R0894", "chunk_strategy": "len_500_o50", "chunk_uid": "915f2a2ada962f158d0440609c24f916", "label_ids": "100155,100156"}}, {"page_content": "The size of fish, crustaceans and molluscs shall be measured in accordance with Article 5 (2) of Regulation (EEC) No 3094/86 unless otherwise specified in Annex IV. If more than one method of measuring size is permitted, the fish, crustacean or mollusc shall be deemed of the required size if at least one of the stipulated measurements is greater than the relevant minimum size.", "metadata": {"categories_en": "environment, agriculture, forestry and fisheries", "celex_id": "31994R1626", "chunk_strategy": "len_500_o50", "chunk_uid": "ffd225d862a69855c0cdae2c89d5b68b", "label_ids": "100155,100156"}}, {"page_content": "3. Lobsters, crawfish, and bivalve and gastropod molluscs belonging to any such species for which a minimum size is set in Annex XII may only be retained on board whole and may only be landed whole.\n4. (a) Edible crabs may only be retained on board whole and may only be landed whole.\n(b) However, a maximum of 5 % by weight of the total catch of edible crabs or parts thereof retained on board or landed may consist of detached claws.\nArticle 19", "metadata": {"categories_en": "environment, agriculture, forestry and fisheries", "celex_id": "31998R0850", "chunk_strategy": "len_500_o50", "chunk_uid": "e2c821cae1a3c99eb9de80ed6d262abf", "label_ids": "100155,100156"}}, {"page_content": "4. The percentages referred to in paragraph 1 may be calculated on the basis of one or more representative samples.\n5. Notwithstanding paragraph 1, in the case of catches of sand eel retained on board and caught with nets having mesh sizes smaller than 16 millimetres, the percentage may be calculated before sorting.\n6. For the purpose of this Article, the equivalent weight of whole Norway lobster shall be obtained by multiplying the weight of Norway lobster tails by three.\nArticle 6", "metadata": {"categories_en": "environment, agriculture, forestry and fisheries", "celex_id": "31998R0850", "chunk_strategy": "len_500_o50", "chunk_uid": "ab4470c53ce26e51a010a66d92c056a1", "label_ids": "100155,100156"}}], "rag_answer": "The answer is not provided in the retrieved context.", "generator_model": "llama3.2", "final_k": 20, "candidate_k": 100, "retrieval_source": "prefetch", "prefetch_path": "/home/mwc/Documents/MIOTI/Current/TFM/Data/eval_top10_dedup/prefetch/eval1_baseline/len_500_o50/hyb_fill_dense_then_bm25_ce_r50/000001.json", "query_index": 1}
{"id": "gt_dedup_00002", "question": "What is the condition under which the export price can be constructed based on the resale price of a product imported from China?", "reference": "31997R1951", "gold_snippet": "31) Two other Chinese producers sold for export to a related importer in the Community, but only in one case did the importer cooperate, and it was possible to construct the export price on the basis of the resale price at which the imported product was first resold to an independent buyer. From the resale price, all costs between i", "ground_truth_answer": "When the importer cooperates and the product is first resold to an independent buyer.", "reference_contexts": ["31) Two other Chinese producers sold for export to a related importer in the Community, but only in one case did the importer cooperate, and it was possible to construct the export price on the basis of the resale price at which the imported product was first resold to an independent buyer. From the resale price, all costs between i"], "retrieved_documents": [{"page_content": "(31) Two other Chinese producers sold for export to a related importer in the Community, but only in one case did the importer cooperate, and it was possible to construct the export price on the basis of the resale price at which the imported product was first resold to an independent buyer. From the resale price, all costs between importation and resale incurred by the importer, as well as a reasonable amount for profit, were deducted, so as to establish a reliable export price, in accordance", "metadata": {"categories_en": "business and competition, industry, energy, trade, geography", "celex_id": "31997R1951", "chunk_strategy": "len_500_o50", "chunk_uid": "3dd774725ce86e63cc18ac471e1e0e6a", "label_ids": "100152,100160,100159,100147,100161"}}, {"page_content": "Article 2 (8) (b) provides that an export price is constructed on the basis of the price at which the imported product is first resold to an independent buyer and that allowance shall be made for all costs incurred by the related importer between importation and resale, including customs duties, any anti-dumping duties and other taxes, and for a reasonable profit margin.", "metadata": {"categories_en": "industry, trade, business and competition, geography", "celex_id": "31988D0328", "chunk_strategy": "len_500_o50", "chunk_uid": "d8c02ebe99df557f3bb8adaa2abbcdb4", "label_ids": "100160,100147,100152,100161"}}, {"page_content": "in these circumstances, the export prices would be constructed based on resales prices to independent buyers in the Community. However, in this case the number of resale transactions made in the IP was very small and actual transaction prices were not supplied by the importer in good time and they were not verifiable. In these circumstances, these sales were not taken into account in the definitive calculation of export prices.", "metadata": {"categories_en": "geography, trade, business and competition, industry", "celex_id": "32005R1174", "chunk_strategy": "len_500_o50", "chunk_uid": "1c7512cf5a9df74fc7d10a70675be211", "label_ids": "100161,100147,100152,100160"}}, {"page_content": "(45)\nSince furthermore no export price could be constructed based on the resale price of the related company to independent customers, as the product concerned goes under substantial transformation to get the final product manufactured by the related company, all those transactions corresponding to captive use were ignored in the determination of the export price.\n2.3. Comparison\n(46)", "metadata": {"categories_en": "geography, trade, business and competition, industry", "celex_id": "32007R0390", "chunk_strategy": "len_500_o50", "chunk_uid": "db0e92cc6240f0ba222bd681ed5cd598", "label_ids": "100161,100147,100152,100160"}}, {"page_content": "(81)\nIn cases where sales were made via a related importer, the export price was constructed on the basis of the resale prices of that related importer to independent customers. Adjustments were made for all costs incurred between importation and resale including sales, general and administrative expenses, and a reasonable profit margin, in accordance with Article 2(9) of the basic Regulation.\n1.4. Comparison\n(82)", "metadata": {"categories_en": "business and competition, industry, trade, agriculture, forestry and fisheries, geography", "celex_id": "32008R0661", "chunk_strategy": "len_500_o50", "chunk_uid": "3040e2978963a8aa49a35def256963b5", "label_ids": "100152,100160,100147,100156,100161"}}, {"page_content": "(27) However, in most cases the export price was made to a related party. In those cases the export price was constructed pursuant to Article 2(9) of the Basic Regulation, i.e. on the basis of the price at which the imported products were first resold to an independent buyer.\n(28) In such cases, adjustments were made for all costs incurred between importation and resale and for profits accruing, in order to establish a reliable export price, at the Community frontier level.", "metadata": {"categories_en": "geography, trade, business and competition, industry", "celex_id": "31998R1845", "chunk_strategy": "len_500_o50", "chunk_uid": "c3344ad4603d6aeddd890fa5f78e5d43", "label_ids": "100161,100147,100152,100160"}}, {"page_content": "(50) However, in cases where export sales were made to a related party, the export price was constructed pursuant to Article 2 (9) of the Basic Regulation, that is to say, on the basis of the price at which the imported products were first resold to an independent buyer. In such cases, adjustments were made for all costs incurred between importation and resale and for profits accruing, in order to establish a reliable export price, at the Community frontier level.", "metadata": {"categories_en": "industry, business and competition, international relations, production, technology and research, trade", "celex_id": "31996R2208", "chunk_strategy": "len_500_o50", "chunk_uid": "e3e98debfd5b4a798b15af6160e9c9c3", "label_ids": "100160,100152,100143,100158,100147"}}, {"page_content": "9. In cases where there is no export price or where it appears that the export price is unreliable because of an association or a compensatory arrangement between the exporter and the importer or a third party, the export price may be constructed on the basis of the price at which the imported products are first resold to an independent buyer, or, if the products are not resold to an independent buyer, or are not resold in the condition in which they were imported, on any reasonable basis.", "metadata": {"categories_en": "business and competition, international relations, trade, agriculture, forestry and fisheries, geography", "celex_id": "32009R1225", "chunk_strategy": "len_500_o50", "chunk_uid": "af5d6c517aa2ec4bcf0382a31ffb17cb", "label_ids": "100152,100143,100147,100156,100161"}}, {"page_content": "(21) For sales made via its related importer, the export price was constructed on the basis of the resale prices to independent customers. Adjustments were made for all costs incurred between importation and resale by that importer, including SG& A expenses, and a reasonable profit margin, in accordance with Article 2(9) of the basic Regulation.\n1.3. Comparison", "metadata": {"categories_en": "industry, trade, business and competition, geography", "celex_id": "32002R0575", "chunk_strategy": "len_500_o50", "chunk_uid": "2be481ef1068808eed69418b9c8ec1e5", "label_ids": "100160,100147,100152,100161"}}, {"page_content": "One US exporter sold the products concerned to a related company in the Community and accordingly this company's export prices were constructed on the basis of the prices at which the imported product was first resold to an independent buyer, suitably adjusted to take account of all costs incurred between importation and resale including customs duty, and the related importer's profit.\nE. Comparison", "metadata": {"categories_en": "production, technology and research, geography, business and competition, industry", "celex_id": "31985D0252", "chunk_strategy": "len_500_o50", "chunk_uid": "bd7b9f9e1949568cc43703864813e5ad", "label_ids": "100158,100161,100152,100160"}}, {"page_content": "(12) The export prices for the Chinese exporters have been established on the basis of prices paid or payable where no related importers were involved and on the basis of resale prices to the first independent buyer adjusted to take account of all costs incurred between importation and resale including customs duties and a 10 % profit on turnover where exports were made to related importers as was the case for Fujian Hitachi Television Co. Ltd and Huaquiang Sanyo Electronics Co. Ltd as", "metadata": {"categories_en": "finance, business and competition, trade, education and communications, geography", "celex_id": "31991R2093", "chunk_strategy": "len_500_o50", "chunk_uid": "7f095a74ed0f8008e6aa5ca6432e09a1", "label_ids": "100148,100152,100147,100150,100161"}}, {"page_content": "(28) In the case sales were made via a related importer, the export price was constructed on the basis of the resale prices to independent customers. Adjustments were made for all costs incurred between importation and resale by that importer, including SG& A expenses, and a reasonable profit margin, in accordance with Article 2(9) of the basic Regulation.\nComparison", "metadata": {"categories_en": "production, technology and research, trade, business and competition, geography", "celex_id": "32003R1251", "chunk_strategy": "len_500_o50", "chunk_uid": "c22c2192bb37fd1a4a4bdac7c9103e67", "label_ids": "100158,100147,100152,100161"}}, {"page_content": "C. Export price\n(9) Export prices were determined on the basis of the prices actually paid or payable for the products sold for export to the Community. All exports were made to Celanese SA, Belgium, and export prices were constructed on the basis of the prices at which the imported product was first resold to an independent buyer, suitably adjusted to take account of all costs incurred between importation and resale.\nD. Comparison", "metadata": {"categories_en": "industry, business and competition, geography", "celex_id": "31984R0512", "chunk_strategy": "len_500_o50", "chunk_uid": "04d041186a3ae020a8e0af931807622b", "label_ids": "100160,100152,100161"}}, {"page_content": "(40)\nIn cases where there was no export price and consequently no resale of imported products the export price was constructed, pursuant to Article 2(9) of the basic Regulation, on any reasonable basis.\n4. COMPARISON\n(41)", "metadata": {"categories_en": "industry, business and competition, production, technology and research, trade, geography", "celex_id": "32008R1256", "chunk_strategy": "len_500_o50", "chunk_uid": "5151329fbcc9a160fc8d91901a752177", "label_ids": "100160,100152,100158,100147,100161"}}, {"page_content": "(18) In order to establish a correct export price for the product of the company only, it was constructed in accordance with Article 2(9) of the basic Regulation as based on the price at which the exported product was first resold to independent customers in the Community by the first related company. This price was adjusted for all costs incurred between importation and resale and for profit.", "metadata": {"categories_en": "trade, geography, business and competition, industry", "celex_id": "32000R2570", "chunk_strategy": "len_500_o50", "chunk_uid": "a28140c94e4c50592ed6d7b05f402d25", "label_ids": "100147,100161,100152,100160"}}, {"page_content": "Since all export sales of BRC to the Community were made via related importers, the ex-works export price had to be constructed in accordance with Article 2(9) of the basic Regulation, on the basis of the price at which the imported products were first resold to the first independent buyer in the Community, adjusted for all costs incurred between importation and resale, as well as a reasonable margin for SG&A and for profits. In this regard the SG&A costs of the related importers were used.", "metadata": {"categories_en": "geography, trade, business and competition, industry", "celex_id": "32009R0825", "chunk_strategy": "len_500_o50", "chunk_uid": "f424a2662769f0d3a8f26db670e64f55", "label_ids": "100161,100147,100152,100160"}}, {"page_content": "it appears that there is an association or a compensatory arrangement between the exporter and the importer or a third party, or that for other reasons the price actually paid or payable for the product sold for export to the Community is unreliable, the export price may be constructed on the basis of the price at which the imported product is first resold to an independent buyer, or if the product is not resold to an independent buyer, or not resold in the condition imported, on any reasonable", "metadata": {"categories_en": "trade, business and competition, economics, agriculture, forestry and fisheries", "celex_id": "31988R2423", "chunk_strategy": "len_500_o50", "chunk_uid": "2f3b0603e5da6113aa25b55911402910", "label_ids": "100147,100152,100146,100156"}}, {"page_content": "(103)\nThe investigation showed that the said producer imported LAM from China which were produced by a Chinese exporter with whom he had a commercial agreement. It was also found that the resale price at which he was selling the imported LAM was comparable to the price he was selling LAM of its own production.\n(104)", "metadata": {"categories_en": "geography, trade, business and competition, industry", "celex_id": "32006R0134", "chunk_strategy": "len_500_o50", "chunk_uid": "0e8c3d7d07ce3bb948983af61d2fd932", "label_ids": "100161,100147,100152,100160"}}, {"page_content": "(58) Since Grosby (China) Limited made its export sales via a related importer, Nick's Sports and Leisure Footwear Ltd (UK), the export price was constructed pursuant to Article 2(9) of the Basic Regulation, i.e. on the basis of the price at which the imported products were first resold to an independent buyer. Adjustments were made for all costs incurred between importation and resale and for profits accruing, in order to establish a reliable export price, at the Community frontier level. A", "metadata": {"categories_en": "industry, trade, business and competition, geography", "celex_id": "31998R0467", "chunk_strategy": "len_500_o50", "chunk_uid": "b4f37c2cec4cdc3263c6dfb83e4d2d08", "label_ids": "100160,100147,100152,100161"}}, {"page_content": "As stipulated in recital 23 of the provisional Regulation, the export price for sales into the Community made via related importers was constructed on the basis of the resale price to the first independent customer in accordance with Article 2(9) of the basic Regulation. In this export price construction, a profit margin of a company which was considered to be an independent importer of the product concerned had been used. After final disclosure was made to the interested parties, one exporting", "metadata": {"categories_en": "trade, industry, business and competition, geography", "celex_id": "32006R1289", "chunk_strategy": "len_500_o50", "chunk_uid": "dd81b180d2de545e5f2e870412a2793a", "label_ids": "100147,100160,100152,100161"}}], "rag_answer": "The condition under which the export price can be constructed based on the resale price of a product imported from China is that there must be no association or compensatory arrangement between the exporter and the importer or a third party, and the price actually paid or payable for the product sold for export to the Community is unreliable.", "generator_model": "llama3.2", "final_k": 20, "candidate_k": 100, "retrieval_source": "prefetch", "prefetch_path": "/home/mwc/Documents/MIOTI/Current/TFM/Data/eval_top10_dedup/prefetch/eval1_baseline/len_500_o50/hyb_fill_dense_then_bm25_ce_r50/000002.json", "query_index": 2}
{"id": "gt_dedup_00003", "question": "What is considered a single crop when referring to an agricultural parcel?", "reference": "31992R3508", "gold_snippet": "ituated within the same Member State's territory,\n- agricultural parcel shall mean a continuous area of land on which a single crop is raised by a single farmer. In accordance with the procedure laid down in Article 12 the Commission shall adopt implementing arrangements for specific uses of agricultural parcels, in particular those concerning mixed crops and jointly used areas", "ground_truth_answer": "A single crop raised by a single farmer.", "reference_contexts": ["ituated within the same Member State's territory,\n- agricultural parcel shall mean a continuous area of land on which a single crop is raised by a single farmer. In accordance with the procedure laid down in Article 12 the Commission shall adopt implementing arrangements for specific uses of agricultural parcels, in particular those concerning mixed crops and jointly used areas"], "retrieved_documents": [{"page_content": "‘(1a)\n“agricultural parcel”: shall mean a continuous area of land on which a single crop group is cultivated by a single farmer; however, where a separate declaration of the use of an area within a crop group is required in the context of this Regulation, that specific use shall further limit the agricultural parcel;’\n(b)\nthe second paragraph is replaced by the following:", "metadata": {"categories_en": "economics, international relations, agriculture, forestry and fisheries", "celex_id": "32007R0972", "chunk_strategy": "len_500_o50", "chunk_uid": "6daa1ade96e53dc17d1a54b9d806671a", "label_ids": "100146,100143,100156"}}, {"page_content": "‘(1a)\n“Agricultural parcel”: shall mean a continuous area of land on which a single crop group is cultivated by a single farmer;\n(1b)\n“Olive parcel” shall mean an agricultural parcel with olive trees, as defined in point 1(a) of Annex XXIV to Commission Regulation (EC) No 1973/2004 (4);\n(b)\npoint (31) is replaced by the following:\n‘(31)", "metadata": {"categories_en": "employment and working conditions, agri-foodstuffs, agriculture, forestry and fisheries", "celex_id": "32005R2184", "chunk_strategy": "len_500_o50", "chunk_uid": "2ace87f4d9d9737ebc2c3a52e54ec583", "label_ids": "100153,100157,100156"}}, {"page_content": "The following definitions shall also apply:\n(1)\n‘agricultural parcel’ means a continuous area of land, declared by one farmer, which does not cover more than one single crop group; however, where a separate declaration of the use of an area within a crop group is required in the context of this Regulation, that specific use shall if necessary further limit the agricultural parcel; Member States may lay down additional criteria for further delimitation of an agricultural parcel;\n(2)", "metadata": {"categories_en": "EUROPEAN UNION, agriculture, forestry and fisheries", "celex_id": "32009R1122", "chunk_strategy": "len_500_o50", "chunk_uid": "168276c8e61f94967062a2c6402ce80d", "label_ids": "100144,100156"}}, {"page_content": "- holding shall mean all the production units managed by a farmer situated within the same Member State's territory,\n- agricultural parcel shall mean a continuous area of land on which a single crop is raised by a single farmer. In accordance with the procedure laid down in Article 12 the Commission shall adopt implementing arrangements for specific uses of agricultural parcels, in particular those concerning mixed crops and jointly used areas.\nArticle 2", "metadata": {"categories_en": "business and competition, economics, international relations, agriculture, forestry and fisheries", "celex_id": "31992R3508", "chunk_strategy": "len_500_o50", "chunk_uid": "780bf89b1a0321ddcf605fdc880af34f", "label_ids": "100152,100146,100143,100156"}}, {"page_content": "(j)\n‘main area’ of a given parcel means the area where the parcel has been used only once during a given crop year, and which is unequivocally defined by that use.\n2. ‘Successive cropping’ refers to a parcel of arable land that is used more than once during a given crop year but which each time it is used has only one crop. That area shall be considered as area under cultivation for each crop. The concepts of main and secondary areas are not applicable in this context.", "metadata": {"categories_en": "economics, agriculture, forestry and fisheries", "celex_id": "32009R0543", "chunk_strategy": "len_500_o50", "chunk_uid": "f13a5a1704505a8aa18b4731e65deb66", "label_ids": "100146,100156"}}, {"page_content": "There is a need to clarify the concept of the term ‘agricultural parcel’ for the purpose of the application of Regulation (EC) No 796/2004 as referring to a continuous area of land on which a single crop group is cultivated by a single farmer. Such definition read in conjunction with Article 49(3) of that Regulation should make it clear, however, that crops of different crop groups may be cultivated on the same continuous area of land where the different aid schemes so allow. In such cases the", "metadata": {"categories_en": "employment and working conditions, agri-foodstuffs, agriculture, forestry and fisheries", "celex_id": "32005R2184", "chunk_strategy": "len_500_o50", "chunk_uid": "5707c85b01f89f5e7b28df73e4e1b29f", "label_ids": "100153,100157,100156"}}, {"page_content": "1. For the purposes of this Regulation:\n(a) a parcel that both contains trees and is used for crop production covered by Article 1 of Regulation (EEC) No 3508/92 shall be considered an agricultural parcel provided that the production envisaged can be carried out in a similar way as on parcels without trees in the same area;", "metadata": {"categories_en": "education and communications, economics, agriculture, forestry and fisheries", "celex_id": "32001R2419", "chunk_strategy": "len_500_o50", "chunk_uid": "2ad7a0654f71e2f52c5d4923017b0bfd", "label_ids": "100150,100146,100156"}}, {"page_content": "Article 2\n1. For the purposes of this Regulation:\n(a) a parcel that both contains trees and is used for crop production covered by Article 1 of Regulation (EEC) No 3508/92 shall be considered an agricultural parcel provided that the production envisaged can be carried out in a similar way as on parcels without trees in the same area;", "metadata": {"categories_en": "business and competition, economics, international relations, agriculture, forestry and fisheries", "celex_id": "31992R3887", "chunk_strategy": "len_500_o50", "chunk_uid": "87b81df9524cc41ff242d448e5240eb3", "label_ids": "100152,100146,100143,100156"}}, {"page_content": "In no case shall the scale include criteria associated with an increase in production or the cotton’s placement on the market.\nIn order to apply the scale, all the parcels belonging to a single producer may be considered as being of the same average parcel category and producing the same quality cotton.", "metadata": {"categories_en": "agri-foodstuffs, EUROPEAN UNION, agriculture, forestry and fisheries", "celex_id": "32005R2182", "chunk_strategy": "len_500_o50", "chunk_uid": "5c8e3d6c3a88ba4d494258bac0e2ba12", "label_ids": "100157,100144,100156"}}, {"page_content": "‘(i)\nbetween the agricultural parcels as declared in the single application and the parcels authorised for cotton production by the Member State in accordance with Article 110b of Regulation (EC) No 1782/2003;\n(j)", "metadata": {"categories_en": "employment and working conditions, agri-foodstuffs, agriculture, forestry and fisheries", "celex_id": "32005R2184", "chunk_strategy": "len_500_o50", "chunk_uid": "14822510082b501419fccbd44f096973", "label_ids": "100153,100157,100156"}}, {"page_content": "(g)\nbetween the agricultural parcels as declared in the single application and the parcels authorised for cotton production by the Member State in accordance with Article 89 of Regulation (EC) No 73/2009;\n(h)", "metadata": {"categories_en": "EUROPEAN UNION, agriculture, forestry and fisheries", "celex_id": "32009R1122", "chunk_strategy": "len_500_o50", "chunk_uid": "057f9cf1d90085392468f75cbeaeeb11", "label_ids": "100144,100156"}}, {"page_content": "Article 2\n1. For the purposes of this Regulation:\n(a) A parcel of land that both contains trees and is used for crop production covered by Article 1 of Regulation (EEC) No 3508/92 shall be considered agricultural land provided that production can be carried out in a similar way as on parcels without trees in the same area.\n(b) Where a forage area is used in common, the competent authorities shall assign it between the individual farmers in proportion to their use of it.", "metadata": {"categories_en": "business and competition, agri-foodstuffs, international relations, politics, agriculture, forestry and fisheries", "celex_id": "31992R3888", "chunk_strategy": "len_500_o50", "chunk_uid": "c79c2cd18e2e1fe8dda5d5a37408dfb2", "label_ids": "100152,100157,100143,100142,100156"}}, {"page_content": "1. A parcel that contains trees shall be considered an agricultural parcel for the purposes of the area-related aid schemes provided that agricultural activities referred to in Article 51 of Regulation (EC) No 1782/2003 or, where applicable, the production envisaged can be carried out in a similar way as on parcels without trees in the same area.\n2. With regard to forage area:\n(a)", "metadata": {"categories_en": "economics, international relations, agriculture, forestry and fisheries", "celex_id": "32004R0796", "chunk_strategy": "len_500_o50", "chunk_uid": "14b7f21c6eb29865ece22107282e4071", "label_ids": "100146,100143,100156"}}, {"page_content": "(16)\nIn the single application, the farmer should declare not only the area he is using for agricultural purposes but also his payment entitlements. Moreover, any specific information relating to production of hemp, durum wheat, rice, nuts, energy crops, starch potato and seeds should be requested together with the single application.\n(17)", "metadata": {"categories_en": "economics, international relations, agriculture, forestry and fisheries", "celex_id": "32004R0796", "chunk_strategy": "len_500_o50", "chunk_uid": "6f996b7d46b1af5e246e7d4d172d069e", "label_ids": "100146,100143,100156"}}, {"page_content": "‘Combined cropping’ refers to a combination of crops that are cultivated on a parcel of agricultural land at the same time. The area under cultivation in this case is distributed between the crops in proportion to the area of the land they are cultivated on. The concepts of main and secondary areas are not applicable in this context.", "metadata": {"categories_en": "economics, agriculture, forestry and fisheries", "celex_id": "32009R0543", "chunk_strategy": "len_500_o50", "chunk_uid": "3ea1caef65b64e25b5704b2bde60854d", "label_ids": "100146,100156"}}, {"page_content": "'Utilised agricultural area' shall mean the total area taken up by arable land, permanent grassland, permanent crops and kitchen gardens as established by the Commission (EUROSTAT) for its statistical purposes.\n5. For the purpose of granting payments under the single area payment scheme, all agricultural parcels corresponding to the criteria provided for in paragraph 4 shall be eligible.", "metadata": {"categories_en": "geography, EUROPEAN UNION, agriculture, forestry and fisheries", "celex_id": "32004D0281", "chunk_strategy": "len_500_o50", "chunk_uid": "ea9e0b90b6948a5e7c1b30e068ed57d5", "label_ids": "100161,100144,100156"}}, {"page_content": "(2)\nIn order to ensure coherence between the obligations to declare separate use of parcels and the definition of the ‘agricultural parcel’, that definition should be clarified in the case where a separate declaration of the use of a parcel is required in the context of Regulation (EC) No 796/2004. In the case where that separate declaration of use concerns an area within a crop group, it is appropriate to clarify that the agricultural parcel is defined by that use.\n(3)", "metadata": {"categories_en": "economics, international relations, agriculture, forestry and fisheries", "celex_id": "32007R0972", "chunk_strategy": "len_500_o50", "chunk_uid": "97f0097ebd042807f16e207b4656de7c", "label_ids": "100146,100143,100156"}}, {"page_content": "(h)\nthe identification of the agricultural parcel(s) on which the fodder for processing is grown, with reference to the single aid application in which these parcels have been declared, in accordance with Article 14(1) of Regulation (EC) No 796/2004 and, where a contract has been concluded or a delivery declaration made before the date of submission of the single aid application, an undertaking to declare those parcels in the single aid application.", "metadata": {"categories_en": "industry, law, economics, agriculture, forestry and fisheries, EUROPEAN UNION", "celex_id": "32008R0232", "chunk_strategy": "len_500_o50", "chunk_uid": "e6452d4ee04ed252e9b683af45b69009", "label_ids": "100160,100145,100146,100156,100144"}}, {"page_content": "(5)\nOnly one application for an area payment should be permitted in respect of any parcel cultivated in a given year except in cases where the area payment is given as a supplement to the same crop or the aid concerns the production of seeds. Area payments may be granted on crops subsidised under a scheme falling within the Community's structural or environmental policies.\n(6)", "metadata": {"categories_en": "trade, international relations, agriculture, forestry and fisheries", "celex_id": "32004R1973", "chunk_strategy": "len_500_o50", "chunk_uid": "c22c25f362a3ce956c1ddb48858aaa2a", "label_ids": "100147,100143,100156"}}, {"page_content": "(e)\nthe identification of the agricultural parcel(s) on which the fodder for processing is grown, with reference to the single aid application in which these parcels have been declared, in accordance with Article 14(1) of Regulation (EC) No 796/2004 and, where a contract has been concluded or a delivery declaration made before the date of submission of the single aid application, an undertaking to declare those parcels in the single aid application.", "metadata": {"categories_en": "industry, economics, trade, agriculture, forestry and fisheries, EUROPEAN UNION", "celex_id": "32005R0382", "chunk_strategy": "len_500_o50", "chunk_uid": "461eb7856cab511f3a5d066195874ee9", "label_ids": "100160,100146,100147,100156,100144"}}], "rag_answer": "According to Document 3, CELEX: 32009R1122:\n\n‘agricultural parcel’ means a continuous area of land, declared by one farmer, which does not cover more than one single crop group; however, where a separate declaration of the use of an area within a crop group is required in the context of this Regulation, that specific use shall if necessary further limit the agricultural parcel;", "generator_model": "llama3.2", "final_k": 20, "candidate_k": 100, "retrieval_source": "prefetch", "prefetch_path": "/home/mwc/Documents/MIOTI/Current/TFM/Data/eval_top10_dedup/prefetch/eval1_baseline/len_500_o50/hyb_fill_dense_then_bm25_ce_r50/000003.json", "query_index": 3}
{"id": "gt_dedup_00004", "question": "What information is required to be included on a container holding eggs, according to Regulation (EEC) No 2772/75?", "reference": "31985R0036", "gold_snippet": "d) the number of eggs packed;\n(e) the word \"packed\", followed by the date or packing period of first packing, and below this the word \"regraded\" followed by the date or period of regrading in accordance with Article 17 (1) (e) of Regulation (EEC) No 2772/75;\n(f) particulars of the refrigeration or method of preservation, uncoded and in Roman type, for refrigerated or preserved eggs.\n3", "ground_truth_answer": "The particulars of the refrigeration or method of preservation, uncoded and in Roman type, for refrigerated or preserved eggs.", "reference_contexts": ["d) the number of eggs packed;\n(e) the word \"packed\", followed by the date or packing period of first packing, and below this the word \"regraded\" followed by the date or period of regrading in accordance with Article 17 (1) (e) of Regulation (EEC) No 2772/75;\n(f) particulars of the refrigeration or method of preservation, uncoded and in Roman type, for refrigerated or preserved eggs.\n3"], "retrieved_documents": [{"page_content": "Article 12\n1. In order to indicate the origin of eggs on small packs in accordance with Article 21 (c) of Regulation (EEC) No 2772/75, terms may be used which refer to the Member State and/or to an administrative or other region, defined by the competent authority of the Member State in which the eggs were produced.", "metadata": {"categories_en": "production, technology and research, trade", "celex_id": "31985R1943", "chunk_strategy": "len_500_o50", "chunk_uid": "18854d155daea7ccdbaa284a90cf68c8", "label_ids": "100158,100147"}}, {"page_content": "Article 11\n1. Small packs containing grade A eggs may carry one of the following terms, as appropriate, to indicate the type of farming as referred to in Article 21 (c) of Regulation (EEC) No 2772/75:\n(a) \"AEg fra fritgaaende hoens\",\n\"Eier aus Freilandhaltung\",\n\"Avgá orníthon apó ektrofí se eléfthero chóro vóskisis\",\n\"Free range eggs\",\n\"OEufs de poules élevées en plein air - système extensif\",\n\"Uova di allevamento all'aperto - sistema estensivo\",", "metadata": {"categories_en": "production, technology and research, trade", "celex_id": "31985R1943", "chunk_strategy": "len_500_o50", "chunk_uid": "33855735915eb335a36fd610f3e3d38f", "label_ids": "100158,100147"}}, {"page_content": "Whereas Article 18 (1) of Regulation (EEC) No 2772/75 requires that additional provisions be laid down concerning the conditions under which the recommended sell-by date may be indicated on small packs; whereas it seems appropriate to relate that date to the quality criteria for eggs;\nWhereas Article 21 (c) of Regulation (EEC) No 2772/75 provides that indications concerning the type of farming and the origin of eggs may be used only in accordance with rules determined at Community level;", "metadata": {"categories_en": "production, technology and research, trade", "celex_id": "31985R1943", "chunk_strategy": "len_500_o50", "chunk_uid": "5fd9f25624393f5ea63508832a0be637", "label_ids": "100158,100147"}}, {"page_content": "Whereas Regulation (EEC) No 2782/75 laid down certain rules for the production and marketing of eggs for hatching and of farmyard poultry chicks ; whereas, the implementation of these rules requires rules of application regarding the allocation of distinguishing numbers, the markings to be made on eggs and packaging and the communication of the necessary information;", "metadata": {"categories_en": "trade, agri-foodstuffs, agriculture, forestry and fisheries", "celex_id": "31977R1868", "chunk_strategy": "len_500_o50", "chunk_uid": "76c856658b2b23bc8fe19a777bb7984c", "label_ids": "100147,100157,100156"}}, {"page_content": "Article 20\n1. Detailed rules for the implementation of this Regulation shall be adopted in accordance with the procedure laid down in Article 17 of Regulation (EEC) No 2771/75, in particular regarding:\n- frequency of collection, delivery and handling of eggs,\n- quality criteria and weight gradings,\n- particulars of indications on eggs and their packs", "metadata": {"categories_en": "trade, agri-foodstuffs", "celex_id": "31990R1907", "chunk_strategy": "len_500_o50", "chunk_uid": "759a3fe6b70d8973f42c7d190e35557a", "label_ids": "100147,100157"}}, {"page_content": "Whereas Regulation (EEC) No 2771/75 provides for the setting of marketing standards which may relate in particular to grading by quality and weight, packing, warehousing, transport, presentation and marking of eggs;", "metadata": {"categories_en": "trade, agri-foodstuffs", "celex_id": "31990R1907", "chunk_strategy": "len_500_o50", "chunk_uid": "62c9aac5c0a6ea15a1f9c8ee0f7cd310", "label_ids": "100147,100157"}}, {"page_content": "3. Further dates and indications concerning the type of farming and the origin of the eggs may only be used in accordance with rules to be laid down under the procedure set out in Article 17 of Regulation (EEC) No 2771/75. These rules shall cover in particular the terms used in indications of the type of farming and the criteria concerning the origin of the eggs.", "metadata": {"categories_en": "trade, agri-foodstuffs", "celex_id": "31990R1907", "chunk_strategy": "len_500_o50", "chunk_uid": "01864ab3409b1e70ccb1bed005790ec3", "label_ids": "100147,100157"}}, {"page_content": "(d) the number of eggs packed;\n(e) the word \"packed\", followed by the date or packing period of first packing, and below this the word \"regraded\" followed by the date or period of regrading in accordance with Article 17 (1) (e) of Regulation (EEC) No 2772/75;\n(f) particulars of the refrigeration or method of preservation, uncoded and in Roman type, for refrigerated or preserved eggs.\n3. Large packs may, however, bear the retail management code or the stock control code.", "metadata": {"categories_en": "trade", "celex_id": "31985R0036", "chunk_strategy": "len_500_o50", "chunk_uid": "c399674dfac16ebc8babaf5b5175153d", "label_ids": "100147"}}, {"page_content": "Whereas it is further necessary to identify eggs for hatching produced in the Community, so as to be able to distinguish them from the eggs subject to Council Regulation (EEC) No 2772/75 (4) of 29 October 1975 on marketing standards for eggs ; whereas, therefore, such identification must be made in the Community by the individual marking of eggs for hatching ; whereas, however, it is necessary to provide that, in the Member States which authorize it, this identification can be carried out", "metadata": {"categories_en": "trade, agri-foodstuffs, agriculture, forestry and fisheries", "celex_id": "31975R2782", "chunk_strategy": "len_500_o50", "chunk_uid": "0854bf9f0adf09992a17596d93702c74", "label_ids": "100147,100157,100156"}}, {"page_content": "4. Small packs containing repacked eggs shall bear, in clearly visible and legible characters and in accordance with Article 18 (2) of Regulation (EEC) No 2772/75, the particulars provided for in paragraph 2. In addition, small packs may bear the trade mark of the undertaking which repacked the eggs or had them repacked, and the particulars laid down in Article 21 of Regulation (EEC) No 2772/75. The word \"Extra\" may not be used.'\nArticle 2", "metadata": {"categories_en": "trade", "celex_id": "31985R0036", "chunk_strategy": "len_500_o50", "chunk_uid": "2f67a026e9796373a53bae39c244eb96", "label_ids": "100147"}}, {"page_content": "Whereas, pursuant to Regulation (EEC) No 2772/75, as amended by Regulation (EEC) No 1831/84 (5), the indication of the packing week number on egg packs has been replaced by that of the packing period; whereas small packs may, pursuant to the same Regulation, bear certain indications; whereas Regulation (EEC) No 3341/84 introduced such a possibility in the case of large packs; whereas, therefore, Commission Regulation (EEC) No 1295/70 (6) should be amended accordingly;", "metadata": {"categories_en": "trade", "celex_id": "31985R0036", "chunk_strategy": "len_500_o50", "chunk_uid": "dd35d8de43ba35338b5b25194d6a93fd", "label_ids": "100147"}}, {"page_content": "(a) the information shown on the eggs;\n(b) the species of poultry from which the eggs come;\n(c) the sender's name or business name or address.'\nArticle 2\nThis Regulation shall enter into force on 1 January 1981.\nThis Regulation shall be binding in its entirety and directly applicable in all Member States.\nDone at Brussels, 22 December 1980.", "metadata": {"categories_en": "trade, agri-foodstuffs, agriculture, forestry and fisheries", "celex_id": "31980R3485", "chunk_strategy": "len_500_o50", "chunk_uid": "5a41e66d3e86db1da0fae887edcccd5b", "label_ids": "100147,100157,100156"}}, {"page_content": "(b) the date of hatching, the number of chicks hatched and the number of chicks intended for actual use.\nArticle 8\nEggs for hatching which are not marked before being incubated and which are removed from the incubator shall be destroyed or, if they are marketed as industrial eggs within the meaning of Article 1 (2) of Regulation (EEC) No 2772/75, shall bear a distinguishing mark to be specified.\nArticle 9", "metadata": {"categories_en": "trade, agri-foodstuffs, agriculture, forestry and fisheries", "celex_id": "31975R2782", "chunk_strategy": "len_500_o50", "chunk_uid": "7e5c4993334ba0ad402001d6edf429f3", "label_ids": "100147,100157,100156"}}, {"page_content": "Whereas Regulation (EEC) No 2772/75 [3] laid down certain marketing standards for eggs; whereas those standards need to be reviewed regularly in order to provide better guarantees and more accurate information to the ultimate consumer of eggs, in particular in the light of evolving trade practices;", "metadata": {"categories_en": "trade, agri-foodstuffs", "celex_id": "31990R1907", "chunk_strategy": "len_500_o50", "chunk_uid": "5e3e0481c80e76805d2f3501584d20b1", "label_ids": "100147,100157"}}, {"page_content": "shell; whereas preserved eggs are included in the said Annex II and are therefore specified in Regulation (EEC) No 2771/75; whereas it is logical and desirable that cooked eggs in shell and moulded egg products should also be mentioned in the said Regulation;", "metadata": {"categories_en": "trade, agri-foodstuffs, agriculture, forestry and fisheries", "celex_id": "31988R3207", "chunk_strategy": "len_500_o50", "chunk_uid": "3b45ffda73c1a7cd26319e74c1605474", "label_ids": "100147,100157,100156"}}, {"page_content": "Whereas it is necessary to determine the indications that may or must be used on packs; whereas the use of certain optional indications must be subject to detailed rules to be adopted in accordance with the procedure laid down in Article 17 of Regulation (EEC) No 2771/75;\nWhereas the marking of \"fresh eggs\" can be optional, since the obligatory marking of other eggs enables them to be easily distinguished;", "metadata": {"categories_en": "trade, agri-foodstuffs", "celex_id": "31990R1907", "chunk_strategy": "len_500_o50", "chunk_uid": "b65fd19501a9542aaee3df4a0266d3fb", "label_ids": "100147,100157"}}, {"page_content": "a marking shall be in conformity with the general requirements for marketing of eggs laid down in Article 6 of Regulation (EEC) No 2782/75 as last amended and its implementing Regulation (EEC) No 1868/77.", "metadata": {"categories_en": "agri-foodstuffs, international relations, production, technology and research, trade, social questions", "celex_id": "32001D0393", "chunk_strategy": "len_500_o50", "chunk_uid": "f28d5ba19d7f2481f4446ccfd9437d1e", "label_ids": "100157,100143,100158,100147,100149"}}, {"page_content": "(d) the number of eggs packed;\n(e) the word \"packed\", followed by the date or packing period of first packing, and below this the word \"repacked\", followed by the date or period of repacking, in accordance with Article 17 (1) (e) of Regulation (EEC) No 2272/75;\n(f) particulars of the refrigeration or method of preservation, uncoded and in Roman type, for refrigerated or preserved eggs;", "metadata": {"categories_en": "trade", "celex_id": "31985R0036", "chunk_strategy": "len_500_o50", "chunk_uid": "cc13f4cd4f90a80c120e76bfb63e4d96", "label_ids": "100147"}}, {"page_content": "4. In order to comply with the provision in force in certain importer third countries, eggs for hatching intended for export and their packings may bear particulars other than those provided for in this Regulation, provided that they are not likely to be confused with the latter and with those provided for in Regulation (EEC) No 2772/75 and its implementing Regulations.\nArticle 6", "metadata": {"categories_en": "trade, agri-foodstuffs, agriculture, forestry and fisheries", "celex_id": "31975R2782", "chunk_strategy": "len_500_o50", "chunk_uid": "8a9da7e15aef17c25072322feb4debb0", "label_ids": "100147,100157,100156"}}, {"page_content": "Whereas Commission Regulation (EEC) No 95/69 of 17 January 1969 implementing Regulation (EEC) No 1619/68 on marketing standards for eggs (6), as amended by Council Regulation (EEC) No 2772/75 of 29 October 1975 on marketing standards for eggs (7) provides for the identification and marketing of incubated eggs which were not marketed before being put into incubation and are marketed as industrial eggs;", "metadata": {"categories_en": "trade, agri-foodstuffs, agriculture, forestry and fisheries", "celex_id": "31977R1868", "chunk_strategy": "len_500_o50", "chunk_uid": "5dd9bd7158d06c8ef44e58a5342a3bd1", "label_ids": "100147,100157,100156"}}], "rag_answer": "The answer to your question is not provided in the retrieved context. The relevant information regarding the requirements for a container holding eggs, according to Regulation (EEC) No 2772/75, cannot be found in the documents provided.", "generator_model": "llama3.2", "final_k": 20, "candidate_k": 100, "retrieval_source": "prefetch", "prefetch_path": "/home/mwc/Documents/MIOTI/Current/TFM/Data/eval_top10_dedup/prefetch/eval1_baseline/len_500_o50/hyb_fill_dense_then_bm25_ce_r50/000004.json", "query_index": 4}
{"id": "gt_dedup_00005", "question": "What is one of the applications of determining mass mentioned in point 5 of the legal instrument?", "reference": "31990L0384", "gold_snippet": "determination of mass in the practice of medicine for weighing patients for the purposes of monitoring, diagnosis and medical treatment;\n5. determination of mass for making up medicines on prescription in a pharmacy and determination of mass in analyses carried out in medical and pharmaceutical laboratories;\n6.", "ground_truth_answer": "Determining mass for making up medicines on prescription in a pharmacy.", "reference_contexts": ["determination of mass in the practice of medicine for weighing patients for the purposes of monitoring, diagnosis and medical treatment;\n5. determination of mass for making up medicines on prescription in a pharmacy and determination of mass in analyses carried out in medical and pharmaceutical laboratories;\n6."], "retrieved_documents": [{"page_content": "This Directive applies to all non-automatic weighing instruments, hereinafter referred to as 'instruments'.\n2. A distinction is made in this Directive between two categories of instrument use:\n(a) 1. determination of mass for commercial transactions;\n2. determination of mass for the calculation of a\ntoll, tariff, tax, bonus, penalty, remuneration, indemnity or similar type of payment;\n3. determination of mass for the application of laws\nor regulations; expert opinion given in court proceedings;", "metadata": {"categories_en": "production, technology and research, industry, science, EUROPEAN UNION", "celex_id": "31990L0384", "chunk_strategy": "len_500_o50", "chunk_uid": "582285371822ec8af4e688fbc498029d", "label_ids": "100158,100160,100151,100144"}}, {"page_content": "For nets of a mesh size of 35 mm or less as determined in accordance with (a), a force of 19,61 newtons (equivalent to a mass of two kilograms) shall be applied and for other nets a force of 49,03 newtons (equivalent to a mass of five kilograms).\nFor the purposes of determining the mesh size in accordance with point 5 when a weight or dynamometer is used, one series of 20 meshes only shall be measured.'\nArticle 2", "metadata": {"categories_en": "production, technology and research, environment, agriculture, forestry and fisheries", "celex_id": "31987R2243", "chunk_strategy": "len_500_o50", "chunk_uid": "ff6b177751b96cafe0c63a8525b1096b", "label_ids": "100158,100155,100156"}}, {"page_content": "2. For the purposes of this Directive, the following categories of use of non-automatic weighing instruments shall be distinguished:\n(a)\n(i)\ndetermination of mass for commercial transactions;\n(ii)\ndetermination of mass for the calculation of a toll, tariff, tax, bonus, penalty, remuneration, indemnity or similar type of payment;\n(iii)\ndetermination of mass for the application of laws or regulations or for an expert opinion given in court proceedings;\n(iv)", "metadata": {"categories_en": "production, technology and research, industry, science, EUROPEAN UNION", "celex_id": "32009L0023", "chunk_strategy": "len_500_o50", "chunk_uid": "89dd9c77a8b41d45f27f2db608002432", "label_ids": "100158,100160,100151,100144"}}, {"page_content": "For nets of a mesh size of 35 mm or less as determined in accordance with paragraph 1, a force of 19,61 newtons (equivalent to a mass of 2 kilograms) shall be applied and for other nets a force of 49,03 newtons (equivalent to a mass of 5 kilograms).\nFor the purposes of determining the mesh size in accordance with Article 5 when using a weight or dynamometer, one series of 20 meshes only shall be measured.\nArticle 7", "metadata": {"categories_en": "industry, agriculture, forestry and fisheries", "celex_id": "31984R2108", "chunk_strategy": "len_500_o50", "chunk_uid": "07bc4db8cff44f1430ab9fe3a20e0d8f", "label_ids": "100160,100156"}}, {"page_content": "(b)\nall applications other than those listed in point (a).\nArticle 2\nFor the purposes of this Directive, the following definitions shall apply:\n1. ‘weighing instrument’: a measuring instrument serving to determine the mass of a body by using the action of gravity on that body. A weighing instrument may also serve to determine other mass-related magnitudes, quantities, parameters or characteristics;", "metadata": {"categories_en": "production, technology and research, industry, science, EUROPEAN UNION", "celex_id": "32009L0023", "chunk_strategy": "len_500_o50", "chunk_uid": "1a1d0cef6d1ae7709e5cb8171cc756aa", "label_ids": "100158,100160,100151,100144"}}, {"page_content": "4. determination of mass in the practice of medicine for weighing patients for the purposes of monitoring, diagnosis and medical treatment;\n5. determination of mass for making up medicines on prescription in a pharmacy and determination of mass in analyses carried out in medical and pharmaceutical laboratories;\n6. determination of price on the basis of mass for\nthe purposes of direct sales to the public and the making-up of prepackages;\n(b)", "metadata": {"categories_en": "production, technology and research, industry, science, EUROPEAN UNION", "celex_id": "31990L0384", "chunk_strategy": "len_500_o50", "chunk_uid": "e4317f75fc88cdeee2fb64a40334a48c", "label_ids": "100158,100160,100151,100144"}}, {"page_content": "Article 1\n1. A weighing instrument is defined as a measuring instrument serving to determine the mass of a body by using the action of gravity on that body. A weighing instrument may also serve to determine other mass-related magnitudes, quantities, parameters or characteristics.\nA non-automatic weighing instrument is defined as a weighing instrument requiring the intervention of an operator during weighing.", "metadata": {"categories_en": "production, technology and research, industry, science, EUROPEAN UNION", "celex_id": "31990L0384", "chunk_strategy": "len_500_o50", "chunk_uid": "1f773da9cd390688b6666e9ae5d65770", "label_ids": "100158,100160,100151,100144"}}, {"page_content": "(iv)\ndetermination of mass in the practice of medicine for weighing patients for the purposes of monitoring, diagnosis and medical treatment;\n(v)\ndetermination of mass for making up medicines on prescription in a pharmacy and determination of mass in analyses carried out in medical and pharmaceutical laboratories;\n(vi)\ndetermination of price on the basis of mass for the purposes of direct sales to the public and the making-up of prepackages;\n(b)", "metadata": {"categories_en": "production, technology and research, industry, science, EUROPEAN UNION", "celex_id": "32009L0023", "chunk_strategy": "len_500_o50", "chunk_uid": "cbaca0217df57f9715848e901e238b84", "label_ids": "100158,100160,100151,100144"}}, {"page_content": "3. For nets of a mesh size of 35 mm or less as determined in accordance with Article 8, a force of 19,61 newtons (equivalent to a mass of 2 kilograms) shall be applied and for other nets a force of 49,03 newtons (equivalent to a mass of 5 kilograms).\n4. For the purposes of determining the mesh size in accordance with Article 7 when using a weight or dynamometer, one series of 20 meshes only shall be measured.\n5. The result of this measurement shall be final.\nCHAPTER III", "metadata": {"categories_en": "production, technology and research, agriculture, forestry and fisheries", "celex_id": "32003R0129", "chunk_strategy": "len_500_o50", "chunk_uid": "ad1979315ec2f6247b584ee7cba2ecf5", "label_ids": "100158,100156"}}, {"page_content": "(f) the method(s) used for the purposes of this Regulation to measure mass or, where applicable, to convert volume into mass, the reasoning behind the coefficients selected, and the exact circumstances in which they apply, together with any subsequent amendments thereto.", "metadata": {"categories_en": "agri-foodstuffs, EUROPEAN UNION, agriculture, forestry and fisheries", "celex_id": "32001R1392", "chunk_strategy": "len_500_o50", "chunk_uid": "a6f9f5c11a7e85865f4d21d9650ef7e7", "label_ids": "100157,100144,100156"}}, {"page_content": "For nets of a mesh size of 35 mm or less as determined in accordance with (a) above, a force of 19,61 newton (equivalent to a mass of two kilograms) shall be applied and a force of 49,03 newton (equivalent to a mass of five kilograms), shall be applied for other nets.\nFor the purposes of determining the mesh size in accordance with point E above (when a weight or dynamometer is used), only one series of 20 meshes shall be measured, wherever a weight or dynamometer is used.", "metadata": {"categories_en": "environment, agriculture, forestry and fisheries", "celex_id": "31998R0066", "chunk_strategy": "len_500_o50", "chunk_uid": "22a626098d9bd1eaebbda88e69239b59", "label_ids": "100155,100156"}}, {"page_content": "2. Member States shall notify to the Commission the method(s) used for the purposes of this Regulation to measure mass or, where applicable, to convert volume into mass, the reasoning behind the coefficients selected, and the exact circumstances in which they apply, together with any subsequent amendments thereto.", "metadata": {"categories_en": "trade, agri-foodstuffs, agriculture, forestry and fisheries, EUROPEAN UNION", "celex_id": "32004R0595", "chunk_strategy": "len_500_o50", "chunk_uid": "39e466b9ecfb3f6f0f0c10f88ca66f4d", "label_ids": "100147,100157,100156,100144"}}, {"page_content": "When Member States grant national type-approval of vehicles approved under this Directive or permit the registration, entry into service or use of such vehicles, they assign to them national registration/in-service maximum permissible masses according to their relevant national maximum authorized masses. For the determination of these registration/in-service maximum permissible masses, no Member State may refuse to apply the procedure provided for in Annex IV, should the manufacturer request", "metadata": {"categories_en": "transport, EUROPEAN UNION", "celex_id": "31997L0027", "chunk_strategy": "len_500_o50", "chunk_uid": "0660ab6c16895e279692a5eb0fd928cb", "label_ids": "100154,100144"}}, {"page_content": "(6) In view of the subsidiarity principle set out in Article 5 of the Treaty, a Directive is the appropriate legal instrument as it provides a framework for the Member States' uniform and compulsory application of the requirements and procedures for the safe loading and unloading of bulk carriers, while leaving each Member State the right to decide which implementation tools best fit its internal system. In accordance with the principle of proportionality, this Directive does not go beyond what", "metadata": {"categories_en": "transport, employment and working conditions, social questions", "celex_id": "32001L0096", "chunk_strategy": "len_500_o50", "chunk_uid": "d90c37db859212657b04141c00681c90", "label_ids": "100154,100153,100149"}}, {"page_content": "Article 5\nContents of permits, certificates and applications for the issue of such documents\nInformation and references in permits and certificates, as well as in applications for the issue of such documents, shall comply with the following requirements:\n(1)\nthe description of specimens must, where it is provided for, include one of the codes contained in Annex VII;\n(2)\nfor the indication of units of quantity and net mass, those contained in Annex VII must be used;\n(3)", "metadata": {"categories_en": "production, technology and research, trade, environment", "celex_id": "32006R0865", "chunk_strategy": "len_500_o50", "chunk_uid": "7bb2e1232d28e8f433911e6755a09afb", "label_ids": "100158,100147,100155"}}, {"page_content": "4. Where statistical value not collected, Member States shall estimate the statistical value of the goods.\n5. Member States shall estimate the net mass whenever it is not collected from the parties responsible for providing information pursuant to Article 9(1). The Commission (Eurostat) shall provide Member States with the coefficients needed to estimate the net mass.", "metadata": {"categories_en": "trade, economics", "celex_id": "32010R0096", "chunk_strategy": "len_500_o50", "chunk_uid": "0e50692cea04de96b00a8a35d343c7ed", "label_ids": "100147,100146"}}, {"page_content": "Having regard to Council Regulation (EEC) No 2913/92 of 12 October 1992 establishing the Community Customs Code (1), as last amended by Regulation (EC) No 82/97 (2), and in particular Article 249 thereof,\nWhereas the verification of the net mass indicated in declarations of entry for free circulation of bananas poses problems of methodology and of uniform application; whereas it is therefore appropriate to specify the methods for determining and checking the net mass of bananas;", "metadata": {"categories_en": "trade, agri-foodstuffs, law", "celex_id": "31997R0089", "chunk_strategy": "len_500_o50", "chunk_uid": "d5be84f40e761e9b091ea7a41e083d57", "label_ids": "100147,100157,100145"}}, {"page_content": "10\n-\nfrom 1 001 to 2 000\n13\n-\nmore than 2 000\n15\nWhere a whole cargo load is covered by a single declaration, the customs office may, unless fraud is suspected, base the calculation of the net mass on a minimum sample of 15 units of packaging (of the same type of packaging and from the same place of origin).\nThe net mass shall be determined as follows:\n-\nopening at least one unit of packaging, then calculating the mass of the packaging,\n-", "metadata": {"categories_en": "trade, agri-foodstuffs, law", "celex_id": "31997R0089", "chunk_strategy": "len_500_o50", "chunk_uid": "0c3bc1142eade52a21ec1071a3d2d80a", "label_ids": "100147,100157,100145"}}, {"page_content": "3.\n‘reference mass’ means the mass of the vehicle in running order less the uniform mass of the driver of 75 kg and increased by a uniform mass of 100 kg;\n4.\n‘gaseous pollutants’ means the exhaust gas emissions of carbon monoxide, oxides of nitrogen, expressed in nitrogen dioxide (NO2) equivalent, and hydrocarbons;\n5.", "metadata": {"categories_en": "transport, industry, EUROPEAN UNION, environment", "celex_id": "32007R0715", "chunk_strategy": "len_500_o50", "chunk_uid": "a5655415853142430cfb78f6c1d12d3f", "label_ids": "100154,100160,100144,100155"}}, {"page_content": "(1) In the case of products exported in bulk or in non-standard units for which it is accepted that their exact net mass cannot be known until after the means of transport has been loaded, Article 5(6) of Commission Regulation (EC) No 800/1999(3), as amended by Regulation (EC) No 1557/2000(4), provides for a reduction in the refund if it is found that the net mass actually loaded is less than a certain percentage of the estimated net mass. To apply this provision, however, account needs to be", "metadata": {"categories_en": "trade, international relations, agriculture, forestry and fisheries", "celex_id": "32001R0090", "chunk_strategy": "len_500_o50", "chunk_uid": "88d20995fc787457d39b8a60423dc233", "label_ids": "100147,100143,100156"}}], "rag_answer": "The answer is not provided in the retrieved context.", "generator_model": "llama3.2", "final_k": 20, "candidate_k": 100, "retrieval_source": "prefetch", "prefetch_path": "/home/mwc/Documents/MIOTI/Current/TFM/Data/eval_top10_dedup/prefetch/eval1_baseline/len_500_o50/hyb_fill_dense_then_bm25_ce_r50/000005.json", "query_index": 5}
{"id": "gt_dedup_00006", "question": "What are the names of two plant species affected by Scrobipalpopsis solanivora?", "reference": "32009L0007", "gold_snippet": "t in Canada, China, Japan, Mongolia, Republic of Korea, Russia, Taiwan and the United States; Chrysanthemum stem necrosis virus on plants of Dendranthema (DC.) Des Moul. and Lycopersicon lycopersicum (L.) Karsten ex Farw.; Scrobipalpopsis solanivora (Povolny) on tubers of Solanum tuberosum L. and Stegophora ulmea (Schweinitz : Fries) Sydow & Sydow on plants of Ulmus L", "ground_truth_answer": "Solanum tuberosum L. and Stegophora ulmea (Schweinitz : Fries) Sydow & Sydow", "reference_contexts": ["t in Canada, China, Japan, Mongolia, Republic of Korea, Russia, Taiwan and the United States; Chrysanthemum stem necrosis virus on plants of Dendranthema (DC.) Des Moul. and Lycopersicon lycopersicum (L.) Karsten ex Farw.; Scrobipalpopsis solanivora (Povolny) on tubers of Solanum tuberosum L. and Stegophora ulmea (Schweinitz : Fries) Sydow & Sydow on plants of Ulmus L"], "retrieved_documents": [{"page_content": "and Pterocarya rhoifolia Siebold & Zucc., and only known to be present in Canada, China, Japan, Mongolia, Republic of Korea, Russia, Taiwan and the United States; Chrysanthemum stem necrosis virus on plants of Dendranthema (DC.) Des Moul. and Lycopersicon lycopersicum (L.) Karsten ex Farw.; Scrobipalpopsis solanivora (Povolny) on tubers of Solanum tuberosum L. and Stegophora ulmea (Schweinitz : Fries) Sydow & Sydow on plants of Ulmus L. and Zelkova L., intended for planting, other than seeds.", "metadata": {"categories_en": "social questions, trade, EUROPEAN UNION, agriculture, forestry and fisheries", "celex_id": "32009L0007", "chunk_strategy": "len_500_o50", "chunk_uid": "b6156c7251a7ae6b950fa055a4162a09", "label_ids": "100149,100147,100144,100156"}}, {"page_content": "(2)\nThe official annual surveys carried out in 2007 by the Member States show that the specified organism also infected plants of Palmae species which are not defined as susceptible plants in Decision 2007/365/EC. It is appropriate that the emergency measures provided for in Decision 2007/365/EC apply also to those plants.\n(3)", "metadata": {"categories_en": "environment, science, agriculture, forestry and fisheries", "celex_id": "32008D0776", "chunk_strategy": "len_500_o50", "chunk_uid": "a7690c65ebd6602f0e688ea5f1698966", "label_ids": "100155,100151,100156"}}, {"page_content": "1.2 // '28a. Plants of Chrysanthemum, Dianthus, and Pelargonium, other than seeds and cut flowers // Official statement: (a) that no symptoms of Epichoristodes acerbella, Helicoverpa armigera, Spodoptera littoralis (Boisd.) or Spodoptera litura (F.) have been observed at the place of production since the beginning of the last complete cycle of vegetation, or (b) that the plants have undergone appropriate treatment to protect them from the said organisms. // 36a. Plants of Beta spp., intended", "metadata": {"categories_en": "trade, agriculture, forestry and fisheries", "celex_id": "31981L0007", "chunk_strategy": "len_500_o50", "chunk_uid": "d706427e543e52ac3f9443c544089f35", "label_ids": "100147,100156"}}, {"page_content": "(6)\nThe measures provided for in this Decision should apply to the introduction or the spread of the harmful organism, the import, production and movement of the plants of the genus Brugmansia Pers. spp., and the species Solanum jasminoides Paxton, intended for planting, including seeds, within the Community. In addition, a survey for the presence or continued absence of the harmful organism in the Member States should be prepared.\n(7)", "metadata": {"categories_en": "trade, science, agri-foodstuffs, agriculture, forestry and fisheries", "celex_id": "32007D0410", "chunk_strategy": "len_500_o50", "chunk_uid": "d7f583e8b753678cb39a0571b625520b", "label_ids": "100147,100151,100157,100156"}}, {"page_content": "ornamental plants such as Rhododendron spp. and Viburnum spp. The relevant services in the Member States have been asked to continue scientific work on the risk of the non-European isolates for the oak trees in the Community, the epidemiology of the harmful organism and the potential host plants.", "metadata": {"categories_en": "environment, science, agriculture, forestry and fisheries", "celex_id": "32002D0757", "chunk_strategy": "len_500_o50", "chunk_uid": "6b161c4edb13486b8b4e767156c5da3f", "label_ids": "100155,100151,100156"}}, {"page_content": "- Council Directive 66/402/EEC of 14 June 1966 on the marketing of cereal seed (3), as last amended by Directive 89/2/EEC (4), for the species Hordeum vulgare, Oryza sativa, Triticum aestivum, Triticum durum and Zea mays, and\n- Council Directive 70/457/EEC of 29 September 1970 on the common catalogue of varieties of agricultural plant species (5), as last amended by Directive 88/380/EEC for the species referred to in the previous two indents;", "metadata": {"categories_en": "trade, geography, agriculture, forestry and fisheries", "celex_id": "31989D0078", "chunk_strategy": "len_500_o50", "chunk_uid": "7ef4af5df39fd4d77ebdbc9e8fcc3f23", "label_ids": "100147,100161,100156"}}, {"page_content": "- they shall have been found free, in growing season inspections and tests on soil or crop samples, as appropriate, from the following harmful organisms: Globodera pallida (Stone) Behrens, Globodera rostochiensis (Wollenweber) Behrens, Clavibacter michiganensis (Smith) Davis et al. ssp. sepedonicus (Spieckermann and Kotthoff) Davis et al, Pseudomonas solanacearum (Smith) Smith, potato spindle tuber viroid, potato stolbur mycoplasm and Synchytrium endobioticum (Schilbersky) Percival. The results", "metadata": {"categories_en": "agri-foodstuffs, trade, agriculture, forestry and fisheries, geography, EUROPEAN UNION", "celex_id": "31996D0618", "chunk_strategy": "len_500_o50", "chunk_uid": "13168489705354cd731c6c674172a426", "label_ids": "100157,100147,100156,100161,100144"}}, {"page_content": "Pisum sativum L. (partim) - Pea, excluding Field pea, Valerianella locusta (L.) Laterr. - Corn salad or Lamb's lettuce,\nVicia faba L. (partim) - Broad bean.\n2. In Article 2 (1) (A) the name of the species Solanum lycopersicum L. (Lycopersicum esculentum Mill.) - Tomato - shall be deleted.\nThe name Lycopersicon lycopersicum (L.) Karst. ex Farwell - Tomato - shall be inserted after the name Lactuca sativa L. - Lettuce.\n3. In Annex II (3) (a) and in Annex III (2) the names of the species:", "metadata": {"categories_en": "trade, agri-foodstuffs, agriculture, forestry and fisheries", "celex_id": "31979L0641", "chunk_strategy": "len_500_o50", "chunk_uid": "6b7dd9a7282cfd11663ae3f71e42bee7", "label_ids": "100147,100157,100156"}}, {"page_content": "(h) in (A) (c) the following items are added:\n1.2.3 // // // // ' 5. // Hypoxylon pruinatum (Klotsche) Cke // Plants of Populus other than seeds intended for planting // 8 (a) // Puccinia pitteriana // Solanum spp. // 15 (a) // Verticillium dahliae // Hops (Humulus lupulus L.)'\n(i) in (B) (a), item 01, the word 'Portugal' is added to the right-hand column;\n(j) in (B) (a) the following items are added:", "metadata": {"categories_en": "production, technology and research, environment, science, agriculture, forestry and fisheries", "celex_id": "31988L0271", "chunk_strategy": "len_500_o50", "chunk_uid": "4ff07c150c4bbabde62f8b1163c47ad8", "label_ids": "100158,100155,100151,100156"}}, {"page_content": "(a) in (A), item 16, in the left-hand column, after the words 'Plants of' in the first line there are added the words 'Crataegus L.' and after the words 'The relevant harmful organisms are:' in the second paragraph the following indent is added:\n'- on Crataegus L. and Malus Mill.: Phyllosticta solitaria Ell. & Ev. (Annex I A (d) (15) (c))'\n(b) in (A), item 28, in the right-hand column, after the words 'Verticillium albo-atrum' there are added the words 'and Verticillium dahliae';", "metadata": {"categories_en": "production, technology and research, environment, science, agriculture, forestry and fisheries", "celex_id": "31988L0271", "chunk_strategy": "len_500_o50", "chunk_uid": "277e251f468b32750f6a1984ec161ba3", "label_ids": "100158,100155,100151,100156"}}, {"page_content": "(d) they shall have been found free, in growing season inspections and in tests on soil and crop samples, as appropriate, from the harmful organisms, Globodera pallida (Stone) Behrens, Globodera rostochiensis (Wollenweber) Behrens, Clavibacter michiganensis Smith (Davis) et al ssp. sepedonicus (Spieckermann et Kotthof) Davis et al., Pseudomonas solanacearum (Smith) Smith, Potato spindle tuber viroid, potato stolbur mycoplasm, and Synchytrium endobioticum (Schilbersky) Percival;", "metadata": {"categories_en": "agri-foodstuffs, social questions, trade, agriculture, forestry and fisheries, geography", "celex_id": "31995D0228", "chunk_strategy": "len_500_o50", "chunk_uid": "5e498f723569ad845daebb052bfa3627", "label_ids": "100157,100149,100147,100156,100161"}}, {"page_content": "‘2. “susceptible plants’” means plants, other than fruit and seeds, of Acer macrophyllum Pursh, Acer pseudoplatanus L., Adiantum aleuticum (Rupr.) Paris, Adiantum jordanii C. Muell., Aesculus californica (Spach) Nutt., Aesculus hippocastanum L., Arbutus menziesii Pursch., Arbutus unedo L., Arctostaphylos spp. Adans, Calluna vulgaris (L.) Hull, Camellia spp. L., Castanea sativa Mill., Fagus sylvatica L., Frangula californica (Eschsch.) Gray, Frangula purshiana (DC.) Cooper, Fraxinus excelsior", "metadata": {"categories_en": "environment, science, agriculture, forestry and fisheries", "celex_id": "32007D0201", "chunk_strategy": "len_500_o50", "chunk_uid": "149bbfc383e7b6da44bde65e65fef05b", "label_ids": "100155,100151,100156"}}, {"page_content": "From information supplied by Member States, it has been determined that only certain plants for planting of Dendranthema (DC.) Des Moul, Dianthus L., Pelargonium l'Hérit. ex Ait. and Solanaceae present a risk of spreading of Heliothis armigera (Hübner). Since the risk of spreading of that organism is limited to those plants, that organism should be deleted from Annex I to Directive 2000/29/EC, which imposes a general ban, and included instead in Annex II to that Directive, which imposes a ban", "metadata": {"categories_en": "environment, science, agriculture, forestry and fisheries", "celex_id": "32008L0064", "chunk_strategy": "len_500_o50", "chunk_uid": "5881410478b4b53a27dd88acf845a6b4", "label_ids": "100155,100151,100156"}}, {"page_content": "1.2 // // // '33 a. Plants of Apium graveolens, Brassica, Capsicum annuum, Chrysanthemum, Cucumis, Dendranthema, Dianthus, Gerbera, Gypsophila, Lactuca sativa, Leucanthemum, Lycopersicon esculentum, Solanum melongena, Tanacetum, intended for planting, other than seeds, originating in a Member State or in those third countries where it has been ascertained, in accordance with the procedure laid down in Article 16, that: - amauromyza maculosa, - Liriomyza huidobrensis, - Liriomyza sativae, -", "metadata": {"categories_en": "environment, agriculture, forestry and fisheries", "celex_id": "31990L0506", "chunk_strategy": "len_500_o50", "chunk_uid": "2e0e314139a37cfdc6ebf28e108ad6d7", "label_ids": "100155,100156"}}, {"page_content": "(2)\nOn the basis of recent scientific information on the possible damage caused by the harmful organism, it appears that the list of plants, wood and bark susceptible for the harmful organism should be extended and updated.\n(3)\nIn order to avoid misinterpretation, it should be laid down clearly that plant passports are necessary for each movement of specific species of susceptible plants within the Community.\n(4)", "metadata": {"categories_en": "environment, science, agriculture, forestry and fisheries", "celex_id": "32007D0201", "chunk_strategy": "len_500_o50", "chunk_uid": "1d89b006e2b2c36687dd98f0a6eecc41", "label_ids": "100155,100151,100156"}}, {"page_content": "solanaceae crops, especially potatoes, has not yet fully been established. The Commission has asked the Member States to continue scientific research work and to deliver an opinion on the risk of pepino mosaic virus to out-door production of tomatoes and of other solanaceae crops. At this stage, the scientific work performed on the pepino mosaic virus has not provided sufficient clarification to revise that preliminary pest risk analysis.", "metadata": {"categories_en": "environment, agri-foodstuffs, science, agriculture, forestry and fisheries", "celex_id": "32003D0064", "chunk_strategy": "len_500_o50", "chunk_uid": "7a44b8b245f7081481d143d6c071ab43", "label_ids": "100155,100157,100151,100156"}}, {"page_content": "(b) in A (d), the following item shall be inserted:\n1.2.3 // '01. Beet curly top virus // Plants of Beta spp., intended for planting other than seeds';\n(c) in B (a), the following items shall be inserted:\n1.2.3 // '01. Aleurothrixus floccosus (Mask) // Plants of Citrus L., intended for planting, other than seeds // Greece, Italy // 02. Athonomus grandis Boh. // Plants of cotton (Gossypium sp.), other than seeds // Greece';\n(d) in B (a), item (5) shall be deleted;", "metadata": {"categories_en": "trade, agriculture, forestry and fisheries", "celex_id": "31981L0007", "chunk_strategy": "len_500_o50", "chunk_uid": "e52ac9a7e389465a6aef86500ce9f543", "label_ids": "100147,100156"}}, {"page_content": "(19) Directives have thus far been adopted for the marketing of seed of the majority of plant species: cereals, beet, fodder plants, potatoes, oil and fibre plants, etc.\nIn addition, Council Directive 70/457/EEC (5), as last amended by the Act of Accession of Austria, Finland and Sweden, introduced a common catalogue of varieties of agricultural plant species.", "metadata": {"categories_en": "production, technology and research, trade, agri-foodstuffs, agriculture, forestry and fisheries", "celex_id": "31999D0006", "chunk_strategy": "len_500_o50", "chunk_uid": "1771ba6ae6d646b0f6ac9f78a2530a45", "label_ids": "100158,100147,100157,100156"}}, {"page_content": "2.\n‘susceptible plants’ means plants, other than fruit and seeds, of Acer macrophyllum Pursh., Aesculus californica Nutt., Arbutus menziesii Pursch., Arctostaphylos spp. Adans, Heteromeles arbutifolia (Lindley) M. Roemer, Lithocarpus densiflorus (H & A), Lonicera hispidula (Dougl.), Quercus spp. L., Rhamnus californica (Esch), Rhododendron spp. L., other than Rhododendron simsii Planch., Umbellularia californica (Pursch.), Vaccinium ovatum (Hook & Arn) Nutt. and Viburnum spp. L.\n3.", "metadata": {"categories_en": "environment, science, agriculture, forestry and fisheries", "celex_id": "32002D0757", "chunk_strategy": "len_500_o50", "chunk_uid": "36309124d458a26849895d8eb822f97f", "label_ids": "100155,100151,100156"}}, {"page_content": "(3)\nPotato spindle tuber viroid is listed in Section I of Part A of Annex I to Directive 2000/29/EC, and as an organism whose introduction into and spread within all Member States is to be prohibited.\n(4)\nPotato spindle tuber viroid has been found on plants of Solanum jasminoides Paxton and Brugmansia Pers. spp. As regards this harmful organism, there are at present no special requirements for these plants originating in the Community.\n(5)", "metadata": {"categories_en": "trade, science, agri-foodstuffs, agriculture, forestry and fisheries", "celex_id": "32007D0410", "chunk_strategy": "len_500_o50", "chunk_uid": "11d61956ebf1903e2f4ea50405ea3744", "label_ids": "100147,100151,100157,100156"}}], "rag_answer": "The answer is not provided in the retrieved context.", "generator_model": "llama3.2", "final_k": 20, "candidate_k": 100, "retrieval_source": "prefetch", "prefetch_path": "/home/mwc/Documents/MIOTI/Current/TFM/Data/eval_top10_dedup/prefetch/eval1_baseline/len_500_o50/hyb_fill_dense_then_bm25_ce_r50/000006.json", "query_index": 6}
{"id": "gt_dedup_00007", "question": "What was the period during which customs duties on melon imports from Israel were suspended?", "reference": "31992R3340", "gold_snippet": "cle 1\nFrom 1 November 1992 to 31 May 1993 the customs duties applicable to imports into the Community of melons originating in Israel shall be suspended, at the levels and within the limits of the Community tariff quota shown below:\nOrder No CN code (a) Description Period Amount of quota (tonnes) Quota duty (%) 09.1329 ex 0807 10 90 Melons 1", "ground_truth_answer": "From 1 November 1992 to 31 May 1993.", "reference_contexts": ["cle 1\nFrom 1 November 1992 to 31 May 1993 the customs duties applicable to imports into the Community of melons originating in Israel shall be suspended, at the levels and within the limits of the Community tariff quota shown below:\nOrder No CN code (a) Description Period Amount of quota (tonnes) Quota duty (%) 09.1329 ex 0807 10 90 Melons 1"], "retrieved_documents": [{"page_content": "HAS ADOPTED THIS REGULATION:\nArticle 1\nFrom 1 November 1992 to 31 May 1993 the customs duties applicable to imports into the Community of melons originating in Israel shall be suspended, at the levels and within the limits of the Community tariff quota shown below:\nOrder No CN code (a) Description Period Amount of quota (tonnes) Quota duty (%) 09.1329 ex 0807 10 90 Melons 1. 11. 1992 to 31. 5. 1993 10 313 - from 1. 11 to 31. 12. 1992: 2,4 - from 1. 1 to 31. 5. 1993: 0\n(a) Taric codes:", "metadata": {"categories_en": "trade, geography", "celex_id": "31992R3340", "chunk_strategy": "len_500_o50", "chunk_uid": "64f0d187de8ba56a5105eb197f0a6b01", "label_ids": "100147,100161"}}, {"page_content": "HAS ADOPTED THIS REGULATION:\nArticle 1\nFrom 1 November 1993 to 31 May 1994 the customs duties applicable to imports into the Community of melons originating in Israel shall be suspended, at the levels and within the limits of the Community tariff quota shown below:\n/* Tables: see OJ */\nArticle 2\nThe tariff quota referred to in Article 1 shall be managed by the Commission, which may take all appropriate administrative measures in order to ensure efficient management thereof.\nArticle 3", "metadata": {"categories_en": "trade, geography, agri-foodstuffs", "celex_id": "31993R2605", "chunk_strategy": "len_500_o50", "chunk_uid": "10801e18ce9d3f9058754bdc7b3ec453", "label_ids": "100147,100161,100157"}}, {"page_content": "HAS ADOPTED THIS REGULATION:\nArticle 1 1. From 1 December 1988 to 31 October 1989 the customs duties applicable to imports into the Community of the products listed below, originating in Israel, shall be suspended at the level and within the limits of the Community tariff quota in respect of each product;", "metadata": {"categories_en": "trade, geography", "celex_id": "31988R4078", "chunk_strategy": "len_500_o50", "chunk_uid": "1969982f9f4a8cbf131449f0643ff817", "label_ids": "100147,100161"}}, {"page_content": "HAS ADOPTED THIS REGULATION:\nArticle 1 From 1 January to 31 December 1989, the customs duties applicable to imports into the Community of the following products originating in Tunisia or Israel shall be suspended at the levels indicated below and within the limits of Community tariff quotas as shown below:", "metadata": {"categories_en": "trade, geography, agri-foodstuffs", "celex_id": "31988R4218", "chunk_strategy": "len_500_o50", "chunk_uid": "130a1a85a73492138c61647469e9ba42", "label_ids": "100147,100161,100157"}}, {"page_content": "HAS ADOPTED THIS REGULATION:\nArticle 1\n1. From 1 November 1993 to 31 October 1994, the customs duties applicable to imports into the Community of the products listed below originating in Morocco, Jordan, Israel or Cyprus shall be suspended at the levels and within the limits of the Community tariff quotas shown below:\n/* Tables: see OJ */\nmay be interrupted if it is found at Community level that the price conditions laid down by Regulation (EEC) No 4088/87 are not being observed.", "metadata": {"categories_en": "trade, geography, agriculture, forestry and fisheries", "celex_id": "31993R2604", "chunk_strategy": "len_500_o50", "chunk_uid": "e1f6a2eb6364df76423e01054b2ed3d3", "label_ids": "100147,100161,100156"}}, {"page_content": "HAS ADOPTED THIS REGULATION:\nArticle 1\n1. From 1 November 1992 to 31 October 1993, the customs duties applicable to imports into the Community of the products listed below originating in Morocco, Jordan, Israel or Cyprus shall be suspended at the levels and within the limits of the Community tariff quotas shown below:\nOrder\nNo CN code Description Origin Amount of\nquota\n(in tonnes) Quota duty\n(%) Fresh cut flowers and flower buds of a kind suitable for ornamental purposes: 09.1114\n09.1152", "metadata": {"categories_en": "trade, geography, agriculture, forestry and fisheries", "celex_id": "31992R3341", "chunk_strategy": "len_500_o50", "chunk_uid": "ddc81e59b7c51b6543bbf77f12933d50", "label_ids": "100147,100161,100156"}}, {"page_content": "Whereas, pursuant to Commission Regulation (EEC) No 2573/90 of 5 September 1990 totally suspending certain customs duties applicable by the Community of Ten to imports from Spain and Portugal (3), the said duties are, as concerns the products referred to in Annex II to the Treaty, totally suspended once they reach a level of 2 % or less; whereas the same rate of duty should be applied to imports of the same products originating in Israel;", "metadata": {"categories_en": "trade, geography, agri-foodstuffs", "celex_id": "31990R3730", "chunk_strategy": "len_500_o50", "chunk_uid": "5a40d7739de32d8635da9bcda99ddb6c", "label_ids": "100147,100161,100157"}}, {"page_content": "Whereas pursuant to Commission Regulation (EEC) N° 2573/90 of 5 September 1990 totally suspending certain customs duties applicable by the Community of Ten to imports from Spain and Portugal (3), the said duties are, as concerns the products referred to in Annex II to the Treaty, totally suspended once they reach a level of 2 % or less; whereas the same rate of duty should be applied to imports of the same products originating in Israel;", "metadata": {"categories_en": "trade, geography, agri-foodstuffs", "celex_id": "31991R3912", "chunk_strategy": "len_500_o50", "chunk_uid": "5b6be46c48421f59f2ea17ff01fafe8b", "label_ids": "100147,100161,100157"}}, {"page_content": "Whereas for the period 1 November to 31 December 1991, the rate of customs duty applied to fresh strawberries from Israel is lower than the rate applied to those from Spain and Portugal; whereas the quota should therefore be opened for the period 1 January to 31 March 1992; whereas to take account of the seasonal nature of imports of this product, the volume of this quota should be set at the average traditional level of imports for the period concerned, namely 1 505 tonnes;", "metadata": {"categories_en": "trade, geography, agri-foodstuffs", "celex_id": "31991R3912", "chunk_strategy": "len_500_o50", "chunk_uid": "a02dabba00b5a03327e1dba500a27df6", "label_ids": "100147,100161,100157"}}, {"page_content": "Whereas it is appropriate to adopt measures to avoid a sudden disturbance to trade in the products in question, for the period from 1 January 1992 to 31 March 1993;\nWhereas, for the period from 1 January to 31 December 1992, collection of the Common Customs Tariff duties and the agricultural levies for the goods in question should be suspended;", "metadata": {"categories_en": "trade, agri-foodstuffs", "celex_id": "31993R0470", "chunk_strategy": "len_500_o50", "chunk_uid": "1fa9305de6b03232c607e3b7ec4072e3", "label_ids": "100147,100157"}}, {"page_content": "Whereas Article 1 of the Fourth Additional Protocol to the Cooperation Agreement between the European Economic Community and the State of Israel (1) provides for the opening of a Community tariff quota for the import into the Community of 9 500 tonnes of melons, falling within CN code ex 0807 10 90, originating in Israel, (from 1 November to 31 May);", "metadata": {"categories_en": "trade, geography", "celex_id": "31992R3340", "chunk_strategy": "len_500_o50", "chunk_uid": "31a8a9f473ca92b217f9c151dba31222", "label_ids": "100147,100161"}}, {"page_content": "Whereas Article 1 of the Fourth Additional Protocol to the Cooperation Agreement between the European Economic Community and the State of Israel (1) provides for the opening of a Community tariff quota for the import into the Community of 9 500 tonnes of melons, falling within CN code ex 0807 10 90, originating in Israel (from 1 November to 31 May);", "metadata": {"categories_en": "trade, geography, agri-foodstuffs", "celex_id": "31993R2605", "chunk_strategy": "len_500_o50", "chunk_uid": "5dab8eb2a497cff2fb72f877c70ad46d", "label_ids": "100147,100161,100157"}}, {"page_content": "Whereas it would be desirable, pending a solution to the problem, temporarily to suspend the collection of import duties on the goods in question for the period 1 January to 31 October 1992,\nHAS ADOPTED THIS REGULATION:\nArticle 1\nCollection of the Common Customs Tariff duties applicable to imports of the products described below are hereby suspended from 1 January until 31 October 1992:", "metadata": {"categories_en": "trade, agri-foodstuffs", "celex_id": "31992R2420", "chunk_strategy": "len_500_o50", "chunk_uid": "3194a691c313fb9ab23db12b4262d265", "label_ids": "100147,100157"}}, {"page_content": "HAS ADOPTED THIS REGULATION:\nArticle 1\nThe customs duties applicable to imports into the Community of the products listed below originating in Israel shall be suspended during the periods, at the levels and within the limits of the Community tariff quotas shown below:\nTABLE\nWithin the limits of these tariff quotas the Kingdom of Spain and the Portuguese Republic shall apply customs duties calculated in accordance with the relevant provisions of Regulation (EEC) N° 4162/87.\nArticle 2", "metadata": {"categories_en": "trade, geography, agri-foodstuffs", "celex_id": "31991R3912", "chunk_strategy": "len_500_o50", "chunk_uid": "c79d572e504b3af6e47ce7be4da74263", "label_ids": "100147,100161,100157"}}, {"page_content": "HAS ADOPTED THIS REGULATION:\nArticle 1\nThe customs duties applicable to imports into the Community of the products listed below originating in Israel shall be suspended during the periods, at the levels and within the limits of the Community tariff quotas shown below:\n09.1309 ex 0701 90 51 New potatoes 1. 1. - 31. 3. 1993 18 020 0 09.1335 ex 0703 10 11\nex 0703 10 19\nex 0709 90 90 Onions, fresh or chilled", "metadata": {"categories_en": "trade, geography", "celex_id": "31993R0223", "chunk_strategy": "len_500_o50", "chunk_uid": "1a2af7a05c79003a5459f7c164a23b38", "label_ids": "100147,100161"}}, {"page_content": "HAS ADOPTED THIS REGULATION:\nArticle 1\nThe customs duties applicable to imports into the Community of the products listed below originating in Israel shall be suspended during the periods, at the levels and within the limits of the Community tariff quotas shown below:\nTABLE\nWithin the limits of these tariff quotas the Kingdom of Spain and the Portuguese Republic shall apply customs duties calculated in accordance with the relevant provisions of Regulation (EEC) No 4162/87.\nArticle 2", "metadata": {"categories_en": "trade, geography, agri-foodstuffs", "celex_id": "31990R3730", "chunk_strategy": "len_500_o50", "chunk_uid": "f27630dd198a33f893efb0715a305ab3", "label_ids": "100147,100161,100157"}}, {"page_content": "Whereas it is appropriate to re-establish the levying of customs duties for the products in question,\nHAS ADOPTED THIS REGULATION:\nArticle 1\nThe levying of customs duties, suspended from 1 July to 31 December 1994, pursuant to Regulation (EEC) No 3832/90, shall be re-established on imports into the Community of the products indicated in the table below:", "metadata": {"categories_en": "trade, industry, geography", "celex_id": "31994R2847", "chunk_strategy": "len_500_o50", "chunk_uid": "2d5cccc2f4165246cec3b33724cd66e4", "label_ids": "100147,100160,100161"}}, {"page_content": "Whereas it is appropriate to re-establish the levying of customs duties for the products in question,\nHAS ADOPTED THIS REGULATION:\nArticle 1\nThe levying of customs duties, suspended from 1 July to 31 December 1994, pursuant to Regulation (EEC) No 3832/90, shall be re-established on imports into the Community of the products indicated in the table below:", "metadata": {"categories_en": "geography, trade, industry", "celex_id": "31994R3121", "chunk_strategy": "len_500_o50", "chunk_uid": "ffa5239bfd946854883e5616912b4303", "label_ids": "100161,100147,100160"}}, {"page_content": "HAS ADOPTED THIS REGULATION:\nArticle 1\nThe customs duties applicable to imports into the Community of the products listed below originating in Israel shall be suspended during the periods, at the levels and within the limits of the Community tariff quotas shown below:", "metadata": {"categories_en": "trade, geography, agriculture, forestry and fisheries", "celex_id": "31994R0300", "chunk_strategy": "len_500_o50", "chunk_uid": "eb508ef4eb5e8b18129d9551103b07e2", "label_ids": "100147,100161,100156"}}, {"page_content": "HAS ADOPTED THIS REGULATION:\nArticle 1 The customs duties applicable to imports into the Community of the products listed below originating in Israel shall be suspended during the periods, at the levels and within the limits of the Community tariff quotas shown below:\nOrder\nNo\nCN code\n(a) (b)\nDescription\nPeriod Amount\nof quota\n(tonnes) Quota\nduty\n(%) Applicable in", "metadata": {"categories_en": "finance, law, agri-foodstuffs, business and competition, agriculture, forestry and fisheries", "celex_id": "31989R3412", "chunk_strategy": "len_500_o50", "chunk_uid": "d5f77903939ca877c159a785d67fc5c6", "label_ids": "100148,100145,100157,100152,100156"}}], "rag_answer": "The customs duties on melon imports from Israel were suspended from 1 November 1992 to 31 May 1993, as stated in Article 1 of Document 11 CELEX: 31992R3340.", "generator_model": "llama3.2", "final_k": 20, "candidate_k": 100, "retrieval_source": "prefetch", "prefetch_path": "/home/mwc/Documents/MIOTI/Current/TFM/Data/eval_top10_dedup/prefetch/eval1_baseline/len_500_o50/hyb_fill_dense_then_bm25_ce_r50/000007.json", "query_index": 7}
{"id": "gt_dedup_00008", "question": "What percentage of the total allocation is reserved for traditional importers compared to those who have traded in live animals with third countries?", "reference": "31994R3171", "gold_snippet": "o 80 %, should be allocated to traditional importers; whereas the other tranche, corresponding to 20 %, should be allocated to operators who have engaged in some trade in live animals with third countries, in order to give them progressive access to the import arrangements in question; whereas a derogat", "ground_truth_answer": "80% should be allocated to traditional importers, while 20% should be allocated to operators who have engaged in some trade in live animals with third countries.", "reference_contexts": ["o 80 %, should be allocated to traditional importers; whereas the other tranche, corresponding to 20 %, should be allocated to operators who have engaged in some trade in live animals with third countries, in order to give them progressive access to the import arrangements in question; whereas a derogat"], "retrieved_documents": [{"page_content": "Whereas each of the quantities available in Italy and Greece should be divided into two tranches; whereas one of the two tranches, corresponding to 80 %, should be allocated to traditional importers; whereas the other tranche, corresponding to 20 %, should be allocated to operators who have engaged in some trade in live animals with third countries, in order to give them progressive access to the import arrangements in question; whereas a derogation from Article 9 (1) (a) of Regulation (EEC) No", "metadata": {"categories_en": "trade, geography, agriculture, forestry and fisheries", "celex_id": "31994R3171", "chunk_strategy": "len_500_o50", "chunk_uid": "92a7e42d03ce5492a5cfa8b66df89426", "label_ids": "100147,100161,100156"}}, {"page_content": "Whereas each of the quantities available in Italy and Greece should be divided into two tranches; whereas one of the two tranches, corresponding to 80 %, should be allocated to traditional importers; whereas the other tranche, corresponding to 20 %, should be allocated to operators who have engaged in some trade in live animals with third countries, in order to give them progressive access to the import arrangements in question; whereas a derogation from Article 9 (1) (a) of Regulation (EEC) No", "metadata": {"categories_en": "trade, agriculture, forestry and fisheries", "celex_id": "31995R0692", "chunk_strategy": "len_500_o50", "chunk_uid": "672d38d29ffb1e306d8526d8ec09075f", "label_ids": "100147,100156"}}, {"page_content": "Article 6\nAllocation of total quantities among traditional and new importers\n1. The total quantity allocated to China and other third countries, pursuant to Annex I, shall be distributed as follows:\n(a)\n95 % to traditional importers;\n(b)\n5 % to new importers.\n2. If the quantity allocated to China and other third countries is not fully exhausted by one category of importers, the remainder shall be allocated to the other category.", "metadata": {"categories_en": "trade, agri-foodstuffs, geography, agriculture, forestry and fisheries", "celex_id": "32006R1979", "chunk_strategy": "len_500_o50", "chunk_uid": "ac44fc7f9cf7bd1532b3b45cc4d7b26c", "label_ids": "100147,100157,100161,100156"}}, {"page_content": "(b) The second part, equal to 30 %, shall be allocated among importers who can furnish proof of having imported from third countries at least 75 live bovine animals falling within CN code 0102 during the 12 months preceding the year of import in question.", "metadata": {"categories_en": "trade, international relations, agriculture, forestry and fisheries", "celex_id": "32001R1096", "chunk_strategy": "len_500_o50", "chunk_uid": "2456a544f1fdc8ac09138b2520082dc9", "label_ids": "100147,100143,100156"}}, {"page_content": "(b) The second part of each quota volume, equal to 30 %, shall be allocated among importers who can furnish proof of having imported from third countries at least 75 live bovine animals falling within CN code 0102 during the 12 months preceding the year of import in question.", "metadata": {"categories_en": "trade, international relations, agriculture, forestry and fisheries", "celex_id": "32001R1096", "chunk_strategy": "len_500_o50", "chunk_uid": "700fda80cc46173b397a8c5316554e5b", "label_ids": "100147,100143,100156"}}, {"page_content": "(b) The second part, equal to 20 % of the quota volume, shall be reserved for importers who can prove that they imported, between 1 July 1994 and 30 June 1995, at least 15 live bovine animals falling within CN code 0102 from countries which, at the time of import, were for them third countries.\nImporters must be entered in a national VAT register.", "metadata": {"categories_en": "trade, international relations, agriculture, forestry and fisheries", "celex_id": "31996R0207", "chunk_strategy": "len_500_o50", "chunk_uid": "f7ac87fe810b04b3a58fd79a26cdf25e", "label_ids": "100147,100143,100156"}}, {"page_content": "(b) The second part, equal to 20 %, shall be allocated among importers who can furnish proof of having imported from third countries during the 12 months preceding the year of import in question at least 15 live bovine animals falling within CN code 0102.\nImporters must be entered in a national VAT register.", "metadata": {"categories_en": "trade, EUROPEAN UNION, international relations, agriculture, forestry and fisheries", "celex_id": "31998R1143", "chunk_strategy": "len_500_o50", "chunk_uid": "b2d493d513199d55cbf60f0e7ad37d37", "label_ids": "100147,100144,100143,100156"}}, {"page_content": "1. The total quantity allocated to China and other countries, pursuant to Annex I, shall be distributed as follows:\n(a)\n95 % to traditional importers;\n(b)\n5 % to new importers.\n2. For imports originating in China and other countries, if in the second six-month period from the start of the calendar year the quantity allocated is not fully exhausted by one category of importers, the remainder shall be allocated to the other category.", "metadata": {"categories_en": "trade, EUROPEAN UNION, agri-foodstuffs, agriculture, forestry and fisheries", "celex_id": "32004R1864", "chunk_strategy": "len_500_o50", "chunk_uid": "af9dec236911dc97c71a17b2fa5de838", "label_ids": "100147,100144,100157,100156"}}, {"page_content": "1. The total quantity allocated to Argentina, China and other countries pursuant to Annex I shall be distributed as follows:\n(a)\n70 % to traditional importers;\n(b)\n30 % to new importers.\n2. As regards imports originating in Argentina, China and other countries, if in any quarter the quantity allocated is not fully exhausted by one category of importers, the remainder shall be allocated to the other category.", "metadata": {"categories_en": "trade, agri-foodstuffs", "celex_id": "32005R1870", "chunk_strategy": "len_500_o50", "chunk_uid": "158d3d94b6ee3c6c7e781e751570f7fa", "label_ids": "100147,100157"}}, {"page_content": "(b) The second part, equal to 20 % of the quota volume, shall be reserved for applicants who can prove that they imported, between 1 July 1994 and 30 June 1995, at least 15 live bovine animals falling within CN code 0102 from countries which, at the time of import, were for them third countries.\nImporters must be entered in a national VAT register.", "metadata": {"categories_en": "trade, EUROPEAN UNION, international relations, agriculture, forestry and fisheries", "celex_id": "31995R2483", "chunk_strategy": "len_500_o50", "chunk_uid": "6bf7638438871e436af851787e629c3d", "label_ids": "100147,100144,100143,100156"}}, {"page_content": "(b) The second part, equal to 20 % of the quota volume, shall be reserved for applicants who can prove that they imported, between 1 July 1994 and 30 June 1995, at least 15 live bovine animals falling within CN code 0102 from countries which, at the time of import, were for them third countries.\nImporters must be entered in a national VAT register.", "metadata": {"categories_en": "trade, agriculture, forestry and fisheries", "celex_id": "31995R1485", "chunk_strategy": "len_500_o50", "chunk_uid": "4472f636994f3040507238eec63306fc", "label_ids": "100147,100156"}}, {"page_content": "- 30 % of the quantity shall be allocated upon application directly by the Member State concerned to traders who furnish proof that, in the period 1 July 1999 to 30 June 2000, they exported to and/or imported from third countries at least 75 live animals covered by CN code 0102 90, excluding imports under the Regulations referred to in Annex I.\nTraders must be entered in a national value added tax (VAT) register.\nApplications for import rights shall be presented:", "metadata": {"categories_en": "trade, EUROPEAN UNION, agriculture, forestry and fisheries", "celex_id": "32001R1095", "chunk_strategy": "len_500_o50", "chunk_uid": "9a85fa44f044216a23c81cd082c1e6e2", "label_ids": "100147,100144,100156"}}, {"page_content": "(b) The second part, equal to 20 %, shall be allocated among importers who can furnish proof of having imported during 1996 at least 15 live bovine animals falling within CN code 0102 from third countries.\nImporters must be registered for VAT purposes in a Member State.\n2. The first part of the quota shall be allocated among applicant importers in proportion to their imports of animals within the meaning of paragraph 1 (a) during the period 1 July 1993 to 30 June 1996.", "metadata": {"categories_en": "trade, international relations, agriculture, forestry and fisheries", "celex_id": "31996R2514", "chunk_strategy": "len_500_o50", "chunk_uid": "682f16c03a00aecc984ddee2e930bb31", "label_ids": "100147,100143,100156"}}, {"page_content": "(b) the second part, equal to 30 % i.e. 21 645 head shall be allocated among importers who can furnish proof of having imported and/or exported at least 100 live bovine animals falling within CN code 0102 90 apart from those under (a), during 1994 from/to countries which are third countries on 31 December 1994 and who are entered in the official register of a Member State.", "metadata": {"categories_en": "trade, agriculture, forestry and fisheries", "celex_id": "31994R3076", "chunk_strategy": "len_500_o50", "chunk_uid": "365aba7c371a56cc29ab61fce4c3566e", "label_ids": "100147,100156"}}, {"page_content": "(3) Traditional importers should be allocated 80 % of the quota, i.e. 42400 tonnes, in proportion to the quantities imported by them under the same type of quota during the most recent reference period. In certain cases administrative errors by the competent national body are liable to restrict traders' access to this part of the quota. Steps shoud be taken to make good any resulting damage.", "metadata": {"categories_en": "trade, agri-foodstuffs, EUROPEAN UNION", "celex_id": "32000R0980", "chunk_strategy": "len_500_o50", "chunk_uid": "3077a841ff98534e1fdb74cdcba4f373", "label_ids": "100147,100157,100144"}}, {"page_content": "(b) The second part, equalling 20 %, of each quota shall be reserved for applicants who can furnish proof that they have imported at least 15 live bovine animals covered by CN code 0102 from third countries in the 12 months prior to the year of import in question.\nImporters must be entered in a national VAT register.", "metadata": {"categories_en": "trade, agriculture, forestry and fisheries", "celex_id": "31999R1081", "chunk_strategy": "len_500_o50", "chunk_uid": "9df1f623584f25792f3a6707dce68434", "label_ids": "100147,100156"}}, {"page_content": "(b) The second part, equal to 20 % of the quota volume, shall be reserved for applicants who can furnish proof of having imported from third countries, during the 12 months preceding the year of import in question, at least 15 live bovine animals covered by CN code 0102.\nImporters must be entered in a national VAT register.", "metadata": {"categories_en": "trade, agriculture, forestry and fisheries", "celex_id": "31998R1012", "chunk_strategy": "len_500_o50", "chunk_uid": "d0d2ef6b536d2742c078cd721161d9d0", "label_ids": "100147,100156"}}, {"page_content": "(3) Traditional importers should consequently be allocated 70 % of the quota, i.e. 37100 tonnes, in proportion to the quantities imported by them under the same type of quota during the period 1 July 1997 to 30 June 2000. In certain cases administrative errors by the competent national body are liable to restrict traders' access to this part of the quota. Steps should be taken to make good any resulting damage.", "metadata": {"categories_en": "trade, agri-foodstuffs, EUROPEAN UNION", "celex_id": "32001R1080", "chunk_strategy": "len_500_o50", "chunk_uid": "e85ea7eba9172f48106f01e47b61ce8e", "label_ids": "100147,100157,100144"}}, {"page_content": "(b) The second part 20 % shall be reserved for importers who can prove that they imported at least 15 live bovine animals falling within CN code 0102 from countries which in the period 1 July 1995 to 30 June 1996.\nImporters must be entered in a national VAT register.\n2. The first part of the quota shall be allocated among applicant importers in proportion to the quantities of animals they imported in accordance with paragraph 1 (a) in the period 1 July 1993 to 30 June 1996.", "metadata": {"categories_en": "trade, international relations, agriculture, forestry and fisheries", "celex_id": "31996R1233", "chunk_strategy": "len_500_o50", "chunk_uid": "3f228c8413dabb7cf5a75a9dff180752", "label_ids": "100147,100143,100156"}}, {"page_content": "Whereas the traditional importers should be allocated 80 % of the quota i.e. 42 400 tonnes on application and in proportion to the quantities imported by them under the same type of quota during the most recent reference period; whereas steps should be taken to ensure that operators of the new Member States can participate on equal terms in the allocations of the quantities available;", "metadata": {"categories_en": "trade, agri-foodstuffs", "celex_id": "31996R1141", "chunk_strategy": "len_500_o50", "chunk_uid": "ae96189565884a9d9580c9e839cdb6aa", "label_ids": "100147,100157"}}], "rag_answer": "The answer is not provided in the retrieved context.", "generator_model": "llama3.2", "final_k": 20, "candidate_k": 100, "retrieval_source": "prefetch", "prefetch_path": "/home/mwc/Documents/MIOTI/Current/TFM/Data/eval_top10_dedup/prefetch/eval1_baseline/len_500_o50/hyb_fill_dense_then_bm25_ce_r50/000008.json", "query_index": 8}
{"id": "gt_dedup_00009", "question": "What is the specific professional or administrative rule that applies to persons providing services from another EU country in the host Member State?", "reference": "31977L0452", "gold_snippet": "The person concerned shall provide services with the same rights and obligations as the nationals of the host Member State ; in particular he shall be subject to the rules of conduct of a professional or administrative nature which apply in that Member State.\nWhere a host Member State adopts a measure pursuant to the second subparagraph or becomes aware of facts which run counter to these provisions, it shall forthwith inform the Member State whe", "ground_truth_answer": "The rules of conduct of a professional or administrative nature that apply in the host Member State.", "reference_contexts": ["The person concerned shall provide services with the same rights and obligations as the nationals of the host Member State ; in particular he shall be subject to the rules of conduct of a professional or administrative nature which apply in that Member State.\nWhere a host Member State adopts a measure pursuant to the second subparagraph or becomes aware of facts which run counter to these provisions, it shall forthwith inform the Member State whe"], "retrieved_documents": [{"page_content": "The person concerned shall provide services with the same rights and obligations as the nationals of the host Member State; in particular he shall be subject to the rules of conduct of a professional or administrative nature which apply in that Member State.", "metadata": {"categories_en": "education and communications, employment and working conditions, social questions", "celex_id": "31993L0016", "chunk_strategy": "len_500_o50", "chunk_uid": "a362ca56c76a690e08af9457182c146e", "label_ids": "100150,100153,100149"}}, {"page_content": "The person concerned shall provide services with the same rights and obligations as nationals of the host Member State; in particular he shall be subject to the rules of conduct of a professional or administrative nature which apply in that Member State.", "metadata": {"categories_en": "education and communications, social questions, employment and working conditions", "celex_id": "31985L0384", "chunk_strategy": "len_500_o50", "chunk_uid": "84cc1903d68a910ebc5a54cd8f9e009e", "label_ids": "100150,100149,100153"}}, {"page_content": "The person concerned shall provide services with the same rights and obligations as the nationals of the host Member State ; in particular he shall be subject to the rules of conduct of a professional or administrative nature which apply in that Member State.", "metadata": {"categories_en": "education and communications, employment and working conditions, social questions", "celex_id": "31978L1026", "chunk_strategy": "len_500_o50", "chunk_uid": "9fa03b6514819e396d1c74da9a030550", "label_ids": "100150,100153,100149"}}, {"page_content": "The person concerned shall provide services with the same rights and obligations as the nationals of the host Member State ; in particular he shall be subject to the rules of conduct of a professional or administrative nature which apply in that Member State.", "metadata": {"categories_en": "education and communications, employment and working conditions, social questions", "celex_id": "31978L0686", "chunk_strategy": "len_500_o50", "chunk_uid": "08872216c50de30e65b67a12f2256ba9", "label_ids": "100150,100153,100149"}}, {"page_content": "The person concerned shall provide services with the same rights and obligations as the nationals of the host Member State ; in particular he shall be subject to the rules of conduct of a professional or administrative nature which apply in that Member State.\nWhere a host Member State adopts a measure pursuant to the second subparagraph or becomes aware of facts which run counter to these provisions, it shall forthwith inform the Member State where the person concerned is established.", "metadata": {"categories_en": "education and communications, law, employment and working conditions, social questions", "celex_id": "31980L0154", "chunk_strategy": "len_500_o50", "chunk_uid": "1a08972620136c2c76bb24683f466c62", "label_ids": "100150,100145,100153,100149"}}, {"page_content": "The person concerned shall provide services with the same rights and obligations as the nationals of the host Member State ; in particular he shall be subject to the rules of conduct of a professional or administrative nature which apply in that Member State.\nWhere a host Member State adopts a measure pursuant to the second subparagraph or becomes aware of facts which run counter to these provisions, it shall forthwith inform the Member State where the person concerned is established.", "metadata": {"categories_en": "education and communications, employment and working conditions, social questions", "celex_id": "31977L0452", "chunk_strategy": "len_500_o50", "chunk_uid": "28959d6704088f6331e2463b6f3dc8a8", "label_ids": "100150,100153,100149"}}, {"page_content": "THE PERSON CONCERNED SHALL PROVIDE SERVICES WITH THE SAME RIGHTS AND OBLIGATIONS AS THE NATIONALS OF THE HOST MEMBER STATE ; IN PARTICULAR HE SHALL BE SUBJECT TO THE RULES OF CONDUCT OF A PROFESSIONAL OR ADMINISTRATIVE NATURE WHICH APPLY IN THAT MEMBER STATE .\nWHERE A HOST MEMBER STATE ADOPTS A MEASURE PURSUANT TO THE SECOND SUBPARAGRAPH OR BECOMES AWARE OF FACTS WHICH RUN COUNTER TO THESE PROVISIONS , IT SHALL FORTHWITH INFORM THE MEMBER STATE WHERE THE PERSON CONCERNED IS ESTABLISHED .", "metadata": {"categories_en": "education and communications, employment and working conditions, social questions", "celex_id": "31975L0362", "chunk_strategy": "len_500_o50", "chunk_uid": "ca611780caeef62ee64f975d4e7b2425", "label_ids": "100150,100153,100149"}}, {"page_content": "(8)\nThe service provider should be subject to the application of disciplinary rules of the host Member State having a direct and specific link with the professional qualifications, such as the definition of the profession, the scope of activities covered by a profession or reserved to it, the use of titles and serious professional malpractice which is directly and specifically linked to consumer protection and safety.\n(9)", "metadata": {"categories_en": "politics, social questions, employment and working conditions, education and communications, geography", "celex_id": "32005L0036", "chunk_strategy": "len_500_o50", "chunk_uid": "3c6523dab53d152e7cad478e1d96d84e", "label_ids": "100142,100149,100153,100150,100161"}}, {"page_content": "3. Where a service provider moves, he shall be subject to professional rules of a professional, statutory or administrative nature which are directly linked to professional qualifications, such as the definition of the profession, the use of titles and serious professional malpractice which is directly and specifically linked to consumer protection and safety, as well as disciplinary provisions which are applicable in the host Member State to professionals who pursue the same profession in that", "metadata": {"categories_en": "politics, social questions, employment and working conditions, education and communications, geography", "celex_id": "32005L0036", "chunk_strategy": "len_500_o50", "chunk_uid": "b5ac8bdddf7ac4ffa4e0a945b902f357", "label_ids": "100142,100149,100153,100150,100161"}}, {"page_content": "1. Member States may require that, where the service provider first moves from one Member State to another in order to provide services, he shall inform the competent authority in the host Member State in a written declaration to be made in advance including the details of any insurance cover or other means of personal or collective protection with regard to professional liability. Such declaration shall be renewed once a year if the service provider intends to provide temporary or occasional", "metadata": {"categories_en": "politics, social questions, employment and working conditions, education and communications, geography", "celex_id": "32005L0036", "chunk_strategy": "len_500_o50", "chunk_uid": "e17276e6449edc5b09734e36ba923d32", "label_ids": "100142,100149,100153,100150,100161"}}, {"page_content": "Article 6\nExemptions\nPursuant to Article 5(1), the host Member State shall exempt service providers established in another Member State from the requirements which it places on professionals established in its territory relating to:\n(a)", "metadata": {"categories_en": "politics, social questions, employment and working conditions, education and communications, geography", "celex_id": "32005L0036", "chunk_strategy": "len_500_o50", "chunk_uid": "2df63b64176d3e43933c3aedc3735918", "label_ids": "100142,100149,100153,100150,100161"}}, {"page_content": "comes shall forward to the host Member State all necessary information regarding measures or disciplinary action of a professional or administrative nature taken in respect of the person concerned, or criminal penalties imposed on him when pursuing his profession in the Member State of origin or in the Member State from which he came.", "metadata": {"categories_en": "education and communications, employment and working conditions, social questions", "celex_id": "31978L1026", "chunk_strategy": "len_500_o50", "chunk_uid": "d3450ce17dd3b4a2ebf07aabcd3e53e8", "label_ids": "100150,100153,100149"}}, {"page_content": "comes shall forward to the host Member State all necessary information regarding measures or disciplinary action of a professional or administrative nature taken in respect of the person concerned or criminal penalties imposed on him when pursuing his profession in the Member State of origin or in the Member State from which he came.", "metadata": {"categories_en": "education and communications, employment and working conditions, social questions", "celex_id": "31993L0016", "chunk_strategy": "len_500_o50", "chunk_uid": "ed7ed80044a4b97907c160655dcad99b", "label_ids": "100150,100153,100149"}}, {"page_content": "This Directive establishes rules according to which a Member State which makes access to or pursuit of a regulated profession in its territory contingent upon possession of specific professional qualifications (referred to hereinafter as the host Member State) shall recognise professional qualifications obtained in one or more other Member States (referred to hereinafter as the home Member State) and which allow the holder of the said qualifications to pursue the same profession there, for", "metadata": {"categories_en": "politics, social questions, employment and working conditions, education and communications, geography", "celex_id": "32005L0036", "chunk_strategy": "len_500_o50", "chunk_uid": "0e2561770ce3314d8936630dc016ecca", "label_ids": "100142,100149,100153,100150,100161"}}, {"page_content": "(3) The host Member State shall take the measures necessary to permit joint practice also between:\n(a) several lawyers from different Member States practising under their home-country professional titles;\n(b) one or more lawyers covered by point (a) and one or more lawyers from the host Member State.\nThe manner in which such lawyers practice jointly in the host Member State shall be governed by the laws, regulations and administrative provisions of that State.", "metadata": {"categories_en": "law, employment and working conditions, education and communications, geography, EUROPEAN UNION", "celex_id": "31998L0005", "chunk_strategy": "len_500_o50", "chunk_uid": "88c246fd3d56f6f73d4b01afafe6ac35", "label_ids": "100145,100153,100150,100161,100144"}}, {"page_content": "Principle of the free provision of services\n1. Without prejudice to specific provisions of Community law, as well as to Articles 6 and 7 of this Directive, Member States shall not restrict, for any reason relating to professional qualifications, the free provision of services in another Member State:\n(a)\nif the service provider is legally established in a Member State for the purpose of pursuing the same profession there (hereinafter referred to as the Member State of establishment), and\n(b)", "metadata": {"categories_en": "politics, social questions, employment and working conditions, education and communications, geography", "celex_id": "32005L0036", "chunk_strategy": "len_500_o50", "chunk_uid": "f2c26cde58fe2ed422aa28e7cbb9a209", "label_ids": "100142,100149,100153,100150,100161"}}, {"page_content": "1. Where, in a host Member State, provisions laid down by law, regulation or administrative action are in force laying down requirements as to good character or good repute including provisions for disciplinary action in respect of serious professional misconduct or conviction of criminal offences and relating to the pursuit of any of the activities of a doctor, the Member State of origin or the Member State from which the foreign national comes shall forward to the host Member State all", "metadata": {"categories_en": "education and communications, employment and working conditions, social questions", "celex_id": "31993L0016", "chunk_strategy": "len_500_o50", "chunk_uid": "7cb8efc68034dd4313f62e56445c4b1c", "label_ids": "100150,100153,100149"}}, {"page_content": "should be entitled to provide his services in a Member State other than the one where he is established.", "metadata": {"categories_en": "trade", "celex_id": "32008R0450", "chunk_strategy": "len_500_o50", "chunk_uid": "743d3499fbbdd856704d2c121479e5fd", "label_ids": "100147"}}, {"page_content": "of services by such companies in Member States other than their home Member State.", "metadata": {"categories_en": "finance, trade, employment and working conditions, EUROPEAN UNION", "celex_id": "32001L0107", "chunk_strategy": "len_500_o50", "chunk_uid": "01934c218902ac69fdd446ec9bd7d6cf", "label_ids": "100148,100147,100153,100144"}}, {"page_content": "1. Where, in a host Member State, laws, regulations or administrative provisions impose requirements as to good character or good repute, including provisions in relation to the pursuit of the activities referred to in Article 1 for disciplinary action in respect of serious professional misconduct or conviction on criminal offences, the Member State of origin or the Member State from which the foreign national comes shall forward to the host Member State all necessary information regarding any", "metadata": {"categories_en": "education and communications, social questions, employment and working conditions", "celex_id": "31985L0384", "chunk_strategy": "len_500_o50", "chunk_uid": "a32392b95d4a341ca08e56daf45300d8", "label_ids": "100150,100149,100153"}}], "rag_answer": "The specific professional or administrative rule that applies to persons providing services from another EU country in the host Member State is:\n\n* The rules of conduct of a professional or administrative nature which apply in that Member State (as stated in Documents 1, 2, 3, 4, 5, 6, 7, 12, 13, and 17).\n\nThese rules are applicable to persons providing services from another EU country in the host Member State, regardless of their nationality or professional qualifications.", "generator_model": "llama3.2", "final_k": 20, "candidate_k": 100, "retrieval_source": "prefetch", "prefetch_path": "/home/mwc/Documents/MIOTI/Current/TFM/Data/eval_top10_dedup/prefetch/eval1_baseline/len_500_o50/hyb_fill_dense_then_bm25_ce_r50/000009.json", "query_index": 9}
{"id": "gt_dedup_00010", "question": "What are the specific dates mentioned in relation to the adoption of conclusions by the Council regarding an arms trade treaty?", "reference": "32009D1012", "gold_snippet": "89, entitled ‘Towards an arms trade treaty: establishing common international standards for the import, export and transfer of conventional arms’. In December 2006 and June and December 2007, the Council adopted conclusions underlining that it is important for the EU and Member Sta", "ground_truth_answer": "In December 2006, June 2007, and December 2007, the Council adopted conclusions.", "reference_contexts": ["89, entitled ‘Towards an arms trade treaty: establishing common international standards for the import, export and transfer of conventional arms’. In December 2006 and June and December 2007, the Council adopted conclusions underlining that it is important for the EU and Member Sta"], "retrieved_documents": [{"page_content": "On 6 December 2006, the United Nations General Assembly, with the support of all Member States of the European Union, adopted Resolution 61/89, entitled ‘Towards an arms trade treaty: establishing common international standards for the import, export and transfer of conventional arms’. In December 2006 and June and December 2007, the Council adopted conclusions underlining that it is important for the EU and Member States to play an active role and cooperate with other States and regional", "metadata": {"categories_en": "production, technology and research, trade, EUROPEAN UNION, international relations", "celex_id": "32009D1012", "chunk_strategy": "len_500_o50", "chunk_uid": "6133d25a2ddeb02b77a5a5247d1c0d92", "label_ids": "100158,100147,100144,100143"}}, {"page_content": "In its conclusions of 11 December 2006, the Council welcomed the formal start of the process towards the elaboration of a legally binding international Arms Trade Treaty and noted with appreciation that a clear majority of UN Member States had supported the above referred Resolution, including all EU Member States. The Council reaffirmed that the EU and its Member States would play an active role in this process, and underlined the importance of cooperation in this process with other States and", "metadata": {"categories_en": "business and competition, law, international relations, trade, international organisations", "celex_id": "32009D0042", "chunk_strategy": "len_500_o50", "chunk_uid": "f9898dfe36b1abed44b8e824ccf6db46", "label_ids": "100152,100145,100143,100147,100162"}}, {"page_content": "the Council Decision concerning the conclusion of the said Agreement.", "metadata": {"categories_en": "EUROPEAN UNION, international relations", "celex_id": "32005D0599", "chunk_strategy": "len_500_o50", "chunk_uid": "f518a3df117bcc8ed6937bd7a28a21c2", "label_ids": "100144,100143"}}, {"page_content": "Council Decision concerning the conclusion of the said Agreement.", "metadata": {"categories_en": "industry, EUROPEAN UNION, geography", "celex_id": "32001D0033", "chunk_strategy": "len_500_o50", "chunk_uid": "605515e3fa0f3c85ef6f05449e58be08", "label_ids": "100160,100144,100161"}}, {"page_content": "In its conclusions of 10 December 2007, the Council underlined the importance of the UN-appointed GGE which it encouraged to move the process forward. The Council expressed its firm belief that a comprehensive, legally binding instrument, consistent with existing responsibilities of States under relevant international law and establishing common international standards for the import, export and transfer of conventional arms, would be a major contribution to tackling the undesirable and", "metadata": {"categories_en": "business and competition, law, international relations, trade, international organisations", "celex_id": "32009D0042", "chunk_strategy": "len_500_o50", "chunk_uid": "48cb07377e4c2f148829958210e427b1", "label_ids": "100152,100145,100143,100147,100162"}}, {"page_content": "(2)\nOn 6 December 2006 the United Nations General Assembly adopted Resolution 61/89 entitled ‘Towards an arms trade treaty: establishing common international standards for the import, export and transfer of conventional arms’.\n(3)", "metadata": {"categories_en": "business and competition, law, international relations, trade, international organisations", "celex_id": "32009D0042", "chunk_strategy": "len_500_o50", "chunk_uid": "fbc85199d472f601b834435fa58fafde", "label_ids": "100152,100145,100143,100147,100162"}}, {"page_content": "(6)\nIn October 2008 the First Committee of the UN General Assembly adopted the resolution ‘Towards an arms trade treaty: establishing common international standards for the import, export and transfer of conventional arms’. All EU Member States co-sponsored the text.\n(7)", "metadata": {"categories_en": "business and competition, law, international relations, trade, international organisations", "celex_id": "32009D0042", "chunk_strategy": "len_500_o50", "chunk_uid": "f4b8ef9be2e5248584fbaf84e0cfd962", "label_ids": "100152,100145,100143,100147,100162"}}, {"page_content": "Whereas, by the Decision of 10 December 1979 concerning the conclusion of the multilateral Agreements resulting from the 1973 to 1979 trade negotiations, the Council approved, on behalf of the European Economic Community, the Agreement on technical barriers to trade, hereinafter referred to as \"the Agreement\";", "metadata": {"categories_en": "production, technology and research", "celex_id": "31980D0045", "chunk_strategy": "len_500_o50", "chunk_uid": "9dd287a317ffd55d0ff6e62c60fcd7c9", "label_ids": "100158"}}, {"page_content": "(4) The Council has decided by decision of 4 December 2000(6) on the conclusion of Agreements on trade in textile products with certain third countries (Armenia, Azerbaijan, Republic of Belarus, People's Republic of China, Arab Republic of Egypt, Former Yugoslav Republic of Macedonia, Georgia, Kazakhstan, Moldova, Kingdom of Nepal, Tajikistan, Turkmenistan, Ukraine, Uzbekistan).", "metadata": {"categories_en": "industry, trade, international relations", "celex_id": "32001R1809", "chunk_strategy": "len_500_o50", "chunk_uid": "1affb0a5de9dd55e036e8c670da7c64f", "label_ids": "100160,100147,100143"}}, {"page_content": "(3)\nSubject to the adoption at a later date of a Decision on the conclusion of the Agreement, it is desirable to sign the two documents that were initialled on 12 July 2004 and have confirmation of the Council approval of the Memorandum of Understanding,\nHAS DECIDED AS FOLLOWS:\nArticle 1", "metadata": {"categories_en": "finance, economics, international relations, geography, EUROPEAN UNION", "celex_id": "32004D0903", "chunk_strategy": "len_500_o50", "chunk_uid": "93e1bfce38face438f1a60acebf9a00a", "label_ids": "100148,100146,100143,100161,100144"}}, {"page_content": "The Council shall, acting in accordance with the procedure laid down in Article 37 of the Treaty, decide by 30 June 2002 on any necessary adjustments to be applied as from 1 July 2002 to the provisions of this paragraph.\"", "metadata": {"categories_en": "economics, agriculture, forestry and fisheries", "celex_id": "32002R0179", "chunk_strategy": "len_500_o50", "chunk_uid": "85128668b33b43e869b18e6e2a771ca3", "label_ids": "100146,100156"}}, {"page_content": "(3)\nSubject to the adoption at a later date of a Decision on the conclusion of the Agreement, it is desirable to sign the two documents that were initialled on 30 July 2004 and have confirmation of the Council approval of the Memorandum of Understanding,\nHAS DECIDED AS FOLLOWS:\nArticle 1", "metadata": {"categories_en": "finance, economics, international relations, geography, EUROPEAN UNION", "celex_id": "32004D0897", "chunk_strategy": "len_500_o50", "chunk_uid": "d53c7991ed95066254a65edaa5e78221", "label_ids": "100148,100146,100143,100161,100144"}}, {"page_content": "(3)\nSubject to the adoption at a later date of a Decision on the conclusion of the Agreement, it is desirable to sign the two documents that were initialled on 1 July 2004 and have confirmation of the Council approval of the Memorandum of Understanding,\nHAS DECIDED AS FOLLOWS:\nArticle 1", "metadata": {"categories_en": "finance, EUROPEAN UNION, economics, geography", "celex_id": "32005D0035", "chunk_strategy": "len_500_o50", "chunk_uid": "57be4c88c4609211fdda51a94829ee61", "label_ids": "100148,100144,100146,100161"}}, {"page_content": "(3)\nSubject to the adoption at a later date of a Decision on the conclusion of the Agreement, it is desirable to sign the two documents that were initialled on 1 July 2004 and have confirmation of the Council approval of the Memorandum of Understanding,\nHAS DECIDED AS FOLLOWS:\nArticle 1", "metadata": {"categories_en": "finance, economics, international relations, geography, EUROPEAN UNION", "celex_id": "32004D0828", "chunk_strategy": "len_500_o50", "chunk_uid": "d2756425de0627e3ac1b4c7f4405f659", "label_ids": "100148,100146,100143,100161,100144"}}, {"page_content": "Having regard to Common Position 96/184/CFSP of 26 February 1996 defined by the Council on the basis of Article J.2 of the Treaty on European Union concerning arms exports to the former Yougoslavia (1),\nWhereas the Council has come to the conclusion that developments in Slovenia, in particular its policy with regard to arms exports, justifies a lifting of the restrictive measures of Common Position 96/184/CFSP in respect of that State,\nHAS DECIDED AS FOLLOWS:\nArticle 1", "metadata": {"categories_en": "trade, geography, EUROPEAN UNION, international relations", "celex_id": "31998D0498", "chunk_strategy": "len_500_o50", "chunk_uid": "3709cf13abd38703b6f1edac0993cc40", "label_ids": "100147,100161,100144,100143"}}, {"page_content": "COUNCIL DECISION 2009/42/CFSP\nof 19 January 2009\non support for EU activities in order to promote among third countries the process leading towards an Arms Trade Treaty, in the framework of the European Security Strategy\nTHE COUNCIL OF THE EUROPEAN UNION,\nHaving regard to the Treaty on European Union, and in particular Article 13(3) and Article 23(1) thereof,\nWhereas:\n(1)", "metadata": {"categories_en": "business and competition, law, international relations, trade, international organisations", "celex_id": "32009D0042", "chunk_strategy": "len_500_o50", "chunk_uid": "9031d5c34736c1d436e79da545f943d4", "label_ids": "100152,100145,100143,100147,100162"}}, {"page_content": "(19) The import arrangements are to be renewed on the basis of the conditions established by the Council in relation to the development of the relations between the Community and the countries concerned, including the European Union's Regional Approach and the Stabilisation and Association Process for the countries of South-Eastern Europe, endorsed by the conclusions of the Council of 21 and 22 July 1999; withdrawal of countries from or (re)inclusion of countries for these trade arrangements", "metadata": {"categories_en": "geography, trade, industry, agriculture, forestry and fisheries", "celex_id": "32000R0006", "chunk_strategy": "len_500_o50", "chunk_uid": "b8f8ad56f3cc7e2adfbfd964a25c26c4", "label_ids": "100161,100147,100160,100156"}}, {"page_content": "Article 4\nThe Council, acting under the conditions laid down in the Treaty, shall decide before 31 December 1994, on a proposal which the Commission will submit before 31 December 1993 on a further reduction in limit values.", "metadata": {"categories_en": "finance, environment, production, technology and research, transport, EUROPEAN UNION", "celex_id": "31993L0059", "chunk_strategy": "len_500_o50", "chunk_uid": "25e3aa718527e69e8fa75af24abf29f9", "label_ids": "100148,100155,100158,100154,100144"}}, {"page_content": "-\nthe European Security Strategy,\n-\nthe EU Strategy to combat illicit accumulation and trafficking of SALW and their ammunition,\n-\nArticle 11 of Common Position 2008/944/CFSP,\n-\nthe EU Programme for Preventing and Combating Illicit Trafficking in Conventional Arms,\n-\nthe International Instrument to Enable States to Identify and Trace, in a Timely and Reliable Manner, Illicit Small Arms and Light Weapons, and,\n-\nthe Council Conclusions on a International Arms Trade Treaty,", "metadata": {"categories_en": "production, technology and research, trade, EUROPEAN UNION, international relations", "celex_id": "32009D1012", "chunk_strategy": "len_500_o50", "chunk_uid": "8705440c202488a57e59a88020b6358f", "label_ids": "100158,100147,100144,100143"}}, {"page_content": "Whereas:\n(1)\nOn 26 June 1997, the Council adopted the EU Programme for Preventing and Combating Illicit Trafficking in Conventional Arms, committing the EU and its Member States to take concerted action to assist other countries in preventing and combating the illicit trafficking of arms.\n(2)", "metadata": {"categories_en": "production, technology and research, trade, EUROPEAN UNION, international relations", "celex_id": "32009D1012", "chunk_strategy": "len_500_o50", "chunk_uid": "9d4dc832c141afcbddff5474639cd459", "label_ids": "100158,100147,100144,100143"}}], "rag_answer": "The specific dates mentioned in relation to the adoption of conclusions by the Council regarding an arms trade treaty are:\n\n* 6 December 2006 (Council adopted conclusions underlining that it is important for the EU and Member States to play an active role and cooperate with other States and regional organizations)\n* 11 December 2006 (Council welcomed the formal start of the process towards the elaboration of a legally binding international Arms Trade Treaty)\n* 10 December 2007 (Council underlined the importance of the UN-appointed GGE which it encouraged to move the process forward)", "generator_model": "llama3.2", "final_k": 20, "candidate_k": 100, "retrieval_source": "prefetch", "prefetch_path": "/home/mwc/Documents/MIOTI/Current/TFM/Data/eval_top10_dedup/prefetch/eval1_baseline/len_500_o50/hyb_fill_dense_then_bm25_ce_r50/000010.json", "query_index": 10}
{"id": "gt_dedup_00011", "question": "What is the minimum purity requirement for stigmasterol in a product ready to be incorporated, calculated on the product's weight?", "reference": "31984R0784", "gold_snippet": "ol) at least 95 % pure, calculated on the product ready to be incorporated,\nor\n17 grams of stigmasterol (C29H48O = D -5,22-stigmastene-3-beta-ol) at least 85 % pure, calculated on the product ready to be incorporated, containing not more than 7,5 % brassicasterol (C28H46O = D-5,22-ergostene-3-beta-ol) and not more than 4 % sitosterol (C29H50O = D -5-stigmastene-3-beta-ol", "ground_truth_answer": "At least 85% pure.", "reference_contexts": ["ol) at least 95 % pure, calculated on the product ready to be incorporated,\nor\n17 grams of stigmasterol (C29H48O = D -5,22-stigmastene-3-beta-ol) at least 85 % pure, calculated on the product ready to be incorporated, containing not more than 7,5 % brassicasterol (C28H46O = D-5,22-ergostene-3-beta-ol) and not more than 4 % sitosterol (C29H50O = D -5-stigmastene-3-beta-ol"], "retrieved_documents": [{"page_content": "FORMULA A\neither\n15 grams of stigmasterol (C29H48O = D -5,22-stigmastene-3-betal-ol) at least 95 % pure, calculated on the product ready to be incorporated,\nor\n17 grams of stigmasterol (C29H48O = D -5,22-stigmastene-3-beta-ol) at least 85 % pure, calculated on the product ready to be incorporated, containing not more than 7,5 % brassicasterol (C28H46O = D-5,22-ergostene-3-beta-ol) and not more than 4 % sitosterol (C29H50O = D -5-stigmastene-3-beta-ol).\nFORMULA B\neither", "metadata": {"categories_en": "trade", "celex_id": "31984R0784", "chunk_strategy": "len_500_o50", "chunk_uid": "67e159cb1c6c446b2145e34448aa21ba", "label_ids": "100147"}}, {"page_content": "Formthla I:\n15 grams of stigmasterol (PS29I48O = D 5,22-stigmastene-3-beta-ol) at least 95 % pure, calculated on the product ready to be incorporated, or", "metadata": {"categories_en": "trade, agri-foodstuffs", "celex_id": "31985R3143", "chunk_strategy": "len_500_o50", "chunk_uid": "948d46d354edafcf803d8c9222719c44", "label_ids": "100147,100157"}}, {"page_content": "FORMULA B\neither\n10 grams of ethyl ester of butyric acid and 15 grams of stigmasterol (C29H48O = D-5,22-stigmastene-3-beta-ol) at least 95 % pure, calculated on the product ready to be incorporated,\nor", "metadata": {"categories_en": "trade", "celex_id": "31984R0784", "chunk_strategy": "len_500_o50", "chunk_uid": "57e70f9a07eaf86e9c02f8e08dadf082", "label_ids": "100147"}}, {"page_content": "or\n10 grams of ethyl ester of butyric acid and 17 grams of stigmasterol (C29H48O = D-5,22-stigmastene-3-beta-ol) at least 85 % pure, calculated on the product ready to be incorporated, containing not more than 7,5 % brassicasterol (C28H46O = D -5,22-ergostene-3-beta-ol) and not more than 4 % sitosterol (C29H50O = D-5-stigmastene-3-beta-ol).", "metadata": {"categories_en": "trade", "celex_id": "31984R0784", "chunk_strategy": "len_500_o50", "chunk_uid": "ee7587bda27528f7fbc495c8fde58836", "label_ids": "100147"}}, {"page_content": "- 81,0 mg/kg (70 % of the minimum incorporation rate for 95 % pure stigmasterol),\n- 82,0 mg/kg (70 % of the minimum incorporation rate for 85 % pure stigmasterol).\nThe tracer concentration of the sample giving the lowest result is used in conjunction with interpolation respectively between 116,0 mg/kg and 81,0 mg/kg or 118,0 mg/kg and 82,0 mg/kg.`;\n(c) points 8.3.2 and 8.3.3 are replaced by:", "metadata": {"categories_en": "social questions, agri-foodstuffs", "celex_id": "31999R0175", "chunk_strategy": "len_500_o50", "chunk_uid": "646c9c665a90dd42dfbd770712743575", "label_ids": "100149,100157"}}, {"page_content": "17 grams of stigmasterol (C29H48O =D 5,22-stigmastene-3-beta-ol) at least 85 % pure, calculated on the product ready to be incorporated, containing not more than 7,5 % brassicasterol (C28H46O = D 5,22-ergostene-3-beta-ol) and not more than 4 % sitosterol (C29H50O = D 5-stigmastene-3-beta-ol), or 1,1 kg of triglycerides of enanthic (n-heptanoic) acid, at least 95 % pure, calculated as triglycerides on the product ready for incorporation, with a maximum acid value of 0,3 % , a saponification", "metadata": {"categories_en": "trade, agri-foodstuffs", "celex_id": "31985R3143", "chunk_strategy": "len_500_o50", "chunk_uid": "a8457929c0f1c0cb46699dc47475e998", "label_ids": "100147,100157"}}, {"page_content": "'8.2.2. The results of the three samples obtained from the analysis of the product are used to check the rate and the homogeneity of tracer incorporation and the lowest of these results is compared with the following limits (Critical Difference for a 95 % probability level (CrD95) taken into consideration):\n- 116,0 mg/kg (95 % of the minimum incorporation rate for 95 % pure stigmasterol),\n- 118,0 mg/kg (95 % of the minimum incorporation rate for 85 % pure stigmasterol),", "metadata": {"categories_en": "social questions, agri-foodstuffs", "celex_id": "31999R0175", "chunk_strategy": "len_500_o50", "chunk_uid": "43cb091b266db75d423ff2ff4ee55a80", "label_ids": "100149,100157"}}, {"page_content": "- 84,0 mg/kg (70 % of the minimum incorporation rate for 95 % pure stigmasterol),\n- 86,0 mg/kg (70 % of the minimum incorporation rate for 85 % pure stigmasterol).\nThe tracer concentration of the sample giving the lowest result is used in conjunction with interpolation respectively between 120,0 mg/kg and 84,0 mg/kg or 122,0 mg/kg and 86,0 mg/kg`;\n(c) points 8.3.2 and 8.3.3 are replaced by the following text:", "metadata": {"categories_en": "social questions, agri-foodstuffs", "celex_id": "31999R0175", "chunk_strategy": "len_500_o50", "chunk_uid": "4f024bd12c60887ab9c8c91e012a67ff", "label_ids": "100149,100157"}}, {"page_content": "'8.2.2. The results of the three samples obtained from the analysis of the product is used to check the rate and the homogeneity of tracer incorporation and the lowest of these results is compared with the following limits (Critical Difference for a 95 % probability level (CrD95) taken into consideration):\n- 120,0 mg/kg (95 % of the minimum incorporation rate for 95 % pure stigmasterol),\n- 122,0 mg/kg (95 % of the minimum incorporation rate for 85 % pure stigmasterol),", "metadata": {"categories_en": "social questions, agri-foodstuffs", "celex_id": "31999R0175", "chunk_strategy": "len_500_o50", "chunk_uid": "5953ef62a6b9995a406022d4321d4d98", "label_ids": "100149,100157"}}, {"page_content": "10 grams of ethyl ester of butyric acid and 17 grams of stigmasterol (C29H48O = D 5,22-stigmastene-3-beta-ol) at least 85 % pure, calculated on the product ready to be incorporated, containing not more than 7,5 % brassicasterol (C28H46O = D 5,22-ergostene-3-beta-ol) and not more than 4 % sitosterol (C29H50O = D 5-stigmastene-3-beta-ol), or", "metadata": {"categories_en": "trade, agri-foodstuffs", "celex_id": "31985R3143", "chunk_strategy": "len_500_o50", "chunk_uid": "2b9dabd6fe20d75fad8bf766935f1cb0", "label_ids": "100147,100157"}}, {"page_content": "Formula II:\n10 grams of ethyl ester of butyric acid and 15 grams of stigmasterol (C29H48O = D 5,22-stigmastene-3-beta-ol) at least 95 % pure calculated on the product ready to be incororated, or", "metadata": {"categories_en": "trade, agri-foodstuffs", "celex_id": "31985R3143", "chunk_strategy": "len_500_o50", "chunk_uid": "2a2392e878024cddec8227cf6bc90948", "label_ids": "100147,100157"}}, {"page_content": "'8.3.2. The results of the three samples obtained from the analysis of the product is used to check the rate and the homogeneity of tracer incorporation and the lowest of these results is compared with the following limits (Critical Difference for a 95 % probability level (CrD95) taken into consideration):\n- 486,0 mg/kg (95 % of the minimum incorporation rate for 90 % pure sitosterol),\n- 358,0 mg/kg (70 % of the minimum incorporation rate for 90 % pure sitosterol).", "metadata": {"categories_en": "social questions, agri-foodstuffs", "celex_id": "31999R0175", "chunk_strategy": "len_500_o50", "chunk_uid": "6d4a9131c8e2684aa1ef407ceaadd0d4", "label_ids": "100149,100157"}}, {"page_content": "'or\n- 600 g of a compound containing at least 90 % of sitosterol and in particular 80 % of beta-sitosterol (C29H50O = D -5-stigmastene-3 beta-ol) and a maximum 9 % of campesterol (C28H48O = D-5-ergostene-3 beta-ol) and 1 % of other sterols in traces including stigmasterol (C29H48O = D -5,22-stigmastadiene-3 beta-ol).'\nArticle 3\nThis Regulation shall enter into force on the day of its publication in the Official Journal of the European Communities.", "metadata": {"categories_en": "trade, finance, agri-foodstuffs", "celex_id": "31984R2815", "chunk_strategy": "len_500_o50", "chunk_uid": "b91ad4aaf69db042d2492c1cc98be536", "label_ids": "100147,100148,100157"}}, {"page_content": "(c) points 8.3.2 and 8.3.3 are replaced by:\n'8.3.2. The results of the three samples obtained from the analysis of the product are used to check the rate and the homogeneity of tracer incorporation and the lowest of these results is compared with the following limits (Critical Difference for a 95 % probability level (CrD95) taken into consideration):\n- 486,0 mg/kg (95 % of the minimum incorporation rate for 90 % pure sitosterol),", "metadata": {"categories_en": "social questions, agri-foodstuffs", "celex_id": "31999R0175", "chunk_strategy": "len_500_o50", "chunk_uid": "6ae51138bc9c8aae170e81aeb1719501", "label_ids": "100149,100157"}}, {"page_content": "(b) 1,1 kilograms of triglycerides of pelargonic (n-nonanoic) acid, at least 95 % pure, calculated as triglycerides on the product ready for incorporation, with a maximum acid value of 0,5 %, a saponification number between 325 and 340, and a 95 % minimum content of pelargonic acid in the esterified acid part.\nThe competent agency shall ensure that the quality and characteristics, including the degree of purity, of the products to be incorporated in concentrated butter have been complied with.", "metadata": {"categories_en": "trade, agri-foodstuffs, agriculture, forestry and fisheries", "celex_id": "31986R2409", "chunk_strategy": "len_500_o50", "chunk_uid": "3a85f7c7bf43d5dc49643c669d5e0bcf", "label_ids": "100147,100157,100156"}}, {"page_content": "- 358,0 mg/kg (70 % of the minimum incorporation rate for 90 % pure sitosterol).\nThe tracer concentration of the sample giving the lowest result is used in conjunction with interpolation between 486,0 mg/kg and 358,0 mg/kg.`\nArticle 3\nRegulation (EC) No 1082/96 is amended as follows:\n1. in Article 1 'Regulation (EEC) No 570/88` is replaced by 'Regulation (EC) No 2571/97`;\n2. point 8 of the Annex is amended as follows:\n(a) point 8.1 is replaced by the following text:", "metadata": {"categories_en": "social questions, agri-foodstuffs", "celex_id": "31999R0175", "chunk_strategy": "len_500_o50", "chunk_uid": "569124dfa789061529ae5c9eaa91a36f", "label_ids": "100149,100157"}}, {"page_content": "(cc) 600 g of a compound congaining at least 90 % in sitosterol and in particular 80 % of beta-sitosterol (C29H50O = D 5-stigmasten-3 beta-01), as well as a maximum 9 % of campesterol (C28H48O = D 5-ergostene-3 beta-01) and 1 % of other sterols in traces including stigmasterol (C29H48O = D 5,22-stigmastadien-3 beta-01).' Article 2\nThis Regulation shall enter into force on the day of its publication in the Official Journal of the European Communities.", "metadata": {"categories_en": "finance, agri-foodstuffs", "celex_id": "31985R1874", "chunk_strategy": "len_500_o50", "chunk_uid": "0b70340fdc44067458f433384ae8f94d", "label_ids": "100148,100157"}}, {"page_content": "In the light of the above findings, it is concluded that all new product types should be considered as the product concerned exclusively in relation to their content of AN - as long as this exceeds 80 % by weight - together with marginal substances and nutrients, but not as far as the primary nutrients P and K are concerned. As a consequence, in order to apply the existing measures only to the product concerned incorporated in all new product types, the proportional application of the existing", "metadata": {"categories_en": "business and competition, geography, agriculture, forestry and fisheries", "celex_id": "32005R0945", "chunk_strategy": "len_500_o50", "chunk_uid": "ca474ff39a522b41a91f5d282bef5883", "label_ids": "100152,100161,100156"}}, {"page_content": "-´´product 1902-1908 (carotene/enanthic acid'' or ´´product 1902-1908 (carotene/stigmasterol)'' in the case of products resulting from incorpo- ration as specified in Annex I (II) to Regulation (EEC) No 262/79,\n-´´product 1902-1908 (sugar/enanthic acid)'' or ´´product 1902-1908 (sugar/stigmasterol)'' in the case of products resulting from incorporation as specified in Annex I (III) of Regulation (EEC) No 262/79,", "metadata": {"categories_en": "trade, agri-foodstuffs", "celex_id": "31988R0222", "chunk_strategy": "len_500_o50", "chunk_uid": "659f28f3ed8d296d2e5b03c0f1001fff", "label_ids": "100147,100157"}}, {"page_content": "1. Product concerned\n(11) The product concerned is paracresol with a minimum para-isomer purity of 97 %, calculated on a net dry basis, currently classifiable within the CN code ex 2907 12 00.", "metadata": {"categories_en": "geography, trade, business and competition, industry", "celex_id": "32003R0510", "chunk_strategy": "len_500_o50", "chunk_uid": "ba76428c663a71ee29fbda31092481a6", "label_ids": "100161,100147,100152,100160"}}], "rag_answer": "The answer to your question cannot be found in the retrieved context.", "generator_model": "llama3.2", "final_k": 20, "candidate_k": 100, "retrieval_source": "prefetch", "prefetch_path": "/home/mwc/Documents/MIOTI/Current/TFM/Data/eval_top10_dedup/prefetch/eval1_baseline/len_500_o50/hyb_fill_dense_then_bm25_ce_r50/000011.json", "query_index": 11}
{"id": "gt_dedup_00012", "question": "What is the minimum price per kilogram of a specific commodity for the period from 1 January to 31 December 1995?", "reference": "31994R3144", "gold_snippet": "om 1 January to 31 December 1995 1 000 4,5 MIN 0,2 ECU/100 kg/net 0808 10 51 4 MIN 1,1 ECU/100 kg/net 0808 10 53 4 MIN 1,1 ECU/100 kg/net 0808 10 59 4 MIN 1,1 ECU/100 kg/net 0808 10 61 3 MIN 0,7 ECU/100 kg/net 0808 10 63 3 MIN 0,7 ECU/100 kg/net 0808 10 69 3 MIN 0,7 ECU/100 kg/net 0808 10 71 *10", "ground_truth_answer": "The minimum price per kilogram of this commodity for the specified period starts at 0.2 ECU/100 kg/net, increasing in increments of 0.1 ECU/100 kg/net until it reaches 0.7 ECU/100 kg/net.", "reference_contexts": ["om 1 January to 31 December 1995 1 000 4,5 MIN 0,2 ECU/100 kg/net 0808 10 51 4 MIN 1,1 ECU/100 kg/net 0808 10 53 4 MIN 1,1 ECU/100 kg/net 0808 10 59 4 MIN 1,1 ECU/100 kg/net 0808 10 61 3 MIN 0,7 ECU/100 kg/net 0808 10 63 3 MIN 0,7 ECU/100 kg/net 0808 10 69 3 MIN 0,7 ECU/100 kg/net 0808 10 71 *10"], "retrieved_documents": [{"page_content": "60 for the period from 1 January 1990 to 31 December 1990,\n75 for the period from 1 January 1991 to 31 December 1991,\n100 for the period from 1 January 1992 to 31 December 1992 or 1995, according to the timetable for tariff reductions laid down for the products concerned in the Act of Accession;\n2. in trade between the Community of Ten and Portugal:\n(a) where goods obtained in Portugal:\n- are listed in Annex VII, that prescribed in the same Annex,\n- are not listed in Annex VII:", "metadata": {"categories_en": "trade, EUROPEAN UNION", "celex_id": "31987R3634", "chunk_strategy": "len_500_o50", "chunk_uid": "3c1e3777aa6927cc01a6a65bcfc31f01", "label_ids": "100147,100144"}}, {"page_content": "(204) On 18 January 1995 all five producers agreed the European target price to be DEM 4,90/kg, with an exceptional minimum price of DEM 4,80/kg (see paragraph 156).\n(205) On 9 March 1995 ADM, Ajinomoto, Sewon and Cheil set the European price at DEM 4,40 to 4,50/kg (see paragraph 158). All five producers confirmed this price on 21 April 1995 (see paragraph 161).", "metadata": {"categories_en": "industry, business and competition, EUROPEAN UNION, international relations", "celex_id": "32001D0418", "chunk_strategy": "len_500_o50", "chunk_uid": "9b7ba78d8b5862964fbf7790f3f96104", "label_ids": "100160,100152,100144,100143"}}, {"page_content": "75 for the period from 1 January 1991 to 31 December 1991,\n100 for the period from 1 January 1992 to 31 December 1992 or 1995, according to the timetable for tariff reductions laid down for the products concerned in the Act of Accession;\n(b) where goods obtained in the Community of Ten:\n- are listed in Annex VI, that prescribed in the same Annex,\n- are not listed in Annex VI:\n35 for the period from 1 January 1988 to 31 December 1988,\n48 for the period from 1 January 1989 to 31 December 1989,", "metadata": {"categories_en": "trade, EUROPEAN UNION", "celex_id": "31987R3634", "chunk_strategy": "len_500_o50", "chunk_uid": "a3267d067ebe531b616031322cb76ea4", "label_ids": "100147,100144"}}, {"page_content": "48 for the period from 1 January 1989 to 31 December 1989,\n60 for the period from 1 January 1990 to 31 December 1990,\n75 for the period from 1 January 1991 to 31 December 1991,\n100 for the period from 1 January 1992 to 31 December 1992 or 1995, according to the timetable for tariff reductions laid down for the products concerned in the Act of Accession.'\n4. Annexes I to VII are replaced by Annexes I to IX to this oegulation.\nArticle 2\nThis Regulation shall enter into force on 1 January 1988.", "metadata": {"categories_en": "trade, EUROPEAN UNION", "celex_id": "31987R3634", "chunk_strategy": "len_500_o50", "chunk_uid": "e174891edec92cfcec6ddec34ae79d62", "label_ids": "100147,100144"}}, {"page_content": "HAS ADOPTED THIS REGULATION:\nArticle 1\nUp to the end of the 1995/96 marketing year the minimum price referred to in Article 1 (3) of Regulation (EEC) No 1035/77 shall be as follows:\nMinimum price: ECU 15,77/100 kg net.\nThe minimum price shall refer to products ex-producers' packaging stations.\nArticle 2\nUp to the end of the 1995/96 marketing year the financial compensation referred to in Article 2 of Regulation (EEC) No 1035/77 shall be as follows:\nFinancial compensation: ECU 10,48/100 kg net.", "metadata": {"categories_en": "finance, agri-foodstuffs, agriculture, forestry and fisheries", "celex_id": "31995R1604", "chunk_strategy": "len_500_o50", "chunk_uid": "73a60facb9ee5667fa5eeb56451b460b", "label_ids": "100148,100157,100156"}}, {"page_content": "(5) The period used for the investigation of subsidies was 1 January 1995 to 31 December 1995 (hereinafter referred to as the 'investigation period`).", "metadata": {"categories_en": "industry, business and competition, economics, trade, geography", "celex_id": "31998D0378", "chunk_strategy": "len_500_o50", "chunk_uid": "3c109495ef536dca1fcfc50f0df8e0b9", "label_ids": "100160,100152,100146,100147,100161"}}, {"page_content": "- for the period from 1 July 1995 to 31 December 1995, to the balance of the quantities of raw sugar remaining to be refined subject to the limit laid down in Article 16a, as amended by the Act of Accession of Austria, Finland and Sweden;\n- for the period from 1 January 1996 to 30 June 1996, to 30 000 tonnes.", "metadata": {"categories_en": "production, technology and research, industry, agri-foodstuffs, agriculture, forestry and fisheries", "celex_id": "31995R1101", "chunk_strategy": "len_500_o50", "chunk_uid": "a3165622940c76a26ce83a48a98022f1", "label_ids": "100158,100160,100157,100156"}}, {"page_content": "HAS ADOPTED THIS REGULATION:\nArticle 1\nUp to the end of the 1994/95 marketing year the minimum price referred to in Article 1 (3) of Regulation (EEC) No 1035/77 shall be as follows:\nMinimum price: ECU 11,60/100 kg net.\nThe minimum price shall refer to products ex-producers' packaging stations.\nArticle 2\nUp to the end of the 1994/95 marketing year the financial compensation referred to in Article 2 of Regulation (EEC) No 1035/77 shall be as follows:\nFinancial compensation: ECU 7,23/100 kg net.", "metadata": {"categories_en": "finance, agri-foodstuffs, agriculture, forestry and fisheries", "celex_id": "31994R1968", "chunk_strategy": "len_500_o50", "chunk_uid": "c2d03a701306842b3e49516d643874b3", "label_ids": "100148,100157,100156"}}, {"page_content": "(206) On 27 April 1995 the five lysine producers set the European minimum price at DEM 4,25/kg and the target price at DEM 4,50/kg (see paragraph 164). All five lysine producers confirmed the minimum price on 23 May 1995 (see paragraph 165).", "metadata": {"categories_en": "industry, business and competition, EUROPEAN UNION, international relations", "celex_id": "32001D0418", "chunk_strategy": "len_500_o50", "chunk_uid": "e74dfdedf33aada6fba39aa9ca0ecb6b", "label_ids": "100160,100152,100144,100143"}}, {"page_content": "(256) From 1 January 1992 the \"list\" price was DEM 76/kg delivered and the \"lowest\" price DEM 74/kg, BASF's pricing instructions of 11 December 1991 confirm the minimum price level of DEM 74/kg.", "metadata": {"categories_en": "social questions, law, business and competition", "celex_id": "32003D0002", "chunk_strategy": "len_500_o50", "chunk_uid": "9730a1bc57544da5a19a7a166d179e4e", "label_ids": "100149,100145,100152"}}, {"page_content": "Whereas application of the abovementioned criteria results in the fixing of the minimum price at the level given below,\nHAS ADOPTED THIS REGULATION:\nArticle 1\nFor the 1994/95 marketing year, the minimum price for unginned cotton provided for in Article 9 (1) of Regulation (EEC) No 2169/81 shall be ECU 96,39 per 100 kg. That price shall apply to goods at the farm gate.\nArticle 2", "metadata": {"categories_en": "finance, agri-foodstuffs, agriculture, forestry and fisheries", "celex_id": "31994R1877", "chunk_strategy": "len_500_o50", "chunk_uid": "1c9bbd99fcf08ec3b04e44cb06703e6b", "label_ids": "100148,100157,100156"}}, {"page_content": "HAS ADOPTED THIS REGULATION:\nArticle 1\nFor the month of June 1995 the minimum price referred to in Article 1 (3) of Regulation (EEC) No 1035/77 shall be as follows:\nMinimum price: ECU 15,77/100 kg net.\nThe minimum price shall refer to products ex-producers' packaging stations.\nArticle 2\nFor the month of June 1995 the financial compensation referred to in Article 2 of Regulation (EEC) No 1035/77 shall be as follows:\nFinancial compensation: ECU 10,48/100 kg net.\nArticle 3", "metadata": {"categories_en": "finance, agri-foodstuffs", "celex_id": "31995R1242", "chunk_strategy": "len_500_o50", "chunk_uid": "f5d6871d888d7809a58138110fb8046a", "label_ids": "100148,100157"}}, {"page_content": "(155) The investigation has shown that the Community producers' average sales price rose from ECU 3,60 per kilogram in 1995 to ECU 3,88 per kilogram in the IP, i.e. a rise of around 8 %. This rise occurred in two phases, one between 1995 and 1996 and the second one between 1997 and 1998. While the prices of all the economic operators on the market (namely the Community industry, the countries concerned and other third countries), increased in the first phase, the second price increase was", "metadata": {"categories_en": "industry, trade, business and competition, international relations", "celex_id": "32000R0449", "chunk_strategy": "len_500_o50", "chunk_uid": "d70d6ebfb667585c5bbf26f6b7cf75b4", "label_ids": "100160,100147,100152,100143"}}, {"page_content": "(c) China: a maximum of 1 050 000 tonnes in the period 1 January 1993 to 31 December 1995, to be imported on the following conditions:\n- the quantity which may be imported during each year during that period may not exceed 367 500 tonnes,\n- in addition, the quantity which may be imported in 1995 may in no case result in an overrun in the maximum of 1 050 000 tonnes laid down for the period 1 January 1993 to 31 December 1995;", "metadata": {"categories_en": "trade, agri-foodstuffs", "celex_id": "31992R3909", "chunk_strategy": "len_500_o50", "chunk_uid": "24315efa8fc5d3a5cf27b0c9f7e287c6", "label_ids": "100147,100157"}}, {"page_content": "2. Reference periods\n(15) The dumping margin of the exporter CBCC was calculated for the following three reference periods: from 1 July 1995 to 31 December 1995, from 1 January 1996 to 31 December 1996 and from 1 January 1997 to 31 December 1997.\n3. Merits of the transactions sold for export between 1 January 1996 and 31 December 1996", "metadata": {"categories_en": "finance, business and competition, industry, trade, geography", "celex_id": "31999D0219", "chunk_strategy": "len_500_o50", "chunk_uid": "70472c8f44eb9c5a00f9365cc442463f", "label_ids": "100148,100152,100160,100147,100161"}}, {"page_content": "(147) The weighted average import price of the countries concerned decreased by around 5 % between 1995 and the IP, from ECU 1,88 to ECU 1,78 per kilogram. More specifically, prices went up significantly between 1995 and 1996, in line with the general price increase on the market, followed also by the Communisy industry and the other third countries. Between 1996 and the IP the price decrease was then very marked and amounted to 10 %, from ECU 1,96 to ECU 1,78 per kilogram.", "metadata": {"categories_en": "industry, trade, business and competition, international relations", "celex_id": "32000R0449", "chunk_strategy": "len_500_o50", "chunk_uid": "155083d7ad674db98770f38b158ea6f5", "label_ids": "100160,100147,100152,100143"}}, {"page_content": "(14) The investigation of dumping covered the period from 1 January 1995 to 31 December 1995 (hereinafter referred to as the 'investigation period`). The period for the determination of injury covered the years 1992 to 1995. The geographical scope of the investigation was the Community as constituted at the time of the initiation, thus including all 15 Member States.", "metadata": {"categories_en": "business and competition, industry, energy, trade, geography", "celex_id": "31997R1951", "chunk_strategy": "len_500_o50", "chunk_uid": "0d52c6592b9384b840f3da3dad0ec9d6", "label_ids": "100152,100160,100159,100147,100161"}}, {"page_content": "- the calculated level of his production of chlorofluorocarbons in the period 1 January to 31 December 1994 and in the following 12-month period does not exceed 15 % of the calculated level of his production in 1986,\n- he produces no chlorofluorocarbons after 31 December 1995.", "metadata": {"categories_en": "industry, international relations, environment, production, technology and research, trade", "celex_id": "31994R3093", "chunk_strategy": "len_500_o50", "chunk_uid": "207f66a32e7735b2667394a672a0fb16", "label_ids": "100160,100143,100155,100158,100147"}}, {"page_content": "Article 3\nAs from 1 January 1993, the minimum rate of excise duty on leaded petrol shall be fixed at ECU 337 per 1 000 litres except in the case of Luxembourg where, during the period from 1 January 1993 to 31 December 1994, the minimum rate of duty shall be fixed at ECU 292 per 1 000 litres.\nArticle 4", "metadata": {"categories_en": "finance, energy", "celex_id": "31992L0082", "chunk_strategy": "len_500_o50", "chunk_uid": "62985c70efee1569064b2eceeb1968e0", "label_ids": "100148,100159"}}, {"page_content": "Article 4\nAs from 1 January 1993, the minimum rate of excise duty on unleaded petrol shall be fixed at ECU 287 per 1 000 litres except in the case of Luxembourg where, during the period from 1 January 1993 to 31 December 1994, the minimum rate of duty shall be fixed at ECU 242 per 1 000 litres, provided that in every case the rate of duty shall be below that charged on leaded petrol.\nArticle 5", "metadata": {"categories_en": "finance, energy", "celex_id": "31992L0082", "chunk_strategy": "len_500_o50", "chunk_uid": "7a5a785ce7e46ad5eccdb9aae80d2bf3", "label_ids": "100148,100159"}}], "rag_answer": "The answer is not provided in the retrieved context.", "generator_model": "llama3.2", "final_k": 20, "candidate_k": 100, "retrieval_source": "prefetch", "prefetch_path": "/home/mwc/Documents/MIOTI/Current/TFM/Data/eval_top10_dedup/prefetch/eval1_baseline/len_500_o50/hyb_fill_dense_then_bm25_ce_r50/000012.json", "query_index": 12}
{"id": "gt_dedup_00013", "question": "What is the basis for attributing the illicit commercial practice to Japan?", "reference": "31992D0169", "gold_snippet": "4) According to the complaint, this illicit commercial practice should be attributed to Japan, because the Harbour Management Fund had been authorized and guided by the Japanse Ministry of Transport (MOT), and because JHTA itself operated under the guidance of MOT and had obtained through MOT's approval its powerful position as intermediary between dock labour trade unions and shipping lines, a position which easily lent itself to abuse if not pr", "ground_truth_answer": "The Harbour Management Fund was authorized and guided by the Japanese Ministry of Transport (MOT), and JHTA operated under MOT's guidance.", "reference_contexts": ["4) According to the complaint, this illicit commercial practice should be attributed to Japan, because the Harbour Management Fund had been authorized and guided by the Japanse Ministry of Transport (MOT), and because JHTA itself operated under the guidance of MOT and had obtained through MOT's approval its powerful position as intermediary between dock labour trade unions and shipping lines, a position which easily lent itself to abuse if not pr"], "retrieved_documents": [{"page_content": "(4) According to the complaint, this illicit commercial practice should be attributed to Japan, because the Harbour Management Fund had been authorized and guided by the Japanse Ministry of Transport (MOT), and because JHTA itself operated under the guidance of MOT and had obtained through MOT's approval its powerful position as intermediary between dock labour trade unions and shipping lines, a position which easily lent itself to abuse if not properly supervised.", "metadata": {"categories_en": "trade, transport, geography, business and competition", "celex_id": "31992D0169", "chunk_strategy": "len_500_o50", "chunk_uid": "cd285ef08f7f0c04cd3edd12f8d61560", "label_ids": "100147,100154,100161,100152"}}, {"page_content": "(15) The Commission has informed the complainant and the Japanese Government of its conclusions and the principal underlying facts and considerations,\nHAS DECIDED AS FOLLOWS:\nSole Article\nThe examination procedure concerning illicit commercial practices within the meaning of Council Regulation (EEC) No 2641/84 consisting of the imposition in Japan of a port charge or fee used for the creation of the Harbour Management Fund is herewith suspended until further notice.", "metadata": {"categories_en": "trade, transport, geography, business and competition", "celex_id": "31992D0169", "chunk_strategy": "len_500_o50", "chunk_uid": "9d2859cfc8d6e17d53b5e03653e5ad90", "label_ids": "100147,100154,100161,100152"}}, {"page_content": "(4) The Commission has informed the complainant and the Japanese Government of its conclusions and the principal underlying facts and,\nHAS DECIDED AS FOLLOWS:\nSole Article\nThe examination procedure concerning illicit commercial practices within the meaning of Regulation (EEC) No 2641/84 consisting to the imposition in Japan of a port charge or fee for the creation of the Harbour Management Fund is herewith terminated.\nDone at Brussels, 9 June 1993.", "metadata": {"categories_en": "trade, transport, geography, business and competition", "celex_id": "31993D0388", "chunk_strategy": "len_500_o50", "chunk_uid": "405d86531ca2eb95a71bd6c06f4e7a38", "label_ids": "100147,100154,100161,100152"}}, {"page_content": "(5) The complaint further alleged that this illicit commercial practice caused injury to Community shipping lines in the order of US$ 4,5 million per year. The uncertainty which the creation of the Fund introduced in trading relations would also pose a threat of injury to EEC - Japan trade in general.\n(6) The complaint concluded by urging the Community to take appropriate action to secure the early elimination of the Harbour Management Fund.\nC. EXAMINATION PROCEDURE", "metadata": {"categories_en": "trade, transport, geography, business and competition", "celex_id": "31992D0169", "chunk_strategy": "len_500_o50", "chunk_uid": "7952b8b7399a070d275646b6c5eec55a", "label_ids": "100147,100154,100161,100152"}}, {"page_content": "(b) ensuring full exercise of the Community's rights with regard to the commercial practices of third countries.\nArticle 2\nDefinitions\n1. For the purposes of this Regulation, illicit commercial practices shall be any international trade practices attributable to third countries which are incompatible with international law or with the generally accepted rules.", "metadata": {"categories_en": "trade, EUROPEAN UNION, business and competition", "celex_id": "31984R2641", "chunk_strategy": "len_500_o50", "chunk_uid": "0f3d02af0e357941ba65d76ea9404d31", "label_ids": "100147,100144,100152"}}, {"page_content": "COMMISSION DECISION of 9 June 1993 terminating the examination procedure concerning illicit commercial practices within the meaning of Council Regulation (EEC) No 2641/84 consisting of the imposition in Japan of a port charge or fee used for the creation of a Harbour Management Fund\n(93/388/EEC)THE COMMISSION OF THE EUROPEAN COMMUNITIES,\nHaving regard to the Treaty establishing the European Economic Community,", "metadata": {"categories_en": "trade, transport, geography, business and competition", "celex_id": "31993D0388", "chunk_strategy": "len_500_o50", "chunk_uid": "b15bc8739c4e80f927e995fcf01b5b9f", "label_ids": "100147,100154,100161,100152"}}, {"page_content": "COMMISSION DECISION of 9 March 1992 suspending the examination procedure concerning illicit commercial practices within the meaning of Council Regulation (EEC) No 2641/84 consisting of the imposition in Japan of a port charge or fee used for the creation of a Harbour Management Fund (92/169/EEC)\nTHE COMMISSION OF THE EUROPEAN COMMUNITIES,\nHaving regard to the Treaty establishing the European Economic Community,", "metadata": {"categories_en": "trade, transport, geography, business and competition", "celex_id": "31992D0169", "chunk_strategy": "len_500_o50", "chunk_uid": "24c69c77c520eb97b21c2012ab71756c", "label_ids": "100147,100154,100161,100152"}}, {"page_content": "2. It shall supply the Commission with the necessary evidence to support its request. Where illicit commercial practices are alleged, proof thereof and of the injury resulting therefrom must be given on the basis of the factors indicated in Article 8.\n3. The Commission shall notify the other Member States of the requests without delay.", "metadata": {"categories_en": "trade, EUROPEAN UNION, business and competition", "celex_id": "31984R2641", "chunk_strategy": "len_500_o50", "chunk_uid": "048fa285f9205b9780c754c91a4a6ada", "label_ids": "100147,100144,100152"}}, {"page_content": "2. The complaint must contain sufficient evidence of the existence of illicit commercial practices and the injury resulting therefrom. Proof of injury must be given on the basis of the factors indicated in Article 8. 3. The complaint shall be submitted, to the Commission, which shall send a copy thereof to the Member States.\n4. The complaint may be withdrawn, in which case the procedure may be terminated unless such termination would not be in the interests of the Community.", "metadata": {"categories_en": "trade, EUROPEAN UNION, business and competition", "celex_id": "31984R2641", "chunk_strategy": "len_500_o50", "chunk_uid": "2ff13efdefdd1706938c17aa56b1988f", "label_ids": "100147,100144,100152"}}, {"page_content": "(125) The investigation has shown that the Community industry's global profitability for all colorformers produced in the same production facilities where black colorformers are produced was positive during the period considered. The negative situation of the Community industry's black colorformer business is therefore attributable to the unfair trading practices by Japanese exporting producers which have had an injurious effect on the Community industry.", "metadata": {"categories_en": "geography, trade, business and competition, industry", "celex_id": "32000R2263", "chunk_strategy": "len_500_o50", "chunk_uid": "36502d3ad40148d1d214329497780ca9", "label_ids": "100161,100147,100152,100160"}}, {"page_content": "As the complaint provided sufficient evidence, within the meaning of Article 6 (1) of Regulation (EEC) No 2641/84, of the existence of an illicit commercial practice attributable to Thailand and of consequent injury, the Commission announced in a notice published in the Official Journal of the European Communities (5) the initiation of an examination procedure concerning piracy of Community sound recordings in Thailand.", "metadata": {"categories_en": "production, technology and research, education and communications, trade, geography", "celex_id": "31996D0040", "chunk_strategy": "len_500_o50", "chunk_uid": "0735a8d0dda2dfaeb8cadfecd2c336fb", "label_ids": "100158,100150,100147,100161"}}, {"page_content": "The complaint provided evidence of the existence of illicit commercial practices and of consequent injury which, following consultations in the Advisory Committee, were considered sufficient to justify the initiation of a procedure.\nThe Commission accordingly announced, in a notice published in the Official Journal of the European Communities (2), the initiation of an 'illicit commercial practice' procedure concerning the unauthorized reproduction of sound recordings in Indonesia.", "metadata": {"categories_en": "education and communications, law, business and competition, geography", "celex_id": "31988D0287", "chunk_strategy": "len_500_o50", "chunk_uid": "6185f8af42ebab71a5ca659fc963f0ab", "label_ids": "100150,100145,100152,100161"}}, {"page_content": "As the complaint provided sufficient evidence, within the meaning of Article 6 (1) of Regulation (EEC) No 2641/84, of the existence of an illicit commercial practice attributable to Turkey and of consequent injury, the Commission announced in a notice published in the Official Journal of the European Communities (5) the initiation of an examination procedure concerning an illicit commercial practice consisting of the imposition by Turkey of a charge known as the 'Mass Housing Fund Levy` in", "metadata": {"categories_en": "business and competition, industry, production, technology and research, trade, geography, EUROPEAN UNION", "celex_id": "31996D0714", "chunk_strategy": "len_500_o50", "chunk_uid": "dd75eb1a06b700b365a4291aa53d1c2f", "label_ids": "100152,100160,100158,100147,100161,100144"}}, {"page_content": "(16) The Commission, having completed the examination procedure provided for under Article 6 of Regulation (EEC) No 2641/84, considers that the application of Section 337 of the United States Tariff Act of 1930 in the case of certain aramid fibre contains sufficient evidence of an illicit commercial practice and resultant threat of injury as defined by the said Regulation to warrant further action.", "metadata": {"categories_en": "business and competition, industry, law, production, technology and research, trade, geography", "celex_id": "31987D0251", "chunk_strategy": "len_500_o50", "chunk_uid": "a781bb3e2b6b782fe24e831699867fc6", "label_ids": "100152,100160,100145,100158,100147,100161"}}, {"page_content": "(1) On 9 December 1985, the Commission received a complaint alleging that the application of Section 337 of the US Tariff Act of 1930 in the matter of 'certain aramid fibres', an action instigated by E.I. Dupont de Nemours (hereinafter Dupont), constituted an illicit commercial practice of the United States Government, and that the resulting order by the US International Trade Commission (USITC) to exclude from the US market unlicensed importations of certain forms of aramid fibre manufactured", "metadata": {"categories_en": "business and competition, industry, law, production, technology and research, trade, geography", "celex_id": "31987D0251", "chunk_strategy": "len_500_o50", "chunk_uid": "320d65ac4010ea006997fd15a16b373a", "label_ids": "100152,100160,100145,100158,100147,100161"}}, {"page_content": "(3) The complaint submitted that the charge for the Harbour Management Fund constituted an illicit commercial practice within the meaning of Article 2 of Council Regulation (EEC) No 2641/84. Arguments presented were that in practice Community shipping lines were forced to make contributions to the Fund, that they had no real influence over the use of the money collected, that the purpose for which the money was actually used (i.e. the construction of inland distribution centres) represented no", "metadata": {"categories_en": "trade, transport, geography, business and competition", "celex_id": "31992D0169", "chunk_strategy": "len_500_o50", "chunk_uid": "2e3198315408a80a9ba3fd95993a6038", "label_ids": "100147,100154,100161,100152"}}, {"page_content": "Whereas:\n(1)\nOn 5 June 1991 the Commission received a complaint, pursuant to Council Regulation (EEC) No 2641/84 of 17 September 1984 on the strengthening of the common commercial policy with regard in particular to protection against illicit commercial practices (2) from the European Office of the International Federation of the Phonographic Industry (IFPI), representing virtually all producers of sound recordings in the Community.\n(2)", "metadata": {"categories_en": "business and competition, production, technology and research, trade, education and communications, geography", "celex_id": "32005D0470", "chunk_strategy": "len_500_o50", "chunk_uid": "7f92624e3c0a43a2d92aa4f40cc07e1a", "label_ids": "100152,100158,100147,100150,100161"}}, {"page_content": "(13) At this stage again, none of the Japanese exporting producers cooperated in the investigation. Consequently, pursuant to Article 18(1) of the basic Regulation, findings were made on the basis of the facts available for Japan as a whole and no verification visits were carried out at the premises of the exporting producers or related importers in accordance with Article 16(1) of the basic Regulation.", "metadata": {"categories_en": "geography, trade, business and competition, industry", "celex_id": "32000R2263", "chunk_strategy": "len_500_o50", "chunk_uid": "21f5651842ee311034d011a48a9b3992", "label_ids": "100161,100147,100152,100160"}}, {"page_content": "(6) The Community producer alleged, inter alia, that the procedure followed by the ITC in the aramid fibre case pursuant to Section 337, and the resulting exclusion order, constituted an illicit commercial practice of the United States Government within the meaning of Article 2 (1) of Regulation (EEC) No 2641/84. Specifically, it was claimed that national treatment provided for by Article III (4) of the GATT had been denied in the ITC procedure in question. It was further alleged that it was", "metadata": {"categories_en": "business and competition, industry, law, production, technology and research, trade, geography", "celex_id": "31987D0251", "chunk_strategy": "len_500_o50", "chunk_uid": "a743c3e38c988dfc5d01b1477ce663a9", "label_ids": "100152,100160,100145,100158,100147,100161"}}, {"page_content": "(a) Allegation of illicit ocmmercial practices\n(4) Smith Kline asserts that by promulgating Law 8 of 1986 amending Article 4 of Law 22 of 1953 on patents, Jordan infringed Article 10 bis (1) and Article 10 ter of the Paris Convention for the protection of industrial property (hereinafter referred to as the Paris Convention) and is guilty of illicit commercial practices within the meaning of Regulation (EEC) No 2641/84.", "metadata": {"categories_en": "production, technology and research, geography, business and competition", "celex_id": "31989D0074", "chunk_strategy": "len_500_o50", "chunk_uid": "4215206fda514ee68b6d9965e2f1ebd1", "label_ids": "100158,100161,100152"}}], "rag_answer": "The basis for attributing the illicit commercial practice to Japan is that the Harbour Management Fund was authorized and guided by the Japanese Ministry of Transport (MOT), and JHTA operated under the guidance of MOT, which had obtained its powerful position as intermediary between dock labour trade unions and shipping lines through MOT's approval.", "generator_model": "llama3.2", "final_k": 20, "candidate_k": 100, "retrieval_source": "prefetch", "prefetch_path": "/home/mwc/Documents/MIOTI/Current/TFM/Data/eval_top10_dedup/prefetch/eval1_baseline/len_500_o50/hyb_fill_dense_then_bm25_ce_r50/000013.json", "query_index": 13}
{"id": "gt_dedup_00014", "question": "What is the time frame for reducing fishing effort in the Community fisheries sector?", "reference": "31995D0577", "gold_snippet": "tailed rules for restructuring the Community fisheries sector over the period 1 January 1994 to 31 December 1996 with a view to achieving a lasting balance between the resources and their exploitation (4); whereas this Decision lays down, for each type of fishery, five-year objectives for the reduction of fishing effort over the period 1992-96 of 20", "ground_truth_answer": "For each type of fishery, five-year objectives for the reduction of fishing effort over the period 1992-96 of 20%.", "reference_contexts": ["tailed rules for restructuring the Community fisheries sector over the period 1 January 1994 to 31 December 1996 with a view to achieving a lasting balance between the resources and their exploitation (4); whereas this Decision lays down, for each type of fishery, five-year objectives for the reduction of fishing effort over the period 1992-96 of 20"], "retrieved_documents": [{"page_content": "Whereas on the basis of this official report the Council adopted Decision 94/15/EC relating to the objectives and detailed rules for restructuring the Community fisheries sector over the period 1 January 1994 to 31 December 1996 with a view to achieving a lasting balance between the resources and their exploitation (4); whereas this Decision lays down, for each type of fishery, five-year objectives for the reduction of fishing effort over the period 1992-96 of 20 %, 15 % and 0 % for demersal,", "metadata": {"categories_en": "production, technology and research, geography, environment, agriculture, forestry and fisheries", "celex_id": "31995D0577", "chunk_strategy": "len_500_o50", "chunk_uid": "21ff2dc7c2f23af6da62baf14fbac5f6", "label_ids": "100158,100161,100155,100156"}}, {"page_content": "1. Where a Member State operates a fishery in Community waters that catches eel, the Member State shall either reduce fishing effort by at least 50 % relative to the average effort deployed from 2004 to 2006 or reduce fishing effort to ensure a reduction of eel catches by at least 50 % relative to the average catch from 2004 to 2006. This reduction is to be achieved gradually, initially by steps of 15 % per year in the first two years over a 5-year period, from 1 July 2009.", "metadata": {"categories_en": "social questions, environment, agriculture, forestry and fisheries", "celex_id": "32007R1100", "chunk_strategy": "len_500_o50", "chunk_uid": "4e9c9d0d41edb2835c4601e69a7c6e8f", "label_ids": "100149,100155,100156"}}, {"page_content": "(14)\nCatches of eels in Community waters seaward of the boundary of eel river basins defined by Member States as constituting natural eel habitats should be reduced gradually by reducing fishing effort or catches by at least 50 % based on the average fishing effort or catches in the years 2004 to 2006.\n(15)", "metadata": {"categories_en": "social questions, environment, agriculture, forestry and fisheries", "celex_id": "32007R1100", "chunk_strategy": "len_500_o50", "chunk_uid": "36a6d9e075f3a09ec99d348a46f099a9", "label_ids": "100149,100155,100156"}}, {"page_content": "(13)\nIn 2006 the Commission initiated a debate concerning a Community strategy for a gradual reduction in fishing mortality in all major fisheries by means of a communication concerning the attainment of the maximum sustainable yield objective by 2015. The Commission has submitted this communication to the RACs for their opinion.\n(14)", "metadata": {"categories_en": "environment, economics, agriculture, forestry and fisheries", "celex_id": "32007R0676", "chunk_strategy": "len_500_o50", "chunk_uid": "96920ac652089b6b3b79c0e56c29c45d", "label_ids": "100155,100146,100156"}}, {"page_content": "HAS ADOPTED THIS DECISION:\nArticle 1\n1. By 31 December 1996 at the latest, and taking into account the objectives fixed in the transitional guidance programmes for 31 December 1991 (5), the fishing effort of the fleet of each Community Member State must have decreased by:\n- 20 % for trawlers bottom trawling for demersal stocks,\n- 15 % for dredgers and beam trawlers targeting benthic stocks,\n- 0 % i.e. no increase for the other segments of fleet.", "metadata": {"categories_en": "production, technology and research, environment, agriculture, forestry and fisheries", "celex_id": "31994D0015", "chunk_strategy": "len_500_o50", "chunk_uid": "6a24a21c04e91fc36a38541e03fa4432", "label_ids": "100158,100155,100156"}}, {"page_content": "HAS ADOPTED THIS DECISION:\nArticle 1\nDecision 97/413/EC is hereby amended as follows:\n1. Paragraphs 1, 2, 3 and 4 of Article 2 shall be replaced by the following: \"1. By 31 December 2002 at the latest, the fishing effort of each Member State shall be reduced, taking the levels defined in Article 7(1) as a starting point, on the basis of the reduction rates in fishing effort which are required to be achieved in relation to the critical stocks set out in Annex I.", "metadata": {"categories_en": "environment, economics, agriculture, forestry and fisheries", "celex_id": "32002D0070", "chunk_strategy": "len_500_o50", "chunk_uid": "2df77ff1b1fa67ff5a60864b8f3c67af", "label_ids": "100155,100146,100156"}}, {"page_content": "(2) In order to make further progress towards achieving a balance between fisheries resources and their exploitation, the fishing effort of the Community fleet should continue to be reduced during the prolongation year.", "metadata": {"categories_en": "environment, economics, agriculture, forestry and fisheries", "celex_id": "32002D0070", "chunk_strategy": "len_500_o50", "chunk_uid": "a08efbad914ec153716e9996efb2149e", "label_ids": "100155,100146,100156"}}, {"page_content": "TITLE I SUBJECT MATTER AND ELIGIBILITY\nArticle 1\nSubject matter\nAn emergency Community measure to assist Member States to achieve additional reductions in fishing effort resulting from recovery plans adopted by the Council is hereby instituted for the period from 2003 to 2006. The measure shall consist of a special incentive to provide Member States with funds to co-finance their additional needs to scrap fishing vessels affected by recovery plans.\nArticle 2\nEligibility", "metadata": {"categories_en": "economics, international relations, agriculture, forestry and fisheries", "celex_id": "32002R2370", "chunk_strategy": "len_500_o50", "chunk_uid": "0905acad48ad24c235d5f59154f380b5", "label_ids": "100146,100143,100156"}}, {"page_content": "(iv)\nsix months, which may be extended by up to six months, in the context of the fishing effort adjustment plans referred to in Article 21(a)(iii);\n(v)\neight months, in the context of the fishing effort adjustment plans referred to in Article 21(a)(iv), and of management plans adopted at national level within the framework of Community conservation measures, and where such plans provide for gradual reductions of fishing effort;\n(vi)", "metadata": {"categories_en": "EUROPEAN UNION, economics, agriculture, forestry and fisheries", "celex_id": "32006R1198", "chunk_strategy": "len_500_o50", "chunk_uid": "7022fcb9e0244c5494f69af230f5eb50", "label_ids": "100144,100146,100156"}}, {"page_content": "(2)\nThe period of application of Council Decision 97/413/EC of 26 June 1997 concerning the objectives and detailed rules for restructuring the Community fisheries sector for the period from 1 January 1997 to 31 December 2001 with a view to achieving a balance on a sustainable basis between resources and their exploitation (4) has been extended and will expire on 31 December 2002.\n(3)\nAppropriate provisions should be laid down for the period commencing on 1 January 2003.\n(4)", "metadata": {"categories_en": "EUROPEAN UNION, economics, agriculture, forestry and fisheries", "celex_id": "32002R2369", "chunk_strategy": "len_500_o50", "chunk_uid": "ad3d4a9af1a85240f7cb1581c63ba826", "label_ids": "100144,100146,100156"}}, {"page_content": "Article 82\nBottom fisheries\n1. Member States shall limit bottom fishing effort or catch in the SPFO area to the average annual levels over the period 1 January 2002 to 31 December 2006 in terms of the number of fishing vessels and other parameters that reflect the level of catch, fishing effort, and fishing capacity.\n2. Member States shall not expand bottom fishing activities into new regions of the SPFO area where such fishing is not currently occurring.", "metadata": {"categories_en": "law, environment, geography, agriculture, forestry and fisheries", "celex_id": "32009R0043", "chunk_strategy": "len_500_o50", "chunk_uid": "73ac2388d2adff0a444501afc15ac021", "label_ids": "100145,100155,100161,100156"}}, {"page_content": "Whereas in light of the most recent scientific advice available regarding the state of resources accessible to Community vessels, there is an urgent need to reduce the fishing mortality of certain stocks;\nWhereas to that end it is necessary to adopt specific guidelines for reducing the fishing effort on the stocks in question, over an appropriate period of time;\nWhereas the fishing effort reduction rates should target depletion risk and overfished stocks;", "metadata": {"categories_en": "environment, agriculture, forestry and fisheries", "celex_id": "31997D0413", "chunk_strategy": "len_500_o50", "chunk_uid": "c4e9756dd3927484cbe05548447d5638", "label_ids": "100155,100156"}}, {"page_content": "(5)\nSince this balance can be achieved only by capacity withdrawal, Community financial support to the fisheries sector through the Financial Instrument for Fisheries Guidance (FIFG) should be concentrated mainly on the scrapping of fishing vessels and public aid for fleet renewal should be permitted only until 31 December 2004.\n(6)", "metadata": {"categories_en": "EUROPEAN UNION, economics, agriculture, forestry and fisheries", "celex_id": "32002R2369", "chunk_strategy": "len_500_o50", "chunk_uid": "71f83444f43691a2412b491b2a27c874", "label_ids": "100144,100146,100156"}}, {"page_content": "Whereas to programme a concerted and balanced reduction in the overall fishing effort of the Community's fleets requires the Community aid scheme to be focused on measures enabling the objectives of the programme to be attained within the deadlines laid down; whereas priority should also be given to investments aimed at bringing the fleet into line with Community rules on hygiene and safety and to investments in the development of selective fisheries which cause minimum damage to the marine", "metadata": {"categories_en": "business and competition, geography, agriculture, forestry and fisheries", "celex_id": "31992D0589", "chunk_strategy": "len_500_o50", "chunk_uid": "c06ea3b873d682dd9888ff7c9ca8aed1", "label_ids": "100152,100161,100156"}}, {"page_content": "(4) In order to ensure that there is no increase in the overall levels of existing fishing effort, it is necessary to establish a new fishing effort management regime in ICES areas V, VI, VII, VIII, IX and X and CECAF divisions 34.1.1, 34.1.2 and 34.2.0. This regime shall limit fishing effort on the basis of the fishing effort deployed in these fisheries during the period 1998 to 2002.", "metadata": {"categories_en": "agriculture, forestry and fisheries", "celex_id": "32003R1954", "chunk_strategy": "len_500_o50", "chunk_uid": "1f78f583d8443ad9d0b8e8d87382697a", "label_ids": "100156"}}, {"page_content": "Article 26\nBottom fisheries\nMember States shall limit bottom fishing effort or catch in the SPRFMO Convention Area to the average annual levels over the period from 1 January 2002 to 31 December 2006 in terms of the number of fishing vessels and other parameters that reflect the level of catch, fishing effort and fishing capacity and to only those parts of the SPRFMO Convention Area where bottom fisheries has occurred during the previous fishing season.\nSection 5\nIATTC convention Area", "metadata": {"categories_en": "law, economics, agriculture, forestry and fisheries, environment", "celex_id": "32010R0053", "chunk_strategy": "len_500_o50", "chunk_uid": "9f8c209fd3d2d3fe921ac62f97a51e0a", "label_ids": "100145,100146,100156,100155"}}, {"page_content": "Whereas it is important that the overall reduction in fishing effort judged to be necessary in order to adapt the Community fleet to available resources should reflect significant reductions in particular segments of that fleet where an imbalance is most apparent; whereas coefficients for the reduction of fishing effort, differentiated according to fishery or group of fisheries, should therefore be applied to the segments of the fleet thus identified;", "metadata": {"categories_en": "business and competition, geography, agriculture, forestry and fisheries", "celex_id": "31992D0589", "chunk_strategy": "len_500_o50", "chunk_uid": "450df90ee8feb8e76fa4a596536ca4d2", "label_ids": "100152,100161,100156"}}, {"page_content": "COUNCIL DECISION of 20 December 1993 relating to the objectives and detailed rules for restructuring the Community fisheries sector over the period 1 January 1994 to 31 December 1996 with a view to achieving a lasting balance between the resources and their exploitation (94/15/EC)\nTHE COUNCIL OF THE EUROPEAN UNION,\nHaving regard to the Treaty establishing the European Community, and in particular Article 43 thereof,\nHaving regard to the proposal from the Commission (1),", "metadata": {"categories_en": "production, technology and research, environment, agriculture, forestry and fisheries", "celex_id": "31994D0015", "chunk_strategy": "len_500_o50", "chunk_uid": "08cd66339ab40c8f15702f2ab58cbc8b", "label_ids": "100158,100155,100156"}}, {"page_content": "COUNCIL DECISION of 26 June 1997 concerning the objectives and detailed rules for restructuring the Community fisheries sector for the period from 1 January 1997 to 31 December 2001 with a view to achieving a balance on a sustainable basis between resources and their exploitation (97/413/EC)\nTHE COUNCIL OF THE EUROPEAN UNION,\nHaving regard to the Treaty establishing the European Community,", "metadata": {"categories_en": "environment, agriculture, forestry and fisheries", "celex_id": "31997D0413", "chunk_strategy": "len_500_o50", "chunk_uid": "a326af6eb22c60937a4a5d1c91c5323c", "label_ids": "100155,100156"}}, {"page_content": "(7)\nThis can be achieved by establishing an appropriate method for gradually reducing the fishing effort in fisheries catching cod to levels that are consistent with the objective, and by fixing the total allowable catches (TACs) for the cod stocks at levels consistent with the fishing effort.\n(8)", "metadata": {"categories_en": "environment, agriculture, forestry and fisheries", "celex_id": "32007R1098", "chunk_strategy": "len_500_o50", "chunk_uid": "f28acfe46c68efdd67f74c57cb58f6ac", "label_ids": "100155,100156"}}], "rag_answer": "The answer is not provided in the retrieved context.", "generator_model": "llama3.2", "final_k": 20, "candidate_k": 100, "retrieval_source": "prefetch", "prefetch_path": "/home/mwc/Documents/MIOTI/Current/TFM/Data/eval_top10_dedup/prefetch/eval1_baseline/len_500_o50/hyb_fill_dense_then_bm25_ce_r50/000014.json", "query_index": 14}
{"id": "gt_dedup_00015", "question": "What was the approximate total amount of Austria's electricity exports in 2005?", "reference": "32008D0585", "gold_snippet": "For 2006, the share of the three largest generators is indicated as 52,2 % in the Commission Staff Working Document of 15 April 2008, SEC(2008) 460 (9). However, Austria has substantial exports and imports of electricity, in 2005 of the order of more than 17 500 GWh exports and over 20 000 GWh imports.", "ground_truth_answer": "Austria exported approximately 17 500 GWh of electricity in 2005.", "reference_contexts": ["For 2006, the share of the three largest generators is indicated as 52,2 % in the Commission Staff Working Document of 15 April 2008, SEC(2008) 460 (9). However, Austria has substantial exports and imports of electricity, in 2005 of the order of more than 17 500 GWh exports and over 20 000 GWh imports."], "retrieved_documents": [{"page_content": "of competition on national markets is the total market share of the biggest three producers’ (8). For 2006, the share of the three largest generators is indicated as 52,2 % in the Commission Staff Working Document of 15 April 2008, SEC(2008) 460 (9). However, Austria has substantial exports and imports of electricity, in 2005 of the order of more than 17 500 GWh exports and over 20 000 GWh imports. It is thus a net importer and imported electricity accounted for approximately a quarter (10) of", "metadata": {"categories_en": "business and competition, trade, energy, geography", "celex_id": "32008D0585", "chunk_strategy": "len_500_o50", "chunk_uid": "6e7d0d66624afe83d9bae4750b170084", "label_ids": "100152,100147,100159,100161"}}, {"page_content": "(321)\nThis is particularly true for Hungary, which is a centrally located country in Europe surrounded by seven countries, four of which belong to the EU. Of the EU Member States, it has interconnectors with Slovakia, Austria and Romania. In 2004 it imported nearly 14 000 GWh and exported 6 300 GWh. From 2005, imports increased to above 15 000 GWh and exports to between 8 000 and 10 000 GWh.\n(322)", "metadata": {"categories_en": "business and competition, economics, energy, social questions, education and communications, geography", "celex_id": "32009D0609", "chunk_strategy": "len_500_o50", "chunk_uid": "ac340aa08bbe302840a93e6fa40ac8f8", "label_ids": "100152,100146,100159,100149,100150,100161"}}, {"page_content": "(b) Electricity imports are minor in the case of supply to large customers and smaller distributors\n(60) Imported electricity plays only a relatively small part in supply to Austrian electricity customers. At the level of energy trading there are substantial dealings in electricity, especially between Germany and Austria(20), but at the level of structured supply to final consumers and small distributors there are only limited exports of electricity from Germany to Austria.", "metadata": {"categories_en": "education and communications, social questions, business and competition, energy", "celex_id": "32004D0271", "chunk_strategy": "len_500_o50", "chunk_uid": "435c0f386788425e036cb8fb6ef6064d", "label_ids": "100150,100149,100152,100159"}}, {"page_content": "(64)\nElectricity is exchanged between Member States. Directive 2003/54/EC completes the creation of an internal market in electricity that was initiated by Directive 96/92/EC. Slovenia’s network is connected in particular with those of Austria and Italy. Slovenia exchanges electricity with its neighbours. For instance, in 2004 Slovenia imported 6 314 GWh of electricity and exported 7 094 GWh (13). The measure therefore has an impact on trade between Member States.\n(65)", "metadata": {"categories_en": "business and competition, economics, energy, environment, geography", "celex_id": "32007D0580", "chunk_strategy": "len_500_o50", "chunk_uid": "764eb37990ce49888ff23543d1ea6e07", "label_ids": "100152,100146,100159,100155,100161"}}, {"page_content": "(115) Verbund's share in gross electricity generation in Austria in 2001 was around [35 to 45 %]*. Its already pre-eminent position on this market prior to the merger would be considerably strengthened by the addition of EnergieAllianz's capability (some [10 to 20 %]* of generation in Austria), bringing the post-merger combined share of the parties to some [55 to 65 %]* of total electricity generation in Austria.", "metadata": {"categories_en": "education and communications, social questions, business and competition, energy", "celex_id": "32004D0271", "chunk_strategy": "len_500_o50", "chunk_uid": "9cc511e642578e927967fb26eec34315", "label_ids": "100150,100149,100152,100159"}}, {"page_content": "(20) In 2001 a total of 62250 GWh of electricity was generated in Austria. Hydroelectric production consisted of 29494 GWh from run-of-river power stations and 12340 GWh from reservoir power stations. In 2001, therefore, 67,2 % of total generation was in hydroelectric power stations. Thermal stations generated 20416 GWh, 32,8 % of the total. The following table shows the breakdown of electricity generation between the main undertakings operating in this sector:\nTable 1", "metadata": {"categories_en": "education and communications, social questions, business and competition, energy", "celex_id": "32004D0271", "chunk_strategy": "len_500_o50", "chunk_uid": "41a2ce1eb7c3eea85ed9824bfb5c7ee3", "label_ids": "100150,100149,100152,100159"}}, {"page_content": "(262)\nIn 2005 Poland exported 14,3 TWh of electricity and imported 3,1 TWh, with domestic consumption levels of 144,8 TWh; (64) however, most trade taking place with the Czech Republic, Germany and Slovakia (interconnectors with Ukraine and Belarus have very small capacity or are out of order).\n(263)", "metadata": {"categories_en": "finance, energy, social questions, trade, geography", "celex_id": "32009D0287", "chunk_strategy": "len_500_o50", "chunk_uid": "db36538ad8d35b85f2e2de8c56d33bcf", "label_ids": "100148,100159,100149,100147,100161"}}, {"page_content": "(4) Austria is implementing Directive 96/92/EC by the Elektrizitätswirtschafts- und Organisationsgesetz (hereinafter \"ElWOG\"), which was published on 18 August 1998 and entered into force on 19 February 1999, as well as complementary laws for the nine Länder. The ElWOG provides for a market opening starting with approximately 27 % in February 1999 and increasing to approximately 50 % in 2003. Accordingly, in the first phase final customers with more than 40 GWh yearly consumption as well as", "metadata": {"categories_en": "geography, EUROPEAN UNION, energy", "celex_id": "31999D0795", "chunk_strategy": "len_500_o50", "chunk_uid": "2d2db1d85af8ee03c4814fc45cdf9a01", "label_ids": "100161,100144,100159"}}, {"page_content": "in their answer of 9 October 2008, 25,6 TWh were exported in 2007 and 9,5 TWh imported during the same year. The Czech Republic is thus a net exporter of electricity with net exports amounting to 16,1 TWh, equivalent to almost 20 % (4) of the total, net electricity generation (81,4 TWh). A further argument submitted with respect to the existence of a wider geographic market is a development towards price convergence between the national market within the Czech Republic and the one in Germany as", "metadata": {"categories_en": "business and competition, trade, energy, geography", "celex_id": "32009D0047", "chunk_strategy": "len_500_o50", "chunk_uid": "96499e379b48ebb34073630fd06fd579", "label_ids": "100152,100147,100159,100161"}}, {"page_content": "(90) First, the sale of energy on the trading markets entails significant costs and risks. When exporting energy for trading purposes, Austrian electricity suppliers must factor in the transport costs, which consist of through-transmission charges, network costs and the CBT payable on electricity leaving Austria - currently EUR 0,5 per MWh. Selling electricity on the trading markets in, for example, Germany also involves administrative and other transaction costs (e.g. charges for trading on", "metadata": {"categories_en": "education and communications, social questions, business and competition, energy", "celex_id": "32004D0271", "chunk_strategy": "len_500_o50", "chunk_uid": "76b5486cffbdf41b1f7a66f06c9b8af4", "label_ids": "100150,100149,100152,100159"}}, {"page_content": "The level of electricity imports into the Czech Republic amounts to slightly more than 11 % of its total demand (17), which, while higher than the share of electricity imports into Poland, reaches less than half of the share in the case of Austria (18) (19). Also in the Swedish and Finnish cases, the high levels of concentration of the three largest producers are ‘offset’ by the ‘competitive pressure on the […] market deriving from the potential to import electricity from outside […]’ (20). It", "metadata": {"categories_en": "business and competition, trade, energy, geography", "celex_id": "32009D0047", "chunk_strategy": "len_500_o50", "chunk_uid": "e0a922fb28635a13cd51c43b2cb8c175", "label_ids": "100152,100147,100159,100161"}}, {"page_content": "(62) The same applies to small distributors. In the course of its investigations the Commission asked Austrian distributors to state their electricity suppliers. Out of 75 private, municipal or local electricity utilities only one customer, a purchasing association of smaller distributors, said it had been supplied by a foreign supplier. The total electricity supplied to the 75 distributors in 2002 was about 3500 GWh. The amount supplied by the foreign supplier to the purchasing association of", "metadata": {"categories_en": "education and communications, social questions, business and competition, energy", "celex_id": "32004D0271", "chunk_strategy": "len_500_o50", "chunk_uid": "e06c9ae7965446934986f2b460ec78c9", "label_ids": "100150,100149,100152,100159"}}, {"page_content": "(58) The breakdown of market shares between the parties and their competitors on the electricity supply markets in Austria is fundamentally different from that in the neighbouring countries or in the EEA as a whole, and this in itself indicates that in geographic terms the relevant markets are confined to Austria(19). It will be enough here to point out that none of the main electricity suppliers at EEA level, such as EdF, E.On, RWE or Enel, has a market share of 5 % or more of the market in", "metadata": {"categories_en": "education and communications, social questions, business and competition, energy", "celex_id": "32004D0271", "chunk_strategy": "len_500_o50", "chunk_uid": "e6e6a8054ced8e2868dd0cd84cb1e1d8", "label_ids": "100150,100149,100152,100159"}}, {"page_content": "(61) In 2002 total sales to large customers in Austria amounted to 25,6 TWh. The Commission's enquiries have established that deliveries to large customers by German suppliers (EnBW and E.On)(21) amounted to less than 1 TWh. This is less than 3 % of total sales to large customers in Austria. The Swiss supplier Atel did not supply any large customers. The Commission's market investigation did not give any indication that this situation might change decisively in the near future.", "metadata": {"categories_en": "education and communications, social questions, business and competition, energy", "celex_id": "32004D0271", "chunk_strategy": "len_500_o50", "chunk_uid": "3d53821ead057f44b319d92179685dc2", "label_ids": "100150,100149,100152,100159"}}, {"page_content": "(65) The small part played on the market by foreign suppliers cannot be attributed to technical barriers to access. The parties rightly point out that there are no bottlenecks in the interconnectors between Germany and Austria or between Switzerland and Austria. The interconnectors have a capacity equal to some 25 % of Austrian electricity consumption(24). In purely technical terms, therefore, substantial imports would be possible.", "metadata": {"categories_en": "education and communications, social questions, business and competition, energy", "celex_id": "32004D0271", "chunk_strategy": "len_500_o50", "chunk_uid": "71760f2561d0e5d533c37bc1dfca4f97", "label_ids": "100150,100149,100152,100159"}}, {"page_content": "(17) The Electricity Market Directive was initially transposed into Austrian law by the Electricity Industry and Organisation Act (Elektrizitätswirtschafts- und Organisationsgesetz). From 19 February 1999 all final consumers with an annual electricity consumption of at least 40 GWh, or from 1 February 2000 20 GWh, became entitled to access to the grid, and could freely choose their electricity supplier. From 19 February 1999 operators of distribution networks who had a transmission network at", "metadata": {"categories_en": "education and communications, social questions, business and competition, energy", "celex_id": "32004D0271", "chunk_strategy": "len_500_o50", "chunk_uid": "d1c5c9f3750315c56473d636a9f5d2c7", "label_ids": "100150,100149,100152,100159"}}, {"page_content": "accounted for approximately a quarter (10) of its total needs (11), in particular for base load power. There is therefore a certain degree of constraint on the pricing behaviour of the leading Austrian producers through imports of electricity from outside the Austrian territory and as a result investment in the electricity sector inside the Austrian territory takes into account other producers in the surrounding countries, in particular in Germany. These factors should therefore be taken as an", "metadata": {"categories_en": "business and competition, trade, energy, geography", "celex_id": "32008D0585", "chunk_strategy": "len_500_o50", "chunk_uid": "e06d879616441696d8c1ee90a1914701", "label_ids": "100152,100147,100159,100161"}}, {"page_content": "Report (4), in ‘2006 system congestion of structural character … was existent at the borders with Germany, the Czech Republic and Slovakia. …’ In 2006 9,74 % of the total generation of electricity was exported from Poland, whereas imports to Poland in the same year amounted to 2,94 % of total generation (net exports thus accounted for 6,8 % of total generation in 2006). The 2007 Activity Report concludes that the ‘most important issue related to electricity exchange is limited transfer capacity", "metadata": {"categories_en": "business and competition, trade, energy, geography", "celex_id": "32008D0741", "chunk_strategy": "len_500_o50", "chunk_uid": "b572a1b609fc9f2fc026689146ac7eaf", "label_ids": "100152,100147,100159,100161"}}, {"page_content": "(5) Verbund generates and transmits electricity and supplies it to industrial customers and to electricity distributors; it also trades in electricity. Verbund is the biggest electricity generator in Austria, and operates the high-voltage grid throughout the country with the exception of Vorarlberg and the Tyrol. Verbund deals with large customers through a 55 % subsidiary, Verbund - Austrian Power Vertriebs GmbH (APC); the bulk of the other shares in APC, which do not carry controlling rights,", "metadata": {"categories_en": "education and communications, social questions, business and competition, energy", "celex_id": "32004D0271", "chunk_strategy": "len_500_o50", "chunk_uid": "8197504cf360b61e509ab5278b38a393", "label_ids": "100150,100149,100152,100159"}}, {"page_content": "a market share of 5 % or more of the market in supply to small customers, large customers or small distributors in Austria. The same applies to the main competitors on the German electricity markets, E.On, RWE, EnBW and Vattenfall. And no Austrian electricity supplier has a share of 5 % or more of any electricity supply market in a neighbouring Member State or at EEA level.", "metadata": {"categories_en": "education and communications, social questions, business and competition, energy", "celex_id": "32004D0271", "chunk_strategy": "len_500_o50", "chunk_uid": "4f93f59e17c9ec88ecdf56e7ed88fb90", "label_ids": "100150,100149,100152,100159"}}], "rag_answer": "The answer is not provided in the retrieved context.", "generator_model": "llama3.2", "final_k": 20, "candidate_k": 100, "retrieval_source": "prefetch", "prefetch_path": "/home/mwc/Documents/MIOTI/Current/TFM/Data/eval_top10_dedup/prefetch/eval1_baseline/len_500_o50/hyb_fill_dense_then_bm25_ce_r50/000015.json", "query_index": 15}
{"id": "gt_dedup_00016", "question": "What is a condition for international bodies or non-governmental organizations to receive contributions from the EU?", "reference": "31988R2508", "gold_snippet": "Contributions shall be granted to international bodies or non-governmental organizations only if such bodies or organizations undertake to comply with the implementing conditions notified to them by the Commission.\nArticle 6\nThe Commission may authorize an agent to conclude co-financing agreements on its behalf.\nArticle 7\n1.", "ground_truth_answer": "They must comply with implementing conditions notified by the Commission.", "reference_contexts": ["Contributions shall be granted to international bodies or non-governmental organizations only if such bodies or organizations undertake to comply with the implementing conditions notified to them by the Commission.\nArticle 6\nThe Commission may authorize an agent to conclude co-financing agreements on its behalf.\nArticle 7\n1."], "retrieved_documents": [{"page_content": "2. Contributions shall be granted to international bodies or non-governmental organizations only if such bodies or organizations undertake to comply with the implementing conditions notified to them by the Commission.\nArticle 6\nThe Commission may authorize an agent to conclude co-financing agreements on its behalf.\nArticle 7\n1. The European Parliament and the Council shall be informed of decisions taken in accordance with Articles 3 and 4 as soon as they are adopted.", "metadata": {"categories_en": "finance, agri-foodstuffs, international relations, trade, international organisations", "celex_id": "31988R2508", "chunk_strategy": "len_500_o50", "chunk_uid": "d660efa7b28312ee36f548667adaeada", "label_ids": "100148,100157,100143,100147,100162"}}, {"page_content": "2. In the case of a participating international organisation, other than an international European interest organisation, or a legal entity established in a third country other than an associated country or international cooperation partner country, a Community financial contribution may be granted provided that at least one of the following conditions is satisfied:\n(a)\nprovision is made to that effect in the specific programmes or in the relevant work programme;\n(b)", "metadata": {"categories_en": "education and communications, production, technology and research, business and competition, EUROPEAN UNION", "celex_id": "32006R1906", "chunk_strategy": "len_500_o50", "chunk_uid": "a767a79c34fba53a41f9bb875b3761ae", "label_ids": "100150,100158,100152,100144"}}, {"page_content": "2. The co-financing operations may be implemented at the request of international bodies or non-governmental organizations to help cover, when such operations seem most appropriate, the food requirements of sections of the population which are unable to make up food shortages from their own means or resources.\n3. The non-governmental organizations must meet the following criteria:\n(a) they must have a status which is characteristic of this type of organization;", "metadata": {"categories_en": "finance, agri-foodstuffs, international relations, trade, international organisations", "celex_id": "31988R2508", "chunk_strategy": "len_500_o50", "chunk_uid": "5568162fd5bc34a9cbdf4975c4d4a12b", "label_ids": "100148,100157,100143,100147,100162"}}, {"page_content": "The Council, acting by a qualified majority on a proposal from the Commission, may amend that list.\n2. Non-profit-making non-governmental organizations (NGOs) eligible for direct or indirect Community financing for the implementation of operations under this Regulation must meet the following criteria:\n(a) if they are European non-governmental organizations, they must be autonomous organizations in a Member State of the European Community under the laws in force in that Member State;", "metadata": {"categories_en": "trade, economics, international relations", "celex_id": "31996R1292", "chunk_strategy": "len_500_o50", "chunk_uid": "a79c9d2f795d6d4983aa8da4f4997263", "label_ids": "100147,100146,100143"}}, {"page_content": "2. The amount of the Community contribution towards the purchase and transport of food products or seeds shall be a minimum of 25 % and a maximum of 75 % of the total cost of the operation.\nArticle 3\n1. Decisions granting, to international bodies or non-governmental organizations, a contribution towards the purchase of food products or seeds shall be taken by the Commission.", "metadata": {"categories_en": "finance, agri-foodstuffs, international relations, trade, international organisations", "celex_id": "31988R2508", "chunk_strategy": "len_500_o50", "chunk_uid": "6eac1249499527e114fd3e0867195101", "label_ids": "100148,100157,100143,100147,100162"}}, {"page_content": "Article 6\nHumanitarian aid operations financed by the Community may be implemented either at the request of international or non-governmental agencies and organizations from a Member State or a recipient third country or on the initiative of the Commission.\nArticle 7\n1. Non-governmental organizations eligible for Community financing for the implementation of operations under this Regulation must meet the following criteria:", "metadata": {"categories_en": "economics, international relations", "celex_id": "31996R1257", "chunk_strategy": "len_500_o50", "chunk_uid": "d3cef6ee756573394bd49d791428ba13", "label_ids": "100146,100143"}}, {"page_content": "2. Any legal entity established in a third country may receive a Community financial contribution, if provision is made for this under an R& TD activity or if it is essential for carrying out the indirect action.\nArticle 7\nParticipation by international organisations\nAny international organisation other than the international European interest organisations referred to in Article 4(5) may take part in R& TD activities, subject to the conditions set out in Article 6.\nArticle 8", "metadata": {"categories_en": "education and communications, production, technology and research, business and competition, EUROPEAN UNION", "celex_id": "32002R2322", "chunk_strategy": "len_500_o50", "chunk_uid": "8208137e7d01c444e430997bf54b7842", "label_ids": "100150,100158,100152,100144"}}, {"page_content": "(g)\ncontributions from international bodies or institutions;\n(h)\nloans and contributions from the European Investment Bank, including the possibility to use the Risk Sharing Finance Facility, pursuant to the eligibility criteria and the selection procedure.\nContributions may include contributions in kind.\n3. The modalities for accessing funding from the EIT shall be defined in the financial rules of the EIT referred to in Article 21(1).", "metadata": {"categories_en": "education and communications, production, technology and research, EUROPEAN UNION", "celex_id": "32008R0294", "chunk_strategy": "len_500_o50", "chunk_uid": "baf9533658083b8936530c859bc8abd0", "label_ids": "100150,100158,100144"}}, {"page_content": "by the Member States, international bodies and non-governmental organizations respectively.", "metadata": {"categories_en": "agri-foodstuffs, EUROPEAN UNION, economics, international relations", "celex_id": "31988R2507", "chunk_strategy": "len_500_o50", "chunk_uid": "1bb48d011586dd8eecdcf8d0df2ef967", "label_ids": "100157,100144,100146,100143"}}, {"page_content": "Whereas a list should be drawn up of the countries and bodies eligible for Community aid operations;\nWhereas to that end provision should also be made for Community aid to be made available to international, regional and non-governmental organizations; whereas such organizations must satisfy a number of conditions guaranteeing the success of food-aid operations;", "metadata": {"categories_en": "trade, economics, international relations", "celex_id": "31996R1292", "chunk_strategy": "len_500_o50", "chunk_uid": "7a26f15b1a93f2e4e71f31ca8f7d5d11", "label_ids": "100147,100146,100143"}}, {"page_content": "Article 2\nCommunity support for storage programmes and early warning systems may be granted, on request, for operations on behalf of developing countries eligible for food aid from the Community and from its Member States, to international organizations, and to non-governmental organizations which meet the following criteria:\n(a) their legal status is characteristic of this type of organization;", "metadata": {"categories_en": "agri-foodstuffs, EUROPEAN UNION, economics, international relations", "celex_id": "31988R2507", "chunk_strategy": "len_500_o50", "chunk_uid": "59af39f7a86e4843be4669950dbf3ffe", "label_ids": "100157,100144,100146,100143"}}, {"page_content": "- granting a contribution to international or regional organizations or non-governmental organizations for the financing of operations in support of food security,\n- granting aid for a storage programme or early-warning system;\nshall be adopted by the Commission in accordance with the procedure laid down in Article 27, in compliance with the limits set in Article 25.\nArticle 24", "metadata": {"categories_en": "trade, economics, international relations", "celex_id": "31996R1292", "chunk_strategy": "len_500_o50", "chunk_uid": "a7c888c0e1962c6782b9388da549a30b", "label_ids": "100147,100146,100143"}}, {"page_content": "Article 2\n1. The countries and organizations eligible to receive the aid referred to in Article 1 are listed in Annex III.\n2. The aid may also be placed at the disposal of non-governmental organizations which must inter alia:\n(a) have their headquarters in a Member State of the Community or, exceptionally, in a third country;\n(b) have a statute that is characteristic of an organization of this type;\n(c) have shown that they have the capacity to carry out food-aid operations successfully;", "metadata": {"categories_en": "economics, international relations", "celex_id": "31986R0232", "chunk_strategy": "len_500_o50", "chunk_uid": "30cd42d8243eafe26525b95d7a430b49", "label_ids": "100146,100143"}}, {"page_content": "The conditions for the grant and payment of the Community contribution referred to in Article 13(4) of Regulation (EC) No 3/2008 shall be governed by an assistance agreement concluded between the Community and the international organisation concerned.\n2. Directive 2004/18/EC shall apply where measures are implemented by the international organisations referred to in Article 6(2) of Regulation (EC) No 3/2008.\nArticle 8\nSubmission of programmes", "metadata": {"categories_en": "business and competition, international relations, trade, agriculture, forestry and fisheries, EUROPEAN UNION", "celex_id": "32008R0501", "chunk_strategy": "len_500_o50", "chunk_uid": "0725642a0154d27f3f09d6de2ac63d27", "label_ids": "100152,100143,100147,100156,100144"}}, {"page_content": "Whereas the Treaty has not provided the necessary powers, other than those of Article 235,\nHAS ADOPTED THIS REGULATION:\nArticle 1\n1. The Community may contribute to the financing of purchases of food products listed in the Commission Decision drawing up annually the list of products to be supplied as food aid or of purchases of seeds carried out by international bodies or non-governmental organizations to benefit needy sections of the population of developing countries.", "metadata": {"categories_en": "finance, agri-foodstuffs, international relations, trade, international organisations", "celex_id": "31988R2508", "chunk_strategy": "len_500_o50", "chunk_uid": "3b3f7575586bdbee9d5cbbbd805928a1", "label_ids": "100148,100157,100143,100147,100162"}}, {"page_content": "4. Non-governmental organisations eligible for financial agreements with a view to the implementation of interventions under this Regulation shall meet the following criteria:\n(a) be non-profit-making autonomous organisations;\n(b) have their main headquarters in a Community Member State or in the third country in receipt of Community aid.\nIn exceptional cases, their headquarters may be located in another third country.", "metadata": {"categories_en": "economics, international relations, politics, international organisations, EUROPEAN UNION", "celex_id": "32001R0381", "chunk_strategy": "len_500_o50", "chunk_uid": "861ef21c9ade2ca0173bba6ea79c406c", "label_ids": "100146,100143,100142,100162,100144"}}, {"page_content": "Article 3\nRegional and international organizations, public and semi-public bodies, organizations providing support to businesses, private operators, cooperatives, mutual societies, associations, foundations and non-governmental organizations shall be eligible to participate in the implementation of projects, programmes and cooperation schemes financed under this Regulation.\nArticle 4", "metadata": {"categories_en": "law, economics, international relations, trade, geography", "celex_id": "31996R1628", "chunk_strategy": "len_500_o50", "chunk_uid": "236ec61eddfaa6ab54ae8fb86b6836f0", "label_ids": "100145,100146,100143,100147,100161"}}, {"page_content": "3. Unless otherwise provided in the relevant specific programme decision, participation by international organizations and legal entities from third countries under this Article shall not benefit from Community financing under the framework programme.\nHowever, in duly specified cases, the participation of international research organizations situated in Europe may receive financial support from the Community.", "metadata": {"categories_en": "production, technology and research, EUROPEAN UNION, international relations", "celex_id": "31994D0763", "chunk_strategy": "len_500_o50", "chunk_uid": "4e403a7b9f3aa6f0aa4474b36b66a185", "label_ids": "100158,100144,100143"}}, {"page_content": "Article 3\nCooperation partners eligible for financial assistance under this Regulation shall be national, provincial and local authorities and public bodies, non-governmental organizations and community-based organizations, regional and international organizations, institutions and public or private operators.\nArticle 4", "metadata": {"categories_en": "geography, international relations", "celex_id": "31996R2259", "chunk_strategy": "len_500_o50", "chunk_uid": "1a8d11aca35bf974ae0da487ace5ffa3", "label_ids": "100161,100143"}}, {"page_content": "- they must be constituted as autonomous non-profit-making organisations in a Member State in accordance with the laws of that State,\n- they must have their headquarters in a Member State and the headquarters must be the main centre for decisions relating to the co-financed operations,\n- the majority of their funding must originate in Europe.\n2. In determining whether an NGO is eligible for co-financing, account shall also be taken of:", "metadata": {"categories_en": "finance, international organisations, economics, international relations", "celex_id": "31998R1658", "chunk_strategy": "len_500_o50", "chunk_uid": "52ddbdf2e2d454bf8f22328de16fb617", "label_ids": "100148,100162,100146,100143"}}], "rag_answer": "The condition for international bodies or non-governmental organizations to receive contributions from the EU is that they must meet certain criteria, which may include:\n\n* Having a status characteristic of this type of organization (Document 3, Article 3; Document 14, Article 8)\n* Being autonomous organizations in a Member State under the laws in force in that Member State (Document 4, Article 6(a))\n* Having their headquarters in a Member State or, exceptionally, in a third country (Document 13, Article 2(a); Document 16, Article 4(a))\n* Meeting specific criteria for non-profit-making organizations (Document 16, Article 4(b))\n\nAdditionally, international bodies or non-governmental organizations must also comply with the implementing conditions notified to them by the Commission.", "generator_model": "llama3.2", "final_k": 20, "candidate_k": 100, "retrieval_source": "prefetch", "prefetch_path": "/home/mwc/Documents/MIOTI/Current/TFM/Data/eval_top10_dedup/prefetch/eval1_baseline/len_500_o50/hyb_fill_dense_then_bm25_ce_r50/000016.json", "query_index": 16}
{"id": "gt_dedup_00017", "question": "What is the specific type of product that requires consent for its placing on the market in France?", "reference": "31997D0392", "gold_snippet": "Article 1\n1. Without prejudice to other Community legislation, in particular Council Directives 69/208/EEC (6) and 70/457/EEC (7), and subject to paragraph 2 of this Article, consent shall be given by the competent authority of France to the placing on the market of the following product, notified by Plant Genetic Systems (ref. C/F/95/05/01/A):\nseeds of hybrid swede-rape (Brassica napus L", "ground_truth_answer": "Seeds of hybrid swede-rape (Brassica napus L)", "reference_contexts": ["Article 1\n1. Without prejudice to other Community legislation, in particular Council Directives 69/208/EEC (6) and 70/457/EEC (7), and subject to paragraph 2 of this Article, consent shall be given by the competent authority of France to the placing on the market of the following product, notified by Plant Genetic Systems (ref. C/F/95/05/01/A):\nseeds of hybrid swede-rape (Brassica napus L"], "retrieved_documents": [{"page_content": "Whereas:\n(1)\nBy Commission Decision 98/294/EC of 22 April 1998 concerning the placing on the market of genetically modified maize (Zea mays L. line MON810), pursuant to Council Directive 90/220/EEC (2) it was decided that consent was to be given for the placing on the market of that product.\n(2)\nOn 3 August 1998 the French authorities granted such consent. The consent covers all uses of the product, namely import, processing into food and feed products and cultivation.\n(3)", "metadata": {"categories_en": "agri-foodstuffs, production, technology and research, trade, social questions, geography", "celex_id": "32008D0495", "chunk_strategy": "len_500_o50", "chunk_uid": "612594068dcfa8db5b467f1595dd615a", "label_ids": "100157,100158,100147,100149,100161"}}, {"page_content": "Whereas:\n(1)\nBy Commission Decision 98/293/EC of 22 April 1998 concerning the placing on the market of genetically modified maize (Zea mays L. line T25), pursuant to Council Directive 90/220/EEC (2) it was decided that consent was to be given for the placing on the market of that product.\n(2)\nOn 3 August 1998 the French authorities granted such consent. The consent covers all uses of the product, namely import, processing into food and feed products and cultivation.\n(3)", "metadata": {"categories_en": "agri-foodstuffs, production, technology and research, trade, social questions, geography", "celex_id": "32008D0470", "chunk_strategy": "len_500_o50", "chunk_uid": "fd02082e8990ced0a669f455f54f18de", "label_ids": "100157,100158,100147,100149,100161"}}, {"page_content": "(4)\nCommission Decision 98/294/EC of 22 April 1998 concerning the placing on the market of genetically modified maize (Zea mays L. line MON 810), decided pursuant to Council Directive 90/220/EEC (4) that consent shall be given for the placing on the market of that product. On 3 August 1998 the French authorities effectively allowed the placing on the market of that product.\n(5)", "metadata": {"categories_en": "business and competition, agri-foodstuffs, production, technology and research, agriculture, forestry and fisheries, geography", "celex_id": "32006D0010", "chunk_strategy": "len_500_o50", "chunk_uid": "2bbe9f739651913cb8122abd383c3842", "label_ids": "100152,100157,100158,100156,100161"}}, {"page_content": "(4)\nCommission Decision 98/294/EC of 22 April 1998 concerning the placing on the market of genetically modified maize (Zea mays L. line MON 810) decided pursuant to Council Directive 90/220/EEC (5) that consent should be given for the placing on the market of that product. On 3 August 1998, the French authorities effectively allowed the placing on the market of that product.\n(5)", "metadata": {"categories_en": "business and competition, agri-foodstuffs, production, technology and research, agriculture, forestry and fisheries, geography", "celex_id": "32006D0335", "chunk_strategy": "len_500_o50", "chunk_uid": "53897de61edc6c8acff02462d35ff91f", "label_ids": "100152,100157,100158,100156,100161"}}, {"page_content": "HAS ADOPTED THIS DECISION:\nArticle 1\n1. Without prejudice to other Community legislation, in particular Council Directives 69/208/EEC (6) and 70/457/EEC (7), and subject to paragraph 2 of this Article, consent shall be given by the competent authority of France to the placing on the market of the following product, notified by Plant Genetic Systems (ref. C/F/95/05/01/A):\nseeds of hybrid swede-rape (Brassica napus L. oleifera Metzg.) derived from crosses using:", "metadata": {"categories_en": "agri-foodstuffs, environment, production, technology and research, social questions, trade", "celex_id": "31997D0392", "chunk_strategy": "len_500_o50", "chunk_uid": "5b519560cf694bda27cf558b034321c7", "label_ids": "100157,100155,100158,100149,100147"}}, {"page_content": "HAS ADOPTED THIS DECISION:\nArticle 1\n1. Without prejudice to other Community legislation, in particular Council Directives 66/402/EEC (6) and 70/457/EEC (7) and Regulation (EC) No 258/97 of the European Parliament and the Council (8), and subject to paragraph 2 of this Article, consent shall be given by the competent authorities of France to the placing on the market of the following product, notified by AgrEvo France (Ref. C/F/95/12/07):", "metadata": {"categories_en": "agri-foodstuffs, production, technology and research, trade, social questions, geography", "celex_id": "31998D0293", "chunk_strategy": "len_500_o50", "chunk_uid": "7df680bc7a836b7ae47ecb4512685908", "label_ids": "100157,100158,100147,100149,100161"}}, {"page_content": "HAS ADOPTED THIS DECISION:\nArticle 1\n1. Without prejudice to other Community legislation, in particular Council Directives 66/402/EEC (4) and 70/457/EEC (5) and Regulation (EC) No 258/97 of the European Parliament and the Council (6), and subject to paragraph 2 of this Article, consent shall be given by the competent authorities of France to the placing on the market of the following product, notified by Monsanto Europe SA (Ref. C/F/95/12-02):", "metadata": {"categories_en": "agri-foodstuffs, production, technology and research, trade, social questions, geography", "celex_id": "31998D0294", "chunk_strategy": "len_500_o50", "chunk_uid": "5e984f1261cbe7063310868f115d0298", "label_ids": "100157,100158,100147,100149,100161"}}, {"page_content": "HAS ADOPTED THIS DECISION:\nArticle 1\nA favourable decision is hereby taken, according to which, consent shall be given under Article 13 of Directive 90/220/EEC by the authorities of France for the placing on the market of the following product, notified by the Société nationale d'exploitation industrielle des tabacs et allumettes (Seita) (Notification number: C/F/93/08-02):", "metadata": {"categories_en": "trade, geography, agri-foodstuffs, agriculture, forestry and fisheries", "celex_id": "31994D0385", "chunk_strategy": "len_500_o50", "chunk_uid": "3a505512e4fad3b00f859b67baa83882", "label_ids": "100147,100161,100157,100156"}}, {"page_content": "Whereas:\n(1)\nPursuant to Directive 2001/18/EC, the placing on the market of a product containing or consisting of a genetically modified organism or a combination of genetically modified organisms is subject to written consent being granted by the competent authority of the Member State that received the notification for the placing on the market of that product, in accordance with the procedure laid down in that Directive.\n(2)", "metadata": {"categories_en": "trade, production, technology and research, geography, agriculture, forestry and fisheries", "celex_id": "32009D0244", "chunk_strategy": "len_500_o50", "chunk_uid": "c180cadcf0810bb9315627c466ff76c5", "label_ids": "100147,100158,100161,100156"}}, {"page_content": "Whereas:\n(1)\nPursuant to Directive 2001/18/EC, the placing on the market of a product containing or consisting of a genetically modified organism or a combination of genetically modified organisms is subject to written consent being granted by the competent authority concerned, in accordance with the procedure laid down in that Directive.\n(2)", "metadata": {"categories_en": "production, technology and research, trade, agri-foodstuffs", "celex_id": "32005D0465", "chunk_strategy": "len_500_o50", "chunk_uid": "a519dff4ae19ca322695da870f2a6e8e", "label_ids": "100158,100147,100157"}}, {"page_content": "Whereas:\n(1)\nPursuant to Directive 2001/18/EC, the placing on the market of a product containing or consisting of a genetically modified organism or a combination of genetically modified organisms is subject to written consent being granted by the competent authority concerned, in accordance with the procedure laid down in that Directive.\n(2)", "metadata": {"categories_en": "production, technology and research, trade, agri-foodstuffs, agriculture, forestry and fisheries", "celex_id": "32007D0232", "chunk_strategy": "len_500_o50", "chunk_uid": "11bddfb8f8280e48f9e15d11424f728e", "label_ids": "100158,100147,100157,100156"}}, {"page_content": "HAS ADOPTED THIS DECISION:\nArticle 1\n1. Without prejudice to other Community legislation and subject to paragraphs 2 and 3, the French authorities shall give consent to the placing on the market of the following product, notified by Ciba-Geigy Limited (Ref. C/F/94/11-03), in accordance with Article 13 of Directive 90/220/EEC.\nThe product consists of inbred lines and hybrids derived from a maize (Zea mays L.) line (CG 00256-176) which has been transformed using plasmids containing:", "metadata": {"categories_en": "agri-foodstuffs, environment, production, technology and research, trade, agriculture, forestry and fisheries", "celex_id": "31997D0098", "chunk_strategy": "len_500_o50", "chunk_uid": "e5c406a33c652e67f206ff741147e82e", "label_ids": "100157,100155,100158,100147,100156"}}, {"page_content": "Whereas:\n(1)\nPursuant to Directive 2001/18/EC, the placing on the market of a product containing or consisting of a genetically modified organism or a combination of genetically modified organisms is subject to written consent being granted by the competent authority of the Member State that received the notification for the placing on the market of that product in accordance with the procedure laid down in that Directive.\n(2)", "metadata": {"categories_en": "agri-foodstuffs, environment, production, technology and research, social questions, trade", "celex_id": "32004D0643", "chunk_strategy": "len_500_o50", "chunk_uid": "098ea29dd68f01aa608200c82cfd2f60", "label_ids": "100157,100155,100158,100149,100147"}}, {"page_content": "Whereas:\n(1)\nPursuant to Directive 2001/18/EC, the placing on the market of a product containing or consisting of a genetically modified organism or a combination of genetically modified organisms is subject to written consent being granted by the competent authority of a Member State, in accordance with the procedure laid down in that Directive.\n(2)", "metadata": {"categories_en": "agri-foodstuffs, production, technology and research, trade, social questions, agriculture, forestry and fisheries", "celex_id": "32006D0047", "chunk_strategy": "len_500_o50", "chunk_uid": "1813a57fb7acccae28fe699aeb7eea24", "label_ids": "100157,100158,100147,100149,100156"}}, {"page_content": "Whereas:\n(1)\nPursuant to Directive 2001/18/EC, the placing on the market of a product containing or consisting of a genetically modified organism or a combination of genetically modified organisms is subject to written consent being granted by the competent authority of a Member State, in accordance with the procedure laid down in that Directive.\n(2)", "metadata": {"categories_en": "agri-foodstuffs, production, technology and research, trade, social questions, geography", "celex_id": "32005D0608", "chunk_strategy": "len_500_o50", "chunk_uid": "bc484ccd86ff1efb9036f1168dbce5eb", "label_ids": "100157,100158,100147,100149,100161"}}, {"page_content": "Whereas:\n(1)\nPursuant to Directive 2001/18/EC, the placing on the market of a product containing or consisting of a genetically modified organism or a combination of genetically modified organisms is subject to written consent being granted by the competent authority of a Member State, in accordance with the procedure laid down in that Directive.\n(2)", "metadata": {"categories_en": "agri-foodstuffs, production, technology and research, trade, agriculture, forestry and fisheries, EUROPEAN UNION", "celex_id": "32005D0772", "chunk_strategy": "len_500_o50", "chunk_uid": "732c42c7ae0ed9f7848782bdc5977ba2", "label_ids": "100157,100158,100147,100156,100144"}}, {"page_content": "Article 10\n1. Consent may only be given for the placing on the market of products containing, or consisting of, GMOs, provided that:\n- written consent has been given to a notification under Part B or if a risk analysis has been carried out based on the elements outlined in that Part;\n- the products comply with the relevant Community product legislation;\n- the products comply with the requirements of this Part of this Directive, concerning the environmental risk assessment.", "metadata": {"categories_en": "environment, production, technology and research, social questions, education and communications, EUROPEAN UNION", "celex_id": "31990L0220", "chunk_strategy": "len_500_o50", "chunk_uid": "d78943126133d982e9ccd877dd822367", "label_ids": "100155,100158,100149,100150,100144"}}, {"page_content": "(2) Under that Regulation, an operator placing on the market products containing or consisting of GMOs is required to include, as part of that relevant information, the unique identifier assigned to each GMO as a means of indicating its presence and reflecting the specific transformation event covered by the consent or authorisation for placing that GMO on the market.", "metadata": {"categories_en": "production, technology and research, trade", "celex_id": "32004R0065", "chunk_strategy": "len_500_o50", "chunk_uid": "42b3a42a5301637c029c08b9fada686f", "label_ids": "100158,100147"}}, {"page_content": "Article 19\nConsent\n1. Without prejudice to requirements under other Community legislation, only if a written consent has been given for the placing on the market of a GMO as or in a product may that product be used without further notification throughout the Community in so far as the specific conditions of use and the environments and/or geographical areas stipulated in these conditions are strictly adhered to.", "metadata": {"categories_en": "environment, production, technology and research, social questions, trade, EUROPEAN UNION", "celex_id": "32001L0018", "chunk_strategy": "len_500_o50", "chunk_uid": "cdd667e1e1d3f7c15f081f615560e6a5", "label_ids": "100155,100158,100149,100147,100144"}}, {"page_content": "(2)\nIn accordance with Directive 2001/18/EC, the notifier may proceed with the placing on the market only when he has received the written consent of the competent authority, and in conformity with any conditions required in that consent.\n(3)\nThe written consent for the placing on the market of a GMO shall explicitly specify monitoring requirements in accordance with Annex VII to Directive 2001/18/EC, including obligations to report to the Commission and competent authorities.\n(4)", "metadata": {"categories_en": "environment, production, technology and research, trade, social questions, education and communications", "celex_id": "32009D0770", "chunk_strategy": "len_500_o50", "chunk_uid": "e37c5e1fd81b01ced438bb2fd7248049", "label_ids": "100155,100158,100147,100149,100150"}}], "rag_answer": "Based on the retrieved context, it appears that the specific type of product that requires consent for its placing on the market in France is genetically modified organisms (GMOs). \n\nThis can be inferred from various documents, such as:\n\n- Document 1: Genetically modified maize (Zea mays L. line MON810) requires consent.\n- Document 2: Genetically modified maize (Zea mays L. line T25) also requires consent.\n- Document 5: Seeds of hybrid swede-rape (Brassica napus L. oleifera Metzg.) derived from crosses using genetically modified organisms require consent.\n- Document 9: Products containing or consisting of GMOs are subject to written consent being granted by the competent authority.\n\nThe answer is not provided in the retrieved context, but it can be inferred that the specific type of product requiring consent for its placing on the market in France is GMO-containing products.", "generator_model": "llama3.2", "final_k": 20, "candidate_k": 100, "retrieval_source": "prefetch", "prefetch_path": "/home/mwc/Documents/MIOTI/Current/TFM/Data/eval_top10_dedup/prefetch/eval1_baseline/len_500_o50/hyb_fill_dense_then_bm25_ce_r50/000017.json", "query_index": 17}
{"id": "gt_dedup_00018", "question": "What is the minimum quantity of goods that can be imported from Sweden without paying customs duties if they qualify for an annual zero-rated tariff quota?", "reference": "31993R1267", "gold_snippet": "ginating in Sweden and qualifying for an annual zero-rated tariff quota amounting to 5 000 tonnes, pursuant to the system provided for in the Bilateral Agreement concluded between the Community and Sweden, may be imported into the Community in accordance with the provisions of this Regulation", "ground_truth_answer": "5 000 tonnes", "reference_contexts": ["ginating in Sweden and qualifying for an annual zero-rated tariff quota amounting to 5 000 tonnes, pursuant to the system provided for in the Bilateral Agreement concluded between the Community and Sweden, may be imported into the Community in accordance with the provisions of this Regulation"], "retrieved_documents": [{"page_content": "Whereas the measures provided for in this Regulation are in accordance with the Management Committee for Cereals,\nHAS ADOPTED THIS REGULATION:\nArticle 1\nProducts falling within CN code 2309 10 originating in Sweden and qualifying for an annual zero-rated tariff quota amounting to 5 000 tonnes, pursuant to the system provided for in the Bilateral Agreement concluded between the Community and Sweden, may be imported into the Community in accordance with the provisions of this Regulation.", "metadata": {"categories_en": "trade, geography, agriculture, forestry and fisheries", "celex_id": "31993R1267", "chunk_strategy": "len_500_o50", "chunk_uid": "869931857389ee79bdeb42da686c5c2d", "label_ids": "100147,100161,100156"}}, {"page_content": "HAS ADOPTED THIS REGULATION:\nArticle 1\nProducts falling within CN code 0406 originating in Sweden, for which an annual tariff quota of 1 000 tonnes at a zero levy has been opened under the arrangements provided for in the Bilateral Agreement concluded between the Community and Sweden, may be imported into the Community in accordance with the provisions of this Regulation.", "metadata": {"categories_en": "trade, agri-foodstuffs, geography", "celex_id": "31993R1316", "chunk_strategy": "len_500_o50", "chunk_uid": "3a619a6abebf0bd3d82e97248a4a1572", "label_ids": "100147,100157,100161"}}, {"page_content": "Whereas, under an Agreement concluded between the Community and Sweden on 17 March 1993, access should be given to all Community importers to the annual tariff quota of 1 000 tonnes of cheese and curds originating in Sweden provided for in the Annex to the Bilateral Agreement signed in Oporto on 2 May 1992, and on import levy of zero ecus per tonne should be set each year until that quantity is exhausted;", "metadata": {"categories_en": "trade, agri-foodstuffs, geography", "celex_id": "31993R1316", "chunk_strategy": "len_500_o50", "chunk_uid": "439ed5c0b1ed851f6c15b6bedcf57ad0", "label_ids": "100147,100157,100161"}}, {"page_content": "Whereas, under the negotiations conducted pursuant to GATT Article XXIV (6) in the wake of the accession of Austria, Finland and Sweden to the European Union, it was agreed to open from 1 January 1996 annual import quotas for 63 000 tonnes of semi-milled and wholly milled rice covered by CN code 1006 30 at zero duty and for 20 000 tonnes of husked rice covered by CN code 1006 20 at a fixed duty of ECU 88 per tonne; whereas these quotas were included in the European Communities list provided for", "metadata": {"categories_en": "trade, agri-foodstuffs, international relations, EUROPEAN UNION", "celex_id": "31996R1522", "chunk_strategy": "len_500_o50", "chunk_uid": "06a9d94561afb571222b0550f271c492", "label_ids": "100147,100157,100143,100144"}}, {"page_content": "Whereas, under the negotiations conducted pursuant to GATT Article XXIV.6 in the wake of the accession of Austria, Finland and Sweden to the European Union, it was agreed to open from 1 January 1996 annual import quotas for 63 000 tonnes of semi-milled and wholly milled rice covered by CN code 1006 30 at zero duty and for 20 000 tonnes of husked rice covered by CN code 1006 20 at a fixed duty of ECU 88 per tonne; whereas these quotas were included in the European Communities list provided for", "metadata": {"categories_en": "trade, agri-foodstuffs, EUROPEAN UNION", "celex_id": "31996R1620", "chunk_strategy": "len_500_o50", "chunk_uid": "1ef0de3a49da35163eac47c698b61dbf", "label_ids": "100147,100157,100144"}}, {"page_content": "(4)\nDetailed rules of application should, therefore, be laid down on a pluriannual basis for a tariff-free import quota of a quantity of 1 200 tonnes per annum starting on 1 January 2005 for meat of bovine animals, boneless, dried, falling under CN code ex 0210 20 90 originating in Switzerland.\n(5)", "metadata": {"categories_en": "trade, agri-foodstuffs, geography", "celex_id": "32004R2092", "chunk_strategy": "len_500_o50", "chunk_uid": "fec8f97ada29714712a3c89c7700e77c", "label_ids": "100147,100157,100161"}}, {"page_content": "Whereas the Community has declared its readiness to open each year, for certain handmade products, a zero-duty Community tariff quota for an overall annual amount of ECU 10 540 000, with a maximum value of ECU 1 200 000 for each group of products covered; whereas eligibility for these Community tariff quotas is nevertheless subject to presentation to the Community customs authorities of a certificate issued by the recognized authorities of the country of manufacture certifying that the goods in", "metadata": {"categories_en": "trade, industry, agriculture, forestry and fisheries", "celex_id": "31995R1808", "chunk_strategy": "len_500_o50", "chunk_uid": "f61512901e9cd26b61ad22bb1f5cf816", "label_ids": "100147,100160,100156"}}, {"page_content": "Whereas the Community has declared its readiness to open each year, for certain handmade products, a zero-duty Community tariff quota for an overall annual amount of ECU 10 540 000, with a maximum value of ECU 1 200 000 for each group of products covered; whereas eligibility for these Community tariff quotas is nevertheless subject to presentation to the Community customs authorities of a certificate issued by the recognized authorities of the country of manufacture certifying that the goods in", "metadata": {"categories_en": "trade, industry, agriculture, forestry and fisheries", "celex_id": "31994R3280", "chunk_strategy": "len_500_o50", "chunk_uid": "a511b4c52f9aa4bfd69086d8e883025f", "label_ids": "100147,100160,100156"}}, {"page_content": "Whereas:\n(1)\nArticle 1(2) of Regulation (EC) No 1964/2005 provides that each year from 1 January, with effect from 1 January 2006, an autonomous tariff quota of 775 000 tonnes net weight subject to a zero-duty rate is to be opened for imports of bananas under CN code 0803 00 19 originating in ACP countries.\n(2)", "metadata": {"categories_en": "trade, agri-foodstuffs, geography", "celex_id": "32006R0219", "chunk_strategy": "len_500_o50", "chunk_uid": "e335504d91cda3dadd7688c8e358a42d", "label_ids": "100147,100157,100161"}}, {"page_content": "shall be imported into the Community free of customs duties within the limits of an annual Community tariff quota of 50 000 hectolitres;", "metadata": {"categories_en": "geography, agri-foodstuffs", "celex_id": "31989R2394", "chunk_strategy": "len_500_o50", "chunk_uid": "162efcc07ee4a508d7f825dfd84e5d59", "label_ids": "100161,100157"}}, {"page_content": "shall be imported into the Community free of customs duties within the limits of an annual Community tariff quota of 50 000 hectolitres;", "metadata": {"categories_en": "geography, agri-foodstuffs", "celex_id": "31988R3004", "chunk_strategy": "len_500_o50", "chunk_uid": "c906d5e23984440a477f96001a6d743f", "label_ids": "100161,100157"}}, {"page_content": "Whereas, pursuant to an agreement concluded between the Community and Sweden on 17 March 1993, all Community importers should be guaranteed access, from 15 April 1993 onwards, to the annual 5 000 tonne quota of pet food prepared for retail sale and originating in Sweden, as provided for in Annex II to the Bilateral Agreement with Sweden signed in Oporto on 2 May 1992, and an import duty of Ecu 0 per tonne should be applied until such time as the said quantity is used up;", "metadata": {"categories_en": "trade, geography, agriculture, forestry and fisheries", "celex_id": "31993R1267", "chunk_strategy": "len_500_o50", "chunk_uid": "d1871317817745dbb3a56ab035c3712c", "label_ids": "100147,100161,100156"}}, {"page_content": "Whereas Council Regulation (EEC) No 2658/87 of 23 July 1987 on the tariff and statistical nomenclature and on the Common Customs Tariff (1) should be amended accordingly,\nHAS ADOPTED THIS REGULATION:\nArticle 1\n1. An annual zero-duty tariff quota shall be opened for imports into the Community of 5 000 tonnes of sweet potatoes intended for uses other than human consumption, falling within CN code 0714 20 90 and oritinating in third countries other than the People's Republic of China.", "metadata": {"categories_en": "trade, agri-foodstuffs", "celex_id": "31988R1471", "chunk_strategy": "len_500_o50", "chunk_uid": "56f286660a246ded357ddc083cb88c42", "label_ids": "100147,100157"}}, {"page_content": "(b) licence applications may only relate to CN code 0406 and to a product originating in Sweden.\nLicence applications must relate to a minimum of one tonne and a maximum of 25 % of the quantity available for the product concerned for each period as defined in Article 1 for which the licence application is submitted;\n(c) in box 8 of licence applications and licences shall be entered 'Sweden'; licences shall carry an obligation to import from that country;", "metadata": {"categories_en": "trade, agri-foodstuffs, geography", "celex_id": "31993R1316", "chunk_strategy": "len_500_o50", "chunk_uid": "b6affb7d6cf517d8db77418f0015a98f", "label_ids": "100147,100157,100161"}}, {"page_content": "Having regard to Council Regulation (EC) No 1964/2005 of 29 November 2005 on the tariff rates for bananas (1), and in particular Article 2 thereof,\nWhereas:\n(1)\nArticle 1(2) of Regulation (EC) No 1964/2005 provides that each year from 1 January, an autonomous tariff quota of 775 000 tonnes net weight subject to a zero-duty rate is to be opened for imports of bananas under CN code 0803 00 19 originating in ACP countries.\n(2)", "metadata": {"categories_en": "trade, agri-foodstuffs, geography", "celex_id": "32006R1789", "chunk_strategy": "len_500_o50", "chunk_uid": "7593eaa700b267af37001032fcc5e3c7", "label_ids": "100147,100157,100161"}}, {"page_content": "(1) Article 26(3) of Council Directive 92/12/EEC of 25 February 1992 on the general arrangements for products(2) subject to excise duty and on the holding, movement and monitoring of such products grants Sweden the right to continue to apply, until 30 June 2000, the same restrictions as laid down in the 1994 Act of Accession of Sweden on the quantity of alcoholic drinks and tobacco products, which may be brought into Swedish territory without further excise duty payment by private individuals", "metadata": {"categories_en": "trade, agri-foodstuffs, geography", "celex_id": "32000L0044", "chunk_strategy": "len_500_o50", "chunk_uid": "ac85f4986ff5a897b4dbd75da890a0b7", "label_ids": "100147,100157,100161"}}, {"page_content": "Article 1\nProducts falling within CN codes ex 2309 90 10, ex 2309 90 31 and ex 2309 90 41 originating in the Faeroes and qualifying under an annual tariff quota of 5 000 tonnes at zero customs duty pursuant to the arrangements laid down in the arrangement concluded between the Community, of the one part, and the Government of Denmark and the Home Government of the Faeroes, of the other part, may be imported into the Community in accordance with the provisions of this Regulation.\nArticle 2", "metadata": {"categories_en": "trade, geography, agriculture, forestry and fisheries", "celex_id": "31997R0955", "chunk_strategy": "len_500_o50", "chunk_uid": "a0c6311ffabbc88b540c08cee373011a", "label_ids": "100147,100161,100156"}}, {"page_content": "Whereas the Community has declared itself ready to open zero-rated annual Community tariff quotas for certain fabrics of silk, silk waste or cotton, woven on handlooms, up to an annual value (customs value) of ECU 2 316 000 for silk fabrics and ECU 2 069 000 for cotton fabrics; whereas eligibility for these Community tariff quotas is nevertheless subject to the presentation of a certificate of manufacture recognized by the relevant Community authorities, the presence of a stamp approved by", "metadata": {"categories_en": "trade, industry, agriculture, forestry and fisheries", "celex_id": "31995R1808", "chunk_strategy": "len_500_o50", "chunk_uid": "4f7524a1967dac80e78d74f772dc7fad", "label_ids": "100147,100160,100156"}}, {"page_content": "Whereas, under the Agreement concluded between the Community and the Kingdom of Norway, access is guaranteed from 1 January 1995 for all Community importers to the annual tariff quota of 1 177 tonnes of fish feed originating in Norway provided for in Annex II to the said Agreement; whereas a zero rate of customs duty applies to that quota;", "metadata": {"categories_en": "finance, trade, geography, agriculture, forestry and fisheries", "celex_id": "31996R2036", "chunk_strategy": "len_500_o50", "chunk_uid": "569f4d801262cd126e6780474bfc52c8", "label_ids": "100148,100147,100161,100156"}}, {"page_content": "Having regard to Council Regulation (EC) No 1964/2005 of 29 November 2005 on the tariff rates for bananas (1), and in particular Article 2 thereof,\nWhereas:\n(1)\nArticle 1(2) of Regulation (EC) No 1964/2005 lays down that from 1 January each year, starting with 1 January 2006, an autonomous tariff quota of 775 000 tonnes net weight subject to a zero duty rate is to be opened for imports of bananas (CN code 0803 00 19) originating in ACP countries.\n(2)", "metadata": {"categories_en": "trade, agri-foodstuffs, geography", "celex_id": "32005R2015", "chunk_strategy": "len_500_o50", "chunk_uid": "c6cd6a8927a3eca1ad52260f7b728060", "label_ids": "100147,100157,100161"}}], "rag_answer": "The answer cannot be found in the retrieved context.", "generator_model": "llama3.2", "final_k": 20, "candidate_k": 100, "retrieval_source": "prefetch", "prefetch_path": "/home/mwc/Documents/MIOTI/Current/TFM/Data/eval_top10_dedup/prefetch/eval1_baseline/len_500_o50/hyb_fill_dense_then_bm25_ce_r50/000018.json", "query_index": 18}
{"id": "gt_dedup_00019", "question": "Are glyphosate residues a concern for consumers when eating lupines, as stated by the EU legal instrument?", "reference": "32006L0060", "gold_snippet": "10)\nLupines are consumed as food in several Member States. On lupines the use of glyphosate is authorised. The insertion of the entry ‘lupines’ and setting of MRLs for lupines is therefore necessary to protect consumers from excess pesticide residues used on lupines.\n(11)\nDirective 90/642/EEC should therefore be amended accordingly.\n(12)\nThe measures provided for in this Directive are in accordance with the opinion of the Standing Committee on th", "ground_truth_answer": "Yes, according to the EU legal instrument, glyphosate residues on lupines pose a risk to consumers due to excess pesticide use, necessitating the insertion of an entry and setting of Maximum Residue Limits (MRLs) to protect consumers.", "reference_contexts": ["10)\nLupines are consumed as food in several Member States. On lupines the use of glyphosate is authorised. The insertion of the entry ‘lupines’ and setting of MRLs for lupines is therefore necessary to protect consumers from excess pesticide residues used on lupines.\n(11)\nDirective 90/642/EEC should therefore be amended accordingly.\n(12)\nThe measures provided for in this Directive are in accordance with the opinion of the Standing Committee on th"], "retrieved_documents": [{"page_content": "(10)\nLupines are consumed as food in several Member States. On lupines the use of glyphosate is authorised. The insertion of the entry ‘lupines’ and setting of MRLs for lupines is therefore necessary to protect consumers from excess pesticide residues used on lupines.\n(11)\nDirective 90/642/EEC should therefore be amended accordingly.\n(12)\nThe measures provided for in this Directive are in accordance with the opinion of the Standing Committee on the Food Chain and Animal Health,", "metadata": {"categories_en": "social questions, trade, environment, agriculture, forestry and fisheries", "celex_id": "32006L0060", "chunk_strategy": "len_500_o50", "chunk_uid": "e4569e5b5e64862729d002289a196ad6", "label_ids": "100149,100147,100155,100156"}}, {"page_content": "(7) Where appropriate, the acute exposure of consumers to these pesticides via each of the food products that may contain residues of these pesticides has been assessed and evaluated in accordance with the procedures and practices currently used within the European Community, taking account of recommendations published by the World Health Organisation, and no acute intake concerns have been identified.", "metadata": {"categories_en": "environment, trade, agri-foodstuffs, agriculture, forestry and fisheries", "celex_id": "32000L0057", "chunk_strategy": "len_500_o50", "chunk_uid": "eabcaca61bbec767eb13817a6c58a3f2", "label_ids": "100155,100147,100157,100156"}}, {"page_content": "(6) The lifetime exposure of consumers to these pesticides via food products that may contain residues of these pesticides, has been assessed and evaluated in accordance with the procedures and practices used within the European Community, taking account of guidelines published by the World Health Organistion(7) and it has been calculated that the maximum residue levels fixed in this Directive do not give rise to an exceedence of the acceptable daily intakes.", "metadata": {"categories_en": "environment, trade, agri-foodstuffs, agriculture, forestry and fisheries", "celex_id": "32000L0057", "chunk_strategy": "len_500_o50", "chunk_uid": "61dd8fdfa2663c92dc3415d1729b205c", "label_ids": "100155,100147,100157,100156"}}, {"page_content": "(3) The acute and lifetime exposure of consumers to these pesticides via food products that may contain residues of these pesticides arising from their uses in plant protection and, where applicable, in veterinary medicine has been assessed and evaluated in accordance with the procedures and practices used within the European Community, taking account of guidelines published by the World Health Organisation(6) and it has been calculated that the maximum residue levels fixed in this Directive do", "metadata": {"categories_en": "social questions, agri-foodstuffs, agriculture, forestry and fisheries", "celex_id": "32003L0062", "chunk_strategy": "len_500_o50", "chunk_uid": "4e54ed3117d86d325b548eb891ca76af", "label_ids": "100149,100157,100156"}}, {"page_content": "(6) Where relevant, the acute exposure of consumers to these pesticides via each of the food products that may contain residues of these pesticides has been assessed and evaluated in accordance with the procedures and practices used within the European Union, taking account of guidelines published by the World Health Organisation. It is calculated that the maximum residue levels fixed in the present Directive do not cause acute toxic effects.", "metadata": {"categories_en": "environment, agri-foodstuffs, agriculture, forestry and fisheries", "celex_id": "32002L0005", "chunk_strategy": "len_500_o50", "chunk_uid": "2b0bf3f939121cb29ef4937938555d5f", "label_ids": "100155,100157,100156"}}, {"page_content": "(9) The lifetime exposure of consumers to these pesticides via food products that may contain residues of these pesticides has been assessed and evaluated in accordance with the procedures and practices used within the European Community taking account of guidelines published by the World Health Organisation(14) and it has been calculated that the maximum residue levels fixed in this Directive do not give rise to an exceedence of the acceptable daily intakes.", "metadata": {"categories_en": "social questions, agri-foodstuffs, environment, agriculture, forestry and fisheries", "celex_id": "32000L0042", "chunk_strategy": "len_500_o50", "chunk_uid": "ae6a67889b759b84aeddeb79a57130ba", "label_ids": "100149,100157,100155,100156"}}, {"page_content": "(3) The lifetime exposure of consumers to these pesticides via food products that may contain residues of these pesticides arising from their uses in plant protection and, where applicable, in veterinary medicine has been assessed and evaluated in accordance with the procedures and practices used within the European Community taking account of guidelines published by the World Health Organisation(11) and it has been calculated that the maximum residue levels fixed in this Directive do not give", "metadata": {"categories_en": "social questions, agri-foodstuffs, environment, agriculture, forestry and fisheries", "celex_id": "32001L0035", "chunk_strategy": "len_500_o50", "chunk_uid": "a41be29cc9cbf7ac8e3da2037b84acbd", "label_ids": "100149,100157,100155,100156"}}, {"page_content": "(4) The acute exposure of consumers to these pesticides via each of the food products that may contain residues of these pesticides has been assessed and evaluated in accordance with the procedures and practices used within the European Community, taking account of guidelines published by the World Health Organisation. It has been calculated that the maximum residue levels fixed for open positions in the present Directive do not give rise to acute toxic effects.", "metadata": {"categories_en": "social questions, agri-foodstuffs, environment, agriculture, forestry and fisheries", "celex_id": "32001L0035", "chunk_strategy": "len_500_o50", "chunk_uid": "e4355700b45ad2ded020e86c1732ddfe", "label_ids": "100149,100157,100155,100156"}}, {"page_content": "(10) The acute exposure of consumers to these pesticides via each of the food products that may contain residues of these pesticides has been assessed and evaluated in accordance with the procedures and practices used within the European Community, taking account of guidelines published by the World Health Organisation. It has been calculated that the maximum residue levels fixed for open positions in the present Directive do not give rise to acute toxic effects.", "metadata": {"categories_en": "social questions, agri-foodstuffs, environment, agriculture, forestry and fisheries", "celex_id": "32000L0042", "chunk_strategy": "len_500_o50", "chunk_uid": "5e62fda6de3492f06fc0b83624a9b78c", "label_ids": "100149,100157,100155,100156"}}, {"page_content": "Where appropriate, the acute exposure of consumers to these pesticides via each of the food products that may contain residues of these pesticides has been assessed and evaluated in accordance with the procedures and practices currently used within the European Community, taking account of guidelines published by the World Health Organisation. The opinions of the Scientific Committee for Plants, in particular advice and recommendations concerning the protection of consumers of food products", "metadata": {"categories_en": "social questions, trade, agri-foodstuffs, environment", "celex_id": "32004L0115", "chunk_strategy": "len_500_o50", "chunk_uid": "04895136695e118a5d98b4accf3a878f", "label_ids": "100149,100147,100157,100155"}}, {"page_content": "the protection of consumers of food products treated with pesticides, have been taken into account.", "metadata": {"categories_en": "social questions, trade, agri-foodstuffs, environment", "celex_id": "32004L0115", "chunk_strategy": "len_500_o50", "chunk_uid": "591e6ddfbd13ca9b515081c4ad0f8e0c", "label_ids": "100149,100147,100157,100155"}}, {"page_content": "in concentrations that might present a risk to consumers.", "metadata": {"categories_en": "finance, agri-foodstuffs, business and competition, economics, agriculture, forestry and fisheries, geography", "celex_id": "32005D0350", "chunk_strategy": "len_500_o50", "chunk_uid": "106e6806456db00d53be7366e4c43637", "label_ids": "100148,100157,100152,100146,100156,100161"}}, {"page_content": "Subject to compliance with the Treaty, authorization may also be accompanied by restrictions on use arising from differences in dietary patterns and necessary in order to avoid exposure of consumers of treated products to the risks of dietary contamination in excess of the acceptable daily intake of the residues concerned.", "metadata": {"categories_en": "politics, production, technology and research, trade, agriculture, forestry and fisheries, education and communications", "celex_id": "31991L0414", "chunk_strategy": "len_500_o50", "chunk_uid": "46a519af9d76ea271e6a5d2794938e9b", "label_ids": "100142,100158,100147,100156,100150"}}, {"page_content": "(13)\nIt is appropriate that specific rules concerning the control of pesticide residues be introduced to complement the general Community provisions on the control of food and feed.\n(14)\nWhilst considering MRLs of pesticides, it should also be recognised that few consumers are aware of the risks arising from pesticides. It would be valuable to fully explain such risks to the public.\n(15)", "metadata": {"categories_en": "social questions, agri-foodstuffs, environment, agriculture, forestry and fisheries", "celex_id": "32005R0396", "chunk_strategy": "len_500_o50", "chunk_uid": "ea5bf0e8a4e3cec7ebcbde77522b24d8", "label_ids": "100149,100157,100155,100156"}}, {"page_content": "(4) Maximum residue levels for pesticides should be kept under review. The levels may be changed to take account of new uses, new information and data and, in particular, should be urgently reconsidered with a view to reduction if concerns about dietary exposure of consumers, based on new or reviewed information, are brought to the attention of the Commission, in particular in implementation of Article 4 of Directive 76/895 and Article 8 of Directive 90/642/EEC.", "metadata": {"categories_en": "environment, trade, agri-foodstuffs, agriculture, forestry and fisheries", "celex_id": "32000L0057", "chunk_strategy": "len_500_o50", "chunk_uid": "3380ea82ad14d9fd5f7f57541e3ee564", "label_ids": "100155,100147,100157,100156"}}, {"page_content": "Whereas maximum residue levels for pesticides should be kept under review; whereas the levels may be changed to take account of new information and data and, in particular, should be urgently reconsidered with a view to reduction if concerns about dietary exposure of consumers, based on new or reviewed information, are brought to the attention of the Commission, in particular in implementation of Article 9 of Directive 86/362/EEC, Article 9 of Directive 86/363/EEC or Article 8 of Directive", "metadata": {"categories_en": "social questions, agri-foodstuffs, environment", "celex_id": "31998L0082", "chunk_strategy": "len_500_o50", "chunk_uid": "85a96db155b0d79d65679148d5b74e74", "label_ids": "100149,100157,100155"}}, {"page_content": "As a result, measures would appear to be essential to ensure the continued presence of new Community producers on the glyphosate market, while safeguarding the viability of those already producing.\n3. Impact on importers/formulators & consumers\n(65) Since the major part of glyphosate imports from the People's Republic of China into the Community is in the form of acid or salt and is therefore resold in a formulated form, the formulating industry is concerned by this proceeding.", "metadata": {"categories_en": "geography, trade, business and competition, industry", "celex_id": "31997R1731", "chunk_strategy": "len_500_o50", "chunk_uid": "4a07d18f723846e9d2c15290784d60c6", "label_ids": "100161,100147,100152,100160"}}, {"page_content": "(9)\nGlyphosate is used as ester or salt. In case of glyphosate trimesium salt, the residue of trimethylsulfonium cation is also of toxicological relevance. It is therefore necessary to set MRLs for that cation.\n(10)\nProvisions of Directive 76/895/EEC which set MRLs for chlorpropham should consequently be deleted.\n(11)\nDirectives 76/895/EEC, 86/362/EEC, 86/363/EEC and 90/642/EEC should therefore be amended accordingly.\n(12)", "metadata": {"categories_en": "agri-foodstuffs, environment, social questions, trade, agriculture, forestry and fisheries", "celex_id": "32005L0070", "chunk_strategy": "len_500_o50", "chunk_uid": "1b1df7d47ce879f4865131c199673ec8", "label_ids": "100157,100155,100149,100147,100156"}}, {"page_content": "of consumers, in particular children, could not be finalised due to the lack of information as regards certain relevant residues. Furthermore, the data supplied by the notifier within the legal deadlines was insufficient to allow the EFSA to assess the ecotoxicological effects of the active substance. As a result, concerns remain as regards the risk assessment for birds and mammals, aquatic organisms, bees, non-target arthropods, earthworms, and soil non-target organisms. Consequently, it was", "metadata": {"categories_en": "business and competition, environment, social questions, trade, agriculture, forestry and fisheries", "celex_id": "32007D0416", "chunk_strategy": "len_500_o50", "chunk_uid": "79798c3837aedcf534e0f7a813dbd00c", "label_ids": "100152,100155,100149,100147,100156"}}, {"page_content": "(3) They should be supplemented by the establishment of criteria for the assessment of the risk to the consumer which could result from the consumption of food containing residues of the additive or its metabolites. Based on the residue studies maximum residue limits (MRL's) and withdrawal periods should be established, where appropriate.", "metadata": {"categories_en": "social questions, agri-foodstuffs, agriculture, forestry and fisheries", "celex_id": "32001L0079", "chunk_strategy": "len_500_o50", "chunk_uid": "0de7d27318cb9eda4e2d208cf4f66c6d", "label_ids": "100149,100157,100156"}}], "rag_answer": "The answer is not provided in the retrieved context.", "generator_model": "llama3.2", "final_k": 20, "candidate_k": 100, "retrieval_source": "prefetch", "prefetch_path": "/home/mwc/Documents/MIOTI/Current/TFM/Data/eval_top10_dedup/prefetch/eval1_baseline/len_500_o50/hyb_fill_dense_then_bm25_ce_r50/000019.json", "query_index": 19}
{"id": "gt_dedup_00020", "question": "What is the minimum notice period required for a credit institution to notify the competent authorities of changes in certain particulars?", "reference": "32000L0012", "gold_snippet": "In the event of a change in any of the particulars communicated pursuant to paragraph 2(b), (c) or (d), a credit institution shall give written notice of the change in question to the competent authorities of the home and host Member States at least one month before making the change so as to enable the competent authorities of the home Member State to take a decision pursuant to paragraph 3 and the competent authorities of the host Member State", "ground_truth_answer": "At least one month.", "reference_contexts": ["In the event of a change in any of the particulars communicated pursuant to paragraph 2(b), (c) or (d), a credit institution shall give written notice of the change in question to the competent authorities of the home and host Member States at least one month before making the change so as to enable the competent authorities of the home Member State to take a decision pursuant to paragraph 3 and the competent authorities of the host Member State"], "retrieved_documents": [{"page_content": "3. In the event of a change in any of the particulars communicated pursuant to points (b), (c) or (d) of Article 25(2), a credit institution shall give written notice of the change in question to the competent authorities of the home and host Member States at least one month before making the change so as to enable the competent authorities of the home Member State to take a decision pursuant to Article 25 and the competent authorities of the host Member State to take a decision on the change", "metadata": {"categories_en": "finance, trade, employment and working conditions, economics", "celex_id": "32006L0048", "chunk_strategy": "len_500_o50", "chunk_uid": "5e94cac37a325c588bab8e9834082d38", "label_ids": "100148,100147,100153,100146"}}, {"page_content": "6. In the event of a change in any of the particulars communicated pursuant to paragraph 2(b), (c) or (d), a credit institution shall give written notice of the change in question to the competent authorities of the home and host Member States at least one month before making the change so as to enable the competent authorities of the home Member State to take a decision pursuant to paragraph 3 and the competent authorities of the host Member State to take a decision on the change pursuant to", "metadata": {"categories_en": "finance, trade, economics", "celex_id": "32000L0012", "chunk_strategy": "len_500_o50", "chunk_uid": "1c1fac10048019336631ef4267af7a51", "label_ids": "100148,100147,100146"}}, {"page_content": "6. In the event of a change in any of the particulars communicated pursuant to paragraph 2 (b), (c) or (d) or in the deposit-guarantee scheme referred to in paragraph 3 a credit institution shall give written notice of the change in question to the competent authorities of the home and host Member States at least one month before making the change so as to enable the competent authorities of the home Member State to take a decision pursuant to paragraph 3 and the competent authorities of the", "metadata": {"categories_en": "finance, EUROPEAN UNION, business and competition, international relations", "celex_id": "31989L0646", "chunk_strategy": "len_500_o50", "chunk_uid": "b503216c064863cf7b4c4d085e74cfaf", "label_ids": "100148,100144,100152,100143"}}, {"page_content": "6. In the event of a change in any of the particulars communicated in accordance with paragraph 2 (b), (c) or (d), an investment firm shall give written notice of that change to the competent authorities of the home and host Member States at least one month before implementing the change so that the competent authorities of the home Member State may take a decision on the change under paragraph 3 and the competent authorities of the host Member State may do so under paragraph 4.", "metadata": {"categories_en": "finance, employment and working conditions, business and competition", "celex_id": "31993L0022", "chunk_strategy": "len_500_o50", "chunk_uid": "011e69dbed5f7bd6ba99ee835ef3204a", "label_ids": "100148,100153,100152"}}, {"page_content": "6. In the event of change of any particulars communicated in accordance with paragraphs 2(b), (c) or (d), a management company shall give written notice of that change to the competent authorities of the home and host Member States at least one month before implementing the change so that the competent authorities of the home Member State may take a decision on the change under paragraph 3 and the competent authorities of the host Member State may do so under paragraph 4.", "metadata": {"categories_en": "finance, trade, employment and working conditions, EUROPEAN UNION", "celex_id": "32001L0107", "chunk_strategy": "len_500_o50", "chunk_uid": "c6a0eb9dfc27dbaf24c86f24f49d303d", "label_ids": "100148,100147,100153,100144"}}, {"page_content": "6. In the event of a change in any of the particulars communicated under paragraph 2(b), (c) or (d), an assurance undertaking shall give written notice of the change to the competent authorities of the home Member State and of the Member State of the branch at least one month before making the change so that the competent authorities of the home Member State and the competent authorities of the Member State of the branch may fulfil their respective roles under paragraphs 3 and 4.\nArticle 41", "metadata": {"categories_en": "finance, employment and working conditions", "celex_id": "32002L0083", "chunk_strategy": "len_500_o50", "chunk_uid": "4f2834534473fba5f05f5441b26e4857", "label_ids": "100148,100153"}}, {"page_content": "4. In the event of a change in any of the particulars communicated in accordance with paragraph 2, an investment firm shall give written notice of that change to the competent authority of the home Member State at least one month before implementing the change. The competent authority of the home Member State shall inform the competent authority of the host Member State of those changes.", "metadata": {"categories_en": "trade, finance", "celex_id": "32004L0039", "chunk_strategy": "len_500_o50", "chunk_uid": "6ccfc7024019a90c6dc787d1a6ab9c8d", "label_ids": "100147,100148"}}, {"page_content": "2. The competent authorities of the home Member State shall, within one month of receipt of the notification mentioned in paragraph 1, send that notification to the competent authorities of the host Member State.\nArticle 21 1. Host Member State may, for statistical purposes, require that all credit institutions having branches within their territories shall report periodically on their activities in those host Member States to the competent authorities of those host Member States.", "metadata": {"categories_en": "finance, EUROPEAN UNION, business and competition, international relations", "celex_id": "31989L0646", "chunk_strategy": "len_500_o50", "chunk_uid": "d2d96544b0fe5b81362e89c0415f0ede", "label_ids": "100148,100144,100152,100143"}}, {"page_content": "6. In the event of a change in any of the particulars communicated under paragraph 2 (b), (c) or (d), an insurance undertaking shall give written notice of the change to the competent authorities of the home Member State and of the Member State of the branch at least one month before making the change so that the competent authorities of the home Member State and the competent authorities of the Member State of the branch may fulfil their respective roles under paragraphs 3 and 4.'\nArticle 33", "metadata": {"categories_en": "finance, employment and working conditions, EUROPEAN UNION", "celex_id": "31992L0049", "chunk_strategy": "len_500_o50", "chunk_uid": "2ae07854a392585264e2d03ffcceeb0b", "label_ids": "100148,100153,100144"}}, {"page_content": "3. Unless the competent authorities of the home Member State have reason to doubt the adequacy of the administrative structure or the financial situation of the credit institution, taking into account the activities envisaged, they shall within three months of receipt of the information referred to in paragraph 2 communicate that information to the competent authorities of the host Member State and shall inform the credit institution accordingly.", "metadata": {"categories_en": "finance, trade, employment and working conditions, economics", "celex_id": "32006L0048", "chunk_strategy": "len_500_o50", "chunk_uid": "a1de3054cf2c081e7bddaf009ae71d8b", "label_ids": "100148,100147,100153,100146"}}, {"page_content": "3. Unless the competent authorities of the home Member State have reason to doubt the adequacy of the administrative structure or the financial situation of the credit institution, taking into account the activities envisaged, they shall within three months of receipt of the information referred to in paragraph 2 communicate that information to the competent authorities of the host Member State and shall inform the institution concerned accordingly.", "metadata": {"categories_en": "finance, EUROPEAN UNION, business and competition, international relations", "celex_id": "31989L0646", "chunk_strategy": "len_500_o50", "chunk_uid": "65e540055910bf1b1203bc203e889b3b", "label_ids": "100148,100144,100152,100143"}}, {"page_content": "3. Unless the competent authorities of the home Member State have reason to doubt the adequacy of the administrative structure or the financial situation of the credit institution, taking into account the activities envisaged, they shall within three months of receipt of the information referred to in paragraph 2 communicate that information to the competent authorities of the host Member State and shall inform the institution accordingly.", "metadata": {"categories_en": "finance, trade, economics", "celex_id": "32000L0012", "chunk_strategy": "len_500_o50", "chunk_uid": "f797f98be8810b646fdcaf252f6495e3", "label_ids": "100148,100147,100146"}}, {"page_content": "3. If those measures fail to secure compliance on the part of the credit institution, the scheme may, where national law permits the exclusion of a member, with the express consent of the competent authorities, give not less than 12 months' notice of its intention of excluding the credit institution from membership of the scheme. Deposits made before the expiry of the notice period shall continue to be fully covered by the scheme. If, on the expiry of the notice period, the credit institution", "metadata": {"categories_en": "finance, business and competition", "celex_id": "31994L0019", "chunk_strategy": "len_500_o50", "chunk_uid": "4c4e6b784af5fa7aa6613d1d47d0a912", "label_ids": "100148,100152"}}, {"page_content": "8. In the event of change of any particulars communicated in accordance with paragraph 2(b), (c) or (d), a management company shall give written notice of that change to the competent authorities of the management company’s home Member State and of the management company’s host Member State at least one month before implementing the change so that the competent authorities of the management company’s home Member State may take a decision on the change under paragraph 3 and the competent", "metadata": {"categories_en": "finance, business and competition, trade, employment and working conditions, EUROPEAN UNION", "celex_id": "32009L0065", "chunk_strategy": "len_500_o50", "chunk_uid": "ba720dead39813efb7d3ee86cacd74ad", "label_ids": "100148,100152,100147,100153,100144"}}, {"page_content": "2. The competent authorities of the home Member State shall, within one month of receipt of the notification provided for in paragraph 1, send that notification to the competent authorities of the host Member State.\n3. This Article shall not affect rights acquired by credit institutions providing services before 1 January 1993.\nSection 5\nPowers of the competent authorities of the host Member State\nArticle 29", "metadata": {"categories_en": "finance, trade, employment and working conditions, economics", "celex_id": "32006L0048", "chunk_strategy": "len_500_o50", "chunk_uid": "79d182cda8589c37e6f3c6ab118d8bef", "label_ids": "100148,100147,100153,100146"}}, {"page_content": "2. The competent authorities of the home Member State shall, within one month of receipt of the notification mentioned in paragraph 1, send that notification to the competent authorities of the host Member State.\n3. This Article shall not affect rights acquired by credit institutions providing services before 1 January 1993.\nArticle 22\nPower of the competent authorities of the host Member State", "metadata": {"categories_en": "finance, trade, economics", "celex_id": "32000L0012", "chunk_strategy": "len_500_o50", "chunk_uid": "2e3f3f3fb36006cf9e9b2fc541f413c7", "label_ids": "100148,100147,100146"}}, {"page_content": "3. The competent authority, or the operator where the competent authority so requires, shall notify the registry administrator within 10 days of any changes in the information provided to the registry administrator pursuant to paragraph 1. Within 10 days of the receipt of such a notification the registry administrator shall update the operator’s details in accordance with the account update process set out in Annex VIII.", "metadata": {"categories_en": "education and communications, trade, EUROPEAN UNION, environment", "celex_id": "32004R2216", "chunk_strategy": "len_500_o50", "chunk_uid": "dae177e53bd6a7ef0941857131389254", "label_ids": "100150,100147,100144,100155"}}, {"page_content": "loans the maturity of which is not fixed shall be repayable only subject to five years’ notice unless the loans are no longer considered as a component of the available solvency margin or unless the prior consent of the competent authorities is specifically required for early repayment. In the latter event the institution shall notify the competent authorities at least six months before the date of the proposed repayment, specifying the available solvency margin and the required solvency margin", "metadata": {"categories_en": "law, finance, employment and working conditions, EUROPEAN UNION", "celex_id": "32009L0138", "chunk_strategy": "len_500_o50", "chunk_uid": "d86e5c1953857701e6834fa3d6749451", "label_ids": "100145,100148,100153,100144"}}, {"page_content": "3. The competent authority, or the operator where the competent authority so requires, shall notify the registry administrator within 10 working days of any changes in the information provided to the registry administrator pursuant to paragraph 1. Within 10 working days of the receipt of such a notification the registry administrator shall update the operator's details using the account update process.", "metadata": {"categories_en": "education and communications, production, technology and research, environment", "celex_id": "32008R0994", "chunk_strategy": "len_500_o50", "chunk_uid": "5d89e927e6124e5a7b276aae16c593df", "label_ids": "100150,100158,100155"}}, {"page_content": "Article 38\n1. Member States shall notify the Commission not later than three months before the date of application of this Regulation of the name(s), address(es) and telephone and telex/telefax number(s) of the competent authorities and of the correspondents, together with the stamp of the competent authorities.\nMember States shall notify the Commission annually of any changes in this information.", "metadata": {"categories_en": "transport, trade, social questions, environment", "celex_id": "31993R0259", "chunk_strategy": "len_500_o50", "chunk_uid": "b3c50377d0097e5026af4a9ed1a9e839", "label_ids": "100154,100147,100149,100155"}}], "rag_answer": "The minimum notice period required for a credit institution to notify the competent authorities of changes in certain particulars is at least one month, as stated in Article 25(2) of the relevant document (CELEX: 32006L0048).", "generator_model": "llama3.2", "final_k": 20, "candidate_k": 100, "retrieval_source": "prefetch", "prefetch_path": "/home/mwc/Documents/MIOTI/Current/TFM/Data/eval_top10_dedup/prefetch/eval1_baseline/len_500_o50/hyb_fill_dense_then_bm25_ce_r50/000020.json", "query_index": 20}
{"id": "gt_dedup_00021", "question": "What type of material are the devices that illuminate signs made of, according to EU legal instrument?", "reference": "31992L0058", "gold_snippet": "re which describes a situation or prescribes specific behaviour and which is used on a signboard or illuminated surface;\n(k)\nilluminated sign means a sign produced by a device made of transparent or translucent materials which are illuminated from the inside or the rear in such a way as to give t", "ground_truth_answer": "Transparent or translucent materials", "reference_contexts": ["re which describes a situation or prescribes specific behaviour and which is used on a signboard or illuminated surface;\n(k)\nilluminated sign means a sign produced by a device made of transparent or translucent materials which are illuminated from the inside or the rear in such a way as to give t"], "retrieved_documents": [{"page_content": "(j)\nSymbol or pictogram means a figure which describes a situation or prescribes specific behaviour and which is used on a signboard or illuminated surface;\n(k)\nilluminated sign means a sign produced by a device made of transparent or translucent materials which are illuminated from the inside or the rear in such a way as to give the appearance of a luminous surface;\n(l)", "metadata": {"categories_en": "production, technology and research, transport, employment and working conditions", "celex_id": "31992L0058", "chunk_strategy": "len_500_o50", "chunk_uid": "9efa5428c147d35fd1808f0e7bf1ccab", "label_ids": "100158,100154,100153"}}, {"page_content": "In cooperation with the European Parliament(3) ,\nHaving regard to the opinion of the Economic and Social Committee(4) ,\nWhereas in each Member State the lighting and light-signalling devices fitted to two or three-wheel vehicles must display certain technical characteristics laid down by mandatory provisions which differ from one Member State to the other; whereas, as a result of their differences, such provisions constitute a barrier to trade within the Community;", "metadata": {"categories_en": "production, technology and research, transport", "celex_id": "31993L0092", "chunk_strategy": "len_500_o50", "chunk_uid": "64ccd6855e4ee0ad7badb3271eea1c67", "label_ids": "100158,100154"}}, {"page_content": "*****\nCOUNCIL DIRECTIVE\nof 26 May 1983\namending Directive 76/756/EEC on the approximation of the laws of the Member States relating to the installation of lighting and light-signalling devices on motor vehicles and their trailers\n(83/276/EEC)\nTHE COUNCIL OF THE EUROPEAN\nCOMMUNITIES,\nHaving regard to the Treaty establishing the European Economic Community, and in particular Article 100 thereof,\nHaving regard to the proposal from the Commission (1),", "metadata": {"categories_en": "transport, trade, EUROPEAN UNION", "celex_id": "31983L0276", "chunk_strategy": "len_500_o50", "chunk_uid": "773764ec1faded8443390de2477fa84c", "label_ids": "100154,100147,100144"}}, {"page_content": "Member States shall take all appropriate measures to prevent the use of marks liable to create confusion between headlamps which function as main-beam and/or dipped-beam headlamps and light source(s) (filament lamp(s) and other(s)) for use in approved lamp units which have been type-approved pursuant to Article 1, and other devices.\nArticle 3", "metadata": {"categories_en": "production, technology and research, transport", "celex_id": "31999L0017", "chunk_strategy": "len_500_o50", "chunk_uid": "a47463e33deac4956f336183b6e289f0", "label_ids": "100158,100154"}}, {"page_content": "Having regard to Council Directive 76/756/EEC of 27 July 1976 on the approximation of the laws of the Member States relating to the installation of lighting and light-signalling devices on motor-vehicles and their trailers (3), as last amended by Directive 84/8/EEC (4), and in particular Article 4 thereof,", "metadata": {"categories_en": "production, technology and research, transport", "celex_id": "31989L0278", "chunk_strategy": "len_500_o50", "chunk_uid": "e434dacef3d90ceda056173ba4c2e0db", "label_ids": "100158,100154"}}, {"page_content": "Having regard to Council Directive 76/756/EEC of 27 July 1976 on the approximation of the laws of the Member States relating to the installation of lighting and light-signalling devices on motor vehicles and their trailers (2), and in particular Article 4 thereof,\nWhereas:\n(1)", "metadata": {"categories_en": "production, technology and research, transport", "celex_id": "32007L0035", "chunk_strategy": "len_500_o50", "chunk_uid": "d3aa9f049ab186c7558c7cbb2d233b83", "label_ids": "100158,100154"}}, {"page_content": "Having regard to Council Directive 78/933/EEC of 17 October 1978 on the approximation of the laws of the Member States relating to the installation of lighting and light-signalling devices on wheeled agricultural and forestry tractors(3), as last amended by Directive 97/54/EC, and in particular Article 5 thereof,\n(1) Whereas, in order to improve safety, it is now necessary to specify how the light-signalling devices should be installed;", "metadata": {"categories_en": "transport, agriculture, forestry and fisheries", "celex_id": "31999L0056", "chunk_strategy": "len_500_o50", "chunk_uid": "d3822fbe57c2f585034c13e4412d00a2", "label_ids": "100154,100156"}}, {"page_content": "Member States shall take all appropriate measures to prevent the use of marks liable to create confusion between headlamps which function as main-beam and/or dipped-beam headlamps and filament lamps for such headlamps which have been type-approved pursuant to Article 1, and other devices.\nArticle 3", "metadata": {"categories_en": "production, technology and research, transport, EUROPEAN UNION", "celex_id": "31976L0761", "chunk_strategy": "len_500_o50", "chunk_uid": "e142b32971103691c431999d17358c49", "label_ids": "100158,100154,100144"}}, {"page_content": "Article 3\n1. No Member State may prohibit the placing on the market of headlamps which function as main-beam and/or dipped-beam headlamps and light source(s) (filament lamp(s) and other(s)) for use in approved lamp units on grounds relating to their construction or method of functioning, if they bear the EC component type-approval mark.", "metadata": {"categories_en": "production, technology and research, transport", "celex_id": "31999L0017", "chunk_strategy": "len_500_o50", "chunk_uid": "14c9c8c5199a3f5bc8d1d4b2c59ad8ea", "label_ids": "100158,100154"}}, {"page_content": "COUNCIL DIRECTIVE of 27 July 1976 on the approximation of the laws of the Member States relating to the installation of lighting and light-signalling devices on motor vehicles and their trailers (76/756/EEC)\nTHE COUNCIL OF THE EUROPEAN COMMUNITIES,\nHaving regard to the Treaty establishing the European Economic Community, and in particular Article 100 thereof,\nHaving regard to the proposal from the Commission,\nHaving regard to the opinion of the European Parliament (1),", "metadata": {"categories_en": "transport, trade, EUROPEAN UNION", "celex_id": "31976L0756", "chunk_strategy": "len_500_o50", "chunk_uid": "b78ab34903f2ef905cf8f39e134851b0", "label_ids": "100154,100147,100144"}}, {"page_content": "27 July 1976 on the approximation of the laws of the Member States relating to the installation of lighting and light-signalling devices on motor vehicles and their trailers(5), as last amended by Commission Directive 97/28/EC(6), are well founded.", "metadata": {"categories_en": "production, technology and research, transport, geography, EUROPEAN UNION", "celex_id": "32001D0821", "chunk_strategy": "len_500_o50", "chunk_uid": "70c66fdebfa322ca1c8212d00d5a0df5", "label_ids": "100158,100154,100161,100144"}}, {"page_content": "Article 2\n1. No Member State may refuse to grant EC type-approval or national type-approval of a type of tractor on grounds relating to the installation of lighting and light-signalling devices, whether mandatory or optional, listed in points 1.5.7 to 1.5.21 of Annex I if these are installed in accordance with the requirements set out in that Annex.", "metadata": {"categories_en": "production, technology and research, transport, agriculture, forestry and fisheries", "celex_id": "32009L0061", "chunk_strategy": "len_500_o50", "chunk_uid": "f8dc7c0072bf985898493546f9937ef0", "label_ids": "100158,100154,100156"}}, {"page_content": "COMMISSION DIRECTIVE 97/28/EC of 11 June 1997 adapting to technical progress Council Directive 76/756/EEC relating to the installation of lighting and light-signalling devices on motor vehicles and their trailers (Text with EEA relevance)\nTHE COMMISSION OF THE EUROPEAN COMMUNITIES,\nHaving regard to the Treaty establishing the European Community,", "metadata": {"categories_en": "production, technology and research, transport", "celex_id": "31997L0028", "chunk_strategy": "len_500_o50", "chunk_uid": "b71d5efb147145c3a502225bbff9d165", "label_ids": "100158,100154"}}, {"page_content": "DIRECTIVE 2009/68/EC OF THE EUROPEAN PARLIAMENT AND OF THE COUNCIL\nof 13 July 2009\non the component type-approval of lighting and light-signalling devices on wheeled agricultural or forestry tractors\n(Codified version)\n(Text with EEA relevance)\nTHE EUROPEAN PARLIAMENT AND THE COUNCIL OF THE EUROPEAN UNION,\nHaving regard to the Treaty establishing the European Community, and in particular Article 95 thereof,\nHaving regard to the proposal from the Commission,", "metadata": {"categories_en": "transport, industry, agriculture, forestry and fisheries", "celex_id": "32009L0068", "chunk_strategy": "len_500_o50", "chunk_uid": "667d7d562a67b4d14653c4a602fdb59a", "label_ids": "100154,100160,100156"}}, {"page_content": "COUNCIL DIRECTIVE 93/92/EEC of 29 October 1993 on the installation of lighting and light-signalling devices on two or three-wheel motor vehicles\nTHE COUNCIL OF THE EUROPEAN COMMUNITIES,\nHaving regard to the Treaty establishing the European Economic Community, and in particular Article 100a thereof,\nHaving regard to Directive 92/61/EEC of 30 June 1992 on the type-approval of two or three-wheel motor vehicles(1) ,\nHaving regard to the proposal from the Commission(2) ,", "metadata": {"categories_en": "production, technology and research, transport", "celex_id": "31993L0092", "chunk_strategy": "len_500_o50", "chunk_uid": "b575a20d399eb85b72c683dd92f3f0fa", "label_ids": "100158,100154"}}, {"page_content": "- shall no longer issue the document referred to in the last indent of Article 10 (1) of Directive 70/156/EEC in respect of a type of vehicle if the installation of the said lighting and light-signalling devices does not comply with the provisions of this Directive, except in respect of the category I a and 1 b front direction indicator lamps described in Annex I to Directive 76/756/EEC, item 4.5.3,", "metadata": {"categories_en": "production, technology and research, transport", "celex_id": "31989L0278", "chunk_strategy": "len_500_o50", "chunk_uid": "fe087f3638f6f1808247d9b695ab426a", "label_ids": "100158,100154"}}, {"page_content": "Whereas Council Directive 76/756/EEC of 27 July 1976 on the approximation of the laws of the Member States relating to the installation of lighting and light-signalling devices on motor vehicles and their trailers (4), as last amended by Directive 91/663/EEC (5), established the symbol used to identify the control of headlamp-levelling devices, and this identification shall be maintained;", "metadata": {"categories_en": "production, technology and research, transport, EUROPEAN UNION", "celex_id": "31993L0091", "chunk_strategy": "len_500_o50", "chunk_uid": "1c363a7ca03ecb32005a7bf74a2e5ac9", "label_ids": "100158,100154,100144"}}, {"page_content": "Article 2\nNo Member State may refuse to grant EEC type-approval or national type-approval of a tractor on grounds relating to the installation of lighting and light-signalling devices, whether mandatory or optional, listed in 1.5.7 to 1.5.21 of Annex I if these are installed in accordance with the requirements set out in that Annex.\nArticle 3", "metadata": {"categories_en": "transport, trade, EUROPEAN UNION, agriculture, forestry and fisheries", "celex_id": "31978L0933", "chunk_strategy": "len_500_o50", "chunk_uid": "092598a816187b4e8c94b1dd50d8b19f", "label_ids": "100154,100147,100144,100156"}}, {"page_content": "Article 2\nNo Member State may refuse to grant EEC type-approval or national type-approval of a vehicle on grounds relating to the installation of lighting and light-signalling devices, whether mandatory or optional, listed in 1.5.7 to 1.5.20 of Annex I if these are installed in accordance with the requirements set out in Annex I.\nArticle 3", "metadata": {"categories_en": "transport, trade, EUROPEAN UNION", "celex_id": "31976L0756", "chunk_strategy": "len_500_o50", "chunk_uid": "25037f4491b58c5b791c830b844f6882", "label_ids": "100154,100147,100144"}}, {"page_content": "(121) Suppliers of raw material to the Community industry can be categorised according to the type of products they offer which are mainly special high grade zinc, drosses from the galvanising industry and other zinc waste materials. Special high grade zinc represented 34 % by value of the Community industry's raw material purchases during the IP. However, the Commission did not receive any replies from suppliers of this raw material. It was therefore considered that most probably their", "metadata": {"categories_en": "geography, trade, business and competition, industry", "celex_id": "32001R1827", "chunk_strategy": "len_500_o50", "chunk_uid": "45e689aaa69c44bd05a033a17325c5ca", "label_ids": "100161,100147,100152,100160"}}], "rag_answer": "The answer to your question is: \"The answer is not provided in the retrieved context.\" \n\nThere is no information about the type of material used for devices that illuminate signs according to EU legal instrument in the provided documents.", "generator_model": "llama3.2", "final_k": 20, "candidate_k": 100, "retrieval_source": "prefetch", "prefetch_path": "/home/mwc/Documents/MIOTI/Current/TFM/Data/eval_top10_dedup/prefetch/eval1_baseline/len_500_o50/hyb_fill_dense_then_bm25_ce_r50/000021.json", "query_index": 21}
{"id": "gt_dedup_00022", "question": "What is the condition under which the security for the successful tenderer will not be released?", "reference": "31998R1579", "gold_snippet": "The successful tenderer shall be discharged of all his obligations relating to the lot in question and the securities shall be released only once he has informed the Commission and the intervention agency forthwith in accordance with Annex II; however, if he requests the intervention agency to supply him with another lot of intervention rye of the quality laid down at no additional charge, the security shall not be released", "ground_truth_answer": "If the successful tenderer requests the intervention agency to supply him with another lot of intervention rye of the quality laid down at no additional charge.", "reference_contexts": ["The successful tenderer shall be discharged of all his obligations relating to the lot in question and the securities shall be released only once he has informed the Commission and the intervention agency forthwith in accordance with Annex II; however, if he requests the intervention agency to supply him with another lot of intervention rye of the quality laid down at no additional charge, the security shall not be released"], "retrieved_documents": [{"page_content": "Article 12\n1. The security shall be released when: (a) the tenderers have not been awarded the goods ; or\n(b) the successful tenderer has satisfied, except in case of force majeure, the obligations laid down by this Regulation, and, where appropriate, other conditions compatible with the provisions of this Regulation, laid down by the Member State concerned, and where the quantity taken over is at least 99 % of the quantity placed at his disposal.", "metadata": {"categories_en": "trade, agri-foodstuffs", "celex_id": "31982R3418", "chunk_strategy": "len_500_o50", "chunk_uid": "ff8e54a2ba9ecfa3ab420e44bfecf8a0", "label_ids": "100147,100157"}}, {"page_content": "- refuse to take over the lot concerned. The successful tenderer shall be discharged of all obligations relating to the lot in question and the securities shall be released provided the Commission and the intervention agency are immediately notified in accordance with Annex II; however, if the successful tenderer requests the intervention agency to supply another lot of intervention barley of the quality laid down at no additional charge, the security shall not be released. The lot must be", "metadata": {"categories_en": "trade, agri-foodstuffs, geography", "celex_id": "32002R2177", "chunk_strategy": "len_500_o50", "chunk_uid": "2b1ec9e3b489dffc27c4bb77dd363264", "label_ids": "100147,100157,100161"}}, {"page_content": "Article 8\nShould the cases mentioned in Article 7(2)(b) and 7(3) arise, the successful tenderer may ask the intervention agency to supply an alternative lot of barley of the requisite quality, at no extra cost. In that case, the security shall not be released. The lot must be replaced within three days of the date of the successful tenderer's request. The successful tenderer shall immediately inform the Commission thereof using the form in Annex I.", "metadata": {"categories_en": "trade, agri-foodstuffs, geography", "celex_id": "32006R0362", "chunk_strategy": "len_500_o50", "chunk_uid": "eedd2b812ccf26f7463b33a8f9b6ef1a", "label_ids": "100147,100157,100161"}}, {"page_content": "refuse to take over the lot concerned. The successful tenderer shall be discharged of all obligations relating to the lot in question and the securities shall be released provided the Commission and the intervention agency are immediately notified in accordance with Annex II; however, if the successful tenderer requests the intervention agency to supply another lot of intervention barley of the quality laid down at no additional charge, the security shall not be released. The lot must be", "metadata": {"categories_en": "trade, geography, agri-foodstuffs", "celex_id": "32005R0462", "chunk_strategy": "len_500_o50", "chunk_uid": "71b1db118c7b830571cd74d72eb3ec5d", "label_ids": "100147,100161,100157"}}, {"page_content": "Article 40\n1. Except in cases of force majeure, the tendering security shall be released only for the quantity for which:\n(a) the successful tenderer:\n- after fulfilling the requirements, has applied for either a certificate or a licence,\n- has lodged the security or provided the negotiable instrument referred to in Article 35(2),\n- has removed the sugar from storage within the time limit laid down, or\n(b) no award is made.\n2. The security shall be released immediately.", "metadata": {"categories_en": "finance, trade, agri-foodstuffs", "celex_id": "32001R1262", "chunk_strategy": "len_500_o50", "chunk_uid": "2fc4c6ca599b9894d62d52c7f466ffd0", "label_ids": "100148,100147,100157"}}, {"page_content": "2. Except in cases of force majeure, the security referred to in Article 51(2) shall be released only for the quantity for which the successful tenderer has paid the purchase price to the account of the intervention agency within the time limit referred to in paragraph 1 of this Article. The security shall be released immediately.\n3. In cases of force majeure, the intervention agency shall determine the measures necessary in view of the circumstances invoked by the successful tenderer.", "metadata": {"categories_en": "finance, agri-foodstuffs, production, technology and research, trade, agriculture, forestry and fisheries", "celex_id": "32006R0952", "chunk_strategy": "len_500_o50", "chunk_uid": "600fa30609562bec1fc888dd6684f2b1", "label_ids": "100148,100157,100158,100147,100156"}}, {"page_content": "Article 9\nTendering securities shall be released:\n(a) where tenders are not accepted;\n(b) when the successful tenderer has provided proof that the security provided for in Article 10 of Commission Regulation (EC) No 1162/95 (1) has been submitted.\nWhere the undertaking provided for in Article 5 (3) (b) hereof is not fulfilled, the tendering security shall be forfeited except in cases of force majeure.\nArticle 10", "metadata": {"categories_en": "finance, trade, agri-foodstuffs, agriculture, forestry and fisheries", "celex_id": "31995R1501", "chunk_strategy": "len_500_o50", "chunk_uid": "8e11c7f83dac86d38a9595e45d894b28", "label_ids": "100148,100147,100157,100156"}}, {"page_content": "2. Article 7 is replaced by the following:\n'Article 7\nThe tendering security shall be released where:\n(a) the tender has not been accepted;\n(b) the successful tenderer provided proof that the security provided for in Article 12 of Commission Regulation (EEC) No 891/89 (5*) has been lodged.\nWhere the undertaking referred to in Article 2 (3) (b) is not complied with the tendering security shall, except in cases of force majeure, be forfeit.`\nArticle 2", "metadata": {"categories_en": "finance, law, agri-foodstuffs, politics, trade", "celex_id": "31995R0299", "chunk_strategy": "len_500_o50", "chunk_uid": "302232f43156afb313e212833d045879", "label_ids": "100148,100145,100157,100142,100147"}}, {"page_content": "3. (a) The tendering security shall be released immediately if the tender has not been accepted or if the successful tenderer has met the conditions laid down in paragraph 1 (a);\n(b) The performance guarantee shall be released immediately by each of the intervention agencies holding the alcohol once the successful tenderer provides each of those intervention agencies, in respect of the quantity removed in question, with the proof required to that end by Title V of Regulation (EEC) No 2220/85.", "metadata": {"categories_en": "trade, business and competition, agri-foodstuffs", "celex_id": "31993R0377", "chunk_strategy": "len_500_o50", "chunk_uid": "1463f614e31d48d86e8152410ff8ccfe", "label_ids": "100147,100152,100157"}}, {"page_content": "Article 10\nTendering securities shall be released:\n(a) where tenders are not accepted;\n(b) when the successful tenderer provided proof that the security provided for in Article 12 of Regulation (EEC) No 891/89 (10) has been submitted.\nWhere the undertaking provided for in Article 6 (3) (b) hereof is not fulfilled, the tendering security shall be forfeited except in cases of force majeure.\nArticle 11", "metadata": {"categories_en": "trade, agri-foodstuffs", "celex_id": "31993R1533", "chunk_strategy": "len_500_o50", "chunk_uid": "deed0aaadeeed67012ab91da96e65a9d", "label_ids": "100147,100157"}}, {"page_content": "of the quality laid down, without additional charges. In this case, the security shall not be released. The lot must be replaced within a maximum of three days from the date of the successful tenderer's request. The successful tenderer shall immediately inform the Commission thereof in accordance with Annex V.", "metadata": {"categories_en": "trade, geography, agri-foodstuffs", "celex_id": "31995R2372", "chunk_strategy": "len_500_o50", "chunk_uid": "b744eb0be2aff61cb77607219efe8596", "label_ids": "100147,100161,100157"}}, {"page_content": "Article 17\n1. Save in cases of force majeure, the security for tender shall be released only in respect of that quantity: (a) in respect of which the tenderer - has not withdrawn his tender before the award of contracts, and\n- has, within the period prescribed, paid the amount corresponding to his tender and provided the processing security ; or\n(b) in respect of which his tender has not been accepted.", "metadata": {"categories_en": "trade, agri-foodstuffs, agriculture, forestry and fisheries", "celex_id": "31977R0368", "chunk_strategy": "len_500_o50", "chunk_uid": "bce9149f15816a9ca098a3a9db0f1ae2", "label_ids": "100147,100157,100156"}}, {"page_content": "of the quality laid down at no additional charge. In that case, the security shall not be released. The lot must be replaced within three days of the date of the successful tenderer's request. The successful tenderer shall immediately inform the Commission thereof in accordance with Annex II.", "metadata": {"categories_en": "trade, geography, agri-foodstuffs, international relations", "celex_id": "32001R2441", "chunk_strategy": "len_500_o50", "chunk_uid": "36146f20af9512fff3ab543a5cb33824", "label_ids": "100147,100161,100157,100143"}}, {"page_content": "of the quality laid down at no additional charge. In that case, the security shall not be released. The lot must be replaced within three days of the date of the successful tenderer's request. The successful tenderer shall immediately inform the Commission thereof in accordance with Annex II.", "metadata": {"categories_en": "trade, agri-foodstuffs, geography", "celex_id": "31998R1579", "chunk_strategy": "len_500_o50", "chunk_uid": "2757d56d75a649e45f996bef3820be71", "label_ids": "100147,100157,100161"}}, {"page_content": "of the quality laid down at no additional charge. In that case, the security shall not be released. The lot must be replaced within three days of the date of the successful tenderer's request. The successful tenderer shall immediately inform the Commission thereof in accordance with Annex II.", "metadata": {"categories_en": "trade, agri-foodstuffs, international relations, EUROPEAN UNION", "celex_id": "32002R1080", "chunk_strategy": "len_500_o50", "chunk_uid": "572d152ce584dcbcba4d0a59a604ec37", "label_ids": "100147,100157,100143,100144"}}, {"page_content": "of the quality laid down at no additional charge. In that case, the security shall not be released. The lot must be replaced within three days of the date of the successful tenderer's request. The successful tenderer shall immediately inform the Commission thereof in accordance with Annex II.", "metadata": {"categories_en": "trade, geography, agri-foodstuffs, international relations", "celex_id": "32001R2440", "chunk_strategy": "len_500_o50", "chunk_uid": "5d568a09967af1c16165109e243ae1ec", "label_ids": "100147,100161,100157,100143"}}, {"page_content": "3. In the cases provided for in the second indent of the second subparagraph of paragraph 2 and in the third subparagraph thereof, the successful tenderer may request the intervention agency to supply another lot of intervention sorghum of the quality laid down at no additional charge. In that case, the security shall not be released. The lot must be replaced within three days of the date of the successful tenderer's request. The successful tenderer shall immediately inform the Commission", "metadata": {"categories_en": "trade, geography, agri-foodstuffs", "celex_id": "32003R1066", "chunk_strategy": "len_500_o50", "chunk_uid": "b3ef00f76eec89125b6631c961a00339", "label_ids": "100147,100161,100157"}}, {"page_content": "3) (a) The tendering security shall be released immediately if the tender has not been accepted or if the successful tenderer has met the requirements laid down in paragraph 1(a).\n(b) The performance guarantee shall be released immediately by each of the intervention agencies holding alcohol once the successful tenderer provides them each with the proof required in points 2 and 3 and in Title V of Regulation (EEC) No 2220/85, for the relevant quantity removed.", "metadata": {"categories_en": "EUROPEAN UNION, agri-foodstuffs, agriculture, forestry and fisheries", "celex_id": "32000R1623", "chunk_strategy": "len_500_o50", "chunk_uid": "6a30cd5dcf28e5c58b55ccae8fffc1ba", "label_ids": "100144,100157,100156"}}, {"page_content": "of intervention rye of the quality laid down at no additional charge. In that case, the security shall not be released. The lot must be replaced within three days of the date of the successful tenderer's request. The successful tenderer shall immediately inform the Commission thereof in accordance with Annex II.", "metadata": {"categories_en": "trade, geography, agri-foodstuffs", "celex_id": "32004R1185", "chunk_strategy": "len_500_o50", "chunk_uid": "41c660dfe26deedd3447a5c19cb83deb", "label_ids": "100147,100161,100157"}}, {"page_content": "quality laid down, without additional charges. In this case, the security shall not be released. The lot must be replaced within a maximum of three days from the date of the successful tenderer's request. The successful tenderer shall immediately inform the Commission thereof in accordance with Annex V.", "metadata": {"categories_en": "trade, geography, agri-foodstuffs", "celex_id": "32001R0931", "chunk_strategy": "len_500_o50", "chunk_uid": "a2d4050987b9b32423ae50c418581a62", "label_ids": "100147,100161,100157"}}], "rag_answer": "The answer is provided in Document 2 (CELEX: 32002R2177) and Document 3 (CELEX: 32006R0362). \n\nAccording to these documents, the security for the successful tenderer will not be released if the successful tenderer requests the intervention agency to supply another lot of barley of the quality laid down at no additional charge.", "generator_model": "llama3.2", "final_k": 20, "candidate_k": 100, "retrieval_source": "prefetch", "prefetch_path": "/home/mwc/Documents/MIOTI/Current/TFM/Data/eval_top10_dedup/prefetch/eval1_baseline/len_500_o50/hyb_fill_dense_then_bm25_ce_r50/000022.json", "query_index": 22}
{"id": "gt_dedup_00023", "question": "What was the primary goal for the 'base' amount in determining remuneration payable to a dealer?", "reference": "32002D0405", "gold_snippet": "s the fixing of the \"base\", because it was the amount by which this was exceeded that determined the maximum amount of remuneration payable. It was therefore in the dealer's interest that the base should be set at the lowest possible level so that he might achieve it easily. It was in Michelin's interest, on the other hand, that it should be s", "ground_truth_answer": "The base amount was set at the lowest possible level so that the dealer could easily achieve it and thus maximize his remuneration.", "reference_contexts": ["s the fixing of the \"base\", because it was the amount by which this was exceeded that determined the maximum amount of remuneration payable. It was therefore in the dealer's interest that the base should be set at the lowest possible level so that he might achieve it easily. It was in Michelin's interest, on the other hand, that it should be s"], "retrieved_documents": [{"page_content": "(a) the key feature of the bonus and one of the key elements in the discussion about annual commitments was the fixing of the \"base\", because it was the amount by which this was exceeded that determined the maximum amount of remuneration payable. It was therefore in the dealer's interest that the base should be set at the lowest possible level so that he might achieve it easily. It was in Michelin's interest, on the other hand, that it should be set at the highest possible level so as to", "metadata": {"categories_en": "finance, law, business and competition, industry, EUROPEAN UNION", "celex_id": "32002D0405", "chunk_strategy": "len_500_o50", "chunk_uid": "6e10e5fa71b3f5bca1e6bbabb8ed65d2", "label_ids": "100148,100145,100152,100160,100144"}}, {"page_content": "(259) The service bonus was abolished in 1997.\n(c) The progress bonus\n(260) This bonus, like the \"achieved-target bonus\" which replaced it in 1997 and 1998, was particularly abusive since, in order to obtain it, the dealer had to commit himself to a minimum amount of purchases (called the base) corresponding either to the previous year's purchases or to the average of the last two or three years (with adjustments in coefficients).", "metadata": {"categories_en": "finance, law, business and competition, industry, EUROPEAN UNION", "celex_id": "32002D0405", "chunk_strategy": "len_500_o50", "chunk_uid": "145bfa1d77651400bfbf8d6455db3261", "label_ids": "100148,100145,100152,100160,100144"}}, {"page_content": "(266) The progress bonus made it possible to obtain annual rebates, provided that an individual objective (the base) established by reference to the specific situation of each dealer (in particular, previous purchase figures) was exceeded. As a result, two dealers who during the year had purchased the same quantities in absolute terms could obtain very different rebates depending on the initial base, the method chosen by Michelin to calculate the base and what was agreed in subsequent", "metadata": {"categories_en": "finance, law, business and competition, industry, EUROPEAN UNION", "celex_id": "32002D0405", "chunk_strategy": "len_500_o50", "chunk_uid": "ec02ca7fc1a6709a376f428282af5308", "label_ids": "100148,100145,100152,100160,100144"}}, {"page_content": "(77) A specific scale applied in which the bonus was sandwiched between a threshold and a ceiling. Dealers could thus generally obtain a progress bonus of 1 % (threshold) of annual turnover (truck/earthmover/light plant) simply by achieving the base, up to a maximum of 3 % if they exceeded the base by 15 % (ceiling).", "metadata": {"categories_en": "finance, law, business and competition, industry, EUROPEAN UNION", "celex_id": "32002D0405", "chunk_strategy": "len_500_o50", "chunk_uid": "9723731f0021c83d23a4c1be7026e060", "label_ids": "100148,100145,100152,100160,100144"}}, {"page_content": "the base and what was agreed in subsequent negotiations. Since the criteria for establishing the bases were neither applied uniformly nor known in advance by dealers, and given Michelin's clear influence on the final determination of the base, the system involved a manifest factor of insecurity and allowed discrimination between dealers which must be regarded as unfair.", "metadata": {"categories_en": "finance, law, business and competition, industry, EUROPEAN UNION", "celex_id": "32002D0405", "chunk_strategy": "len_500_o50", "chunk_uid": "6b02880653aa947db3a14bb7fd7009c0", "label_ids": "100148,100145,100152,100160,100144"}}, {"page_content": "(268) As from 1995, the end-of-year pressure increased considerably. If he achieved the base, the dealer obtained not only a rebate of 0,5 % on the total amount of truck/earthmover tyres purchased, but also continued to receive bonuses of 12 % to 15 % on purchases in excess of the minimum established in the base. The incentive to exceed the base by 20 % was even stronger, since the dealer was then entitled to rebates ranging from 2 % to 2,5 % of his total annual turnover with Michelin.", "metadata": {"categories_en": "finance, law, business and competition, industry, EUROPEAN UNION", "celex_id": "32002D0405", "chunk_strategy": "len_500_o50", "chunk_uid": "3bcca4340d3b9333a53bfd114901b372", "label_ids": "100148,100145,100152,100160,100144"}}, {"page_content": "car, the category of dealer and the percentage of target attained.", "metadata": {"categories_en": "industry, business and competition, law, trade, EUROPEAN UNION", "celex_id": "32006D0431", "chunk_strategy": "len_500_o50", "chunk_uid": "641dcb2bf51cbdd62c2dc70db75dc190", "label_ids": "100160,100152,100145,100147,100144"}}, {"page_content": "(68) The progress bonus was intended to reward dealers who agreed at the beginning of the year to undertake in writing to exceed a \"minimum base, fixed by common agreement, depending on past performance and future prospects\" and who managed to exceed it. The base was proposed each year and was negotiated with the dealer.\n(69) To calculate the bonus Michelin used the following formula:\nREFERENCE TO A GRAPHIC", "metadata": {"categories_en": "finance, law, business and competition, industry, EUROPEAN UNION", "celex_id": "32002D0405", "chunk_strategy": "len_500_o50", "chunk_uid": "d9393c8a7e84e43185c418d8e5f7dccf", "label_ids": "100148,100145,100152,100160,100144"}}, {"page_content": "(269) The end-of-year pressure on dealers whose purchase volumes had enabled them to sign a commercial agreement was also very marked during the period examined. In addition to the steps in the quantity rebates, the progress bonus enabled them to obtain large additional, progressive rebates, merely as a result of achieving or exceeding the base. Achieving the base meant obtaining 1 % of the \"truck/earthmover/forklift/light plant\" turnover by way of \"support for industrial products\"(34).", "metadata": {"categories_en": "finance, law, business and competition, industry, EUROPEAN UNION", "celex_id": "32002D0405", "chunk_strategy": "len_500_o50", "chunk_uid": "8d84cd925c38723db3139527c10075c2", "label_ids": "100148,100145,100152,100160,100144"}}, {"page_content": "approach as a basis for the proposed remuneration.", "metadata": {"categories_en": "finance, geography, economics, business and competition", "celex_id": "32006D0739", "chunk_strategy": "len_500_o50", "chunk_uid": "7211c89c8b5c1d5f6ceb8cecff82bac9", "label_ids": "100148,100161,100146,100152"}}, {"page_content": "(73) If a dealer managed only to achieve sales equal to the \"base\", he nevertheless received a bonus worth 0,5 % of all tyres bought.\n(74) To understand fully how this bonus operated, two of its aspects must be brought to the fore:", "metadata": {"categories_en": "finance, law, business and competition, industry, EUROPEAN UNION", "celex_id": "32002D0405", "chunk_strategy": "len_500_o50", "chunk_uid": "142ff0e778500b4cb5f126cfb3863d1b", "label_ids": "100148,100145,100152,100160,100144"}}, {"page_content": "at the start of the year, since the minimum base included a number of steps, with a commitment to purchase greater quantities entitling the dealer to higher rebates. Secondly, at the end of the year, to exceed the minimum set and to exceed it by as large an amount as possible (up to 25 %), since the size of the rebates that could be obtained, while potentially certainly very large, depended on the degree to which the base was exceeded.", "metadata": {"categories_en": "finance, law, business and competition, industry, EUROPEAN UNION", "celex_id": "32002D0405", "chunk_strategy": "len_500_o50", "chunk_uid": "8c1ebaf8beefb29a696cfdd27ef96a27", "label_ids": "100148,100145,100152,100160,100144"}}, {"page_content": "(44) Bonuses are generally calculated as a proportional or lump-sum remuneration which is paid to the dealer by his supplier at regular intervals for each vehicle sold in accordance with the relevant conditions. Bonus payments depend on the achievement of certain qualitative and quantitative targets. Commonly used quantitative targets are a stated market share and the achievement of the dealer's sales forecast within his contract territory. Qualitative targets are usually customer related, or", "metadata": {"categories_en": "industry, business and competition, trade, geography, EUROPEAN UNION", "celex_id": "32001D0146", "chunk_strategy": "len_500_o50", "chunk_uid": "b5e8c3cd8eafe4d510797d6890a009ae", "label_ids": "100160,100152,100147,100161,100144"}}, {"page_content": "In the Netherlands, dealers’ remuneration was made up of a fixed part (the margin on invoices (3)) and a part linked to the dealer’s results (the bonus (4)), which the dealer needed in order to earn a profit from his business. This bonus could be obtained by a Dutch dealer only if the cars he sold were registered in the Netherlands. The system introduced by Peugeot distinguished between two phases of the bonus grant mechanism. Acquisition of entitlement to the bonus was based on a progressive", "metadata": {"categories_en": "industry, business and competition, law, trade, EUROPEAN UNION", "celex_id": "32006D0431", "chunk_strategy": "len_500_o50", "chunk_uid": "8af7eaa7cc7533c1da23abe3cac32725", "label_ids": "100160,100152,100145,100147,100144"}}, {"page_content": "(582) The dealer is remunerated through a commission based on sales volumes and unrelated to pump price. The agent receives only a margin on every sale, of typically about 2,5 to 3 pfennig per litre for dealer operated and 5 pfennig per litre for dealer-owned stations. The commission is higher for dealer-owned stations because the dealer has then to bear more costs than in a company-owned station.", "metadata": {"categories_en": "education and communications, business and competition, industry, energy", "celex_id": "32004D0284", "chunk_strategy": "len_500_o50", "chunk_uid": "188364094a0420cf5f32ad7f2b131a22", "label_ids": "100150,100152,100160,100159"}}, {"page_content": "In general, the 'targets' were fixed in such a way that the highest 'target' set for a given year was higher than the amount of purchases made in the previous year, while the corresponding bonus figure did not in most cases show any increase. Pressure was thus put on the dealer to endeavour to sell more Michelin tyres every year so as to obtain at least the same annual bonus.", "metadata": {"categories_en": "industry, business and competition, geography", "celex_id": "31981D0969", "chunk_strategy": "len_500_o50", "chunk_uid": "07331bc848fd693bbe35f12a86002ff1", "label_ids": "100160,100152,100161"}}, {"page_content": "(123) Together with the dealer margin, the bonus forms the basis of the calculations which each dealer carries out in order to determine how he can economically provide for the sale of vehicles and the associated operating costs (sales staff, showrooms, advertising, etc.) linked to his business. The dealer margin and the bonus condition the dealer's room for manoeuvre on prices in his negotiations with customers.", "metadata": {"categories_en": "industry, business and competition, trade, geography, EUROPEAN UNION", "celex_id": "32001D0146", "chunk_strategy": "len_500_o50", "chunk_uid": "b611a694cae1d8d77ae86d210590cbed", "label_ids": "100160,100152,100147,100161,100144"}}, {"page_content": "by way of \"support for industrial products\"(34). Exceeding the base entitled the dealer to progressive rebates of up to 3 % of the figure if the base was exceeded by 15 %.", "metadata": {"categories_en": "finance, law, business and competition, industry, EUROPEAN UNION", "celex_id": "32002D0405", "chunk_strategy": "len_500_o50", "chunk_uid": "ba2163e7b817f8d65f434da55b8a2161", "label_ids": "100148,100145,100152,100160,100144"}}, {"page_content": "payment of the advance bonus and of the fixed monthly bonus was based on expected annual sales (laid down in the 'target'), of a given number of tyres. If the relevant dealer's sales were not on course to meet the target, NBIM reserved the right to alter the bonus terms in the interim and/or to request repayment of advances already received. To what extent this happened, only NBIM can say. It was also possible for the bonus to be increased if the dealer exceeded his target. In general, the", "metadata": {"categories_en": "industry, business and competition, geography", "celex_id": "31981D0969", "chunk_strategy": "len_500_o50", "chunk_uid": "6831cb0790a4b345d3f8cca219b7ac8d", "label_ids": "100160,100152,100161"}}, {"page_content": "(69) When the new Audi A 4 was being launched Autogerma decided to change the system of dealer's margins. In place of the basic discount of 15 % that had applied to the old Audi 80 model, which was payable immediately, that is on the invoice, the new basic margin, known as the 'sconto in fattura` (invoice discount) or 'sconto base/immediato` (basic/immediate discount), would amount to only 10 %. The remaining 5 % 'sconto differito a breve` (short-term deferred discount) would be paid after two", "metadata": {"categories_en": "industry, law, transport, trade, geography, EUROPEAN UNION", "celex_id": "31998D0273", "chunk_strategy": "len_500_o50", "chunk_uid": "df075fb5d78561c3a24f4046cdb61f53", "label_ids": "100160,100145,100154,100147,100161,100144"}}], "rag_answer": "The primary goal for the \"base\" amount in determining remuneration payable to a dealer was to set a minimum target that dealers had to exceed in order to obtain a bonus. According to Document 8, the base was proposed each year and was negotiated with the dealer, and it was intended to reward dealers who agreed at the beginning of the year to undertake in writing to exceed a \"minimum base\" (Document 8, paragraph 68).", "generator_model": "llama3.2", "final_k": 20, "candidate_k": 100, "retrieval_source": "prefetch", "prefetch_path": "/home/mwc/Documents/MIOTI/Current/TFM/Data/eval_top10_dedup/prefetch/eval1_baseline/len_500_o50/hyb_fill_dense_then_bm25_ce_r50/000023.json", "query_index": 23}
{"id": "gt_dedup_00024", "question": "What are some of the places mentioned as being part of the provinces of Padova and Verona?", "reference": "32003L0021", "gold_snippet": "olo di Po, Giacciano con Baruchella, Bosaro, Canaro, Lusia, Pincara, Stienta, Gaiba, Salara, and in the province of Padova the communes Castelbaldo, Barbona, Piacenza d'Adige, Vescovana, S. Urbano, Boara Pisani, Masi, and in the province of Verona the communes of Palù, Roverchiara, Legnago, Castagnaro, Ronco all'Adi", "ground_truth_answer": "These include communes such as Castelbaldo, Barbona, Piacenza d'Adige, Vescovana, S. Urbano, Boara Pisani, Masi in the province of Padova, and Palù, Roverchiara, Legnago, Castagnaro, Ronco all'Adi in the province of Verona.", "reference_contexts": ["olo di Po, Giacciano con Baruchella, Bosaro, Canaro, Lusia, Pincara, Stienta, Gaiba, Salara, and in the province of Padova the communes Castelbaldo, Barbona, Piacenza d'Adige, Vescovana, S. Urbano, Boara Pisani, Masi, and in the province of Verona the communes of Palù, Roverchiara, Legnago, Castagnaro, Ronco all'Adi"], "retrieved_documents": [{"page_content": "Guarda Veneta, Frassinelle Polesine, Villanova del Ghebbo, Fiesso Umbertiano, Castelguglielmo, Bagnolo di Po, Giacciano con Baruchella, Bosaro, Canaro, Lusia, Pincara, Stienta, Gaiba, Salara, and in the province of Padova the communes Castelbaldo, Barbona, Piacenza d'Adige, Vescovana, S. Urbano, Boara Pisani, Masi, and in the province of Verona the communes of Palù, Roverchiara, Legnago, Castagnaro, Ronco all'Adige, Villa Bartolomea, Oppeano, Terrazzo, Isola Rizza, Angiari), Latvia, Lithuania,", "metadata": {"categories_en": "environment, geography, science, agriculture, forestry and fisheries", "celex_id": "32004D0522", "chunk_strategy": "len_500_o50", "chunk_uid": "98e451553b1ca3d8ac34715244897d45", "label_ids": "100155,100161,100151,100156"}}, {"page_content": "and, until 31 March 2010, Ireland, Italy (Apúlia, Emilia-Romagna (the provinces of Parma and Piacenza), Lombardy (except the province of Mantua), Veneto (except the provinces of Rovigo and Venice, the communes Castelbaldo, Barbona, Piacenza d’Adige, Vescovana, S. Urbano, Boara Pisani and Masi in the province of Padova and the area situated to the South of highway A4 in the province of Verona)), Lithuania, Slovenia (except the regions Gorenjska, Koroška, Maribor and Notranjska), Slovakia (except", "metadata": {"categories_en": "environment, geography, science, agriculture, forestry and fisheries", "celex_id": "32010R0017", "chunk_strategy": "len_500_o50", "chunk_uid": "d70d507e750ffcafd3d0a1e53a796603", "label_ids": "100155,100161,100151,100156"}}, {"page_content": "Ceneselli, Pontecchio Polesine, Arquà Polesine, Costa di Rovigo, Occhiobello, Lendinara, Canda, Ficarolo, Guarda Veneta, Frassinelle Polesine, Villanova del Ghebbo, Fiesso Umbertiano, Castelguglielmo, Bagnolo di Po, Giacciano con Baruchella, Bosaro, Canaro, Lusia, Pincara, Stienta, Gaiba, Salara, and in the province of Padova the communes Castelbaldo, Barbona, Piacenza d’Adige, Vescovana, S. Urbano, Boara Pisani, Masi, and in the province of Verona the communes Palù, Roverchiara, Legnago,", "metadata": {"categories_en": "environment, science, agriculture, forestry and fisheries", "celex_id": "32006L0036", "chunk_strategy": "len_500_o50", "chunk_uid": "be21f70172fa62ace0d88d0b62f13fed", "label_ids": "100155,100151,100156"}}, {"page_content": "Veneta, Frassinelle Polesine, Villanova del Ghebbo, Fiesso Umbertiano, Castelguglielmo, Bagnolo di Po, Giacciano con Baruchella, Bosaro, Canaro, Lusia, Pincara, Stienta, Gaiba, Salara, and in the province of Padova the communes Castelbaldo, Barbona, Piacenza d'Adige, Vescovana, S. Urbano, Boara Pisani, Masi, and in the province of Verona the communes of Palù, Roverchiara, Legnago, Castagnaro, Ronco all'Adige, Villa Bartolomea, Oppeano, Terrazzo, Isola Rizza, Angiari), and for Austria", "metadata": {"categories_en": "environment, geography, science, agriculture, forestry and fisheries", "celex_id": "32003L0021", "chunk_strategy": "len_500_o50", "chunk_uid": "ef38976ad7d819974b48988a51af19a4", "label_ids": "100155,100161,100151,100156"}}, {"page_content": "Italy has now submitted to the Commission documentation demonstrating compliance with the appropriate conditions provided for in Directive 64/432/EEC as regards the Region of Emilia-Romagna, the provinces of Novara and Verbania in the Region of Piemonte, the provinces of Livorno, Lucca and Siena in the Region of Toscana and the provinces of Belluno and Padova in the Region of Veneto in order that those provinces and that region may be declared officially tuberculosis-free regions of a Member", "metadata": {"categories_en": "geography, agriculture, forestry and fisheries", "celex_id": "32007D0174", "chunk_strategy": "len_500_o50", "chunk_uid": "62cda1029a119b220ea4dc83646521ed", "label_ids": "100161,100156"}}, {"page_content": "Ficarolo, Guarda Veneta, Frassinelle Polesine, Villanova del Ghebbo, Fiesso Umbertiano, Castelguglielmo, Bagnolo di Po, Giacciano con Baruchella, Bosaro, Canaro, Lusia, Pincara, Stienta, Gaiba, Salara, and in the province of Padova the communes Castelbaldo, Barbona, Piacenza d'Adige, Vescovana, S. Urbano, Boara Pisani, Masi, and in the province of Verona the communes of Palù, Roverchiara, Legnago, Castagnaro, Ronco all'Adige, Villa Bartolomea, Oppeano, Terrazzo, Isola Rizza, Angiari), and for", "metadata": {"categories_en": "environment, geography, science, agriculture, forestry and fisheries", "celex_id": "32004L0032", "chunk_strategy": "len_500_o50", "chunk_uid": "5cae7259f1ec21d79d62c019e75637b0", "label_ids": "100155,100161,100151,100156"}}, {"page_content": "Occhiobello, Lendinara, Canda, Ficarolo, Guarda Veneta, Frassinelle Polesine, Villanova del Ghebbo, Fiesso Umbertiano, Castelguglielmo, Bagnolo di Po, Giacciano con Baruchella, Bosaro, Canaro, Lusia, Pincara, Stienta, Gaiba, Salara, and in the province of Padova the communes Castelbaldo, Barbona, Piacenza d'Adige, Vescovana, S. Urbano, Boara Pisani, Masi, and in the province of Verona the communes of Palù, Roverchiara, Legnago (the portion of the communal territory situated to the north east of", "metadata": {"categories_en": "environment, geography, science, agriculture, forestry and fisheries", "celex_id": "32002L0029", "chunk_strategy": "len_500_o50", "chunk_uid": "577fe57a006642df135430d6101d31e4", "label_ids": "100155,100161,100151,100156"}}, {"page_content": "Whereas there have been no outbreaks in the province of Verona since 27 March 1993 or Lecce since 15 March 1993, and no outbreaks at all in the provinces of Bari, Brindisi, Foggio, Taranto and Reggio Di Calabria; whereas the restrictions may be lifted in these provinces;\nWhereas the measures provided for in this Decision are in accordance with the opinion of the Standing Veterinary Committee,\nHAS ADOPTED THIS DECISION:\nArticle 1\nDecision 93/180/EEC is hereby amended as follows:", "metadata": {"categories_en": "geography, agri-foodstuffs, agriculture, forestry and fisheries", "celex_id": "31993D0241", "chunk_strategy": "len_500_o50", "chunk_uid": "82e2f00203a9386f7c755f687e02c92f", "label_ids": "100161,100157,100156"}}, {"page_content": "CHAPTER 5\nItaly\n- Alessandria, Asti, Cuneo, Novara, Torino and Vercelli (Piedmont region),\n- Valle d'Aosta,\n- Bergamo, Brescia, Como, Cremona, Mantova, Milan, Pavia, Sondrio et Varese (Lombardy region),\n- Bolzano and Trento (Trentino-Alto Adige region),\n- Belluno, Padua, Rovigo, Treviso, Venezia, Verona and Vicenza (Veneto region),\n- Gorizia, Pordenone, Trieste and Udine (region of Friuli Venezia Giulia),\n- Genova, Imperia, La Spezia and Savona (region of Liguria),", "metadata": {"categories_en": "social questions, agriculture, forestry and fisheries", "celex_id": "31989D0020", "chunk_strategy": "len_500_o50", "chunk_uid": "8fa7c7be04ff714a45f7d33c980856bc", "label_ids": "100149,100156"}}, {"page_content": "HAS ADOPTED THIS REGULATION:\nArticle 1\nNotwithstanding Article 21 (3) of Regulation (EEC) No 822/87, for the 1994/95 wine year, producers of wine from fresh grapes from the provinces of Verona (Veneto) and Piacenza (Emilia Romagna) which has been enriched in accordance with Articles 18 and 19 of the abovementioned Regulation may carry out the oenological practice of acidification in accordance with the conditions and limits laid down in Article 21 (1) of that same Regulation.\nArticle 2", "metadata": {"categories_en": "environment, geography, agri-foodstuffs, agriculture, forestry and fisheries", "celex_id": "31995R0878", "chunk_strategy": "len_500_o50", "chunk_uid": "05f46b8d0b9fa9c9c44a2e3af676fdf0", "label_ids": "100155,100161,100157,100156"}}, {"page_content": "-\nthe provinces of Agrigento, Avellino, Bari, Benevento, Brindisi, Cagliari, Caltanissetta, Campobasso, Caserta, Catania, Catanzaro, Cosenza, Crotone Enna, Foggia, Frosinone, Isernia, Lecce, Massa, Matera, Messina, Napoli, Nuoro, Oristano, Palermo, Potenza, Reggio Calabria, Salerno, Sassari Siracusa, Taranto, Trapani, Vibo Valentia and Viterbo;\n-\nthe municipalities of Tivoli (Rome), Formia (Latina), Sora (Frosinone) and Cassino (Frosinone).\n(10)", "metadata": {"categories_en": "finance, geography, economics, business and competition", "celex_id": "32005D0655", "chunk_strategy": "len_500_o50", "chunk_uid": "5e36830564bbbee08bd5e0bef74ba600", "label_ids": "100148,100161,100146,100152"}}, {"page_content": "-\nCagliari-Verona and Verona-Cagliari\n-\nCagliari-Naples and Naples-Cagliari\n-\nCagliari-Palermo and Palermo-Cagliari\n-\nOlbia-Rome and Rome-Olbia\n-\nOlbia-Milan and Milan-Olbia\n-\nOlbia-Bologna and Bologna-Olbia\n-\nOlbia-Turin and Turin-Olbia\n-\nOlbia-Verona and Verona-Olbia\n-", "metadata": {"categories_en": "business and competition, transport, trade, employment and working conditions, geography", "celex_id": "32005D0247", "chunk_strategy": "len_500_o50", "chunk_uid": "5dff01fad1ea4acfb833703f53800ff5", "label_ids": "100152,100154,100147,100153,100161"}}, {"page_content": "Verona the communes Palù, Roverchiara, Legnago, Castagnaro, Ronco all’Adige, Villa Bartolomea, Oppeano, Terrazzo, Isola Rizza, Angiari), Lithuania, Austria (Burgenland, Carinthia, Lower Austria, Tirol (administrative district Lienz), Styria, Vienna), Slovenia (except the Gorenjska and Maribor regions), Slovakia (except the communes of Blahová, Horné Mýto and Okoč (Dunajská Streda County), Hronovce and Hronské Kľačany (Levice County), Veľké Ripňany (Topoľčany County), Málinec (Poltár County),", "metadata": {"categories_en": "environment, science, agriculture, forestry and fisheries", "celex_id": "32006L0036", "chunk_strategy": "len_500_o50", "chunk_uid": "785b5aae979f1cc3df93da428bc5e9f0", "label_ids": "100155,100151,100156"}}, {"page_content": "COMMISSION REGULATION (EC) No 878/95 of 21 April 1995 derogating from Regulation (EEC) No 822/87 as regards the acidification of enriched wines produced in 1994/95 in the provinces of Verona and Piacenza (Italy)\nTHE COMMISSION OF THE EUROPEAN COMMUNITIES,\nHaving regard to the Treaty establishing the European Community,", "metadata": {"categories_en": "environment, geography, agri-foodstuffs, agriculture, forestry and fisheries", "celex_id": "31995R0878", "chunk_strategy": "len_500_o50", "chunk_uid": "23724850f6188345729b3c4e5c81e461", "label_ids": "100155,100161,100157,100156"}}, {"page_content": "In the provinces of Florence, Livorno, Lucca, Massa-Carrara, Pisa, Pistoia, Prato and Siena in the Region of Tuscany and in the provinces of Perugia and Terni in the Region of Umbria, at least 99,8 % of the ovine or caprine holdings are officially brucellosis-free holdings. In addition, those provinces have undertaken to comply with certain other conditions laid down in Directive 91/68/EEC concerning random checks to be carried out following recognition of the concerned provinces as", "metadata": {"categories_en": "social questions, geography, agriculture, forestry and fisheries", "celex_id": "32005D0028", "chunk_strategy": "len_500_o50", "chunk_uid": "aa5e2d5713b9e485fb6ad823a934f587", "label_ids": "100149,100161,100156"}}, {"page_content": "- Campania: Avellino, Benevento, Napoli,\n- Emilia-Romagna: Bologna, Parma, Piacenza, Reggio Emilia,\n- Friuli Venezia Giulia: Gorizia, Pordenone, Trieste, Udine,\n- Lazio: Frosinone, Rieti, Roma, Viterbo,\n- Liguria: Genova, Imperia, La Spezia, Savona,\n- Lombardia: Bergamo, Brescia, Como, Cremona, Mantova, Milano, Pavia, Sondrio, Varese,\n- Marche: Ancona, Ascoli Piceno, Macerata, Pesaro, Urbino,\n- Piemonte: Alessandria, Asti, Cuneo, Novara, Torino, Vercelli,", "metadata": {"categories_en": "agriculture, forestry and fisheries", "celex_id": "31988D0222", "chunk_strategy": "len_500_o50", "chunk_uid": "e28f9e3e06fea173a6af1c9a7872da02", "label_ids": "100156"}}, {"page_content": "Following observations regarding the presence of that harmful organism in certain parts of the Veneto region made by the Commission during an inspection in Italy from 31 August to 11 September 2009, Italy informed the Commission on 23 October 2009 of the results of the latest survey carried out in the Veneto region for the presence of that harmful organism in September and October 2009. The results of this latest survey show that in the province of Venice there are 14 places, in which that", "metadata": {"categories_en": "environment, geography, science, agriculture, forestry and fisheries", "celex_id": "32010L0001", "chunk_strategy": "len_500_o50", "chunk_uid": "aa6fee2f1afbf67475fdd511f15b1fd9", "label_ids": "100155,100161,100151,100156"}}, {"page_content": "Following observations regarding the presence of that harmful organism in certain parts of the Veneto region made by the Commission during an inspection in Italy from 31 August to 11 September 2009, Italy informed the Commission on 23 October 2009 of the results of the latest survey carried out in the Veneto region for the presence of that harmful organism in September and October 2009. The results of this latest survey show that in the province of Venice there are 14 places, in which that", "metadata": {"categories_en": "environment, geography, science, agriculture, forestry and fisheries", "celex_id": "32010R0017", "chunk_strategy": "len_500_o50", "chunk_uid": "bb142b5f0649a9d38506b6b830720c9d", "label_ids": "100155,100161,100151,100156"}}, {"page_content": "- Puglia: Bari, Brindisi, Foggia, Lecce, Taranto,\n- Sardegna: Nuoro, Oristano, Sassari,\n- Sicilia: Agrigento, Caltanissetta, Catania, Enna, Messina, Palermo, Ragusa, Siracusa, Trapani,\n- Toscana: Arezzo, Firenze, Grosseto, Livorno, Lucca, Massa Carrara, Pisa,\n- Trentino-Alto Adige: Bolzano, Trento,\n- Umbria: Perugia, Terni,\n- Valle d'Aosta: Aosta,\n- Veneto: Rovigo, Venezia;\n8. Luxembourg;\n9. Netherlands;\n10. in respect of Portugal, the Distritos:\n- Beja,", "metadata": {"categories_en": "agriculture, forestry and fisheries", "celex_id": "31988D0222", "chunk_strategy": "len_500_o50", "chunk_uid": "1d4424dc6515930aa286b72ad6e58c78", "label_ids": "100156"}}, {"page_content": "Whereas there is evidence that in Italy swine vesicular disease has spread from an assembly centre located in the municipality of Mezzocorona, Province of Trento, to a number of pig holdings located in the Provinces of Bolzano and Verona;", "metadata": {"categories_en": "geography, EUROPEAN UNION, agriculture, forestry and fisheries", "celex_id": "31998D0497", "chunk_strategy": "len_500_o50", "chunk_uid": "bece5f03ba4158d897b862bdd6b3d0bb", "label_ids": "100161,100144,100156"}}], "rag_answer": "Based on the retrieved context, some places mentioned as being part of the provinces of Padova and Verona are:\n\nFrom Document 1:\n- In the province of Padova: Castelbaldo, Barbona, Piacenza d'Adige, Vescovana, S. Urbano, Boara Pisani, Masi\n- In the province of Verona: Palù, Roverchiara, Legnago, Castagnaro, Ronco all'Adige, Villa Bartolomea, Oppeano, Terrazzo, Isola Rizza, Angiari\n\nFrom Document 2:\n- In the province of Padova: The same communes as mentioned in Document 1\n- In the province of Verona: The same communes as mentioned in Document 1", "generator_model": "llama3.2", "final_k": 20, "candidate_k": 100, "retrieval_source": "prefetch", "prefetch_path": "/home/mwc/Documents/MIOTI/Current/TFM/Data/eval_top10_dedup/prefetch/eval1_baseline/len_500_o50/hyb_fill_dense_then_bm25_ce_r50/000024.json", "query_index": 24}
{"id": "gt_dedup_00025", "question": "What is the specific EU legal instrument being referred to in the context of Chapter V of the Annex?", "reference": "31994D0777", "gold_snippet": "mpetent Turkish authorities have provided official assurances regarding compliance with the requirements specified in Chapter V of the Annex to Directive 91/492/EEC and with requirements equivalent to those prescribed in that Directive for the classification of producting and relaying zones, approval of dispatch centres and public health control and production monitoring; whereas in particular any possibl", "ground_truth_answer": "The EU legal instrument being referred to is Directive 91/492/EEC.", "reference_contexts": ["mpetent Turkish authorities have provided official assurances regarding compliance with the requirements specified in Chapter V of the Annex to Directive 91/492/EEC and with requirements equivalent to those prescribed in that Directive for the classification of producting and relaying zones, approval of dispatch centres and public health control and production monitoring; whereas in particular any possibl"], "retrieved_documents": [{"page_content": "1. Member States shall presume conformity with the essential requirements referred to in Annex I and in the relevant instrument-specific Annexes in respect of a measuring instrument that complies with the elements of the national standards implementing the European harmonised standard for that measuring instrument that correspond to those elements of this European harmonised standard the references in respect of which have been published in the Official Journal of the European Union, C series.", "metadata": {"categories_en": "production, technology and research, industry, science", "celex_id": "32004L0022", "chunk_strategy": "len_500_o50", "chunk_uid": "67dcdb90e5549f289948adb8465951c5", "label_ids": "100158,100160,100151"}}, {"page_content": "(b)\nChapter II(1)(f) and Chapter V(1) of Annex II to Regulation (EC) No 852/2004 as regards the type of materials of which the instruments and the equipment used specifically for the preparation, packaging and wrapping of these products are made.\nThe cleaning and disinfecting measures for the premises referred in (a) and the frequency with which they are carried out shall be adapted to the activity in order to take account of their specific ambient flora.", "metadata": {"categories_en": "industry, agri-foodstuffs, social questions, trade, production, technology and research, agriculture, forestry and fisheries, EUROPEAN UNION", "celex_id": "32005R2074", "chunk_strategy": "len_500_o50", "chunk_uid": "3ed741d087849c94c004206b470c38f0", "label_ids": "100160,100157,100149,100147,100158,100156,100144"}}, {"page_content": "3. Where the competent authority finds, in the course of checks carried out in accordance with Chapter V of Annex I, that there is repeated non-compliance during self-monitoring with the criteria laid down in Annexes II and IV, it shall intensify the measures for monitoring the production of the establishment in question, and may seize the labels and other items bearing the health mark referred to in Chapter VI of Annex I.", "metadata": {"categories_en": "social questions, trade, agri-foodstuffs", "celex_id": "31994L0065", "chunk_strategy": "len_500_o50", "chunk_uid": "dccc0702bc6544847f8f58a71a7c4f1f", "label_ids": "100149,100147,100157"}}, {"page_content": "2. Member States shall presume conformity with the essential requirements referred to in Annex I and in the relevant instrument-specific Annexes in respect of a measuring instrument that complies with the corresponding parts of the normative documents and lists referred to in Article 16(1)(a), the references in respect of which have been published in the Official Journal of the European Union, C series.", "metadata": {"categories_en": "production, technology and research, industry, science", "celex_id": "32004L0022", "chunk_strategy": "len_500_o50", "chunk_uid": "9d0d5af8a0d8fedbc14b78a9b0f51a3a", "label_ids": "100158,100160,100151"}}, {"page_content": "CHAPTER II Guarantees Section 1: Guarantee documents\nArticle 34\nThe guarantee document referred to in Article 25 (1) of the basic Regulation shall conform to the specimen contained in:\n- Annex IV, in the case of a comprehensive guarantee,\n- Annex V, in the case of an individual guarantee,\n- Annex VI, in the case of a flat-rate guarantee.\nSection 2: Comprehensive Guarantee Guarantee certificate\nArticle 35", "metadata": {"categories_en": "trade", "celex_id": "31992R1214", "chunk_strategy": "len_500_o50", "chunk_uid": "c7a9de154d652589fc14ab8e6b7d3698", "label_ids": "100147"}}, {"page_content": "(c) the decisions, exceptions, derogations, conditions and lists referred to in this Chapter and Annex V;\n(d) the application of points C to G of Annex V to products harvested in Community regions not included within the wine-growing zones specified in Annex III;\n(e) in respect of point J of Annex V, the lists referred to in paragraphs 2(b) and 6 thereof, the derogations referred to in paragraph 4(b) and the declaration and registration procedure referred to in paragraph 6.", "metadata": {"categories_en": "agri-foodstuffs, agriculture, forestry and fisheries", "celex_id": "31999R1493", "chunk_strategy": "len_500_o50", "chunk_uid": "85270e3fa1fccfba9ab1bde33a152db4", "label_ids": "100157,100156"}}, {"page_content": "Whereas Article 2 of Regulation (EEC) No 792/93 defines the types of measure for which the cohesion financial instrument may provide assistance;\nWhereas Article 10 of Regulation (EEC) No 792/93 requires the Member States to ensure that adequate publicity is given to the operations of the financial instrument and that the measures which are described in Annex V to this Decision are undertaken;\nWhereas references to 'project' shall be understood as being also to the project stage in question;", "metadata": {"categories_en": "finance, industry, transport, geography, EUROPEAN UNION", "celex_id": "31994D0414", "chunk_strategy": "len_500_o50", "chunk_uid": "a55d5f9026d3190fd0d54e687cd05126", "label_ids": "100148,100160,100154,100161,100144"}}, {"page_content": "Whereas Article 2 of Regulation (EEC) No 792/93 defines the types of measure for which the cohesion financial instrument may provide assistance;\nWhereas Article 10 of Regulation (EEC) No 792/93 requires the Member States to ensure that adequate publicity is given to the operations of the financial instrument and that the measures which are described in Annex V to this Decision are undertaken;\nWhereas references to 'project' shall be understood as being also to the project stage in question;", "metadata": {"categories_en": "finance, industry, transport, geography, EUROPEAN UNION", "celex_id": "31994D0413", "chunk_strategy": "len_500_o50", "chunk_uid": "180247f11ea9bdb6c442cd4445434c45", "label_ids": "100148,100160,100154,100161,100144"}}, {"page_content": "Whereas Article 2 of Regulation (EEC) No 792/93 defines the types of measure for which the cohesion financial instrument may provide assistance;\nWhereas Article 10 of Regulation (EEC) No 792/93 requires the Member States to ensure that adequate publicity is given to the operations of the financial instrument and that the measures which are described in Annex V to this Decision are undertaken;\nWhereas references to 'the project' shall be understood as being to the set of project stages;", "metadata": {"categories_en": "social questions, geography, EUROPEAN UNION, environment", "celex_id": "31994D0546", "chunk_strategy": "len_500_o50", "chunk_uid": "d5579468ce2df9ecdd5c70ed8080246c", "label_ids": "100149,100161,100144,100155"}}, {"page_content": "- the quantities of raw material which qualified for the aid referred to in Chapter IV, broken down by product set out in Part A of Annex III, and the quantities, expressed in net weight, of finished products broken down in accordance with Part B of Annex III,\n- the quantities which qualified for the aid and the increased aid referred to in Chapter V, broken down by product, and their average value within the meaning of Article 21(4);", "metadata": {"categories_en": "agri-foodstuffs, economics, trade, agriculture, forestry and fisheries, geography", "celex_id": "31998R1524", "chunk_strategy": "len_500_o50", "chunk_uid": "b3a215fc18a50151b4f8129af603f70d", "label_ids": "100157,100146,100147,100156,100161"}}, {"page_content": "CHAPTER 3\nFEES\nArticle 7\nFees for the notification for the fourth stage of the work programme\n1. Any producer submitting a notification in accordance with the provisions of Article 4 shall at the time of the submission of its notification pay a fee of EUR 750 for each active substance to the body designated in Annex V. The fee shall be used to finance exclusively the costs actually incurred for the tasks referred to in Annex V.", "metadata": {"categories_en": "politics, social questions, trade, agriculture, forestry and fisheries", "celex_id": "32002R1112", "chunk_strategy": "len_500_o50", "chunk_uid": "9f71fcab6dcd9dbf48efa4537e29e9d6", "label_ids": "100142,100149,100147,100156"}}, {"page_content": "2. Any producer submitting a notification in accordance with the provisions of Article 5(2)(a) shall at the time of the submission of its notification pay a fee of EUR 5000 for each active substance to the body designated in Annex V. The fee shall be used to finance exclusively the costs actually incurred for the tasks referred to in Annex V.\nCHAPTER 4\nFINAL PROVISION\nArticle 8\nTemporary measures", "metadata": {"categories_en": "politics, social questions, trade, agriculture, forestry and fisheries", "celex_id": "32002R1112", "chunk_strategy": "len_500_o50", "chunk_uid": "cf621af6da8eacfa1d6fd9014150db67", "label_ids": "100142,100149,100147,100156"}}, {"page_content": "(6) A specific legal instrument is therefore necessary to permit effective control of all concentrations in terms of their effect on the structure of competition in the Community and to be the only instrument applicable to such concentrations. Regulation (EEC) No 4064/89 has allowed a Community policy to develop in this field. In the light of experience, however, that Regulation should now be recast into legislation designed to meet the challenges of a more integrated market and the future", "metadata": {"categories_en": "business and competition", "celex_id": "32004R0139", "chunk_strategy": "len_500_o50", "chunk_uid": "e81a5264391858a0e837311a8b511536", "label_ids": "100152"}}, {"page_content": "(a) the first subparagraph of paragraph 1 is replaced by the following:\"Processors who have declared, under Article 9(3), their intention to export, in the context of regional trade, or dispatch, in the context of traditional trade flows, processed products containing raw materials which have benefited from the specific supply arrangements, may do so within the limits of the annual quantities indicated in Annex V. The competent authorities shall take the necessary measures to ensure that these", "metadata": {"categories_en": "trade, agri-foodstuffs, economics", "celex_id": "32004R0489", "chunk_strategy": "len_500_o50", "chunk_uid": "d4b2752e600513b588c3910dbfb99d58", "label_ids": "100147,100157,100146"}}, {"page_content": "in Part V of Annex XX to Regulation (EC) No 1234/2007.", "metadata": {"categories_en": "trade, agri-foodstuffs", "celex_id": "32010R0060", "chunk_strategy": "len_500_o50", "chunk_uid": "a553f9e5704d0450b4ba2113dd130aa0", "label_ids": "100147,100157"}}, {"page_content": "Article 5\nThe Annex to Decision 2004/247/EC is amended in accordance with Part V of the Annex to this Regulation.\nArticle 6\nThe Annex to Decision 2005/303/EC is amended in accordance with Part VI of the Annex to this Regulation.\nArticle 7\nThis Regulation shall enter into force on the seventh day following its publication in the Official Journal of the European Union.\nThis Regulation shall be binding in its entirety and directly applicable in all Member States.\nDone at Brussels, 12 August 2005.", "metadata": {"categories_en": "environment, trade, agriculture, forestry and fisheries", "celex_id": "32005R1335", "chunk_strategy": "len_500_o50", "chunk_uid": "298ef1de56d73e2cb9549a06b34d06a5", "label_ids": "100155,100147,100156"}}, {"page_content": "4. In the Annex the heading \"Annex\" is replaced by \"Annex V\".\n5. The text of the Annex hereto is added as Annexes I to IV.\nArticle 2\nThis Regulation shall enter into force on the day following that of its publication in the Official Journal of the European Union.\nThis Regulation shall be binding in its entirety and directly applicable in all Member States.\nDone at Brussels, 16 March 2004.", "metadata": {"categories_en": "trade, agri-foodstuffs, economics", "celex_id": "32004R0489", "chunk_strategy": "len_500_o50", "chunk_uid": "c5af57d5ccca35257c6b3ef0c9a734fb", "label_ids": "100147,100157,100146"}}, {"page_content": "13.\nAnnex I shall be replaced by the text in Annex I to this Regulation;\n14.\nAnnex IV shall be replaced by the text in Annex II to this Regulation;\n15.\nThe text in Annex III to this Regulation shall be added as Annex V;\n16.\nThe text in Annex IV to this Regulation shall be added as Annex VI.\nArticle 2\nThis Regulation shall enter into force on the day of its publication in the Official Journal of the European Union.", "metadata": {"categories_en": "finance, industry, international relations, production, technology and research, trade, education and communications, geography", "celex_id": "32009R1283", "chunk_strategy": "len_500_o50", "chunk_uid": "28febddf5ccdcb0d431131d1ec7abe3a", "label_ids": "100148,100160,100143,100158,100147,100150,100161"}}, {"page_content": "3. Without prejudice to cases covered by criminal law, the competent authorities which, pursuant to Article 106, receive information under Title III, Chapter I, Title V, Chapter I and Annex I, may use it only for the performance of their duties or in the context of administrative appeals or legal proceedings in relation to such performance.", "metadata": {"categories_en": "education and communications, finance", "celex_id": "32001L0034", "chunk_strategy": "len_500_o50", "chunk_uid": "bcf3c416adca32c13e0b414bb6d8ade5", "label_ids": "100150,100148"}}, {"page_content": "2. The rules of origin applicable to the products referred to in paragraph 1 shall be those in Protocol 1 of Annex V to the Cotonou Agreement.\n3. Agricultural products originating in the ACP States shall be imported under the arrangements of Annex I to this Regulation, subject to the specific arrangements contained in Annex II.\nArticle 2\nSpecific provisions regarding certain products in Annex I", "metadata": {"categories_en": "law, agri-foodstuffs, trade, agriculture, forestry and fisheries, geography, EUROPEAN UNION", "celex_id": "32002R2286", "chunk_strategy": "len_500_o50", "chunk_uid": "058e890b3d2f5a30800f983017ceb51b", "label_ids": "100145,100157,100147,100156,100161,100144"}}], "rag_answer": "The answer is not provided in the retrieved context.", "generator_model": "llama3.2", "final_k": 20, "candidate_k": 100, "retrieval_source": "prefetch", "prefetch_path": "/home/mwc/Documents/MIOTI/Current/TFM/Data/eval_top10_dedup/prefetch/eval1_baseline/len_500_o50/hyb_fill_dense_then_bm25_ce_r50/000025.json", "query_index": 25}
{"id": "gt_dedup_00026", "question": "What type of entities are required to make information available to final customers?", "reference": "32006L0032", "gold_snippet": "Member States shall ensure that, where appropriate, the following information is made available to final customers in clear and understandable terms by energy distributors, distribution system operators or retail energy sales companies in or with their bills, contracts, transactions", "ground_truth_answer": "energy distributors, distribution system operators or retail energy sales companies", "reference_contexts": ["Member States shall ensure that, where appropriate, the following information is made available to final customers in clear and understandable terms by energy distributors, distribution system operators or retail energy sales companies in or with their bills, contracts, transactions"], "retrieved_documents": [{"page_content": "3. Member States shall ensure that, where appropriate, the following information is made available to final customers in clear and understandable terms by energy distributors, distribution system operators or retail energy sales companies in or with their bills, contracts, transactions, and/or receipts at distribution stations:\n(a)\ncurrent actual prices and actual consumption of energy;\n(b)", "metadata": {"categories_en": "EUROPEAN UNION, energy", "celex_id": "32006L0032", "chunk_strategy": "len_500_o50", "chunk_uid": "0ffa03fd422b30e541cb6031e3881f7a", "label_ids": "100144,100159"}}, {"page_content": "(9)\nTransmission and distribution system operators should be required to deliver a high level of service to final customers in terms of the frequency and duration of interruptions.\n(10)", "metadata": {"categories_en": "trade, finance, energy", "celex_id": "32005L0089", "chunk_strategy": "len_500_o50", "chunk_uid": "99abd96542df9f2b073deca3d3bedd3f", "label_ids": "100147,100148,100159"}}, {"page_content": "equipment. It is recalled that some such valuable information should already be made available to final customers under Article 3(6) of Directive 2003/54/EC. In addition, consumers should be actively encouraged to check their own meter readings regularly.", "metadata": {"categories_en": "EUROPEAN UNION, energy", "celex_id": "32006L0032", "chunk_strategy": "len_500_o50", "chunk_uid": "310d44b528a0dbe5a404d556c849ca49", "label_ids": "100144,100159"}}, {"page_content": "Final customers", "metadata": {"categories_en": "education and communications, business and competition, energy", "celex_id": "32004D0275", "chunk_strategy": "len_500_o50", "chunk_uid": "2ce545970245cad786247f060ac1cdd9", "label_ids": "100150,100152,100159"}}, {"page_content": "5. Member States shall take appropriate measures to protect final customers, and shall in particular ensure that there are adequate safeguards to protect vulnerable customers, including measures to help them avoid disconnection. In this context, Member States may take measures to protect final customers in remote areas. They shall ensure high levels of consumer protection, particularly with respect to transparency regarding contractual terms and conditions, general information and dispute", "metadata": {"categories_en": "EUROPEAN UNION, energy", "celex_id": "32003L0054", "chunk_strategy": "len_500_o50", "chunk_uid": "ae358488987bc358b1b24cfc0c0c09f7", "label_ids": "100144,100159"}}, {"page_content": "Article 13\nConfidentiality\n1. In the context of provision of technical specifications to interested economic operators, of qualification and selection of economic operators and of award of contracts, contracting entities may impose requirements with a view to protecting the confidential nature of information which they make available.", "metadata": {"categories_en": "energy, environment, transport, trade, education and communications", "celex_id": "32004L0017", "chunk_strategy": "len_500_o50", "chunk_uid": "c5156908d694ece43ca8d26829f55807", "label_ids": "100159,100155,100154,100147,100150"}}, {"page_content": "Undertakings providing communications services, operating in a competitive environment, are likely to make adequate and up-to-date information on their services publicly available for reasons of commercial advantage. National regulatory authorities should nonetheless be able to require publication of such information where it is demonstrated that such information is not effectively available to the public.", "metadata": {"categories_en": "education and communications, trade", "celex_id": "32002L0022", "chunk_strategy": "len_500_o50", "chunk_uid": "27ef8a2be4cc37b1ac56c2e14d1a7d0a", "label_ids": "100150,100147"}}, {"page_content": "linked to vulnerable customers are applied. In particular, they shall take appropriate measures to protect final customers in remote areas who are connected to the gas system. Member States may appoint a supplier of last resort for customers connected to the gas system. They shall ensure high levels of consumer protection, particularly with respect to transparency regarding contractual terms and conditions, general information and dispute settlement mechanisms. Member States shall ensure that", "metadata": {"categories_en": "business and competition, energy, social questions, trade, EUROPEAN UNION", "celex_id": "32009L0073", "chunk_strategy": "len_500_o50", "chunk_uid": "f62c2882ccdb6d25a432626c0758713c", "label_ids": "100152,100159,100149,100147,100144"}}, {"page_content": "Article 18\n1. Third parties shall make information requested in accordance with the requirements laid down in Article 8(1)(a) to (c) immediately available to the institution or person covered by this Directive to which the customer is being referred.", "metadata": {"categories_en": "politics, finance, law", "celex_id": "32005L0060", "chunk_strategy": "len_500_o50", "chunk_uid": "d639fbb646f51f2a90941cca1ee63341", "label_ids": "100142,100148,100145"}}, {"page_content": "5. The Commission shall make available the information communicated by Member States to the European Parliament and the Council and shall ensure that it is also available to consumers and suppliers who request it.", "metadata": {"categories_en": "finance, trade, EUROPEAN UNION", "celex_id": "32002L0065", "chunk_strategy": "len_500_o50", "chunk_uid": "7bae7b7fc24bef4f2ff418870ac90934", "label_ids": "100148,100147,100144"}}, {"page_content": "provided by them to end-users and consumers in accordance with Annex II. Such information shall be published in a clear, comprehensive and easily accessible form. National regulatory authorities may specify additional requirements regarding the form in which such information is to be published.", "metadata": {"categories_en": "education and communications, law", "celex_id": "32009L0136", "chunk_strategy": "len_500_o50", "chunk_uid": "dbcfaaf51b02ddf15aab773b4b7dae2b", "label_ids": "100150,100145"}}, {"page_content": "The regulatory authority or another competent national authority shall take the necessary steps to ensure that the information provided by suppliers to their customers pursuant to this Article is reliable and is provided, at a national level, in a clearly comparable manner.", "metadata": {"categories_en": "business and competition, trade, energy", "celex_id": "32009L0072", "chunk_strategy": "len_500_o50", "chunk_uid": "25b808dd41b630e824a02b2005f685e1", "label_ids": "100152,100147,100159"}}, {"page_content": "(653) Final customers are mainly interested in the overall result, i.e. the complete electrical installation. The only price quoted to them is for the complete final installation, the bulk of which consists of payment for the installation work. In practice, final customers are not informed of the price of each product installed and they are not normally interested in obtaining such information. But in general they tend to be more interested in the choice of equipment downstream of the final", "metadata": {"categories_en": "education and communications, business and competition, energy", "celex_id": "32004D0275", "chunk_strategy": "len_500_o50", "chunk_uid": "24cc986f163a165afc955b3152009740", "label_ids": "100150,100152,100159"}}, {"page_content": "Whereas compliance with the principles of non-discrimination and competitive procurement by entities carrying out exploration or extraction, in particular as regards the information they make available to enterprises concerning their intentions with respect to the award of contracts, and with the obligation to transmit to the Commission information on the award of such contracts, as provided for in Article 3 (2) of Directive 90/531/EEC, corresponds to the very aim pursued by the Directive;", "metadata": {"categories_en": "trade, geography, EUROPEAN UNION, energy", "celex_id": "31993D0018", "chunk_strategy": "len_500_o50", "chunk_uid": "d24999d6ff2f991fc243211adf08c90c", "label_ids": "100147,100161,100144,100159"}}, {"page_content": "of the successful suppliers. In the procedure, contracting entities are required to ensure that there is no discrimination between different suppliers or service providers. Many contracting entities have established a system of qualification for suppliers, mostly using European standards as a reference. The criteria for this qualification system have to be made available to interested suppliers. Contracting entities requiring certificates for attesting conformity of the supplier to certain", "metadata": {"categories_en": "production, technology and research, industry, EUROPEAN UNION, business and competition", "celex_id": "32003D0176", "chunk_strategy": "len_500_o50", "chunk_uid": "3ae1914119928c54cf2b0641981b43b3", "label_ids": "100158,100160,100144,100152"}}, {"page_content": "4. The Commission shall, with a view to creating a high level of transparency by all appropriate means, ensure that information, on the national provisions communicated to it, is made available to consumers and suppliers.\nArticle 5\nCommunication of the contractual terms and conditions and of the prior information", "metadata": {"categories_en": "finance, trade, EUROPEAN UNION", "celex_id": "32002L0065", "chunk_strategy": "len_500_o50", "chunk_uid": "e29b5965604963a017c7e05ce3c8b2f6", "label_ids": "100148,100147,100144"}}, {"page_content": "4. Member States shall ensure that competent national authorities may require undertakings to provide the necessary information, if requested by the competent authorities, in order for these authorities, in conjunction with national regulatory authorities, to be able to establish a detailed inventory of the nature, availability and geographical location of the facilities referred to in paragraph 1 and make it available to interested parties.", "metadata": {"categories_en": "education and communications, business and competition, EUROPEAN UNION", "celex_id": "32009L0140", "chunk_strategy": "len_500_o50", "chunk_uid": "79c8cec564353beb3e473e8b7d68ea11", "label_ids": "100150,100152,100144"}}, {"page_content": "2. With a view to carrying out inspections as referred to in this Article, traders or their representatives shall make available to the competent agency all necessary information. Such information shall include identification of the produce and details of the place and the period during which the consignment(s) are to be dispatched, and of the destination.\nTraders meeting the conditions laid down in Article 6 (1) shall be exempt from this requirement.", "metadata": {"categories_en": "production, technology and research, trade, agri-foodstuffs, economics", "celex_id": "31992R2251", "chunk_strategy": "len_500_o50", "chunk_uid": "b2de64ab5957b4629804b2dfea4e9e7e", "label_ids": "100158,100147,100157,100146"}}, {"page_content": "In order to establish a high level of transparency by all appropriate means, the Commission shall ensure that the information it receives relating to national provisions is also communicated to consumers and insurance intermediaries.\nArticle 13\nInformation conditions\n1. All information to be provided to customers in accordance with Article 12 shall be communicated:\n(a) on paper or on any other durable medium available and accessible to the customer;", "metadata": {"categories_en": "finance, trade, employment and working conditions", "celex_id": "32002L0092", "chunk_strategy": "len_500_o50", "chunk_uid": "9bca5eaf443ea102adc7668f3d18821c", "label_ids": "100148,100147,100153"}}, {"page_content": "six months. Information should be provided on corporate, post-paid and pre-paid customers separately.", "metadata": {"categories_en": "trade, education and communications, finance", "celex_id": "32007R0717", "chunk_strategy": "len_500_o50", "chunk_uid": "835aa2c1bd8511643d1386d5eb1e287a", "label_ids": "100147,100150,100148"}}], "rag_answer": "The answer is not provided in the retrieved context.", "generator_model": "llama3.2", "final_k": 20, "candidate_k": 100, "retrieval_source": "prefetch", "prefetch_path": "/home/mwc/Documents/MIOTI/Current/TFM/Data/eval_top10_dedup/prefetch/eval1_baseline/len_500_o50/hyb_fill_dense_then_bm25_ce_r50/000026.json", "query_index": 26}
{"id": "gt_dedup_00027", "question": "What is the name of the Dutch company that appears as a producer in third countries, alongside other companies?", "reference": "31984D0131", "gold_snippet": "Carlos Lecoutre & Fils, France,\n- Hayfield Textiles Ltd, United Kingdom,\n- Sirdar Ltd, United Kingdom,\n- NV Koninklijke D. S. van Schuppens en Zn, Netherlands,\n- Leidsche Wolspinnerij NV, Netherlands.\nExporters and producers in third countries:\n- AK-PA Tekstil Ihracat Pazarlama AS,\nas exporting company for:\n- AK-SU Iplik Dokuma ve Boya Apre Fabrikalari TAS,\n- AK-AL Tekstil Sanayii AS,\n- Emboey-Yuentas , Birles , ik Kamgarn ve Straygarn Iplik Imal", "ground_truth_answer": "Leidsche Wolspinnerij NV", "reference_contexts": ["Carlos Lecoutre & Fils, France,\n- Hayfield Textiles Ltd, United Kingdom,\n- Sirdar Ltd, United Kingdom,\n- NV Koninklijke D. S. van Schuppens en Zn, Netherlands,\n- Leidsche Wolspinnerij NV, Netherlands.\nExporters and producers in third countries:\n- AK-PA Tekstil Ihracat Pazarlama AS,\nas exporting company for:\n- AK-SU Iplik Dokuma ve Boya Apre Fabrikalari TAS,\n- AK-AL Tekstil Sanayii AS,\n- Emboey-Yuentas , Birles , ik Kamgarn ve Straygarn Iplik Imal"], "retrieved_documents": [{"page_content": "(9)\nThe Commission sought and verified all the information deemed necessary for its investigation, and carried out verification visits at the premises of the following companies:\nCommunity producer:\n-\nGrass Valley Netherlands BV, Breda (the Netherlands)\nOther producers in the Community:\n-\nIkegami Electronics (Europe) GmbH - UK Branch, Sunbury on Thames (United Kingdom)\nProducer in the exporting country:\n-\nIkegami Tsushinki Co., Ltd, Tokyo\n(10)", "metadata": {"categories_en": "education and communications, trade, business and competition, geography", "celex_id": "32006R1910", "chunk_strategy": "len_500_o50", "chunk_uid": "6887b79c2934a595b55b8d1de4d2a25c", "label_ids": "100150,100147,100152,100161"}}, {"page_content": "(12)\nThe Commission sought and verified all the information deemed necessary for its analysis and carried out verification visits at the premises of the following companies:\n(a)\nCommunity producers\n-\nNorit BV, Amersfoort, the Netherlands, and Glasgow, United Kingdom,\n-\nCECA SA, Paris and Bordeaux, France,\n(b)\nOther producer\n-\nChemviron Carbon SA, Feluy, Belgium,\n(c)\nCommunity suppliers\n-\nKlasmann & Deilmann GmbH, Geeste, Niedersachsen, Germany,\n-\nRheinbraun Brennstoff GmbH, Cologne, Germany,\n-", "metadata": {"categories_en": "trade, business and competition, geography, energy", "celex_id": "32008R0649", "chunk_strategy": "len_500_o50", "chunk_uid": "b59423f5eb001d5e1bf7efdcb106c460", "label_ids": "100147,100152,100161,100159"}}, {"page_content": "The Dutch company Akzo, which is one of the Community's largest chemical companies specializes in selling high quality fine nylon yarns at the top end of the market. It has maintained market share in this segment.\n(40) There is some import penetration from the large US nylon producer Allied Signal, which has less than 5 % of the market. There is no indication, however, that the other large US nylon producers intend to export production to the Community in the foreseeable future.", "metadata": {"categories_en": "industry, business and competition", "celex_id": "31993D0009", "chunk_strategy": "len_500_o50", "chunk_uid": "66de91cf650a7476bbed8b6e5d149a0f", "label_ids": "100160,100152"}}, {"page_content": "- Fertibo Holland NV, Oudenbosch, Netherlands,\n- Kali (UK) Ltd, Sawbridgeworth, Herts, UK,\n- London Chemical Co. Ltd, London WC2, UK,\n- Usborne Grain Ltd, Winchester, Hants, UK;\n(c) Traders\n- International Polysacks, Viernheim, Germany;\n(d) Producers in non-member countries\n(i) Arcadian Corporation, Memphis, Tennessee, United States of America;\n(ii) A producer of ammonium nitrate in Hungary, the identity of which cannot be revealed for reasons of confidentiality.", "metadata": {"categories_en": "business and competition, politics, trade, agriculture, forestry and fisheries, geography", "celex_id": "31994D0293", "chunk_strategy": "len_500_o50", "chunk_uid": "f4ea7a12202678ccf80cb0d059754641", "label_ids": "100152,100142,100147,100156,100161"}}, {"page_content": "A. Community producer and related companies:\n- Philips Components BV, Eindhoven, The Netherlands,\n- Philips Components GmbH, Hamburg, Germany,\n- Philips Components Miniwatt SA, Barcelona, Spain,\n- Philips Iberica SA, Barcelona, Spain,\n- Philips SpA, Monza, Italy.\nB. Exporting producers in the countries concerned:\n(a) Lithuania\n- AB Ekranas, Panevezys.\nDistributor related to the exporting producer\n- Farimex AS, Geneva, Switzerland.\n(b) Malaysia", "metadata": {"categories_en": "industry, business and competition, international relations, trade, education and communications", "celex_id": "32000R0837", "chunk_strategy": "len_500_o50", "chunk_uid": "262b76d3793dbdd1bcd6000eb4becbd8", "label_ids": "100160,100152,100143,100147,100150"}}, {"page_content": "group which had salmon farming activities in Norway, Chile and other third countries, the ultimate parent company of the group was a Dutch based publicly quoted company. Consequently, they considered that they should be taken into account as part of the Community industry. However, for the reasons noted in the aforementioned Articles, this claim could not be accepted.", "metadata": {"categories_en": "trade, geography, business and competition, agriculture, forestry and fisheries", "celex_id": "32003R0930", "chunk_strategy": "len_500_o50", "chunk_uid": "9a2c3005bb39bf03636271ee53d2c987", "label_ids": "100147,100161,100152,100156"}}, {"page_content": "(64) The Netherlands is one of the largest gas-producing countries in the EEA. It is a net exporter of gas. The largest equity producers in the Netherlands are NAM, a joint venture (JV) between Exxon and Shell, and EBN, the Dutch State's oil and gas company. Exxon and Shell and the Dutch State (via EBN and directly) own Gasunie, the wholesale distribution company to which almost all Dutch gas is sold. Gasunie sells [80 to 90]* % of the gas consumed in the Netherlands and owns the total Dutch", "metadata": {"categories_en": "education and communications, business and competition, industry, energy", "celex_id": "32004D0284", "chunk_strategy": "len_500_o50", "chunk_uid": "72fc3a507666810fa973b41761f7d1a1", "label_ids": "100150,100152,100160,100159"}}, {"page_content": "5.4. Unrelated importers\n-\nAchten Beheer BV, Waalwijk, The Netherlands\n-\nAdidas AG, Herzogenaurach, Germany\n-\nC&J Clark's International Limited, Street, Somerset, United Kingdom\n-\nFootex International BV, Hazerswoude-dorp, The Netherlands\n-\nNike European Operations BV, Laakdal, Belgium\n-\nPuma AG Rudolf Dassler Sport, Herzogenaurach, Germany\n-\nTimberland Europe BV, Enschede, The Netherlands\n5.5. Producers in the analogue market\n-\nHenrich & Cia Ltda, Dois Irmãos, Brazil\n-", "metadata": {"categories_en": "trade, industry, business and competition, geography", "celex_id": "32009R1294", "chunk_strategy": "len_500_o50", "chunk_uid": "c2e8058ad1d88047540ec1a60545884a", "label_ids": "100147,100160,100152,100161"}}, {"page_content": "market as a whole and in each Member State, the amount of output consumed internally by each of the parties, giving the name and business activity of the producer and consumer, and full particulars of each company's total output of the products concerned in the Community and in third countries. The report shall also state all variation as to the production capacity of Bayer, BPCL and EC in the polyethylene sector and give details of all changes in the production and distribution of the products", "metadata": {"categories_en": "geography, business and competition, industry", "celex_id": "31988D0330", "chunk_strategy": "len_500_o50", "chunk_uid": "1acfbec85c955c4f9397864ffb4cf9db", "label_ids": "100161,100152,100160"}}, {"page_content": "market as a whole and in each Member State: the amount of output consumed internally by each of the parties giving the name and business of the producer and consumer, and full particulars of each company's total output of the products concerned in the Community and in third countries. The report shall also state all variations as to the production capacity of Bayer, BPCL and EC in the polyethylene sector and give details of all changes in the production and distribution of the products in", "metadata": {"categories_en": "education and communications, industry, energy, business and competition", "celex_id": "31994D0384", "chunk_strategy": "len_500_o50", "chunk_uid": "1a2b99a3c5a07513271ca69c8928b364", "label_ids": "100150,100160,100159,100152"}}, {"page_content": "(99) Moreover, the abovementioned amount is only the minimum of supplies from Endemol to HMG which is guaranteed. As a parent company, Endemol can use its influence in HMG to obtain even more orders from HMG. No other producer in the Netherlands has a similar possibility to have a safe sales basis for its production and to influence the programme acquisition of a broadcaster.", "metadata": {"categories_en": "trade, education and communications, business and competition, geography", "celex_id": "31996D0346", "chunk_strategy": "len_500_o50", "chunk_uid": "a24e2edf8816d7f4de98a3331f854b87", "label_ids": "100147,100150,100152,100161"}}, {"page_content": "(38) The investigation revealed that one of the companies which was granted MES could not be considered, on its own, an exporting producer of the product concerned. This company had established a long-term business relationship with another company based in a third country. According to this relationship, the latter company was virtually the sole supplier under tolling agreements (and owner throughout the production process) of the main raw material. This company was also actively involved on", "metadata": {"categories_en": "trade, business and competition, international relations, agriculture, forestry and fisheries", "celex_id": "32002R0092", "chunk_strategy": "len_500_o50", "chunk_uid": "f822eac2f291cd0484ab5632267e44bd", "label_ids": "100147,100152,100143,100156"}}, {"page_content": "(a) complainant Community producers:\n- Nederlandse Philipsbedrijven BV (Zwolle, The Netherlands) and its related company, Österreichische Philips Industrie GmbH (Klagenfurt, Austria), (hereinafter referred to as 'Philips`);\n(b) importers:\n- Acal Electronics Ltd (Bracknell, United Kingdom),\n- Beck Elektronik Bauelemente GmbH (Nürnberg, Germany);\n(c) producers/exporters - USA:\n- Matsushita Electronic Components Corporation of America (Knoxville, USA),", "metadata": {"categories_en": "geography, trade, business and competition, industry", "celex_id": "31998R1845", "chunk_strategy": "len_500_o50", "chunk_uid": "699fb3bbe647b0507f13160987a9b7f4", "label_ids": "100161,100147,100152,100160"}}, {"page_content": "A Community producer and an association representing distributors and users claimed that one company that was considered a Community producer was not, in fact, producing glyphosate acid within the Community but merely importing acid or salt from a third country and formulating it in the Community. The investigation has shown that, while the company does import certain quantities of formulated glyphosate from third countries, nevertheless, the majority of the products it sells in the Community", "metadata": {"categories_en": "trade, business and competition, geography, agriculture, forestry and fisheries", "celex_id": "32004R1683", "chunk_strategy": "len_500_o50", "chunk_uid": "7cb3d21013bfd6f430bac04cd68364dc", "label_ids": "100147,100152,100161,100156"}}, {"page_content": "While acknowledging the fact that the name of the Dutch company Extensis Europe actually appeared in the contents of the mailing, DPAG claimed that the fact that the name of Multiple Zones GmbH was written in a larger typeface was one of the determining factors for identifying a German sender(97).", "metadata": {"categories_en": "education and communications, geography, EUROPEAN UNION, law", "celex_id": "32001D0892", "chunk_strategy": "len_500_o50", "chunk_uid": "382797b176816326861676691a7efaa7", "label_ids": "100150,100161,100144,100145"}}, {"page_content": "(54) It should be noted that though the production of PTY is not labour-intensive, there has been a steady curtailment in employment of the Community industry. The level of investment was generally reduced for most companies. The increase in PTY production capacity is specifically the result of significant investment in 1992 and 1993 by one company, related to a third country producer; this company reduced drastically its imports of POY from the parent company and as a counterpart extended its", "metadata": {"categories_en": "industry, trade, business and competition, geography", "celex_id": "31996R0940", "chunk_strategy": "len_500_o50", "chunk_uid": "3ebd6b40cb7c7943fa8159e57d522d43", "label_ids": "100160,100147,100152,100161"}}, {"page_content": "(4) The Commission sought and verified all information it deemed to be necessary for the purposes of a preliminary determination and carried out investigations at the premises of the following:\n(a) Community producers\nAGFA Gevaert AG, Muenchen, Germany,\nBASF Aktiengesellschaft, Ludwigshafen, Germany,\nSUMA, Gien, France.\nThese Community producers are all members of Cefic.\n(b) Japanese producers/exporters\nTDK, Tokyo,\nDenon Columbia, Tokyo.\n(c) Korean producers/exporters\nSaehan Media Co., Seoul,", "metadata": {"categories_en": "trade, education and communications, geography", "celex_id": "31992D0062", "chunk_strategy": "len_500_o50", "chunk_uid": "f80acac67f8059ecd3c0cdbd39167aab", "label_ids": "100147,100150,100161"}}, {"page_content": "(29) There is a separate geographic market for independant Dutch TV productions. The Belgian Flanders region has to be excluded from the relevant market. Cultural differences are such that virtually no Dutch productions are bought in Belgium and no Belgian productions are bought in the Netherlands. This is confirmed by the Commission's investigation in this case: of all Dutch producers questioned on this point - including Endemol -, only three have indicated that they sold some TV production to", "metadata": {"categories_en": "trade, education and communications, business and competition, geography", "celex_id": "31996D0346", "chunk_strategy": "len_500_o50", "chunk_uid": "48d47e87282bf4de40c9d36815233391", "label_ids": "100147,100150,100152,100161"}}, {"page_content": "4. INJURY\n4.1. Community production and Community industry\n(54)\nWithin the Community, the like product is manufactured for sale by three companies: Kuraray Europe GmbH (KEG) in Germany, Celanese Ibérica Chemicals (Celanese) in Spain and a third producer which produces very limited volumes but did not cooperate in the investigation. KEG and Celanese fully cooperated in the investigation.\n(55)", "metadata": {"categories_en": "trade, industry, business and competition, geography", "celex_id": "32007R1069", "chunk_strategy": "len_500_o50", "chunk_uid": "3d4247eb909ebcd9cea9b6657dfe43a3", "label_ids": "100147,100160,100152,100161"}}, {"page_content": "(69)\nSome of the sales of the third exporting producer were made via a chain of related companies and ultimately by a related trader in a third country. In these cases, the export price was established on the basis of this related trading company's resale prices to independent customers in the Community.\n5. Comparison\n(70)", "metadata": {"categories_en": "geography, trade, business and competition, industry", "celex_id": "32007R1420", "chunk_strategy": "len_500_o50", "chunk_uid": "9ed1100e9c5870525723165c6544b79d", "label_ids": "100161,100147,100152,100160"}}], "rag_answer": "The answer is not provided in the retrieved context.", "generator_model": "llama3.2", "final_k": 20, "candidate_k": 100, "retrieval_source": "prefetch", "prefetch_path": "/home/mwc/Documents/MIOTI/Current/TFM/Data/eval_top10_dedup/prefetch/eval1_baseline/len_500_o50/hyb_fill_dense_then_bm25_ce_r50/000027.json", "query_index": 27}
{"id": "gt_dedup_00028", "question": "What is the estimated annual cost reduction for transporting and discharging waste from the current system to the proposed system?", "reference": "32003D0107", "gold_snippet": "This investment would eliminate the risks inherent in transporting the waste. According to the Italian authorities, this investment will reduce the costs of transporting and discharging the waste from EUR 70 per tonne/year to EUR 15 per tonne/year. The capacity of this extension is 60000 tonnes per year.", "ground_truth_answer": "The costs would be reduced from EUR 70 per tonne/year to EUR 15 per tonne/year, resulting in a savings of EUR 55 per tonne/year.", "reference_contexts": ["This investment would eliminate the risks inherent in transporting the waste. According to the Italian authorities, this investment will reduce the costs of transporting and discharging the waste from EUR 70 per tonne/year to EUR 15 per tonne/year. The capacity of this extension is 60000 tonnes per year."], "retrieved_documents": [{"page_content": "(15) Extension of landfill for special waste by 300000 m2: the waste is currently transported to special landfills outside the company's premises. This investment would eliminate the risks inherent in transporting the waste. According to the Italian authorities, this investment will reduce the costs of transporting and discharging the waste from EUR 70 per tonne/year to EUR 15 per tonne/year. The capacity of this extension is 60000 tonnes per year. The investment amounts to EUR 1290000.", "metadata": {"categories_en": "industry, business and competition, economics, environment, geography", "celex_id": "32003D0107", "chunk_strategy": "len_500_o50", "chunk_uid": "0a799707182a2a80cc04bce5a36b51d2", "label_ids": "100160,100152,100146,100155,100161"}}, {"page_content": "Table 2\nIMPACT OF COSTS ON REVENUE\nPresent system (output volume = 800 quintals)\nTABLE\nOutgoings comprise the fixed costs due to amortisation of plant and buildings, maintenance and repayments on loans.\nProposed system (output volume = 1100 quintals)\nTABLE\nOutgoings comprise the fixed costs due to amortisation of plant and buildings, maintenance and repayments on loans.\nComparison of present and proposed systems\nTABLE", "metadata": {"categories_en": "geography, EUROPEAN UNION, economics, agriculture, forestry and fisheries", "celex_id": "32002D0229", "chunk_strategy": "len_500_o50", "chunk_uid": "f4e93f810b6f662c0a7e1d9c82f82533", "label_ids": "100161,100144,100146,100156"}}, {"page_content": "The Commission notes that the Netherlands has acknowledged that, compared with the current tax system, the measure gives rise to an advantage of an estimated EUR 4 million annually, without any quid pro quo on the part of the recipients (16). The proposed measure is imputable to the Netherlands, as it derives directly from an amendment to the national legislation in force.", "metadata": {"categories_en": "industry, finance, economics, business and competition, environment, social questions, education and communications, geography", "celex_id": "32010D0402", "chunk_strategy": "len_500_o50", "chunk_uid": "f1f3cb81526f50b37167d4c0c841349a", "label_ids": "100160,100148,100146,100152,100155,100149,100150,100161"}}, {"page_content": "normal costs for the disposal or recycling of the waste in question.", "metadata": {"categories_en": "finance, industry, economics, geography", "celex_id": "31999D0227", "chunk_strategy": "len_500_o50", "chunk_uid": "387359e08bcdbac1e3bc069c024bbad6", "label_ids": "100148,100160,100146,100161"}}, {"page_content": "(d) Material costs would be reduced by DEM 1,5 million through the purchase and use of fewer materials.\n(e) Transport costs were to be reduced. The firm would consider whether it might not be cheaper to farm out its haulage operations rather than use its own hived-off subsidiary. (It was estimated that this would cost 40 % less, i.e. a saving of DEM 1,6 million).", "metadata": {"categories_en": "finance, business and competition, industry, economics, geography, EUROPEAN UNION", "celex_id": "32002D0779", "chunk_strategy": "len_500_o50", "chunk_uid": "03b205fc3e3c022becff407c65139ffa", "label_ids": "100148,100152,100160,100146,100161,100144"}}, {"page_content": "(12) Installation of a conveyor belt for the transportation of mineral to the homogenisation plant: this system will replace the transportation by lorry currently used. Dust emissions will be eliminated. The total cost of the project amounts to EUR 4700000. According to the Italian authorities, this investment will result in cost savings of EUR 312000 per year. They have deducted EUR 2500000 as cost savings over 10 years. Costs considered eligible by the Italian authorities amount therefore to", "metadata": {"categories_en": "industry, business and competition, economics, environment, geography", "celex_id": "32003D0107", "chunk_strategy": "len_500_o50", "chunk_uid": "34a41b4add9acac5b615c61cc7615433", "label_ids": "100160,100152,100146,100155,100161"}}, {"page_content": "figure to estimates of between GBP 330 000/tonne and GPB 533 000/tonne for the comprehensive management of such waste according to independent studies from the University of Harvard and NIREX.", "metadata": {"categories_en": "business and competition, economics, politics, energy, geography", "celex_id": "32006D0643", "chunk_strategy": "len_500_o50", "chunk_uid": "f7e6211a46fc915d9ccfd2e24e1e65cc", "label_ids": "100152,100146,100142,100159,100161"}}, {"page_content": "(where K is the average unit cost, Kt the total cost and Qt total output),\nunder the present system, P&lt; K\nPIC FILE= \"L_2002077EN.003201.TIF\nunder the proposed system, P &gt;K\nPIC FILE= \"L_2002077EN.003301.TIF\nThe improvement in output volume and quality required to restore viability will be obtained by:", "metadata": {"categories_en": "geography, EUROPEAN UNION, economics, agriculture, forestry and fisheries", "celex_id": "32002D0229", "chunk_strategy": "len_500_o50", "chunk_uid": "6a2e76ba169f3c69c4cd9191fd9af307", "label_ids": "100161,100144,100146,100156"}}, {"page_content": "proportion. In addition, the quantity of sewage sludge, which has to be removed via a recognised sewage processor and eventually dumped, will also be reduced by 200 tonnes a year. The investment has no effect on production and all the costs relate solely to the objective of environmental protection.", "metadata": {"categories_en": "industry, business and competition, economics, environment, geography, EUROPEAN UNION", "celex_id": "32000D0360", "chunk_strategy": "len_500_o50", "chunk_uid": "e45d6594e11b1ab07696ba4fb2be6c3e", "label_ids": "100160,100152,100146,100155,100161,100144"}}, {"page_content": "were then expressed net of estimated transport costs.", "metadata": {"categories_en": "production, technology and research, geography, business and competition", "celex_id": "31984R1129", "chunk_strategy": "len_500_o50", "chunk_uid": "06fa0fdd847fcecbd4a43726a4c230b9", "label_ids": "100158,100161,100152"}}, {"page_content": "(20) Apart from the fact that Shotton has to use an agreed tonnage of waste newspapers and magazines recovered from the municipal waste stream as the raw material for the new facility, the support to Shotton is subject to other environmental obligations set out in the funding agreement. These comprise:\n(a) a reduction of 118000 tonnes of CO2 emissions;\n(b) an annual reduction of some 6500 lorry movements (this means a minimum reduction of some 325000 lorry miles per year);", "metadata": {"categories_en": "industry, business and competition, economics, environment, geography", "celex_id": "32003D0814", "chunk_strategy": "len_500_o50", "chunk_uid": "a035abd372dfe1fb8e6c3e697a75c17f", "label_ids": "100160,100152,100146,100155,100161"}}, {"page_content": "- can be implemented as envisaged and thereby bring about the necessary cost reductions.", "metadata": {"categories_en": "business and competition, law, economics, transport, trade, geography", "celex_id": "32010D0137", "chunk_strategy": "len_500_o50", "chunk_uid": "7a663a5ba356994ff6cfeac02f61cf4b", "label_ids": "100152,100145,100146,100154,100147,100161"}}, {"page_content": "(10) The investment aid will keep HVC's transport costs to the incineration plant lower, entailing a concomitant reduction in the cost to be paid by the municipalities. Accordingly, the transport costs to be borne by the municipalities will increase by only EUR 1,80 per tonne (about 14 % of the price), an amount which the municipalities may well be able to bear without introducing higher waste charges. The Dutch view is that without the province's contribution the project would not be viable", "metadata": {"categories_en": "geography, economics, business and competition, environment", "celex_id": "32003D0879", "chunk_strategy": "len_500_o50", "chunk_uid": "5878080ced929ed6173cb409892f0195", "label_ids": "100161,100146,100152,100155"}}, {"page_content": "(57)\nThe investment reduced pumping costs by EUR 206 712 annually. On the other hand, water from the local authority purification plant is not free of charge, but costs EUR 0,15 per m3, which results in additional costs of EUR 226 200 annually. The new system consequently costs Lucchini EUR 19 488 annually more that the old one. Thus there are no production benefits which might have to be deducted.\n5. CONCLUSION\n(58)", "metadata": {"categories_en": "industry, business and competition, economics, education and communications, geography, EUROPEAN UNION", "celex_id": "32009D0389", "chunk_strategy": "len_500_o50", "chunk_uid": "d342b8bc83af789e9efc06a06820103d", "label_ids": "100160,100152,100146,100150,100161,100144"}}, {"page_content": "FUNDING AND FINANCIAL MANAGEMENT\nArticle 4\nThe estimated budgetary cost of implementing the system pursuant to Article 1 should not exceed 50 million ECU for the five-year period from the financial year 1987 to the financial year 1991.\nArticle 5\n1. The appropriations required for implementing the system established under this Regulation shall be determined under the annual budgetary procedure.", "metadata": {"categories_en": "trade, business and competition, economics, international relations", "celex_id": "31987R0428", "chunk_strategy": "len_500_o50", "chunk_uid": "447038be5ec009f4573412b9ffb4edcd", "label_ids": "100147,100152,100146,100143"}}, {"page_content": "could also cut the time required for transporting products. The cost of this measure would be DEM 8 million.", "metadata": {"categories_en": "geography, economics, industry, law", "celex_id": "31999D0679", "chunk_strategy": "len_500_o50", "chunk_uid": "b4f6831c9c7aa532210772cac02a675a", "label_ids": "100161,100146,100160,100145"}}, {"page_content": "(6) One of the three projects, \"centralised reduction of scrap\", consisted in replacing the former system of reducing scrap in the place where it is produced by a centralised system in which scrap is reduced in a single location. In contrast to the previous situation, this central location is enclosed and the resulting waste gases are then cleaned via a filter unit. The total cost of the equipment (EUR 2478935) was deemed eligible for environmental aid by the Belgian authorities. This includes", "metadata": {"categories_en": "industry, business and competition, economics, environment, geography, EUROPEAN UNION", "celex_id": "32002D0285", "chunk_strategy": "len_500_o50", "chunk_uid": "82d964a5cc21c5c665f9d40e4bd70c24", "label_ids": "100160,100152,100146,100155,100161,100144"}}, {"page_content": "(a) landspreading of sludge is no longer necessary, and there will be no more costs related to the use of sludge for animal bedding. The cost of animal bedding amounts to GBP [...] per tonne. The cost of landspreading is estimated at GBP [...] per tonne. The avoided cost for 10000 tonnes of animal bedding and 127500 tonnes of landspreading per year amounts to GBP [...] per year. For five years, taking the net present value in the first year(36), this amounts to GBP [...];", "metadata": {"categories_en": "industry, business and competition, economics, environment, geography", "celex_id": "32003D0814", "chunk_strategy": "len_500_o50", "chunk_uid": "c95057fea71d2606550076791ac3f6b0", "label_ids": "100160,100152,100146,100155,100161"}}, {"page_content": "(25) The core element of the restructuring plan was the moving of the current production site from a 150-year-old building to a modern industrial park. This was intended to reduce internal transport costs and optimise the operational activities. The machinery acquired was supposed to improve efficiency and help reduce material costs as well as personnel and energy expenditure. Facilities to treat waste water were to reduce energy and water expenditure by 10-15 %.", "metadata": {"categories_en": "finance, industry, economics, international relations, business and competition, geography", "celex_id": "32002D0895", "chunk_strategy": "len_500_o50", "chunk_uid": "680f07337872c5616154922a5e5519b5", "label_ids": "100148,100160,100146,100143,100152,100161"}}, {"page_content": "loading quay and finished paper warehouse. Unlike road transport, waste paper transported by rail is packed in bales. Therefore also investment costs for conveying, equalising and de-wiring the bales is included. The investment in containers and special vehicles for combined transport is not included due to their multi-purpose character, nor is the cost of offices and social rooms, sprinkler installations and indirect cost. This leaves an expected eligible cost of EUR 8 864 000. If afterwards", "metadata": {"categories_en": "industry, business and competition, economics, finance, geography, EUROPEAN UNION", "celex_id": "32005D0164", "chunk_strategy": "len_500_o50", "chunk_uid": "979aa1090ec91c9038526a96ada4f1cf", "label_ids": "100160,100152,100146,100148,100161,100144"}}], "rag_answer": "The answer is not provided in the retrieved context.", "generator_model": "llama3.2", "final_k": 20, "candidate_k": 100, "retrieval_source": "prefetch", "prefetch_path": "/home/mwc/Documents/MIOTI/Current/TFM/Data/eval_top10_dedup/prefetch/eval1_baseline/len_500_o50/hyb_fill_dense_then_bm25_ce_r50/000028.json", "query_index": 28}
{"id": "gt_dedup_00029", "question": "What is the consequence if a Member State fails to adopt a specific EU decision regarding the development of ISDN as a trans-European network?", "reference": "31995D2717", "gold_snippet": "or creating the basic infrastructure, in order to ensure the harmonized introduction of ISDN services; whereas failure to adopt a Decision of the European Parliament and of the Council on the development of ISDN as a trans-European network would be liable to result in a lack of interconnection and interoperability between nationa", "ground_truth_answer": "Failure to adopt the Decision would result in a lack of interconnection and interoperability between national networks.", "reference_contexts": ["or creating the basic infrastructure, in order to ensure the harmonized introduction of ISDN services; whereas failure to adopt a Decision of the European Parliament and of the Council on the development of ISDN as a trans-European network would be liable to result in a lack of interconnection and interoperability between nationa"], "retrieved_documents": [{"page_content": "Whereas adequate Community action is needed to establish smooth coordination between the Member States and the economic operators responsible for creating the basic infrastructure, in order to ensure the harmonized introduction of ISDN services; whereas failure to adopt a Decision of the European Parliament and of the Council on the development of ISDN as a trans-European network would be liable to result in a lack of interconnection and interoperability between national networks and a smaller", "metadata": {"categories_en": "education and communications, employment and working conditions, international relations, EUROPEAN UNION", "celex_id": "31995D2717", "chunk_strategy": "len_500_o50", "chunk_uid": "1f1611aa891d829668f75e6bc1b70782", "label_ids": "100150,100153,100143,100144"}}, {"page_content": "Article 6\nThe development of EURO-ISDN as a trans-European network shall be carried out pursuant to this Decision in the form of projects of common interest. Those projects shall be as listed in Annex II.\nArticle 7\nThis Decision shall not prejudice any financial commitment by a Member State or the Community.\nArticle 8", "metadata": {"categories_en": "education and communications, employment and working conditions, international relations, EUROPEAN UNION", "celex_id": "31995D2717", "chunk_strategy": "len_500_o50", "chunk_uid": "630ddc20fe8949078df514d30d10d1af", "label_ids": "100150,100153,100143,100144"}}, {"page_content": "(11) Whereas in the selection and implementation of such projects account should be taken of all infrastructures offered by incumbent and new providers;\n(12) Whereas on 9 November 1995 the European Parliament and the Council adopted Decision No 2717/95/EC on a set of guidelines for the development of the EURO-ISDN (Integrated Services Digital Network) as a trans-European network (5);", "metadata": {"categories_en": "education and communications, business and competition, EUROPEAN UNION, economics", "celex_id": "31997D1336", "chunk_strategy": "len_500_o50", "chunk_uid": "7b8c5cf7de2c6b1b4bd97de4dfc909a4", "label_ids": "100150,100152,100144,100146"}}, {"page_content": "(5) Whereas the European Parliament, in its resolution of 12 June 1997(7), invited the European Union and the Member States to take action with regard to the development and application of new information and communication technologies (ICT) in the next decade;\n(6) Whereas the European Parliament and the Council, in Decision No 2717/95/EC(8), adopted a series of guidelines for the development of Euro-ISDN as a trans-European network;", "metadata": {"categories_en": "politics, education and communications, EUROPEAN UNION", "celex_id": "31999D1720", "chunk_strategy": "len_500_o50", "chunk_uid": "7f134f1686c1d71937859b7699486ee6", "label_ids": "100142,100150,100144"}}, {"page_content": "(5) Whereas the European Parliament, in its resolution of 12 June 1997(7), invited the European Union and the Member States to take action with regard to the development and application of new information and communication technologies (ICT) in the next decade;\n(6) Whereas the European Parliament and the Council, in Decision No 2717/95/EC(8), adopted a series of guidelines for the development of Euro-ISDN as a trans-European network;", "metadata": {"categories_en": "politics, education and communications, EUROPEAN UNION", "celex_id": "31999D1719", "chunk_strategy": "len_500_o50", "chunk_uid": "6f7311bf2e385319607eeeaf0d40aa50", "label_ids": "100142,100150,100144"}}, {"page_content": "In such a case, the decision referred to in Article 6 shall also be notified to each Member State so authorized.\nArticle 9\nIf the Commission fails to take a decision within the period referred to in Article 6 or fails to notify a decision to the Member State concerned within the period referred to in Article 7, the competent authorities of that Member State shall not recover the duties in question.\nArticle 10", "metadata": {"categories_en": "finance", "celex_id": "31991R2164", "chunk_strategy": "len_500_o50", "chunk_uid": "838cdfecb731753fe29e25554ce4bfa1", "label_ids": "100148"}}, {"page_content": "(98) According to the ruling in Pleuger, \"it is only if the Member State, notwithstanding the Commission's order, fails to provide the information requested, that the Commission is empowered to terminate the procedure and make its decision, on the basis of the information available to it, on the question whether or not the aids are compatible with the common market\"(63). This power of the Commission's to take a decision on the basis of the information available if a Member State fails to comply", "metadata": {"categories_en": "business and competition, economics, social questions, trade, geography, EUROPEAN UNION", "celex_id": "32002D0014", "chunk_strategy": "len_500_o50", "chunk_uid": "e378ba151ffee15dac052291f16f3522", "label_ids": "100152,100146,100149,100147,100161,100144"}}, {"page_content": "HAVE ADOPTED THIS DECISION:\nArticle 1\nThis Decision establishes the guidelines identifying the objectives, priorities, broad categories of measures and a number of projects of common interest concerning the development of EURO-ISDN as a trans-European network.\nArticle 2\nfor the purposes of this Decision:\n- 'Euro-ISDN` shall mean a set if ISDN facilities and services implemented on the basis of the harmonized European standards as set out in Annex I, point 1,", "metadata": {"categories_en": "education and communications, employment and working conditions, international relations, EUROPEAN UNION", "celex_id": "31995D2717", "chunk_strategy": "len_500_o50", "chunk_uid": "53ba581f582b4fc04ecdc262caaadd99", "label_ids": "100150,100153,100143,100144"}}, {"page_content": "DECISION No 2717/95/EC OF THE EUROPEAN PARLIAMENT AND OF THE COUNCIL of 9 November 1995 on a set of guidelines for the development of the EURO-ISDN (Integrated Services Digital Network) as a trans-European network\nTHE EUROPEAN PARLIAMENT AND THE COUNCIL OF THE EUROPEAN UNION,\nHaving regard to the Treaty establishing the European Community, and in particular Article 129d thereof,\nHaving regard to the proposal from the Commission (1),", "metadata": {"categories_en": "education and communications, employment and working conditions, international relations, EUROPEAN UNION", "celex_id": "31995D2717", "chunk_strategy": "len_500_o50", "chunk_uid": "fe51de153ef9d5381455f0e959b051b8", "label_ids": "100150,100153,100143,100144"}}, {"page_content": "against the Member State concerned for failure to comply with its obligations under this Regulation.", "metadata": {"categories_en": "finance, law, politics, trade, education and communications, EUROPEAN UNION", "celex_id": "32009R1060", "chunk_strategy": "len_500_o50", "chunk_uid": "f3095dde0686727824b8564c9557d5d4", "label_ids": "100148,100145,100142,100147,100150,100144"}}, {"page_content": "In such a case, the decision referred to in Article 873 shall also be notified to each Member State so authorized.\nArticle 876\nIf the Commission fails to take a decision within the period referred to in Article 873 or fails to notify a decision to the Member State concerned within the period referred to in Article 874, the customs authorities of that Member State shall not enter the duties in question in the accounts.\nTITLE IV\nREPAYMENT OR REMISSION OF IMPORT OR EXPORT DUTIES\nCHAPTER 1", "metadata": {"categories_en": "trade, law", "celex_id": "31993R2454", "chunk_strategy": "len_500_o50", "chunk_uid": "53501278bcea7c45a9909e930541b45f", "label_ids": "100147,100145"}}, {"page_content": "Article 8\nMember States shall encourage public network operators to put in place the infrastructure required for the development of EURO-ISDN in accordance with market demand and in compliance with Community rules.\nArticle 9", "metadata": {"categories_en": "education and communications, employment and working conditions, international relations, EUROPEAN UNION", "celex_id": "31995D2717", "chunk_strategy": "len_500_o50", "chunk_uid": "f26e518e9fec6c1d15bc314df269edcf", "label_ids": "100150,100153,100143,100144"}}, {"page_content": "1. Member States shall regularly notify the Commission of the national plans and programmes which they have drawn up for the development of the trans-European transport network, in particular as regards the projects of common interest identified by this Decision.", "metadata": {"categories_en": "transport, EUROPEAN UNION", "celex_id": "31996D1692", "chunk_strategy": "len_500_o50", "chunk_uid": "eab2d3aabf684b597d083ea9e97ba246", "label_ids": "100154,100144"}}, {"page_content": "Whereas, in some Member States, national implementation of ISDN may exhibit incompatibilities with Euro-ISDN terminals; whereas any such variations should not be subject to type-approval; whereas any such national variations should be identified by the appropriate national authorities and information on them should be made available to the public;", "metadata": {"categories_en": "production, technology and research, education and communications", "celex_id": "31997D0346", "chunk_strategy": "len_500_o50", "chunk_uid": "61fdd7eeb0e23c340824daa16de2c5da", "label_ids": "100158,100150"}}, {"page_content": "located in another Member State as a result of a failure of the two operators concerned to conclude an agreement. Such intervention should be in accordance with the provisions of Article 5 of Directive 2002/19/EC of the European Parliament and of the Council of 7 March 2002 on access to, and interconnection of, electronic communications networks and associated facilities (Access Directive) (5) and on a coordinated basis, and in accordance with the provisions of Article 8(1) of Regulation (EC)", "metadata": {"categories_en": "education and communications, EUROPEAN UNION", "celex_id": "32009R0544", "chunk_strategy": "len_500_o50", "chunk_uid": "1924ee66dc9afc20b174d5a5e29a5d30", "label_ids": "100150,100144"}}, {"page_content": "Article 909\nIf the Commission fails to take a decision within the time limit set in Article 907, or fails to notify a decision to the Member State in question within the time limit set in Article 908, the decision-making customs authority shall grant the application.\nCHAPTER 4\nAdministrative assistance between the Customs authorities of the Member States\nArticle 910", "metadata": {"categories_en": "trade, law", "celex_id": "31993R2454", "chunk_strategy": "len_500_o50", "chunk_uid": "abc96135294bdee161ff9ea5725fbb44", "label_ids": "100147,100145"}}, {"page_content": "- 'basic services ` shall mean the services set out in Annex I, point 2,\n- 'telematic services` shall mean the services set out in Annex I, point 3.\nArticle 3\nThe objectives as regards the development of the ISDN as a trans-European network and into an element of the infrastructure for the 'universal service` shall be as follows:", "metadata": {"categories_en": "education and communications, employment and working conditions, international relations, EUROPEAN UNION", "celex_id": "31995D2717", "chunk_strategy": "len_500_o50", "chunk_uid": "d232df4e7c660fc3ba2db8931b98ac7a", "label_ids": "100150,100153,100143,100144"}}, {"page_content": "5. If, despite the measures taken by the competent authorities of the UCITS home Member State or because such measures prove to be inadequate, or because the UCITS home Member State fails to act within a reasonable timeframe, the UCITS persists in acting in a manner that is clearly prejudicial to the interests of the UCITS host Member State’s investors, the competent authorities of the UCITS host Member State, may, as a consequence, take either of the following actions:\n(a)", "metadata": {"categories_en": "finance, business and competition, trade, employment and working conditions, EUROPEAN UNION", "celex_id": "32009L0065", "chunk_strategy": "len_500_o50", "chunk_uid": "8e4ca0b113a17bde7de8c7bfef3e0922", "label_ids": "100148,100152,100147,100153,100144"}}, {"page_content": "Whereas the Council Resolution of 18 July 1989 (6) called for a strengthening of coordination on the introduction of ISDN in the European Community before the end of 1992;\nWhereas Council Recommendation 92/383/EEC (7) calls for the application to ISDN of the principles of open network provision;\nWhereas, in this Resolution of 5 June 1992 (8), the Council recognized the importance of developing ISDN in the context of trans-European networks;", "metadata": {"categories_en": "education and communications, employment and working conditions, international relations, EUROPEAN UNION", "celex_id": "31995D2717", "chunk_strategy": "len_500_o50", "chunk_uid": "6e9d34e1156ffbff1debc3a27074e190", "label_ids": "100150,100153,100143,100144"}}, {"page_content": "(8) Whereas obligations for the provision of universal service contribute to the Community objective of economic and social cohesion and territorial equity; whereas there may be more than one organization in a Member State with universal service obligations; whereas Member States should encourage the early introduction of new technologies like the integrated services digital network (ISDN) on as broad a basis as possible; whereas at its current stage of development in the Community, ISDN is not", "metadata": {"categories_en": "production, technology and research, politics, education and communications", "celex_id": "31997L0033", "chunk_strategy": "len_500_o50", "chunk_uid": "f47cc13e69dcd2985462ac9e98bac2d7", "label_ids": "100158,100142,100150"}}], "rag_answer": "The consequence if a Member State fails to adopt a specific EU decision regarding the development of ISDN as a trans-European network is that it may be subject to administrative penalties. \n\nAccording to Article 10 of Document 6 (CELEX: 31991R2164), if the Commission fails to take a decision within the period referred to in Article 6 or fails to notify a decision to the Member State concerned within the period referred to in Article 7, the competent authorities of that Member State shall not recover the duties in question.\n\nAdditionally, according to Document 11 (CELEX: 31993R2454), if the Commission fails to take a decision within the time limit set in Article 907 or fails to notify a decision to the Member State in question within the time limit set in Article 908, the decision-making customs authority shall grant the application.\n\nIt is also mentioned that failure to comply with obligations under this Regulation may result in administrative penalties against the Member State concerned.", "generator_model": "llama3.2", "final_k": 20, "candidate_k": 100, "retrieval_source": "prefetch", "prefetch_path": "/home/mwc/Documents/MIOTI/Current/TFM/Data/eval_top10_dedup/prefetch/eval1_baseline/len_500_o50/hyb_fill_dense_then_bm25_ce_r50/000029.json", "query_index": 29}
{"id": "gt_dedup_00030", "question": "What is required to be sealed when a means of transport leaves Community customs territory?", "reference": "31999R1125", "gold_snippet": "9. Article 9(6) is replaced by the following:\n\"6. The agency responsible for the controls shall seal the means of transport leaving Community customs territory at the time of loading. In the case of transhipment outside Community customs territory, the agency designated by the Commission shall verify that the seals on the means of transport arriving at the points of transhipment are intact, and shall seal the new means of transport used after tra", "ground_truth_answer": "The agency responsible for the controls must seal the means of transport leaving Community customs territory at the time of loading.", "reference_contexts": ["9. Article 9(6) is replaced by the following:\n\"6. The agency responsible for the controls shall seal the means of transport leaving Community customs territory at the time of loading. In the case of transhipment outside Community customs territory, the agency designated by the Commission shall verify that the seals on the means of transport arriving at the points of transhipment are intact, and shall seal the new means of transport used after tra"], "retrieved_documents": [{"page_content": "19. Article 9(6) is replaced by the following:\n\"6. The agency responsible for the controls shall seal the means of transport leaving Community customs territory at the time of loading. In the case of transhipment outside Community customs territory, the agency designated by the Commission shall verify that the seals on the means of transport arriving at the points of transhipment are intact, and shall seal the new means of transport used after transhipment.\";", "metadata": {"categories_en": "finance, agri-foodstuffs, international relations, trade, agriculture, forestry and fisheries, geography", "celex_id": "31999R1125", "chunk_strategy": "len_500_o50", "chunk_uid": "7b1f396df1c931ba0044024ef385c9f0", "label_ids": "100148,100157,100143,100147,100156,100161"}}, {"page_content": "In order to identify products and goods on dispatch from one Member State to another, the means of transport or packages used for transport must be sealed in accordance with Article 349 of Regulation (EEC) No 2454/93.\n2. In cases as referred to in paragraph 1, proof that the products have left the customs territory of the Community or reached the destination laid down shall be furnished by presentation of the T5 control copy.", "metadata": {"categories_en": "production, technology and research, trade, agriculture, forestry and fisheries", "celex_id": "31997R2114", "chunk_strategy": "len_500_o50", "chunk_uid": "d58a2421ed1bfa6ed8becb31b20bcdf1", "label_ids": "100158,100147,100156"}}, {"page_content": "(b) at the time of the departure from the Community territory:\n- where an official customs seal has been applied to the means of transport, it shall be checked that the seal is undamaged. If the seal is undamaged a sample check shall only be carried out if there are doubts as to the regularity of the load,", "metadata": {"categories_en": "education and communications, economics, agriculture, forestry and fisheries", "celex_id": "32001R2419", "chunk_strategy": "len_500_o50", "chunk_uid": "e3a8a022dd9a1330a8c88bacb44fea76", "label_ids": "100150,100146,100156"}}, {"page_content": "Article 6\nIn order to ensure the identity of the goods for export between the customs office of export and the customs office of exit from the customs territory of the Community, the means of transport or packages shall be sealed in accordance with Article 349 of Regulation (EEC) No 2454/93.\nArticle 7\n1. Each customs office of export shall apply measures to ensure that achievement of the check rate of 5 % can be verified at any time.\nThe measures must show, per sector:", "metadata": {"categories_en": "trade, agriculture, forestry and fisheries", "celex_id": "31995R2221", "chunk_strategy": "len_500_o50", "chunk_uid": "e993450e4b11487709e9ef09213b100c", "label_ids": "100147,100156"}}, {"page_content": "Article 7\nIn order to ensure that the goods passing through the customs office of exit from the Community's customs territory or the office to which the T5 control copy is sent, where this is not the customs office of exit, are the same goods that passed through the customs office of export, the means of transport or packaging shall be sealed in accordance with Article 357 of Regulation (EEC) No 2454/93.\nArticle 8", "metadata": {"categories_en": "trade, agriculture, forestry and fisheries", "celex_id": "32002R2090", "chunk_strategy": "len_500_o50", "chunk_uid": "b045719def8a3bc6ba09f6bb848b2859", "label_ids": "100147,100156"}}, {"page_content": "Article 357\n1. Without prejudice to paragraph 4, goods to be placed under the Community transit procedure shall not be released unless they are sealed.\n2. The following shall be sealed:\n(a) the space containing the goods, where the means of transport has been approved under other rules or recognised by the office of departure as suitable for sealing;\n(b) each individual package, in other cases.\nSeals must have the characteristics set out in Annex 46a.", "metadata": {"categories_en": "trade, EUROPEAN UNION", "celex_id": "32000R2787", "chunk_strategy": "len_500_o50", "chunk_uid": "b47bddf8972fbce8d99b187b7d785dae", "label_ids": "100147,100144"}}, {"page_content": "16.\nunder Title V (Goods leaving the customs territory of the Community) the following Articles shall be inserted:\n‘Article 182a\n1. Goods leaving the customs territory of the Community, with the exception of goods carried on means of transport only passing through the territorial waters or the airspace of the customs territory without a stop within this territory, shall be covered either by a customs declaration or, where a customs declaration is not required, a summary declaration.", "metadata": {"categories_en": "trade", "celex_id": "32005R0648", "chunk_strategy": "len_500_o50", "chunk_uid": "92695cdf41e580c6c7cd771b52d6b625", "label_ids": "100147"}}, {"page_content": "2. If the customs office of export has not sealed the means of transport or the packaging, then substitution checks shall be carried out, wherever possible in the light of a risk analysis, without prejudice to checks carried out under other provisions.\nThe number of substitution checks carried out each calendar year shall not be less than the number of days on which export refund products leave the Community's customs territory through the customs office of exit concerned.", "metadata": {"categories_en": "trade, agriculture, forestry and fisheries", "celex_id": "32002R2090", "chunk_strategy": "len_500_o50", "chunk_uid": "5b0aa57e0dd9bdfa780930908fe3f059", "label_ids": "100147,100156"}}, {"page_content": "(c) such transport is carried out, without the goods being unloaded on Community territory, under the supervison of the competent authorities in vehicles or containers sealed by the competent authorities; the only handling authorized during this transport shall be that carried out respectively at the point of entry into or exit from Community territory for direct transhipment from a ship or aircraft to any other means of transport or vice versa.", "metadata": {"categories_en": "trade, agri-foodstuffs, agriculture, forestry and fisheries", "celex_id": "31989L0227", "chunk_strategy": "len_500_o50", "chunk_uid": "a5ed834b86b3c822dcc776f640169189", "label_ids": "100147,100157,100156"}}, {"page_content": "(c) such transport is carried out, without the goods being unloaded on Community territory, under the supervision of the competent authorities in vehicles or containers sealed by the competent authorities; the only handling authorized during this transport shall be that carried out respectively at the point of entry into or exit from Community territory for direct transhipment from a ship or aircraft to any other means of transport or vice versa.", "metadata": {"categories_en": "social questions, trade, agri-foodstuffs, agriculture, forestry and fisheries", "celex_id": "31983L0091", "chunk_strategy": "len_500_o50", "chunk_uid": "f5adb54507c6f62ada185142e16fcce1", "label_ids": "100149,100147,100157,100156"}}, {"page_content": "is provided that the product has left the customs territory of the Community.", "metadata": {"categories_en": "trade, agri-foodstuffs, geography, EUROPEAN UNION", "celex_id": "32006R1649", "chunk_strategy": "len_500_o50", "chunk_uid": "634165daa9e3fe5d69add4db015e3c9f", "label_ids": "100147,100157,100161,100144"}}, {"page_content": "Article 842c\n1. In the case of inter-modal transportation, where goods are transferred from one means of transport to another for transport out of the customs territory of the Community, the time limit for lodging the exit summary declaration shall correspond to the time limit applicable to the means of transport leaving the customs territory of the Community, as specified in Article 842d(1).", "metadata": {"categories_en": "education and communications, trade", "celex_id": "32006R1875", "chunk_strategy": "len_500_o50", "chunk_uid": "83d41e9d1c654fad315715c2863a9b09", "label_ids": "100150,100147"}}, {"page_content": "(d)\nthe identification measures to be taken. To this end the customs authorities may prescribe that the means of transport or the package or packages shall bear special seals, accepted by the customs authorities and affixed by the authorized consignor.\nArticle 401\n1. The authorization shall stipulate that the box reserved for the office of departure on the front of the Community transit declaration forms must:\n(a)", "metadata": {"categories_en": "trade, law", "celex_id": "31993R2454", "chunk_strategy": "len_500_o50", "chunk_uid": "b29e6f43b6c1efcc9cca7d6a30bbdfb4", "label_ids": "100147,100145"}}, {"page_content": "destination outside the customs territory of the Community.", "metadata": {"categories_en": "transport, trade, geography, agriculture, forestry and fisheries", "celex_id": "32002R1253", "chunk_strategy": "len_500_o50", "chunk_uid": "c138f1add7c1ed35869dd6e8dac2a438", "label_ids": "100154,100147,100161,100156"}}, {"page_content": "Article 592c\n1. In the case of inter-modal transportation, where goods are transferred from one means of transport to another for transport out of the customs territory of the Community, the time limit for submission of the declaration shall correspond to the time limit applicable to the means of transport leaving the customs territory of the Community, as specified in Article 592b.", "metadata": {"categories_en": "education and communications, trade", "celex_id": "32006R1875", "chunk_strategy": "len_500_o50", "chunk_uid": "eddaac28b13830fec8b47d88feec7af7", "label_ids": "100150,100147"}}, {"page_content": "not sealed according to the first subparagraph of Article 10(2), leave the Community's customs territory through the customs office of exit concerned.", "metadata": {"categories_en": "education and communications, trade, agriculture, forestry and fisheries", "celex_id": "32004R1454", "chunk_strategy": "len_500_o50", "chunk_uid": "85a3036c07d4c4ea387e01fdb5a3022d", "label_ids": "100150,100147,100156"}}, {"page_content": "(a) On dispatch the Community territory, the material shall be enclosed in lead-sealed container units or trucks or in bulk in a vessel. If transported in containers the containers and in all cases the accompanying documents must be clearly marked: 'not for use in human or animal food'. The containers and the accompanying documents shall bear the name and address of the processing establishment.", "metadata": {"categories_en": "agri-foodstuffs, international relations, transport, trade, agriculture, forestry and fisheries", "celex_id": "31994D0446", "chunk_strategy": "len_500_o50", "chunk_uid": "0c03fb8da6a13266d80853de41740397", "label_ids": "100157,100143,100154,100147,100156"}}, {"page_content": "(d) the identification measures to be taken. To this end the customs authorities may prescribe that the means of transport or the package or packages shall bear special seals, accepted by the customs authorities and affixed by the authorized consignor.\nAuthentication in advance\nArticle 66\n1. The authorization shall stipulate that the box reserved for the office of departure on the front of the Community transit declaration form:", "metadata": {"categories_en": "trade, law", "celex_id": "31987R1062", "chunk_strategy": "len_500_o50", "chunk_uid": "297ac237169db5a8b108f95218d60e57", "label_ids": "100147,100145"}}, {"page_content": "(d) the identification measures to be taken. To this end the competent authorities may prescribe that the means of transport or the package or packages shall bear special seals, accepted by the customs authorities and affixed by the authorized consignor.\nAuthentication in advance\nArticle 106\n1. The authorization shall stipulate that the box reserved for the office of departure on the front of the Community transit declaration form:", "metadata": {"categories_en": "trade", "celex_id": "31992R1214", "chunk_strategy": "len_500_o50", "chunk_uid": "9f2fe66da08feaf1999b082ba3bc15f9", "label_ids": "100147"}}, {"page_content": "(a) on dispatch to the Community territory, the raw material must be enclosed in leak-proof and duly sealed containers. The containers and the accompanying documents must be marked: 'Use restricted to the manufacture of pharmaceuticals'. The containers and the accompanying documents shall bear the name and address of the consignee;\n(b) the raw material must be transported from the point of arrival in Community territory in containers or means of transport which are leak-proof and duly sealed;", "metadata": {"categories_en": "social questions, trade, agri-foodstuffs, international relations", "celex_id": "31992D0183", "chunk_strategy": "len_500_o50", "chunk_uid": "38e341b3f0688fb1cf23814c2e629297", "label_ids": "100149,100147,100157,100143"}}], "rag_answer": "The answer is provided in Document 6, Article 357(1), which states: \"2. The following shall be sealed: (a) the space containing the goods, where the means of transport has been approved under other rules or recognised by the office of departure as suitable for sealing; (b) each individual package, in other cases.\"\n\nAdditionally, Document 3(b) states that at the time of departure from the Community territory, if an official customs seal has been applied to the means of transport, it shall be checked that the seal is undamaged.", "generator_model": "llama3.2", "final_k": 20, "candidate_k": 100, "retrieval_source": "prefetch", "prefetch_path": "/home/mwc/Documents/MIOTI/Current/TFM/Data/eval_top10_dedup/prefetch/eval1_baseline/len_500_o50/hyb_fill_dense_then_bm25_ce_r50/000030.json", "query_index": 30}
{"id": "gt_dedup_00031", "question": "What type of changes are being referred to in relation to portfolio hedges?", "reference": "32004R2086", "gold_snippet": "orce them to carry out disproportionate and costly changes both to their asset/liability management and to their accounting systems. As a portfolio hedge, due to internal interactions and the law of large numbers, is different from the hedge of a single asset or a single liability, it is also argued that enabli", "ground_truth_answer": "Disproportionate and costly changes both to their asset/liability management and to their accounting systems.", "reference_contexts": ["orce them to carry out disproportionate and costly changes both to their asset/liability management and to their accounting systems. As a portfolio hedge, due to internal interactions and the law of large numbers, is different from the hedge of a single asset or a single liability, it is also argued that enabli"], "retrieved_documents": [{"page_content": "Many European banks argue that IAS 39 does not allow them to apply hedge accounting to their core deposits on a portfolio basis and would force them to carry out disproportionate and costly changes both to their asset/liability management and to their accounting systems. As a portfolio hedge, due to internal interactions and the law of large numbers, is different from the hedge of a single asset or a single liability, it is also argued that enabling portfolio hedge accounting of core deposits", "metadata": {"categories_en": "production, technology and research, finance, business and competition", "celex_id": "32004R2086", "chunk_strategy": "len_500_o50", "chunk_uid": "f6e631799fcecbb5c4ec15fb9c3269bd", "label_ids": "100158,100148,100152"}}, {"page_content": "The question whether and how the accounting treatment of portfolio hedging can be designed in such a way that it better reflects the particularities of banks operating in a fixed interest rate environment has been recognised as a significant issue by the IASB. The latter has created as a matter of priority a working group which is examining proposals made by European banks for the introduction into IAS 39 of a new hedge accounting method (interest margin hedge) which would reflect more closely", "metadata": {"categories_en": "production, technology and research, finance, business and competition", "celex_id": "32004R2086", "chunk_strategy": "len_500_o50", "chunk_uid": "cd040c67e461fc6723351cc7d66c4a58", "label_ids": "100158,100148,100152"}}, {"page_content": "The provisions of IAS 39, which are directly related to the accounting treatment of portfolio hedging should therefore not be adopted for mandatory use at this stage because they cannot be considered as final and may be changed in the near future. The relevant provisions that are excluded from mandatory application are clearly distinct and separable from the rest of the standard. They concern those provisions that do not reflect a portfolio approach and therefore prevent the application of", "metadata": {"categories_en": "production, technology and research, finance, business and competition", "celex_id": "32004R2086", "chunk_strategy": "len_500_o50", "chunk_uid": "554e5baff0d563a8e1aa884920ab5b2c", "label_ids": "100158,100148,100152"}}, {"page_content": "(3)\nOn 31 March 2004, the IASB issued an amendment to IAS 39 Financial Instruments: recognition and measurement on fair value hedge accounting for a portfolio hedge of interest rate risk. The general objective of the amendment is to simplify the implementation of IAS 39 by enabling fair value hedge accounting for a portfolio hedge of interest rate risk.\n(4)", "metadata": {"categories_en": "production, technology and research, finance, business and competition", "celex_id": "32004R2086", "chunk_strategy": "len_500_o50", "chunk_uid": "420d61769866f0c440c447c47e228765", "label_ids": "100158,100148,100152"}}, {"page_content": "portfolio hedge accounting of core deposits on a fair value measurement basis is consistent with the principle in IAS 39 that the fair value of a financial liability with a demand feature cannot be less than the amount payable on demand.", "metadata": {"categories_en": "production, technology and research, finance, business and competition", "celex_id": "32004R2086", "chunk_strategy": "len_500_o50", "chunk_uid": "d4d823d441f275bfb01de154b1cff5d9", "label_ids": "100158,100148,100152"}}, {"page_content": "approach and therefore prevent the application of hedge accounting to a portfolio of core deposits and those provisions that assimilate a prepayment risk to an interest rate risk and therefore prevent the continuation of risk management techniques recognised as acceptable by banking supervisors. However, companies do have the option to apply these provisions and can therefore apply all hedge accounting provisions in IAS 39.", "metadata": {"categories_en": "production, technology and research, finance, business and competition", "celex_id": "32004R2086", "chunk_strategy": "len_500_o50", "chunk_uid": "57a5b0268cb868bed168819ea9284729", "label_ids": "100158,100148,100152"}}, {"page_content": "ING also plans a number of risk reducing measures, such as hedging programs, reductions, closures and run-off of risky positions, and reduction of direct equity exposure. As regards its investment portfolio, ING has received an asset protection measure from the Netherlands in the form of the Alt-A IA measure. Further measures implemented by ING include a reclassification of a number of its ABS from the available for sale category into the held-to-maturity category, thus limiting the volatility", "metadata": {"categories_en": "finance, economics, business and competition, geography", "celex_id": "32010D0608", "chunk_strategy": "len_500_o50", "chunk_uid": "fb7ec2ad873f3abbedd552ddb3a9b8d0", "label_ids": "100148,100146,100152,100161"}}, {"page_content": "3. Trading intent shall be evidenced on the basis of the strategies, policies and procedures set up by the institution to manage the position or portfolio in accordance with Part A of Annex VII.\n4. Institutions shall establish and maintain systems and controls to manage their trading book in accordance with Parts B and D of Annex VII.\n5. Internal hedges may be included in the trading book, in which case Part C of Annex VII shall apply.\nCHAPTER IV\nOwn funds\nArticle 12", "metadata": {"categories_en": "finance, business and competition, law", "celex_id": "32006L0049", "chunk_strategy": "len_500_o50", "chunk_uid": "29219c9cdabb404075fc2c6446cbce30", "label_ids": "100148,100152,100145"}}, {"page_content": "Considering the relevance of this factor to the yard’s activities, the plan does not address this issue convincingly. Indeed, the sensitivity analysis suggests that, despite the introduction of these risk-mitigating measures, allegedly factored in the financial projections, the latter remain sensitive to minor changes in the exchange rate, as will be described below. The Commission therefore has not been convinced that the intended hedging policy is sufficiently far-reaching to ensure the", "metadata": {"categories_en": "business and competition, industry, economics, geography", "celex_id": "32010D0047", "chunk_strategy": "len_500_o50", "chunk_uid": "74b230d51c1c94f647f21dededf961aa", "label_ids": "100152,100160,100146,100161"}}, {"page_content": "hedging policy is considered necessary for this activity.", "metadata": {"categories_en": "business and competition, industry, economics, education and communications, geography, EUROPEAN UNION", "celex_id": "32010D0175", "chunk_strategy": "len_500_o50", "chunk_uid": "bbef39f137fed8cc95c5d1af6c6dbf8b", "label_ids": "100152,100160,100146,100150,100161,100144"}}, {"page_content": "4. Credit institutions shall not include in own funds either the fair value reserves related to gains or losses on cash flow hedges of financial instruments measured at amortised cost, or any gains or losses on their liabilities valued at fair value that are due to changes in the credit institutions' own credit standing.\nArticle 65", "metadata": {"categories_en": "finance, trade, employment and working conditions, economics", "celex_id": "32006L0048", "chunk_strategy": "len_500_o50", "chunk_uid": "06266f7c293819ccd7f327acadcc52a7", "label_ids": "100148,100147,100153,100146"}}, {"page_content": "According to CL, from September 1995 to the end of 1996, it set up an instrument providing partial cover for the rate risk it was incurring on account of the structure of its loan refinancing liabilities. These 'swap` type hedging derivatives enabled the bank, it claims, to limit its carrying costs in 1995-96 to some FRF 670 million (i.e. only very partial cover for the rate risk incurred, as is clear from the amount of the neutralization subsequently necessary), which it took into account in", "metadata": {"categories_en": "finance, geography, economics, business and competition", "celex_id": "31998D0490", "chunk_strategy": "len_500_o50", "chunk_uid": "9ebf880f5c4db0fbe2bfb01be7452bc0", "label_ids": "100148,100161,100146,100152"}}, {"page_content": "3. For the purpose of hedging market risks arising from the issuance of electronic money and from the investments referred to in paragraph 1, electronic money institutions may use sufficiently liquid interest-rate and foreign-exchange-related off balance-sheet items in the form of exchange-traded (i.e. not OTC) derivative instruments where they are subject to daily margin requirements or foreign exchange contracts with an original maturity of 14 calendar days or less. The use of derivative", "metadata": {"categories_en": "finance, business and competition", "celex_id": "32000L0046", "chunk_strategy": "len_500_o50", "chunk_uid": "13e9faa98a7fbf95502c61c7ef25304b", "label_ids": "100148,100152"}}, {"page_content": "in particular through the sale of hedging instruments for interest rate, currency and commodities risks.", "metadata": {"categories_en": "finance, geography, economics, business and competition", "celex_id": "32010D0395", "chunk_strategy": "len_500_o50", "chunk_uid": "c97bec356c66f3532334d91d53da21c5", "label_ids": "100148,100161,100146,100152"}}, {"page_content": "provisions on hedge accounting in the near future is closely linked to the progress made by the working group set up by the IASB.", "metadata": {"categories_en": "production, technology and research, finance, business and competition", "celex_id": "32004R2086", "chunk_strategy": "len_500_o50", "chunk_uid": "a0257d5558584d754f0a29e1417a203f", "label_ids": "100158,100148,100152"}}, {"page_content": "the organisational structure, using information technology and adopting various risk-limitation methods (natural hedging, indexation clauses in contracts and purchase of financial products such as currency options and forwards). The plan describes the currency hedging policy proposal in greater detail. It identifies three hedging instruments the yard should use (natural hedging, fx forward transactions and currency options); it quantifies the exposure of the order book to currency risks until", "metadata": {"categories_en": "business and competition, industry, economics, education and communications, geography, EUROPEAN UNION", "celex_id": "32010D0175", "chunk_strategy": "len_500_o50", "chunk_uid": "66af2daf19e17ba59ecc61bca838f1b6", "label_ids": "100152,100160,100146,100150,100161,100144"}}, {"page_content": "An adjustment was requested for the hedging of exchange rates which Taiwanese firms practice so as to avoid losses from a possible dollar devaluation. Such allowance was not granted because Regulation (EEC) No 2176/84 does not provide for such adjustments. At any rate, it was considered that hedging is a financial device which is external to the commercial transaction, and which, in the framework of an anti-dumping investigation, is likely to be disclosed by the exporter only if it works to his", "metadata": {"categories_en": "industry, business and competition, international relations", "celex_id": "31988R1695", "chunk_strategy": "len_500_o50", "chunk_uid": "5fcb2832af2f96541a6b0ffe406e6a6d", "label_ids": "100160,100152,100143"}}, {"page_content": "The September plan, compared to the June draft, contains more detailed information on the intended hedging strategy to mitigate currency-related risks. However, the plan does not demonstrate that either of the two yards has used these instruments (including cost-free natural hedging), at least in recent years (70). Although the September plan quantifies the costs and effects of the proposed hedging policy, it does not show that the new yard would be able to obtain such hedging on the market. It", "metadata": {"categories_en": "business and competition, industry, economics, geography", "celex_id": "32010D0047", "chunk_strategy": "len_500_o50", "chunk_uid": "be1d4173796fb0fa66dee536567fe1da", "label_ids": "100152,100160,100146,100161"}}, {"page_content": "returns on floating-rate portfolios, though the floating-rate portfolios are more risky, because they are subject to annual variations in interest rates.", "metadata": {"categories_en": "finance, business and competition, economics, education and communications, geography", "celex_id": "32009D0178", "chunk_strategy": "len_500_o50", "chunk_uid": "fecc09ee57ed441e5a2f002eb4271f1b", "label_ids": "100148,100152,100146,100150,100161"}}, {"page_content": "2. The description referred to in point (e)(i) of paragraph 1 shall include an analysis of any significant changes as compared to the previous reporting period and an explanation of any major differences in relation to the value of such elements in financial statements, and a brief description of the capital transferability.", "metadata": {"categories_en": "law, finance, employment and working conditions, EUROPEAN UNION", "celex_id": "32009L0138", "chunk_strategy": "len_500_o50", "chunk_uid": "f4b72c2226f1d4b36a3859b466632626", "label_ids": "100145,100148,100153,100144"}}], "rag_answer": "The type of changes being referred to in relation to portfolio hedges are changes to the accounting treatment of portfolio hedging that better reflect the particularities of banks operating in a fixed interest rate environment.\n\nAccording to Document 2, the IASB has created a working group to examine proposals made by European banks for the introduction into IAS 39 of a new hedge accounting method (interest margin hedge) which would reflect more closely the accounting treatment of portfolio hedging.\n\nAdditionally, Document 4 mentions that an amendment was issued to IAS 39 Financial Instruments: recognition and measurement on fair value hedge accounting for a portfolio hedge of interest rate risk, aiming to simplify the implementation of IAS 39 by enabling fair value hedge accounting for a portfolio hedge of interest rate risk.", "generator_model": "llama3.2", "final_k": 20, "candidate_k": 100, "retrieval_source": "prefetch", "prefetch_path": "/home/mwc/Documents/MIOTI/Current/TFM/Data/eval_top10_dedup/prefetch/eval1_baseline/len_500_o50/hyb_fill_dense_then_bm25_ce_r50/000031.json", "query_index": 31}
{"id": "gt_dedup_00032", "question": "What is the deadline for completion of works to be assisted by Community assistance?", "reference": "31994D0253", "gold_snippet": "Community assistance shall cover expenditure on the project for which legally binding arrangements have been made in Spain and for which the requisite finance has been specifically allocated to works to be completed not later than 18 March 1994.\n2. Expenditure incurred before 1 January 1993 shall not be eligible for assistance.\n3.", "ground_truth_answer": "Works must be completed not later than 18 March 1994.", "reference_contexts": ["Community assistance shall cover expenditure on the project for which legally binding arrangements have been made in Spain and for which the requisite finance has been specifically allocated to works to be completed not later than 18 March 1994.\n2. Expenditure incurred before 1 January 1993 shall not be eligible for assistance.\n3."], "retrieved_documents": [{"page_content": "Article 4\n1. Community assistance shall cover expenditure on the project for which legally binding arrangements have been made in Ireland and for which the requisite finance has been specifically allocated to works to be completed not later than 31 March 1994.\n2. Expenditure incurred before 1 January 1993 shall not be eligible for assistance.\n3. The closing date for the completion of national payments on the project is fixed not later than 12 months after the date mentioned in subparagraph 1.", "metadata": {"categories_en": "finance, transport, geography", "celex_id": "31994D0429", "chunk_strategy": "len_500_o50", "chunk_uid": "920ad307b94dfa72ea1dc76c0cbe1413", "label_ids": "100148,100154,100161"}}, {"page_content": "Article 4\n1. Community assistance shall cover expenditure on the project for which legally binding arrangements have been made in Spain and for which the requisite finance has been specifically allocated to works to be completed not later than 31. December 1993.\n2. Expenditure incurred before 1 January 1993 shall not be eligible for assistance.\n3. The closing date for the completion of national payments on the project is fixed not later than 12 months after the date mentioned in subparagraph 1.", "metadata": {"categories_en": "transport, geography, EUROPEAN UNION, environment", "celex_id": "31994D0712", "chunk_strategy": "len_500_o50", "chunk_uid": "159e52b8fd5a04681ed2d917fccad26d", "label_ids": "100154,100161,100144,100155"}}, {"page_content": "Article 4\n1. Community assistance shall cover expenditure on the project for which legally binding arrangements have been made in Spain and for which the requisite finance has been specifically allocated to works to be completed not later than 31 December 1993.\n2. Expenditure incurred before 1 January 1993 shall not be eligible for assistance.\n3. The closing date for the completion of national payments on the project is fixed not later than 12 months after the date mentioned in subparagraph 1.", "metadata": {"categories_en": "transport, industry, EUROPEAN UNION, geography", "celex_id": "31994D0245", "chunk_strategy": "len_500_o50", "chunk_uid": "9d0467154d186e6dd662c5ea8e8b2bfe", "label_ids": "100154,100160,100144,100161"}}, {"page_content": "Article 4\n1. Community assistance shall cover expenditure on the project for which legally binding arrangements have been made in Spain and for which the requisite finance has been specifically allocated to works to be completed not later than 31 December 1993.\n2. Expenditure incurred before 1 January 1993 shall not be eligible for assistance.\n3. The closing date for the completion of national payments on the project is fixed not later than 12 months after the date mentioned in subparagraph 1.", "metadata": {"categories_en": "transport, geography, industry", "celex_id": "31994D0243", "chunk_strategy": "len_500_o50", "chunk_uid": "ff689d4706f78a803449f904d660ca5d", "label_ids": "100154,100161,100160"}}, {"page_content": "Article 4\n1. Community assistance shall cover expenditure on the project for which legally binding arrangements have been made in Portugal and for which the requisite finance has been specifically allocated to works to be completed not later than 31 March 1995.\n2. Expenditure incurred before 1 January 1993 shall not be eligible for assistance.\n3. The closing date for the completion of national payments on the project is fixed not later than 12 months after the date mentioned in subparagraph 1.", "metadata": {"categories_en": "social questions, industry, EUROPEAN UNION, geography", "celex_id": "31994D0395", "chunk_strategy": "len_500_o50", "chunk_uid": "b02f500c45ddfdfbbac39351b68e45db", "label_ids": "100149,100160,100144,100161"}}, {"page_content": "Article 4\n1. Community assistance shall cover expenditure on the project for which legally binding arrangements have been made in Portugal and for which the requisite finance has been specifically allocated to works to be completed not later than 31 March 1995.\n2. Expenditure incurred before 1 January 1993 shall not be eligible for assistance.\n3. The closing date for the completion of national payments on the project is fixed not later than 12 months after the date mentioned in subparagraph 1.", "metadata": {"categories_en": "industry, environment, social questions, production, technology and research, geography, EUROPEAN UNION", "celex_id": "31994D0250", "chunk_strategy": "len_500_o50", "chunk_uid": "9a14be617a92938c4ba0c7d4331e64fe", "label_ids": "100160,100155,100149,100158,100161,100144"}}, {"page_content": "Article 4\n1. Community assistance shall cover expenditure on the project for which legally binding arrangements have been made in Spain and for which the requisite finance has been specifically allocated to works to be completed not later than 30 December 1993.\n2. Expenditure incurred before 1 January 1993 shall not be eligible for assistance.\n3. The closing date for the completion of national payments on the project is fixed not later than 12 months after the date mentioned in subparagraph 1.", "metadata": {"categories_en": "transport, geography, EUROPEAN UNION, industry", "celex_id": "31994D0402", "chunk_strategy": "len_500_o50", "chunk_uid": "26bfc855f7a1e492b4db63020b920bc2", "label_ids": "100154,100161,100144,100160"}}, {"page_content": "Article 4\n1. Community assistance shall cover expenditure on the project for which legally binding arrangements have been made in Greece and for which the requisite finance has been specifically allocated to works to be completed not later than 31 December 1994.\n2. Expenditure incurred before 1 January 1993 shall not be eligible for assistance.\n3. The closing date for the completion of national payments on the project is fixed not later than 12 months after the date mentioned in subparagraph 1.", "metadata": {"categories_en": "transport, industry, EUROPEAN UNION, geography", "celex_id": "31994D0692", "chunk_strategy": "len_500_o50", "chunk_uid": "f95a6aeffb76a6bfebdf7a71919bfd70", "label_ids": "100154,100160,100144,100161"}}, {"page_content": "Article 4\n1. Community assistance shall cover expenditure on the project for which legally binding arrangements have been made in Greece and for which the requisite finance has been specifically allocated to works to be completed not later than 31 December 1994.\n2. Expenditure incurred before 1 January 1993 shall not be eligible for assistance.\n3. The closing date for the completion of national payments on the project is fixed not later than 12 months after the date mentioned in subparagraph 1.", "metadata": {"categories_en": "environment, production, technology and research, social questions, geography, EUROPEAN UNION", "celex_id": "31994D0590", "chunk_strategy": "len_500_o50", "chunk_uid": "029a936e6ab199ea8718849e616d596e", "label_ids": "100155,100158,100149,100161,100144"}}, {"page_content": "Article 4\n1. Community assistance shall cover expenditure on the project for which legally binding arrangements have been made in Greece and for which the requisite finance has been specifically allocated to works to be completed not later than 31 December 1994.\n2. Expenditure incurred before 1 January 1993 shall not be eligible for assistance.\n3. The closing date for the completion of national payments on the project is fixed not later than 12 months after the date mentioned in subparagraph 1.", "metadata": {"categories_en": "industry, environment, social questions, geography, EUROPEAN UNION", "celex_id": "31994D0586", "chunk_strategy": "len_500_o50", "chunk_uid": "bbd3298372776fa0d612e0dc1a0ba723", "label_ids": "100160,100155,100149,100161,100144"}}, {"page_content": "Article 4\n1. Community assistance shall cover expenditure on the project for which legally binding arrangements have been made in Greece and for which the requisite finance has been specifically allocated to works to be completed not later than 31 December 1994.\n2. Expenditure incurred before 1 January 1993 shall not be eligible for assistance.\n3. The closing date for the completion of national payments on the project is fixed not later than 12 months after the date mentioned in subparagraph 1.", "metadata": {"categories_en": "environment, production, technology and research, social questions, geography, EUROPEAN UNION", "celex_id": "31994D0591", "chunk_strategy": "len_500_o50", "chunk_uid": "857cb0cfd710ebac7c8f6f8c8765e215", "label_ids": "100155,100158,100149,100161,100144"}}, {"page_content": "Article 4\n1. Community assistance shall cover expenditure on the project for which legally binding arrangements have been made in Greece and for which the requisite finance has been specifically allocated to works to be completed not later than 31 December 1994.\n2. Expenditure incurred before 1 January 1993 shall not be eligible for assistance.\n3. The closing date for the completion of national payments on the project is fixed not later than 12 months after the date mentioned in subparagraph 1.", "metadata": {"categories_en": "social questions, geography, EUROPEAN UNION, environment", "celex_id": "31994D0589", "chunk_strategy": "len_500_o50", "chunk_uid": "3ba9bc6484ba00d237196e73fad6381f", "label_ids": "100149,100161,100144,100155"}}, {"page_content": "Article 4\n1. Community assistance shall cover expenditure on the project for which legally binding arrangements have been made in Greece and for which the requisite finance has been specifically allocated to works to be completed not later than 31 December 1994.\n2. Expenditure incurred before 1 January 1993 shall not be eligible for assistance.\n3. The closing date for the completion of national payments on the project is fixed not later than 12 months after the date mentioned in subparagraph 1.", "metadata": {"categories_en": "transport, industry, EUROPEAN UNION, geography", "celex_id": "31994D0693", "chunk_strategy": "len_500_o50", "chunk_uid": "8903f27913a05c525dec6a38868d912e", "label_ids": "100154,100160,100144,100161"}}, {"page_content": "Article 4\n1. Community assistance shall cover expenditure on the project for which legally binding arrangements have been made in Greece and for which the requisite finance has been specifically allocated to works to be completed not later than 31 December 1994.\n2. Expenditure incurred before 1 January 1993 shall not be eligible for assistance.\n3. The closing date for the completion of national payments on the project is fixed not later than 12 months after the date mentioned in subparagraph 1.", "metadata": {"categories_en": "production, technology and research, geography, EUROPEAN UNION, environment", "celex_id": "31994D0588", "chunk_strategy": "len_500_o50", "chunk_uid": "2782e8aa70722c35af06b00e8b437062", "label_ids": "100158,100161,100144,100155"}}, {"page_content": "Article 4\n1. Community assistance shall cover expenditure on the project for which legally binding arrangements have been made in Greece and for which the requisite finance has been specifically allocated to works to be completed not later than 31 December 1994.\n2. Expenditure incurred before 1 January 1993 shall not be eligible for assistance.\n3. The closing date for the completion of national payments on the project is fixed not later than 12 months after the date mentioned in subparagraph 1.", "metadata": {"categories_en": "environment, production, technology and research, social questions, geography, EUROPEAN UNION", "celex_id": "31994D0587", "chunk_strategy": "len_500_o50", "chunk_uid": "deb67a38b75e1458d006445a23a5cf58", "label_ids": "100155,100158,100149,100161,100144"}}, {"page_content": "Article 4\n1. Community assistance shall cover expenditure on the project for which legally binding arrangements have been made in Greece and for which the requisite finance has been specifically allocated to works to be completed not later than 31 December 1994.\n2. Expenditure incurred before 1 January 1993 shall not be eligible for assistance.\n3. The closing date for the completion of national payments on the project is fixed not later than 12 months after the date mentioned in subparagraph 1.", "metadata": {"categories_en": "industry, economics, transport, geography, EUROPEAN UNION", "celex_id": "31994D0714", "chunk_strategy": "len_500_o50", "chunk_uid": "85dd6f1b9b71e6cdaa1d5695f963eb22", "label_ids": "100160,100146,100154,100161,100144"}}, {"page_content": "Article 4\n1. Community assistance shall cover expenditure on the project for which legally binding arrangements have been made in Spain and for which the requisite finance has been specifically allocated to works to be completed not later than 31 March 1995.\n2. Expenditure incurred before 1 January 1993 shall not be eligible for assistance.\n3. The closing date for the completion of national payments on the project is fixed not later than 12 months after the date mentioned in subparagraph 1.", "metadata": {"categories_en": "transport, industry, EUROPEAN UNION, geography", "celex_id": "31994D0242", "chunk_strategy": "len_500_o50", "chunk_uid": "59c6d2cee94400fa0c67580d942385c0", "label_ids": "100154,100160,100144,100161"}}, {"page_content": "Article 4\n1. Community assistance shall cover expenditure on the project for which legally binding arrangements have been made in Spain and for which the requisite finance has been specifically allocated to works to be completed not later than 31 July 1993.\n2. Expenditure incurred before 1 January 1993 shall not be eligible for assistance.\n3. The closing date for the completion of national payments on the project is fixed not later than 12 months after the date mentioned in subparagraph 1.", "metadata": {"categories_en": "transport, industry, EUROPEAN UNION, geography", "celex_id": "31994D0400", "chunk_strategy": "len_500_o50", "chunk_uid": "7bd21807e4fcdd8f5865aa9fb3194047", "label_ids": "100154,100160,100144,100161"}}, {"page_content": "Article 4\n1. Community assistance shall cover expenditure on the project for which legally binding arrangements have been made in Spain and for which the requisite finance has been specifically allocated to works to be completed not later than 31 December 1994.\n2. Expenditure incurred before 1 January 1993 shall not be eligible for assistance.\n3. The closing date for the completion of national payments on the project is fixed not later than 12 months after the date mentioned in subparagraph 1.", "metadata": {"categories_en": "geography, EUROPEAN UNION, environment", "celex_id": "31994D0552", "chunk_strategy": "len_500_o50", "chunk_uid": "f30de742400e34fc305a584908ccb6ef", "label_ids": "100161,100144,100155"}}, {"page_content": "Article 4\n1. Community assistance shall cover expenditure on the project for which legally binding arrangements have been made in Spain and for which the requisite finance has been specifically allocated to works to be completed not later than 31 December 1994.\n2. Expenditure incurred before 1 January 1993 shall not be eligible for assistance.\n3. The closing date for the completion of national payments on the project is fixed not later than 12 months after the date mentioned in subparagraph 1.", "metadata": {"categories_en": "transport, industry, EUROPEAN UNION, geography", "celex_id": "31994D0244", "chunk_strategy": "len_500_o50", "chunk_uid": "7398be85bb49da7df994ebb618e8f823", "label_ids": "100154,100160,100144,100161"}}], "rag_answer": "The answer to the user's question cannot be found in the retrieved context.", "generator_model": "llama3.2", "final_k": 20, "candidate_k": 100, "retrieval_source": "prefetch", "prefetch_path": "/home/mwc/Documents/MIOTI/Current/TFM/Data/eval_top10_dedup/prefetch/eval1_baseline/len_500_o50/hyb_fill_dense_then_bm25_ce_r50/000032.json", "query_index": 32}
